merged_spelling,ipa,langid
{arm}կողմից,k ɔ ʁ m i t͡sʰ,0
{arm}կողմնակի,k ɔ ʁ m n ɑ k i,0
{arm}կողմնացույց,k ɔ ʁ m n ɑ t͡sʰ u j t͡sʰ,0
{arm}կողոպտել,k ɔ ʁ ɔ p t ɛ l,0
{arm}կողպել,k ɔ χ p ɛ l,0
{arm}կողպեք,k ɔ χ p ɛ kʰ,0
{arm}կողք,k ɔ χ kʰ,0
{arm}կողքիս,k ɔ χ kʰ i s,0
{arm}կոճապղպեղ,k ɔ t͡ʃ ɑ p ə χ p ɛ ʁ,0
{arm}կոմբայն,k ɔ m b ɑ j n,0
{arm}կոմիտե,k ɔ m i t ɛ,0
{arm}կոմնենոս,k ɔ m n ɛ n ɔ s,0
{arm}կոմունիզմ,k ɔ m u n i z m,0
{arm}կոմպետենտ,k ɔ m p ɛ t ɛ n t,0
{arm}կոմպոզիտոր,k ɔ m p ɔ z i t ɔ ɾ,0
{arm}կոմպոնենտ,k ɔ m p ɔ n ɛ n t,0
{arm}կոմսություն,k ɔ m s u tʰ j u n,0
{arm}կոյամպուտուր,k ɔ j ɑ m p u t u ɾ,0
{arm}կոնական,k ɔ n ɑ k ɑ n,0
{arm}կոնյակ,k ɔ n j ɑ k,0
{arm}կոնսոլիդացիա,k ɔ n s ɔ l i d ɑ t͡sʰ j ɑ,0
{arm}կոնստրուկտիվ,k ɔ n s t ɾ u k t i v,0
{arm}կոնտեյներ,k ɔ n t ɛ j n ɛ ɾ,0
{arm}կոնտեքստ,k ɔ n t ɛ kʰ s t,0
{arm}կոնտրոլ,k ɔ n t ɾ ɔ l,0
{arm}կոնրադ,k ɔ n ɾ ɑ d,0
{arm}կոնք,k ɔ ŋ kʰ,0
{arm}կոնֆետ,k ɔ n f ɛ t,0
{arm}կոնֆերանս,k ɔ n f ɛ ɾ ɑ n s,0
{arm}կոնֆերանսը,k ɔ n f ɛ ɾ ɑ n s ə,0
{arm}կոշիկ,k ɔ ʃ i k,0
{arm}կոշկակար,k ɔ ʃ k ɑ k ɑ ɾ,0
{arm}կոշկեղեն,k ɔ ʃ k ɛ ʁ ɛ n,0
{arm}կոչ,k ɔ t͡ʃʰ,0
{arm}կոչել,k ɔ t͡ʃʰ ɛ l,0
{arm}կոչեցյալ,k ɔ t͡ʃʰ ɛ t͡sʰ j ɑ l,0
{arm}կոչում,k ɔ t͡ʃʰ u m,0
{arm}կոպեկ,k ɔ p ɛ k,0
{arm}կոպիտ,k ɔ p i t,0
{arm}կոռներեն,k ɔ r n ɛ ɾ ɛ n,0
{arm}կոռուպցիա,k ɔ r u p t͡sʰ j ɑ,0
{arm}կոռուպցիոն,k ɔ r u p t͡sʰ i ɔ n,0
{arm}կոսմոպոլիտական,k ɔ s m ɔ p ɔ l i t ɑ k ɑ n,0
{arm}կոսմոպոլիտություն,k ɔ s m ɔ p ɔ l i t u tʰ j u n,0
{arm}կոսմոս,k ɔ s m ɔ s,0
{arm}կոսովո,k ɔ s ɔ v ɔ,0
{arm}կոստանդնուպոլիս,k ɔ s t ɑ n d n u p ɔ l i s,0
{arm}կոստրոմա,k ɔ s t ɾ ɔ m ɑ,0
{arm}կով,k ɔ v,0
{arm}կովբոյ,k ɔ v b ɔ j,0
{arm}կովլակ,k ɔ v l ɑ k,0
{arm}կովկասյան,k ɔ f k ɑ s j ɑ n,0
{arm}կովկասցի,k ɔ f k ɑ s t͡sʰ i,0
{arm}կոտակ,k ɔ t ɑ k,0
{arm}կոտայք,k ɔ t ɑ j kʰ,0
{arm}կոտլետ,k ɔ t l ɛ t,0
{arm}կոտոշ,k ɔ t ɔ ʃ,0
{arm}կոտոր,k ɔ t ɔ ɾ,0
{arm}կոտրել,k ɔ t ɾ ɛ l,0
{arm}կորեա,k ɔ ɾ ɛ ɑ,0
{arm}կորիզ,k ɔ ɾ i z,0
{arm}կործան,k ɔ ɾ t͡s ɑ n,0
{arm}կործանել,k ɔ ɾ t͡s ɑ n ɛ l,0
{arm}կործանիչ,k ɔ ɾ t͡s ɑ n i t͡ʃʰ,0
{arm}կործանում,k ɔ ɾ t͡s ɑ n u m,0
{arm}կործել,k ɔ ɾ t͡s ɛ l,0
{arm}կորյուն,k ɔ ɾ j u n,0
{arm}կորնթոս,k ɔ ɾ ə n tʰ ɔ s,0
{arm}կորնչել,k ɔ ɾ ə n t͡ʃʰ ɛ l,0
{arm}կորոնավիրուս,k ɔ ɾ ɔ n ɑ v i ɾ u s,0
{arm}կորուսյալ,k ɔ ɾ u s j ɑ l,0
{arm}կորուստ,k ɔ ɾ u s t,0
{arm}կորչել,k ɔ ɾ t͡ʃʰ ɛ l,0
{arm}կորպուս,k ɔ ɾ p u s,0
{arm}կորպուսը,k ɔ ɾ p u s ə,0
{arm}կորտ,k ɔ ɾ t,0
{arm}կորցնել,k ɔ ɾ t͡sʰ n ɛ l,0
{arm}կուզ,k u z,0
{arm}կուզիկ,k u z i k,0
{arm}կութ,k u tʰ,0
{arm}կուլ,k u l,0
{arm}կուլտուրա,k u l t u ɾ ɑ,0
{arm}կուլտուրական,k u l t u ɾ ɑ k ɑ n,0
{arm}կուխնի,k u χ n i,0
{arm}կույս,k u j s,0
{arm}կույտ,k u j t,0
{arm}կույր,k u j ɾ,0
{arm}կուշտ,k u ʃ t,0
{arm}կուպր,k u p ə ɾ,0
{arm}կուռ,k u r,0
{arm}կուռք,k u r kʰ,0
{arm}կուսակցություն,k u s ɑ k t͡sʰ u tʰ j u n,0
{arm}կուտ,k u t,0
{arm}կուտիկ,k u t i k,0
{arm}կուր,k u ɾ,0
{arm}կուրծք,k u ɾ t͡s kʰ,0
{arm}կուրսկ,k u ɾ s k,0
{arm}կուց,k u t͡sʰ,0
{arm}կպնել,k ə p n ɛ l,0
{arm}կպչուն,k ə p t͡ʃʰ u n,0
{arm}կռահել,k ə r ɑ h ɛ l,0
{arm}կռատուկ,k ə r ɑ t u k,0
{arm}կռիս,k r i s,0
{arm}կռիվ,k ə r i v,0
{arm}կռկռալ,k ə r k ə r ɑ l,0
{arm}կռճիկ,k ə r t͡ʃ i k,0
{arm}կռնակ,k ə r n ɑ k,0
{arm}կռնատ,k ə r n ɑ t,0
{arm}կռունկ,k ə r u ŋ k,0
{arm}կռվել,k ə r v ɛ l,0
{arm}կռտած,k ə r t ɑ t͡s,0
{arm}կսկիծ,k ə s k i t͡s,0
{arm}կտակ,k ə t ɑ k,0
{arm}կտակարան,k ə t ɑ k ɑ ɾ ɑ n,0
{arm}կտոր,k ə t ɔ ɾ,0
{arm}կտուր,k ə t u ɾ,0
{arm}կտուց,k ə t u t͡sʰ,0
{arm}կտրական,k ə t ɾ ɑ k ɑ n,0
{arm}կտրականապես,k ə t ɾ ɑ k ɑ n ɑ p ɛ s,0
{arm}կտրել,k ə t ɾ ɛ l,0
{arm}կտրիճ,k ə t ɾ i t͡ʃ,0
{arm}կտրոն,k ə t ɾ ɔ n,0
{arm}կտցել,k ə t t͡sʰ ɛ l,0
{arm}կրավորական,k ə ɾ ɑ v ɔ ɾ ɑ k ɑ n,0
{arm}կրաքար,k ə ɾ ɑ kʰ ɑ ɾ,0
{arm}կրեատիվ,k ɾ ɛ ɑ t i v,0
{arm}կրել,k ə ɾ ɛ l,0
{arm}կրեմլ,k ə ɾ ɛ m ə l,0
{arm}կրետե,k ə ɾ ɛ t ɛ,0
{arm}կրթել,k ə ɾ tʰ ɛ l,0
{arm}կրթություն,k ə ɾ tʰ u tʰ j u n,0
{arm}կրիա,k ə ɾ j ɑ,0
{arm}կրիկետ,k ɾ i k ɛ t,0
{arm}կրիշնա,k ɾ i ʃ n ɑ,0
{arm}կրծել,k ə ɾ t͡s ɛ l,0
{arm}կրծկալ,k ə ɾ t͡s k ɑ l,0
{arm}կրծող,k ə ɾ t͡s ɔ ʁ,0
{arm}կրծքանշան,k ə ɾ t͡s kʰ ɑ n ə ʃ ɑ n,0
{arm}կրծքավանդակ,k ə ɾ t͡s kʰ ɑ v ɑ n d ɑ k,0
{arm}կրկես,k ə ɾ k ɛ s,0
{arm}կրկին,k ə ɾ k i n,0
{arm}կրկնություն,k ə ɾ k n u tʰ j u n,0
{arm}կրճատում,k ə ɾ t͡ʃ ɑ t u m,0
{arm}կրոնագետ,k ə ɾ ɔ n ɑ ɡ ɛ t,0
{arm}կրուասան,k ɾ u ɑ s ɑ n,0
{arm}կրունկ,k ə ɾ u ŋ k,0
{arm}կրպակ,k ə ɾ p ɑ k,0
{arm}կրտսեր,k ə ɾ t s ɛ ɾ,0
{arm}կցել,k ə t͡sʰ ɛ l,0
{arm}կցորդ,k ə t͡sʰ ɔ ɾ tʰ,0
{arm}կքել,k ə kʰ ɛ l,0
{arm}հա,h ɑ,0
{arm}հաագա,h ɑ ɑ ɡ ɑ,0
{arm}հաբ,h ɑ b,0
{arm}հագել,h ɑ ɡ ɛ l,0
{arm}հագենալ,h ɑ ɡ ɛ n ɑ l,0
{arm}հագեցնել,h ɑ ɡ ɛ t͡sʰ n ɛ l,0
{arm}հագնել,h ɑ kʰ n ɛ l,0
{arm}հագնի,h ɑ kʰ n i,0
{arm}հագնվել,h ɑ ɡ n ə v ɛ l,0
{arm}հագուստ,h ɑ kʰ u s t,0
{arm}հագցնել,h ɑ kʰ t͡sʰ ə n ɛ l,0
{arm}հադես,h ɑ d ɛ s,0
{arm}հադրոն,h ɑ d ɾ ɔ n,0
{arm}հազ,h ɑ z,0
{arm}հազարամյակ,h ɑ z ɑ ɾ ɑ m j ɑ k,0
{arm}հազարապետ,h ɑ z ɑ ɾ ɑ p ɛ t,0
{arm}հազարերորդ,h ɑ z ɑ ɾ ɛ ɾ ɔ ɾ tʰ,0
{arm}հազիվ,h ɑ z i v,0
{arm}հազվադեպ,h ɑ z v ɑ d ɛ p,0
{arm}հաթ,h ɑ tʰ,0
{arm}հաթաթա,h ɑ tʰ ɑ tʰ ɑ,0
{arm}հալածանք,h ɑ l ɑ t͡s ɑ ŋ kʰ,0
{arm}հալածել,h ɑ l ɑ t͡s ɛ l,0
{arm}հալեպ,h ɑ l ɛ p,0
{arm}հալոգեն,h ɑ l ɔ ɡ ɛ n,0
{arm}հալումաշ,h ɑ l u m ɑ ʃ,0
{arm}հալվա,h ɑ l v ɑ,0
{arm}հալվե,h ɑ l v ɛ,0
{arm}հակ,h ɑ k,0
{arm}հակագրոհ,h ɑ k ɑ ɡ ə ɾ ɔ h,0
{arm}հակազդել,h ɑ k ɑ z d ɛ l,0
{arm}հակահեղափոխական,h ɑ k ɑ h ɛ ʁ ɑ pʰ ɔ χ ɑ k ɑ n,0
{arm}հակահեղափոխություն,h ɑ k ɑ h ɛ ʁ ɑ pʰ ɔ χ u tʰ j u n,0
{arm}հականեխիչ,h ɑ k ɑ n ɛ χ i t͡ʃʰ,0
{arm}հակառակ,h ɑ k ɑ r ɑ k,0
{arm}հակաօդային,h ɑ k ɑ ɔ tʰ ɑ j i n,0
{arm}հակինթ,h ɑ k i n tʰ,0
{arm}հակիրճ,h ɑ k i ɾ t͡ʃ,0
{arm}հակոբ,h ɑ k ɔ pʰ,0
{arm}հակոբյան,h ɑ k ɔ pʰ j ɑ n,0
{arm}հահ,h ɑ h,0
{arm}հաղագս,h ɑ ʁ ɑ ɡ ə s,0
{arm}հաղարջ,h ɑ ʁ ɑ ɾ d͡ʒ,0
{arm}հաղբ,h ɑ ʁ b,0
{arm}հաղթ,h ɑ χ tʰ,0
{arm}հաղթաթուղթ,h ɑ χ tʰ ɑ tʰ u χ tʰ,0
{arm}հաղթական,h ɑ χ tʰ ɑ k ɑ n,0
{arm}հաղթանակ,h ɑ χ tʰ ɑ n ɑ k,0
{arm}հաղթել,h ɑ χ tʰ ɛ l,0
{arm}հաղթու,h ɑ χ tʰ u,0
{arm}հաղորդագրություն,h ɑ ʁ ɔ ɾ tʰ ɑ ɡ ɾ u tʰ j u n,0
{arm}հաղորդակցություն,h ɑ ʁ ɔ ɾ tʰ ɑ k t͡sʰ u tʰ j u n,0
{arm}հաղորդավար,h ɑ ʁ ɔ ɾ tʰ ɑ v ɑ ɾ,0
{arm}հաղորդել,h ɑ ʁ ɔ ɾ tʰ ɛ l,0
{arm}հաճ,h ɑ t͡ʃ,0
{arm}հաճախորդ,h ɑ t͡ʃ ɑ χ ɔ ɾ tʰ,0
{arm}հաճախություն,h ɑ t͡ʃ ɑ χ u tʰ j u n,0
{arm}հաճախում,h ɑ t͡ʃ ɑ χ u m,0
{arm}հաճարենի,h ɑ t͡ʃ ɑ ɾ ɛ n i,0
{arm}հաճարի,h ɑ t͡ʃ ɑ ɾ i,0
{arm}հաճել,h ɑ t͡ʃ ɛ l,0
{arm}հաճելի,h ɑ t͡ʃ ɛ l i,0
{arm}հաճո,h ɑ t͡ʃ ɔ,0
{arm}հաճություն,h ɑ t͡ʃ u tʰ j u n,0
{arm}հաճույք,h ɑ t͡ʃ u j kʰ,0
{arm}համ,h ɑ m,0
{arm}համա,h ɑ m ɑ,0
{arm}համագործակցել,h ɑ m ɑ ɡ ɔ ɾ t͡s ɑ k t͡sʰ ɛ l,0
{arm}համագործակցության,h ɑ m ɑ ɡ ɔ ɾ t͡s ɑ k t͡sʰ u tʰ j ɑ n,0
{arm}համագործակցություն,h ɑ m ɑ ɡ ɔ ɾ t͡s ɑ k t͡sʰ u tʰ j u n,0
{arm}համագործել,h ɑ m ɑ ɡ ɔ ɾ t͡s ɛ l,0
{arm}համագումար,h ɑ m ɑ ɡ u m ɑ ɾ,0
{arm}համադան,h ɑ m ɑ d ɑ n,0
{arm}համադրություն,h ɑ m ɑ d ə ɾ u tʰ j u n,0
{arm}համազասպ,h ɑ m ɑ z ɑ s p,0
{arm}համաժամանակյա,h ɑ m ɑ ʒ ɑ m ɑ n ɑ k j ɑ,0
{arm}համալիր,h ɑ m ɑ l i ɾ,0
{arm}համալսարան,h ɑ m ɑ l s ɑ ɾ ɑ n,0
{arm}համախոհ,h ɑ m ɑ χ ɔ h,0
{arm}համակարգ,h ɑ m ɑ k ɑ ɾ kʰ,0
{arm}համակարգային,h ɑ m ɑ k ɑ ɾ kʰ ɑ j i n,0
{arm}համակարգել,h ɑ m ɑ k ɑ ɾ kʰ ɛ l,0
{arm}համակարգող,h ɑ m ɑ k ɑ ɾ kʰ ɔ ʁ,0
{arm}համակարգչային,h ɑ m ɑ k ɑ ɾ kʰ t͡ʃʰ ɑ j i n,0
{arm}համակրանք,h ɑ m ɑ k ɾ ɑ ŋ kʰ,0
{arm}համակրել,h ɑ m ɑ k ɾ ɛ l,0
{arm}համակրելի,h ɑ m ɑ k ɾ ɛ l i,0
{arm}համաձայն,h ɑ m ɑ d͡z ɑ j n,0
{arm}համաձայնել,h ɑ m ɑ d͡z ɑ j n ɛ l,0
{arm}համաձուլվածք,h ɑ m ɑ d͡z u l v ɑ t͡s kʰ,0
{arm}համամարդկային,h ɑ m ɑ m ɑ ɾ tʰ k ɑ j i n,0
{arm}համանախագահ,h ɑ m ɑ n ɑ χ ɑ ɡ ɑ h,0
{arm}համաներում,h ɑ m ɑ n ɛ ɾ u m,0
{arm}համանուն,h ɑ m ɑ n u n,0
{arm}համաշխարհային,h ɑ m ɑ ʃ χ ɑ ɾ ɑ j i n,0
{arm}համաշխարհաքաղաքացի,h ɑ m ɑ ʃ χ ɑ ɾ ɑ kʰ ɑ ʁ ɑ kʰ ɑ t͡sʰ i,0
{arm}համաչափ,h ɑ m ɑ t͡ʃʰ ɑ pʰ,0
{arm}համապատասխան,h ɑ m ɑ p ɑ t ɑ s χ ɑ n,0
{arm}համասեռամոլություն,h ɑ m ɑ s ɛ r ɑ m ɔ l u tʰ j u n,0
{arm}համաստեղություն,h ɑ m ɑ s t ɛ ʁ u tʰ j u n,0
{arm}համատարած,h ɑ m ɑ t ɑ ɾ ɑ t͡s,0
{arm}համատեղ,h ɑ m ɑ t ɛ ʁ,0
{arm}համատիրություն,h ɑ m ɑ t i ɾ u tʰ j u n,0
{arm}համար,h ɑ m ɑ ɾ,0
{arm}համարել,h ɑ m ɑ ɾ ɛ l,0
{arm}համարժեք,h ɑ m ɑ ɾ ʒ ɛ kʰ,0
{arm}համարիչ,h ɑ m ɑ ɾ i t͡ʃʰ,0
{arm}համարյա,h ɑ m ɑ ɾ j ɑ,0
{arm}համացանց,h ɑ m ɑ t͡sʰ ɑ n t͡sʰ,0
{arm}համացանցային,h ɑ m ɑ t͡sʰ ɑ n t͡sʰ ɑ j i n,0
{arm}համաքաղաքացի,h ɑ m ɑ kʰ ɑ ʁ ɑ kʰ ɑ t͡sʰ i,0
{arm}համբալ,h ɑ m b ɑ l,0
{arm}համբավավոր,h ɑ m b ɑ v ɑ v ɔ ɾ,0
{arm}համբար,h ɑ m b ɑ ɾ,0
{arm}համբարձում,h ɑ m b ɑ ɾ t͡sʰ u m,0
{arm}համբարձումյան,h ɑ m b ɑ ɾ t͡sʰ u m j ɑ n,0
{arm}համբերատար,h ɑ m pʰ ɛ ɾ ɑ t ɑ ɾ,0
{arm}համբերել,h ɑ m pʰ ɛ ɾ ɛ l,0
{arm}համբերություն,h ɑ m pʰ ɛ ɾ u tʰ j u n,0
{arm}համբյուր,h ɑ m pʰ j u ɾ,0
{arm}համբույր,h ɑ m pʰ u j ɾ,0
{arm}համբուրգ,h ɑ m b u ɾ ɡ,0
{arm}համբուրել,h ɑ m pʰ u ɾ ɛ l,0
{arm}համել,h ɑ m ɛ l,0
{arm}համեղ,h ɑ m ɛ ʁ,0
{arm}համեմատություն,h ɑ m ɛ m ɑ t u tʰ j u n,0
{arm}համեմունք,h ɑ m ɛ m u ŋ kʰ,0
{arm}համեստաբար,h ɑ m ɛ s t ɑ b ɑ ɾ,0
{arm}համեստորեն,h ɑ m ɛ s t ɔ ɾ ɛ n,0
{arm}համեստություն,h ɑ m ɛ s t u tʰ j u n,0
{arm}համերաշխ,h ɑ m ɛ ɾ ɑ ʃ χ,0
{arm}համերաշխություն,h ɑ m ɛ ɾ ɑ ʃ χ u tʰ j u n,0
{arm}համերգ,h ɑ m ɛ ɾ ɡ,0
{arm}համերգասրահ,h ɑ m ɛ ɾ ɡ ɑ s ə ɾ ɑ h,0
{arm}համընկնել,h ɑ m ə ŋ k n ɛ l,0
{arm}համշենցի,h ɑ m ʃ ɛ n t͡sʰ i,0
{arm}համշենցիներ,h ɑ m ʃ ɛ n t͡sʰ i n ɛ ɾ,0
{arm}համոզել,h ɑ m ɔ z ɛ l,0
{arm}համոզկեր,h ɑ m ɔ z k ɛ ɾ,0
{arm}համոզմունք,h ɑ m ɔ z m u ŋ kʰ,0
{arm}համով,h ɑ m ɔ v,0
{arm}համր,h ɑ m ə ɾ,0
{arm}հայաբնակ,h ɑ j ɑ b ə n ɑ k,0
{arm}հայագիտական,h ɑ j ɑ ɡ i t ɑ k ɑ n,0
{arm}հայագիտություն,h ɑ j ɑ ɡ i t u tʰ j u n,0
{arm}հայասա,h ɑ j ɑ s ɑ,0
{arm}հայաստան,h ɑ j ɑ s t ɑ n,0
{arm}հայաստանի,h ɑ j ɑ s t ɑ n i,0
{arm}հայացի,h ɑ j ɑ t͡sʰ i,0
{arm}հայացք,h ɑ j ɑ t͡sʰ kʰ,0
{arm}հայդարաբադ,h ɑ j d ɑ ɾ ɑ b ɑ d,0
{arm}հայելի,h ɑ j ɛ l i,0
{arm}հայերեն,h ɑ j ɛ ɾ ɛ n,0
{arm}հայեցակարգ,h ɑ j ɛ t͡sʰ ɑ k ɑ ɾ kʰ,0
{arm}հայեցի,h ɑ j ɛ t͡sʰ i,0
{arm}հայթայթել,h ɑ j tʰ ɑ j tʰ ɛ l,0
{arm}հայլի,h ɑ j l i,0
{arm}հայկ,h ɑ j k,0
{arm}հայկազն,h ɑ j k ɑ z ə n,0
{arm}հայկազուն,h ɑ j k ɑ z u n,0
{arm}հայկական,h ɑ j k ɑ k ɑ n,0
{arm}հայկականություն,h ɑ j k ɑ k ɑ n u tʰ j u n,0
{arm}հայկյան,h ɑ j k j ɑ n,0
{arm}հայհոյանք,h ɑ j h ɔ j ɑ ŋ kʰ,0
{arm}հայհոյել,h ɑ j h ɔ j ɛ l,0
{arm}հայոց,h ɑ j ɔ t͡sʰ,0
{arm}հայուհի,h ɑ j u h i,0
{arm}հայտ,h ɑ j t,0
{arm}հայտանիշ,h ɑ j t ɑ n i ʃ,0
{arm}հայտարար,h ɑ j t ɑ ɾ ɑ ɾ,0
{arm}հայտարարել,h ɑ j t ɑ ɾ ɑ ɾ ɛ l,0
{arm}հայտարարություն,h ɑ j t ɑ ɾ ɑ ɾ u tʰ j u n,0
{arm}հայտարարում,h ɑ j t ɑ ɾ ɑ ɾ u m,0
{arm}հայտարարվել,h ɑ j t ɑ ɾ ɑ ɾ v ɛ l,0
{arm}հայտնաբերել,h ɑ j t n ɑ b ɛ ɾ ɛ l,0
{arm}հայտնագործություն,h ɑ j t n ɑ ɡ ɔ ɾ t͡s u tʰ j u n,0
{arm}հայտնապես,h ɑ j t n ɑ p ɛ s,0
{arm}հայտնել,h ɑ j t n ɛ l,0
{arm}հայտնի,h ɑ j t n i,0
{arm}հայր,h ɑ j ɾ,0
{arm}հայրական,h ɑ j ɾ ɑ k ɑ n,0
{arm}հայրանուն,h ɑ j ɾ ɑ n u n,0
{arm}հայրատ,h ɑ j ɾ ɑ t,0
{arm}հայրենակից,h ɑ j ɾ ɛ n ɑ k i t͡sʰ,0
{arm}հայրենասիրական,h ɑ j ɾ ɛ n ɑ s i ɾ ɑ k ɑ n,0
{arm}հայրենիք,h ɑ j ɾ ɛ n i kʰ,0
{arm}հայրենյաց,h ɑ j ɾ ɛ n j ɑ t͡sʰ,0
{arm}հայց,h ɑ j t͡sʰ,0
{arm}հայցական,h ɑ j t͡sʰ ɑ k ɑ n,0
{arm}հայցել,h ɑ j t͡sʰ ɛ l,0
{arm}հայք,h ɑ j kʰ,0
{arm}հանապազ,h ɑ n ɑ p ɑ z,0
{arm}հանգ,h ɑ ŋ ɡ,0
{arm}հանգամանք,h ɑ ŋ ɡ ɑ m ɑ ŋ kʰ,0
{arm}հանգել,h ɑ ŋ ɡ ɛ l,0
{arm}հանգիստ,h ɑ ŋ ɡ i s t,0
{arm}հանգույց,h ɑ ŋ ɡ u j t͡sʰ,0
{arm}հանգստանալ,h ɑ ŋ ɡ ə s t ɑ n ɑ l,0
{arm}հանգրվան,h ɑ ŋ ɡ ə ɾ v ɑ n,0
{arm}հանդ,h ɑ n d,0
{arm}հանդարտ,h ɑ n d ɑ ɾ t,0
{arm}հանդբոլ,h ɑ n d b ɔ l,0
{arm}հանդեպ,h ɑ n d ɛ p,0
{arm}հանդես,h ɑ n d ɛ s,0
{arm}հանդերձ,h ɑ n d ɛ ɾ t͡sʰ,0
{arm}հանդիմանել,h ɑ n d i m ɑ n ɛ l,0
{arm}հանդիպել,h ɑ n d i p ɛ l,0
{arm}հանդիպում,h ɑ n d i p u m,0
{arm}հանդիսական,h ɑ n d i s ɑ k ɑ n,0
{arm}հանդիսավոր,h ɑ n d i s ɑ v ɔ ɾ,0
{arm}հանդիսավորապես,h ɑ n d i s ɑ v ɔ ɾ ɑ p ɛ s,0
{arm}հանդուգն,h ɑ n d u ɡ ə n,0
{arm}հանդուրժել,h ɑ n d u ɾ ʒ ɛ l,0
{arm}հանդուրժող,h ɑ n d u ɾ ʒ ɔ ʁ,0
{arm}հանդուրժողական,h ɑ n d u ɾ ʒ ɔ ʁ ɑ k ɑ n,0
{arm}հանել,h ɑ n ɛ l,0
{arm}հանելուկ,h ɑ n ɛ l u k,0
{arm}հանի,h ɑ n i,0
{arm}հանկարծ,h ɑ ŋ k ɑ ɾ t͡s,0
{arm}հանձին,h ɑ n d͡z i n,0
{arm}հանձինս,h ɑ n d͡z i n ə s,0
{arm}հանձնախումբ,h ɑ n d͡z n ɑ χ u m b,0
{arm}հանձնարարել,h ɑ n d͡z n ɑ ɾ ɑ ɾ ɛ l,0
{arm}հանձնել,h ɑ n d͡z n ɛ l,0
{arm}հանում,h ɑ n u m,0
{arm}հանուն,h ɑ n u n,0
{arm}հանպատրաստից,h ɑ n p ɑ t ɾ ɑ s t i t͡sʰ,0
{arm}հանվել,h ɑ n v ɛ l,0
{arm}հանրագիտարան,h ɑ n ɾ ɑ ɡ i t ɑ ɾ ɑ n,0
{arm}հանրախանութ,h ɑ n ɾ ɑ χ ɑ n u tʰ,0
{arm}հանրակացարան,h ɑ n ɾ ɑ k ɑ t͡sʰ ɑ ɾ ɑ n,0
{arm}հանրահավաք,h ɑ n ɾ ɑ h ɑ v ɑ kʰ,0
{arm}հանրապետական,h ɑ n ɾ ɑ p ɛ t ɑ k ɑ n,0
{arm}հանրապետություն,h ɑ n ɾ ɑ p ɛ t u tʰ j u n,0
{arm}հանրաքվե,h ɑ n ɾ ɑ kʰ ə v ɛ,0
{arm}հանցագործ,h ɑ n t͡sʰ ɑ ɡ ɔ ɾ t͡s,0
{arm}հանցանք,h ɑ n t͡sʰ ɑ ŋ kʰ,0
{arm}հանցավորություն,h ɑ n t͡sʰ ɑ v ɔ ɾ u tʰ j u n,0
{arm}հանքաքար,h ɑ ŋ kʰ ɑ kʰ ɑ ɾ,0
{arm}հաշիվ,h ɑ ʃ i v,0
{arm}հաշմանդամություն,h ɑ ʃ m ɑ n d ɑ m u tʰ j u n,0
{arm}հաշվապահություն,h ɑ ʃ v ɑ p ɑ h u tʰ j u n,0
{arm}հաշվառում,h ɑ ʃ v ɑ r u m,0
{arm}հաշվետախտակ,h ɑ ʃ v ɛ t ɑ χ t ɑ k,0
{arm}հաշվեքննիչ,h ɑ ʃ v ɛ kʰ ə nː i t͡ʃʰ,0
{arm}հաշվիչ,h ɑ ʃ v i t͡ʃʰ,0
{arm}հաշվում,h ɑ ʃ v u m,0
{arm}հաշտ,h ɑ ʃ t,0
{arm}հաշտեցում,h ɑ ʃ t ɛ t͡sʰ u m,0
{arm}հաուրան,h ɑ u ɾ ɑ n,0
{arm}հաչաղ,h ɑ t͡ʃʰ ɑ ʁ,0
{arm}հաչել,h ɑ t͡ʃʰ ɛ l,0
{arm}հապալաս,h ɑ p ɑ l ɑ s,0
{arm}հապաղ,h ɑ p ɑ ʁ,0
{arm}հապաղել,h ɑ p ɑ ʁ ɛ l,0
{arm}հապաղում,h ɑ p ɑ ʁ u m,0
{arm}հապավում,h ɑ p ɑ v u m,0
{arm}հապկ,h ɑ p k,0
{arm}հաջող,h ɑ d͡ʒ ɔ ʁ,0
{arm}հաջողություն,h ɑ d͡ʒ ɔ ʁ u tʰ j u n,0
{arm}հառաչ,h ɑ r ɑ t͡ʃʰ,0
{arm}հառաչալի,h ɑ r ɑ t͡ʃʰ ɑ l i,0
{arm}հառաչալիր,h ɑ r ɑ t͡ʃʰ ɑ l i ɾ,0
{arm}հառաչակից,h ɑ r ɑ t͡ʃʰ ɑ k i t͡sʰ,0
{arm}հառաչել,h ɑ r ɑ t͡ʃʰ ɛ l,0
{arm}հառաջացում,h ɑ r ɑ t͡ʃʰ ɑ t͡sʰ u m,0
{arm}հառել,h ɑ r ɛ l,0
{arm}հաս,h ɑ s,0
{arm}հասանելի,h ɑ s ɑ n ɛ l i,0
{arm}հասարակ,h ɑ s ɑ ɾ ɑ k,0
{arm}հասարակած,h ɑ s ɑ ɾ ɑ k ɑ t͡s,0
{arm}հասարակական,h ɑ s ɑ ɾ ɑ k ɑ k ɑ n,0
{arm}հասարակություն,h ɑ s ɑ ɾ ɑ k u tʰ j u n,0
{arm}հասկ,h ɑ s k,0
{arm}հասկանալ,h ɑ s k ɑ n ɑ l,0
{arm}հասկանալի,h ɑ s k ɑ n ɑ l i,0
{arm}հասկանում,h ɑ s k ɑ n u m,0
{arm}հասնել,h ɑ s n ɛ l,0
{arm}հասու,h ɑ s u,0
{arm}հաստ,h ɑ s t,0
{arm}հաստատ,h ɑ s t ɑ t,0
{arm}հաստատակամ,h ɑ s t ɑ t ɑ k ɑ m,0
{arm}հաստատել,h ɑ s t ɑ t ɛ l,0
{arm}հաստատուն,h ɑ s t ɑ t u n,0
{arm}հաստիչ,h ɑ s t i t͡ʃʰ,0
{arm}հաստոց,h ɑ s t ɔ t͡sʰ,0
{arm}հաստություն,h ɑ s t u tʰ j u n,0
{arm}հասցե,h ɑ s t͡sʰ ɛ,0
{arm}հասցեատեր,h ɑ s t͡sʰ ɛ ɑ t ɛ ɾ,0
{arm}հավ,h ɑ v,0
{arm}հավա,h ɑ v ɑ,0
{arm}հավանա,h ɑ v ɑ n ɑ,0
{arm}հավանաբար,h ɑ v ɑ n ɑ b ɑ ɾ,0
{arm}հավանական,h ɑ v ɑ n ɑ k ɑ n,0
{arm}հավանականություն,h ɑ v ɑ n ɑ k ɑ n u tʰ j u n,0
{arm}հավասարակողմ,h ɑ v ɑ s ɑ ɾ ɑ k ɔ ʁ m,0
{arm}հավասարասրուն,h ɑ v ɑ s ɑ ɾ ɑ s ɾ u n,0
{arm}հավասարություն,h ɑ v ɑ s ɑ ɾ u tʰ j u n,0
{arm}հավասարում,h ɑ v ɑ s ɑ ɾ u m,0
{arm}հավաստի,h ɑ v ɑ s t i,0
{arm}հավատալ,h ɑ v ɑ t ɑ l,0
{arm}հավատարիմ,h ɑ v ɑ t ɑ ɾ i m,0
{arm}հավատարմաբար,h ɑ v ɑ t ɑ ɾ m ɑ b ɑ ɾ,0
{arm}հավատարմագրել,h ɑ v ɑ t ɑ ɾ m ɑ ɡ ɾ ɛ l,0
{arm}հավատարմորեն,h ɑ v ɑ t ɑ ɾ m ɔ ɾ ɛ n,0
{arm}հավատարմություն,h ɑ v ɑ t ɑ ɾ m u tʰ j u n,0
{arm}հավատք,h ɑ v ɑ t kʰ,0
{arm}հավաք,h ɑ v ɑ kʰ,0
{arm}հավաքածու,h ɑ v ɑ kʰ ɑ t͡s u,0
{arm}հավաքական,h ɑ v ɑ kʰ ɑ k ɑ n,0
{arm}հավաքույթ,h ɑ v ɑ kʰ u j tʰ,0
{arm}հավելել,h ɑ v ɛ l ɛ l,0
{arm}հավելված,h ɑ v ɛ l v ɑ t͡s,0
{arm}հավես,h ɑ v ɛ s,0
{arm}հավետ,h ɑ v ɛ t,0
{arm}հավերժ,h ɑ v ɛ ɾ ʒ,0
{arm}հավիտյան,h ɑ v i t j ɑ n,0
{arm}հավր,h ɑ v ə ɾ,0
{arm}հավք,h ɑ f kʰ,0
{arm}հատ,h ɑ t,0
{arm}հատակ,h ɑ t ɑ k,0
{arm}հատապտուղ,h ɑ t ɑ p ə t u ʁ,0
{arm}հատել,h ɑ t ɛ l,0
{arm}հատիկ,h ɑ t i k,0
{arm}հատկություն,h ɑ t k u tʰ j u n,0
{arm}հատոր,h ɑ t ɔ ɾ,0
{arm}հատու,h ɑ t u,0
{arm}հատուկ,h ɑ t u k,0
{arm}հատում,h ɑ t u m,0
{arm}հատուցել,h ɑ t u t͡sʰ ɛ l,0
{arm}հատուցում,h ɑ t u t͡sʰ u m,0
{arm}հատված,h ɑ t v ɑ t͡s,0
{arm}հարազատ,h ɑ ɾ ɑ z ɑ t,0
{arm}հարակատար,h ɑ ɾ ɑ k ɑ t ɑ ɾ,0
{arm}հարամի,h ɑ ɾ ɑ m i,0
{arm}հարավային,h ɑ ɾ ɑ f ɑ j i n,0
{arm}հարբած,h ɑ ɾ pʰ ɑ t͡s,0
{arm}հարբել,h ɑ ɾ pʰ ɛ l,0
{arm}հարբուխ,h ɑ ɾ b u χ,0
{arm}հարգել,h ɑ ɾ ɡ ɛ l,0
{arm}հարդ,h ɑ ɾ d,0
{arm}հարել,h ɑ ɾ ɛ l,0
{arm}հարեւան,h ɑ ɾ ɛ v ɑ n,0
{arm}հարթ,h ɑ ɾ tʰ,0
{arm}հարթաքանդակ,h ɑ ɾ tʰ ɑ kʰ ɑ n d ɑ k,0
{arm}հարթություն,h ɑ ɾ tʰ u tʰ j u n,0
{arm}հարիսա,h ɑ ɾ i s ɑ,0
{arm}հարկ,h ɑ ɾ k,0
{arm}հարկահավաք,h ɑ ɾ k ɑ h ɑ v ɑ kʰ,0
{arm}հարկային,h ɑ ɾ k ɑ j i n,0
{arm}հարկավ,h ɑ ɾ k ɑ v,0
{arm}հարձակում,h ɑ ɾ t͡sʰ ɑ k u m,0
{arm}հարյուր,h ɑ ɾ j u ɾ,0
{arm}հարյուրամյակ,h ɑ ɾ j u ɾ ɑ m j ɑ k,0
{arm}հարյուրերորդ,h ɑ ɾ j u ɾ ɛ ɾ ɔ ɾ tʰ,0
{arm}հարոյան,h ɑ ɾ ɔ j ɑ n,0
{arm}հարություն,h ɑ ɾ u tʰ j u n,0
{arm}հարությունյան,h ɑ ɾ u tʰ j u n j ɑ n,0
{arm}հարուստ,h ɑ ɾ u s t,0
{arm}հարս,h ɑ ɾ s,0
{arm}հարսանեկան,h ɑ ɾ s ɑ n ɛ k ɑ n,0
{arm}հարսանիթ,h ɑ ɾ s ɑ n i tʰ,0
{arm}հարսանիք,h ɑ ɾ s ɑ n i kʰ,0
{arm}հարսանյաց,h ɑ ɾ s ɑ n j ɑ t͡sʰ,0
{arm}հարսնանալ,h ɑ ɾ s n ɑ n ɑ l,0
{arm}հարսնացնել,h ɑ ɾ s n ɑ t͡sʰ n ɛ l,0
{arm}հարսնացու,h ɑ ɾ s n ɑ t͡sʰ u,0
{arm}հարստություն,h ɑ ɾ ə s t u tʰ j u n,0
{arm}հարված,h ɑ ɾ v ɑ t͡s,0
{arm}հարվածել,h ɑ ɾ v ɑ t͡s ɛ l,0
{arm}հարց,h ɑ ɾ t͡sʰ,0
{arm}հարցազրույց,h ɑ ɾ t͡sʰ ɑ z ɾ u j t͡sʰ,0
{arm}հարցաքննություն,h ɑ ɾ t͡sʰ ɑ kʰ ə nː u tʰ j u n,0
{arm}հարցաքննում,h ɑ ɾ t͡sʰ ɑ kʰ ə nː u m,0
{arm}հարցնել,h ɑ ɾ t͡sʰ n ɛ l,0
{arm}հարցում,h ɑ ɾ t͡sʰ u m,0
{arm}հաց,h ɑ t͡sʰ,0
{arm}հացաբույս,h ɑ t͡sʰ ɑ b u j s,0
{arm}հացագործ,h ɑ t͡sʰ ɑ ɡ ɔ ɾ t͡s,0
{arm}հացադուլ,h ɑ t͡sʰ ɑ d u l,0
{arm}հացահատիկ,h ɑ t͡sʰ ɑ h ɑ t i k,0
{arm}հացենի,h ɑ t͡sʰ ɛ n i,0
{arm}հացի,h ɑ t͡sʰ i,0
{arm}հացհամեմ,h ɑ t͡sʰ h ɑ m ɛ m,0
{arm}հացուտ,h ɑ t͡sʰ u t,0
{arm}հափափել,h ɑ pʰ ɑ pʰ ɛ l,0
{arm}հափշտակում,h ɑ pʰ ʃ t ɑ k u m,0
{arm}հաքեր,h ɑ kʰ ɛ ɾ,0
{arm}հեգ,h ɛ ɡ,0
{arm}հեգել,h ɛ ɡ ɛ l,0
{arm}հեգնական,h ɛ ɡ n ɑ k ɑ n,0
{arm}հեթանոս,h ɛ tʰ ɑ n ɔ s,0
{arm}հեթում,h ɛ tʰ u m,0
{arm}հելլադա,h ɛ lː ɑ d ɑ,0
{arm}հելլեն,h ɛ lː ɛ n,0
{arm}հելլեսպոնտոս,h ɛ lː ɛ s p ɔ n t ɔ s,0
{arm}հելսինկի,h ɛ l s i ŋ k i,0
{arm}հեծան,h ɛ t͡s ɑ n,0
{arm}հեծանիվ,h ɛ t͡s ɑ n i v,0
{arm}հեծել,h ɛ t͡s ɛ l,0
{arm}հեծելազոր,h ɛ t͡s ɛ l ɑ z ɔ ɾ,0
{arm}հեծյալ,h ɛ t͡s j ɑ l,0
{arm}հեղաշրջում,h ɛ ʁ ɑ ʃ ə ɾ d͡ʒ u m,0
{arm}հեղել,h ɛ ʁ ɛ l,0
{arm}հեղեղ,h ɛ ʁ ɛ ʁ,0
{arm}հեղեղել,h ɛ ʁ ɛ ʁ ɛ l,0
{arm}հեղեղում,h ɛ ʁ ɛ ʁ u m,0
{arm}հեղինակ,h ɛ ʁ i n ɑ k,0
{arm}հեղինակություն,h ɛ ʁ i n ɑ k u tʰ j u n,0
{arm}հեղինե,h ɛ ʁ i n ɛ,0
{arm}հեղուկ,h ɛ ʁ u k,0
{arm}հեղված,h ɛ ʁ v ɑ t͡s,0
{arm}հեղվել,h ɛ ʁ v ɛ l,0
{arm}հենան,h ɛ n ɑ n,0
{arm}հենվել,h ɛ n v ɛ l,0
{arm}հենրիկ,h ɛ n ɾ i k,0
{arm}հեշթեգ,h ɛ ʃ tʰ ɛ ɡ,0
{arm}հեշտ,h ɛ ʃ t,0
{arm}հեշտոցային,h ɛ ʃ t ɔ t͡sʰ ɑ j i n,0
{arm}հեռագիր,h ɛ r ɑ ɡ i ɾ,0
{arm}հեռադիտակ,h ɛ r ɑ d i t ɑ k,0
{arm}հեռախոս,h ɛ r ɑ χ ɔ s,0
{arm}հեռակառավարման,h ɛ r ɑ k ɑ r ɑ v ɑ ɾ m ɑ n,0
{arm}հեռաձայն,h ɛ r ɑ d͡z ɑ j n,0
{arm}հեռաձայնել,h ɛ r ɑ d͡z ɑ j n ɛ l,0
{arm}հեռանկար,h ɛ r ɑ n ə k ɑ ɾ,0
{arm}հեռավոր,h ɛ r ɑ v ɔ ɾ,0
{arm}հեռացնել,h ɛ r ɑ t͡sʰ n ɛ l,0
{arm}հեռացում,h ɛ r ɑ t͡sʰ u m,0
{arm}հեռու,h ɛ r u,0
{arm}հեռուստաընկերություն,h ɛ r u s t ɑ ə ŋ k ɛ ɾ u tʰ j u n,0
{arm}հեռուստատեսություն,h ɛ r u s t ɑ t ɛ s u tʰ j u n,0
{arm}հեռուստացմփորիկ,h ɛ r u s t ɑ t͡sʰ ə m pʰ ɔ ɾ i k,0
{arm}հեսան,h ɛ s ɑ n,0
{arm}հեստ,h ɛ s t,0
{arm}հետազոտող,h ɛ t ɑ z ɔ t ɔ ʁ,0
{arm}հետազոտություն,h ɛ t ɑ z ɔ t u tʰ j u n,0
{arm}հետախուզական,h ɛ t ɑ χ u z ɑ k ɑ n,0
{arm}հետաձգել,h ɛ t ɑ d͡z ə kʰ ɛ l,0
{arm}հետանցք,h ɛ t ɑ n t͡sʰ kʰ,0
{arm}հետաքրքիր,h ɛ t ɑ kʰ ə ɾ kʰ i ɾ,0
