merged_spelling,ipa,langid
{arm}աագխ,ɑ ɑ ɡ ə χ ə,0
{arm}աաի,ɑ ɑ i,0
{arm}աած,ɑ ɑ t͡s ə,0
{arm}աակ,ɑ ɑ k ə,0
{arm}աահ,ɑ ɑ h ə,0
{arm}աապ,ɑ ɑ p ə,0
{arm}աապվ,ɑ ɑ p ə v ə,0
{arm}աբա,ɑ b ɑ,0
{arm}աբական,ɑ b ɑ k ɑ n,0
{arm}աբաջյան,ɑ b ɑ d͡ʒ j ɑ n,0
{arm}աբաս,ɑ b ɑ s,0
{arm}աբբա,ɑ bː ɑ,0
{arm}աբբայուհի,ɑ bː ɑ j u h i,0
{arm}աբել,ɑ b ɛ l,0
{arm}աբեղա,ɑ b ɛ ʁ ɑ,0
{arm}աբեղայական,ɑ b ɛ ʁ ɑ j ɑ k ɑ n,0
{arm}աբեղուկ,ɑ b ɛ ʁ u k,0
{arm}աբիսողոմ,ɑ b i s ɔ ʁ ɔ m,0
{arm}աբխազ,ɑ pʰ χ ɑ z,0
{arm}աբխազական,ɑ pʰ χ ɑ z ɑ k ɑ n,0
{arm}աբխազերեն,ɑ pʰ χ ɑ z ɛ ɾ ɛ n,0
{arm}աբխազիա,ɑ pʰ χ ɑ z j ɑ,0
{arm}աբո,ɑ b ɔ,0
{arm}աբոնեմենտ,ɑ b ɔ n ɛ m ɛ n t,0
{arm}աբովյան,ɑ b ɔ v j ɑ n,0
{arm}աբորտ,ɑ b ɔ ɾ t,0
{arm}աբսոլյուտ,ɑ pʰ s ɔ l j u t,0
{arm}աբսուրդ,ɑ pʰ s u ɾ d,0
{arm}աբստրակտ,ɑ pʰ s t ɾ ɑ k t,0
{arm}աբստրակցիա,ɑ pʰ s t ɾ ɑ k t͡sʰ j ɑ,0
{arm}աբստրահվել,ɑ pʰ s t ɾ ɑ h v ɛ l,0
{arm}աբրա,ɑ b ɾ ɑ,0
{arm}աբրահամյան,ɑ b ɾ ɑ h ɑ m j ɑ n,0
{arm}աբրամ,ɑ b ɾ ɑ m,0
{arm}ագա,ɑ ɡ ɑ,0
{arm}ագաթ,ɑ ɡ ɑ tʰ,0
{arm}ագահաբար,ɑ ɡ ɑ h ɑ b ɑ ɾ,0
{arm}ագահորեն,ɑ ɡ ɑ h ɔ ɾ ɛ n,0
{arm}ագահություն,ɑ ɡ ɑ h u tʰ j u n,0
{arm}ագարակ,ɑ ɡ ɑ ɾ ɑ k,0
{arm}ագարակացնել,ɑ ɡ ɑ ɾ ɑ k ɑ t͡sʰ n ɛ l,0
{arm}ագարտալա,ɑ ɡ ɑ ɾ t ɑ l ɑ,0
{arm}ագն,ɑ ɡ ə n ə,0
{arm}ագնոստիկ,ɑ ɡ n ɔ s t i k,0
{arm}ագնոստիցիզմ,ɑ ɡ n ɔ s t i t͡sʰ i z m,0
{arm}ագուցահանել,ɑ ɡ u t͡sʰ ɑ h ɑ n ɛ l,0
{arm}ագուցանել,ɑ ɡ u t͡sʰ ɑ n ɛ l,0
{arm}ագուցել,ɑ ɡ u t͡sʰ ɛ l,0
{arm}ագուցվել,ɑ ɡ u t͡sʰ v ɛ l,0
{arm}ագռավ,ɑ ɡ r ɑ v,0
{arm}ագռավանալ,ɑ ɡ r ɑ v ɑ n ɑ l,0
{arm}ագրեսիա,ɑ ɡ ɾ ɛ s j ɑ,0
{arm}ագրիպպաս,ɑ ɡ ɾ i pː ɑ s,0
{arm}ադամ,ɑ d ɑ m,0
{arm}ադամաթուզ,ɑ d ɑ m ɑ tʰ u z,0
{arm}ադամանդ,ɑ d ɑ m ɑ n d,0
{arm}ադամանդագործ,ɑ d ɑ m ɑ n d ɑ ɡ ɔ ɾ t͡s,0
{arm}ադամանդագործական,ɑ d ɑ m ɑ n d ɑ ɡ ɔ ɾ t͡s ɑ k ɑ n,0
{arm}ադամանդվել,ɑ d ɑ m ɑ n d v ɛ l,0
{arm}ադանա,ɑ d ɑ n ɑ,0
{arm}ադլեր,ɑ d l ɛ ɾ,0
{arm}ադոնց,ɑ d ɔ n t͡sʰ,0
{arm}ադրբեջանական,ɑ d ə ɾ b ɛ d͡ʒ ɑ n ɑ k ɑ n,0
{arm}ադրբեջաներեն,ɑ d ə ɾ b ɛ d͡ʒ ɑ n ɛ ɾ ɛ n,0
{arm}ադրբեջանցի,ɑ d ə ɾ b ɛ d͡ʒ ɑ n t͡sʰ i,0
{arm}ադրիանապոլիս,ɑ d ɾ i j ɑ n ɑ p ɔ l i s,0
{arm}ադրիանոս,ɑ d ɾ i j ɑ n ɔ s,0
{arm}ազազանալ,ɑ z ɑ z ɑ n ɑ l,0
{arm}ազատ,ɑ z ɑ t,0
{arm}ազատագրվել,ɑ z ɑ t ɑ ɡ ə ɾ v ɛ l,0
{arm}ազատազրկել,ɑ z ɑ t ɑ z ə ɾ k ɛ l,0
{arm}ազատականացնել,ɑ z ɑ t ɑ k ɑ n ɑ t͡sʰ n ɛ l,0
{arm}ազատել,ɑ z ɑ t ɛ l,0
{arm}ազատություն,ɑ z ɑ t u tʰ j u n,0
{arm}ազգագրական,ɑ z ɡ ɑ ɡ ə ɾ ɑ k ɑ n,0
{arm}ազգայնականություն,ɑ z ɡ ɑ j n ɑ k ɑ n u tʰ j u n,0
{arm}ազգասեր,ɑ z ɡ ɑ s ɛ ɾ,0
{arm}ազգերի,ɑ z ɡ ɛ ɾ i,0
{arm}ազգություն,ɑ z ɡ u tʰ j u n,0
{arm}ազդակ,ɑ z d ɑ k,0
{arm}ազդանշան,ɑ z d ɑ n ə ʃ ɑ n,0
{arm}ազդարար,ɑ z d ɑ ɾ ɑ ɾ,0
{arm}ազդարարել,ɑ z d ɑ ɾ ɑ ɾ ɛ l,0
{arm}ազդեցություն,ɑ z d ɛ t͡sʰ u tʰ j u n,0
{arm}ազդվել,ɑ z d v ɛ l,0
{arm}ազդր,ɑ z d ə ɾ,0
{arm}ազերի,ɑ z ɛ ɾ i,0
{arm}ազնավուր,ɑ z n ɑ v u ɾ,0
{arm}ազնիվ,ɑ z n i v,0
{arm}ազնվական,ɑ z n ə v ɑ k ɑ n,0
{arm}ազոտ,ɑ z ɔ t,0
{arm}աթեիզմ,ɑ tʰ ɛ j i z m,0
{arm}աթեիստ,ɑ tʰ ɛ i s t,0
{arm}աթենք,ɑ tʰ ɛ ŋ kʰ,0
{arm}աթլաս,ɑ tʰ l ɑ s,0
{arm}աթլետիկա,ɑ tʰ l ɛ t i k ɑ,0
{arm}աթոռ,ɑ tʰ ɔ r,0
{arm}աթոռակ,ɑ tʰ ɔ r ɑ k,0
{arm}աթս,ɑ tʰ ə s ə,0
{arm}աժ,ɑ ʒ ə,0
{arm}աժան,ɑ ʒ ɑ n,0
{arm}աժդահա,ɑ ʒ d ɑ h ɑ,0
{arm}աժդահակ,ɑ ʒ d ɑ h ɑ k,0
{arm}ալ,ɑ l,0
{arm}ալադին,ɑ l ɑ d i n,0
{arm}ալազան,ɑ l ɑ z ɑ n,0
{arm}ալաժահրի,ɑ l ɑ ʒ ɑ h ɾ i,0
{arm}ալան,ɑ l ɑ n,0
{arm}ալանի,ɑ l ɑ n i,0
{arm}ալավերդի,ɑ l ɑ v ɛ ɾ d i,0
{arm}ալբաներեն,ɑ l b ɑ n ɛ ɾ ɛ n,0
{arm}ալբանիա,ɑ l b ɑ n j ɑ,0
{arm}ալբերտ,ɑ l b ɛ ɾ t,0
{arm}ալբոմ,ɑ l b ɔ m,0
{arm}ալեկոծ,ɑ l ɛ k ɔ t͡s,0
{arm}ալեմաներեն,ɑ l ɛ m ɑ n ɛ ɾ ɛ n,0
{arm}ալեւոր,ɑ l ɛ v ɔ ɾ,0
{arm}ալեքսանդրիա,ɑ l ɛ kʰ s ɑ n d ɾ j ɑ,0
{arm}ալի,ɑ l i,0
{arm}ալիբի,ɑ l i b i,0
{arm}ալիգատոր,ɑ l i ɡ ɑ t ɔ ɾ,0
{arm}ալիեւ,ɑ l i j ɛ v,0
{arm}ալինա,ɑ l i n ɑ,0
{arm}ալիք,ɑ l i kʰ,0
{arm}ալկաշ,ɑ l k ɑ ʃ,0
{arm}ալկոհոլ,ɑ l k ɔ h ɔ l,0
{arm}ալմաթի,ɑ l m ɑ tʰ i,0
{arm}ալմանախ,ɑ l m ɑ n ɑ χ,0
{arm}ալմաստ,ɑ l m ɑ s t,0
{arm}ալյանս,ɑ l j ɑ n s,0
{arm}ալյուր,ɑ l j u ɾ,0
{arm}ալոե,ɑ l ɔ ɛ,0
{arm}ալոճ,ɑ l ɔ t͡ʃ,0
{arm}ալուցք,ɑ l u t͡sʰ kʰ,0
{arm}ալպագա,ɑ l p ɑ ɡ ɑ,0
{arm}ալպեր,ɑ l p ɛ ɾ,0
{arm}ալպինիզմ,ɑ l p i n i z m,0
{arm}ալտ,ɑ l t,0
{arm}ալքիմիկոս,ɑ l kʰ i m i k ɔ s,0
{arm}ախալցխա,ɑ χ ɑ l t͡sʰ ə χ ɑ,0
{arm}ախալքալաք,ɑ χ ɑ l kʰ ɑ l ɑ kʰ,0
{arm}ախոռ,ɑ χ ɔ r,0
{arm}ախորժակ,ɑ χ ɔ ɾ ʒ ɑ k,0
{arm}ախուրյան,ɑ χ u ɾ j ɑ n,0
{arm}ախպար,ɑ χ p ɑ ɾ,0
{arm}ախպեր,ɑ χ p ɛ ɾ,0
{arm}ախտ,ɑ χ t,0
{arm}ախտաբան,ɑ χ t ɑ b ɑ n,0
{arm}ախտարար,ɑ χ t ɑ ɾ ɑ ɾ,0
{arm}ախտորոշել,ɑ χ t ɔ ɾ ɔ ʃ ɛ l,0
{arm}ախտորոշում,ɑ χ t ɔ ɾ ɔ ʃ u m,0
{arm}ած,ɑ t͡s,0
{arm}ածանցել,ɑ t͡s ɑ n t͡sʰ ɛ l,0
{arm}ածանցյալ,ɑ t͡s ɑ n t͡sʰ j ɑ l,0
{arm}ածել,ɑ t͡s ɛ l,0
{arm}ածելի,ɑ t͡s ɛ l i,0
{arm}ածեր,ɑ t͡s ɛ ɾ,0
{arm}ածու,ɑ t͡s u,0
{arm}ածուխ,ɑ t͡s u χ,0
{arm}ակ,ɑ k,0
{arm}ակադեմիա,ɑ k ɑ d ɛ m j ɑ,0
{arm}ական,ɑ k ɑ n,0
{arm}ականավոր,ɑ k ɑ n ɑ v ɔ ɾ,0
{arm}ականատես,ɑ k ɑ n ɑ t ɛ s,0
{arm}ականի,ɑ k ɑ n i,0
{arm}ականջ,ɑ k ɑ n d͡ʒ,0
{arm}ականջօղ,ɑ k ɑ n d͡ʒ ɔ ʁ,0
{arm}ակն,ɑ k ə n,0
{arm}ակնախնձոր,ɑ k n ɑ χ ə n d͡z ɔ ɾ,0
{arm}ակնածալից,ɑ k n ɑ t͡s ɑ l i t͡sʰ,0
{arm}ակնածանք,ɑ k n ɑ t͡s ɑ ŋ kʰ,0
{arm}ակնածել,ɑ k n ɑ t͡s ɛ l,0
{arm}ակնաղբյուր,ɑ k n ɑ χ p j u ɾ,0
{arm}ակնային,ɑ k n ɑ j i n,0
{arm}ակնարկ,ɑ k n ɑ ɾ k,0
{arm}ակներեւ,ɑ k n ɛ ɾ ɛ v,0
{arm}ակներեւաբար,ɑ k n ɛ ɾ ɛ v ɑ b ɑ ɾ,0
{arm}ակներեւապես,ɑ k n ɛ ɾ ɛ v ɑ p ɛ s,0
{arm}ակնթարթ,ɑ k ə n tʰ ɑ ɾ tʰ,0
{arm}ակնկալիք,ɑ k ə ŋ k ɑ l i kʰ,0
{arm}ակնհայտ,ɑ k ə n h ɑ j t,0
{arm}ակնոց,ɑ k n ɔ t͡sʰ,0
{arm}ակոս,ɑ k ɔ s,0
{arm}ակորդեոն,ɑ k ɔ ɾ d ɛ ɔ n,0
{arm}ակութ,ɑ k u tʰ,0
{arm}ակունք,ɑ k u ŋ kʰ,0
{arm}ակտիվ,ɑ k t i v,0
{arm}ակտիվորեն,ɑ k t i v ɔ ɾ ɛ n,0
{arm}ահ,ɑ h,0
{arm}ահաբեկում,ɑ h ɑ b ɛ k u m,0
{arm}ահաբեկչական,ɑ h ɑ b ɛ k t͡ʃʰ ɑ k ɑ n,0
{arm}ահաբեկչություն,ɑ h ɑ b ɛ k t͡ʃʰ u tʰ j u n,0
{arm}ահագին,ɑ h ɑ ɡ i n,0
{arm}ահագնանալ,ɑ h ɑ ɡ n ɑ n ɑ l,0
{arm}ահազանգում,ɑ h ɑ z ɑ ŋ ɡ u m,0
{arm}ահազդու,ɑ h ɑ z d u,0
{arm}ահարոն,ɑ h ɑ ɾ ɔ n,0
{arm}ահեղ,ɑ h ɛ ʁ,0
{arm}աղ,ɑ ʁ,0
{arm}աղա,ɑ ʁ ɑ,0
{arm}աղաթոն,ɑ ʁ ɑ tʰ ɔ n,0
{arm}աղալ,ɑ ʁ ɑ l,0
{arm}աղախին,ɑ ʁ ɑ χ i n,0
{arm}աղաղակ,ɑ ʁ ɑ ʁ ɑ k,0
{arm}աղաղակել,ɑ ʁ ɑ ʁ ɑ k ɛ l,0
{arm}աղանդավոր,ɑ ʁ ɑ n d ɑ v ɔ ɾ,0
{arm}աղանդավորական,ɑ ʁ ɑ n d ɑ v ɔ ɾ ɑ k ɑ n,0
{arm}աղանդավորություն,ɑ ʁ ɑ n d ɑ v ɔ ɾ u tʰ j u n,0
{arm}աղաչել,ɑ ʁ ɑ t͡ʃʰ ɛ l,0
{arm}աղասի,ɑ ʁ ɑ s i,0
{arm}աղավաղել,ɑ ʁ ɑ v ɑ ʁ ɛ l,0
{arm}աղավնի,ɑ ʁ ɑ v n i,0
{arm}աղբ,ɑ χ p,0
{arm}աղբաման,ɑ ʁ b ɑ m ɑ n,0
{arm}աղբանոց,ɑ χ p ɑ n ɔ t͡sʰ,0
{arm}աղբերակ,ɑ χ p ɛ ɾ ɑ k,0
{arm}աղբյուր,ɑ χ p j u ɾ,0
{arm}աղդամ,ɑ ʁ d ɑ m,0
{arm}աղեկ,ɑ ʁ ɛ k,0
{arm}աղեղ,ɑ ʁ ɛ ʁ,0
{arm}աղերս,ɑ ʁ ɛ ɾ s,0
{arm}աղերսել,ɑ ʁ ɛ ɾ s ɛ l,0
{arm}աղի,ɑ ʁ i,0
{arm}աղիճ,ɑ ʁ i t͡ʃ,0
{arm}աղիողորմ,ɑ ʁ i ɔ ʁ ɔ ɾ m,0
{arm}աղիք,ɑ ʁ i kʰ,0
{arm}աղխ,ɑ χː,0
{arm}աղճատել,ɑ χ t͡ʃ ɑ t ɛ l,0
{arm}աղմկել,ɑ ʁ m ə k ɛ l,0
{arm}աղմուկ,ɑ ʁ m u k,0
{arm}աղյուս,ɑ ʁ j u s,0
{arm}աղյուսակ,ɑ ʁ j u s ɑ k,0
{arm}աղյուսե,ɑ ʁ j u s ɛ,0
{arm}աղոթք,ɑ ʁ ɔ tʰ kʰ,0
{arm}աղու,ɑ ʁ u,0
{arm}աղունիկ,ɑ ʁ u n i k,0
{arm}աղջամուղջ,ɑ ʁ d͡ʒ ɑ m u ʁ d͡ʒ,0
{arm}աղջիկ,ɑ χ t͡ʃʰ i k,0
{arm}աղվանք,ɑ ʁ v ɑ ŋ kʰ,0
{arm}աղվես,ɑ ʁ v ɛ s,0
{arm}աղվեսենի,ɑ ʁ v ɛ s ɛ n i,0
{arm}աղվոր,ɑ ʁ v ɔ ɾ,0
{arm}աղտ,ɑ χ t,0
{arm}աղտոտել,ɑ χ t ɔ t ɛ l,0
{arm}աղցան,ɑ χ t͡sʰ ɑ n,0
{arm}աղքատ,ɑ χ kʰ ɑ t,0
{arm}աղքատները,ɑ χ kʰ ɑ t n ɛ ɾ ə,0
{arm}աղքատություն,ɑ χ kʰ ɑ t u tʰ j u n,0
{arm}աճառյան,ɑ t͡ʃ ɑ r j ɑ n,0
{arm}աճեմյան,ɑ t͡ʃ ɛ m j ɑ n,0
{arm}աճեցնել,ɑ t͡ʃ ɛ t͡sʰ n ɛ l,0
{arm}աճյուն,ɑ t͡ʃ j u n,0
{arm}աճուրդ,ɑ t͡ʃ u ɾ tʰ,0
{arm}աճպարարություն,ɑ t͡ʃ p ɑ ɾ ɑ ɾ u tʰ j u n,0
{arm}ամ,ɑ m,0
{arm}ամայի,ɑ m ɑ j i,0
{arm}աման,ɑ m ɑ n,0
{arm}ամանոր,ɑ m ɑ n ɔ ɾ,0
{arm}ամանորյա,ɑ m ɑ n ɔ ɾ j ɑ,0
{arm}ամաչել,ɑ m ɑ t͡ʃʰ ɛ l,0
{arm}ամաչկոտ,ɑ m ɑ t͡ʃʰ k ɔ t,0
{arm}ամառ,ɑ m ɑ r,0
{arm}ամառային,ɑ m ɑ r ɑ j i n,0
{arm}ամառանոց,ɑ m ɑ r ɑ n ɔ t͡sʰ,0
{arm}ամբակում,ɑ m b ɑ k u m,0
{arm}ամբաստանյալ,ɑ m b ɑ s t ɑ n j ɑ l,0
{arm}ամբաստանք,ɑ m b ɑ s t ɑ ŋ kʰ,0
{arm}ամբար,ɑ m b ɑ ɾ,0
{arm}ամբարիշտ,ɑ m b ɑ ɾ i ʃ t,0
{arm}ամբարտակ,ɑ m b ɑ ɾ t ɑ k,0
{arm}ամբարտավանություն,ɑ m b ɑ ɾ t ɑ v ɑ n u tʰ j u n,0
{arm}ամբոխ,ɑ m b ɔ χ,0
{arm}ամբողջ,ɑ m b ɔ χ t͡ʃʰ,0
{arm}ամբողջություն,ɑ m b ɔ χ t͡ʃʰ u tʰ j u n,0
{arm}ամեն,ɑ m ɛ n,0
{arm}ամենագետ,ɑ m ɛ n ɑ ɡ ɛ t,0
{arm}ամենազոր,ɑ m ɛ n ɑ z ɔ ɾ,0
{arm}ամենալավ,ɑ m ɛ n ɑ l ɑ v,0
{arm}ամենակալ,ɑ m ɛ n ɑ k ɑ l,0
{arm}ամենամեծ,ɑ m ɛ n ɑ m ɛ t͡s,0
{arm}ամենայն,ɑ m ɛ n ɑ j n,0
{arm}ամենուր,ɑ m ɛ n u ɾ,0
{arm}ամերիկա,ɑ m ɛ ɾ i k ɑ,0
{arm}ամերիկական,ɑ m ɛ ɾ i k ɑ k ɑ n,0
{arm}ամերիկայի,ɑ m ɛ ɾ i k ɑ j i,0
{arm}ամերիկացի,ɑ m ɛ ɾ i k ɑ t͡sʰ i,0
{arm}ամերիկյան,ɑ m ɛ ɾ i k j ɑ n,0
{arm}ամերիկուհի,ɑ m ɛ ɾ i k u h i,0
{arm}ամիս,ɑ m i s,0
{arm}ամիրա,ɑ m i ɾ ɑ,0
{arm}ամիրյան,ɑ m i ɾ j ɑ n,0
{arm}ամիրսպասալար,ɑ m i ɾ s p ɑ s ɑ l ɑ ɾ,0
{arm}ամն,ɑ m ə n ə,0
{arm}ամնիստիա,ɑ m n i s t j ɑ,0
{arm}ամոթ,ɑ m ɔ tʰ,0
{arm}ամորձիք,ɑ m ɔ ɾ d͡z i kʰ,0
{arm}ամուլ,ɑ m u l,0
{arm}ամուսին,ɑ m u s i n,0
{arm}ամուսնալուծություն,ɑ m u s n ɑ l u t͡s u tʰ j u n,0
{arm}ամուսնացած,ɑ m u s n ɑ t͡sʰ ɑ t͡s,0
{arm}ամուսնություն,ɑ m u s n u tʰ j u n,0
{arm}ամուր,ɑ m u ɾ,0
{arm}ամուրի,ɑ m u ɾ i,0
{arm}ամսագիր,ɑ m s ɑ ɡ i ɾ,0
{arm}ամսական,ɑ m s ɑ k ɑ n,0
{arm}ամսեկան,ɑ m s ɛ k ɑ n,0
{arm}ամստերդամ,ɑ m s t ɛ ɾ d ɑ m,0
{arm}ամրակ,ɑ m ɾ ɑ k,0
{arm}ամրակազմ,ɑ m ɾ ɑ k ɑ z m,0
{arm}ամրապնդում,ɑ m ɾ ɑ p ə n d u m,0
{arm}ամրոց,ɑ m ɾ ɔ t͡sʰ,0
{arm}ամփոփել,ɑ m pʰ ɔ pʰ ɛ l,0
{arm}այբ,ɑ j b,0
{arm}այբբենարան,ɑ j bː ɛ n ɑ ɾ ɑ n,0
{arm}այբուբեն,ɑ j b u b ɛ n,0
{arm}այգաբաց,ɑ j ɡ ɑ b ɑ t͡sʰ,0
{arm}այգեպան,ɑ j ɡ ɛ p ɑ n,0
{arm}այգեստան,ɑ j ɡ ɛ s t ɑ n,0
{arm}այգի,ɑ j ɡ i,0
{arm}այդուհանդերձ,ɑ j d u h ɑ n d ɛ ɾ t͡sʰ,0
{arm}այդտեղ,ɑ j d t ɛ ʁ,0
{arm}այժմ,ɑ j ʒ ə m,0
{arm}այժմու,ɑ j ʒ ə m u,0
{arm}այլ,ɑ j l,0
{arm}այլանդակություն,ɑ j l ɑ n d ɑ k u tʰ j u n,0
{arm}այլեւայլ,ɑ j l ɛ v ɑ j l,0
{arm}այլեւայլություն,ɑ j l ɛ v ɑ j l u tʰ j u n,0
{arm}այլեւս,ɑ j l ɛ v ə s,0
{arm}այլընտրանք,ɑ j l ə n t ɾ ɑ ŋ kʰ,0
{arm}այլընտրանքային,ɑ j l ə n t ɾ ɑ ŋ kʰ ɑ j i n,0
{arm}այծ,ɑ j t͡s,0
{arm}այծենի,ɑ j t͡s ɛ n i,0
{arm}այծյամ,ɑ j t͡s j ɑ m,0
{arm}այնուամենայնիվ,ɑ j n u ɑ m ɛ n ɑ j n i v,0
{arm}այնուհետեւ,ɑ j n u h ɛ t ɛ v,0
{arm}այնպես,ɑ j n p ɛ s,0
{arm}այնտեղ,ɑ j n t ɛ ʁ,0
{arm}այուբյան,ɑ j u b j ɑ n,0
{arm}այսինքն,ɑ j s i ŋ kʰ ə n,0
{arm}այսու,ɑ j s u,0
{arm}այսուամենայնիվ,ɑ j s u ɑ m ɛ n ɑ j n i v,0
{arm}այսուհանդերձ,ɑ j s u h ɑ n d ɛ ɾ t͡sʰ,0
{arm}այսուհետ,ɑ j s u h ɛ t,0
{arm}այսուհետեւ,ɑ j s u h ɛ t ɛ v,0
{arm}այստեղ,ɑ j s t ɛ ʁ,0
{arm}այստեղացի,ɑ j s t ɛ ʁ ɑ t͡sʰ i,0
{arm}այսրկովկասյան,ɑ j s ə ɾ k ɔ f k ɑ s j ɑ n,0
{arm}այսօր,ɑ j s ɔ ɾ,0
{arm}այվազյան,ɑ j v ɑ z j ɑ n,0
{arm}այտուց,ɑ j t u t͡sʰ,0
{arm}այրել,ɑ j ɾ ɛ l,0
{arm}այրի,ɑ j ɾ i,0
{arm}այրուկ,ɑ j ɾ u k,0
{arm}այց,ɑ j t͡sʰ,0
{arm}այցելել,ɑ j t͡sʰ ɛ l ɛ l,0
{arm}այցելություն,ɑ j t͡sʰ ɛ l u tʰ j u n,0
{arm}ան,ɑ n,0
{arm}անագորույն,ɑ n ɑ ɡ ɔ ɾ u j n,0
{arm}անազնիվ,ɑ n ɑ z n i v,0
{arm}անալի,ɑ n ɑ l i,0
{arm}անախորժ,ɑ n ɑ χ ɔ ɾ ʒ,0
{arm}անակ,ɑ n ɑ k,0
{arm}անակնկալ,ɑ n ɑ k ə ŋ k ɑ l,0
{arm}անահիտ,ɑ n ɑ h i t,0
{arm}անաղարտ,ɑ n ɑ ʁ ɑ ɾ t,0
{arm}անամոք,ɑ n ɑ m ɔ kʰ,0
{arm}անապատ,ɑ n ɑ p ɑ t,0
{arm}անասնաբույժ,ɑ n ɑ s n ɑ b u j ʒ,0
{arm}անաստաս,ɑ n ɑ s t ɑ s,0
{arm}անատոլիա,ɑ n ɑ t ɔ l j ɑ,0
{arm}անատոլիական,ɑ n ɑ t ɔ l j ɑ k ɑ n,0
{arm}անատոմիա,ɑ n ɑ t ɔ m j ɑ,0
{arm}անարատ,ɑ n ɑ ɾ ɑ t,0
{arm}անարդարություն,ɑ n ɑ ɾ tʰ ɑ ɾ u tʰ j u n,0
{arm}անարի,ɑ n ɑ ɾ i,0
{arm}անաքսիմանդրոս,ɑ n ɑ kʰ s i m ɑ n d ɾ ɔ s,0
{arm}անբարյացկամ,ɑ n b ɑ ɾ j ɑ t͡sʰ k ɑ m,0
{arm}անբիծ,ɑ n b i t͡s,0
{arm}անբնակ,ɑ n b ə n ɑ k,0
{arm}անբովանդակ,ɑ n b ɔ v ɑ n d ɑ k,0
{arm}անգ,ɑ ŋ ɡ,0
{arm}անգամ,ɑ ŋ kʰ ɑ m,0
{arm}անգեղ,ɑ ŋ ɡ ɛ ʁ,0
{arm}անգինա,ɑ ŋ ɡ i n ɑ,0
{arm}անգիր,ɑ ŋ ɡ i ɾ,0
{arm}անգլերեն,ɑ ŋ ɡ l ɛ ɾ ɛ n,0
{arm}անգլիա,ɑ ŋ ɡ l j ɑ,0
{arm}անգլիացի,ɑ ŋ ɡ l j ɑ t͡sʰ i,0
{arm}անգլուհի,ɑ ŋ ɡ l u h i,0
{arm}անգղ,ɑ ŋ ɡ ə ʁ,0
{arm}անգնահատելի,ɑ ŋ ɡ ə n ɑ h ɑ t ɛ l i,0
{arm}անգործ,ɑ ŋ ɡ ɔ ɾ t͡s,0
{arm}անդ,ɑ n d,0
{arm}անդադար,ɑ n d ɑ tʰ ɑ ɾ,0
{arm}անդամ,ɑ n tʰ ɑ m,0
{arm}անդամալուծություն,ɑ n tʰ ɑ m ɑ l u t͡s u tʰ j u n,0
{arm}անդամակից,ɑ n tʰ ɑ m ɑ k i t͡sʰ,0
{arm}անդաստան,ɑ n d ɑ s t ɑ n,0
{arm}անդեր,ɑ n d ɛ ɾ,0
{arm}անդորր,ɑ n d ɔ ɾː,0
{arm}անդորրագիր,ɑ n d ɔ ɾː ɑ ɡ i ɾ,0
{arm}անդունդ,ɑ n d u n d,0
{arm}անդրադառնալ,ɑ n d ɾ ɑ d ɑ r n ɑ l,0
{arm}անդրանիկ,ɑ n d ɾ ɑ n i k,0
{arm}անդրավարտիք,ɑ n d ɾ ɑ v ɑ ɾ t i kʰ,0
{arm}անդրի,ɑ n d ɾ i,0
{arm}անդրկովկաս,ɑ n d ə ɾ k ɔ f k ɑ s,0
{arm}անդրկովկասյան,ɑ n d ə ɾ k ɔ f k ɑ s j ɑ n,0
{arm}անդրշիրիմյան,ɑ n d ə ɾ ʃ i ɾ i m j ɑ n,0
{arm}անդրջրհեղեղյան,ɑ n d ə ɾ d͡ʒ ə ɾ h ɛ ʁ ɛ ʁ j ɑ n,0
{arm}անեզական,ɑ n ɛ z ɑ k ɑ n,0
{arm}անել,ɑ n ɛ l,0
{arm}անելիք,ɑ n ɛ l i kʰ,0
{arm}անեծք,ɑ n ɛ t͡s kʰ,0
{arm}անեկդոտ,ɑ n ɛ k d ɔ t,0
{arm}աներ,ɑ n ɛ ɾ,0
{arm}աներկյուղ,ɑ n ɛ ɾ k j u ʁ,0
{arm}աներձագ,ɑ n ɛ ɾ d͡z ɑ kʰ,0
{arm}անզոր,ɑ n z ɔ ɾ,0
{arm}անթառամ,ɑ n tʰ ɑ r ɑ m,0
{arm}անթարշամ,ɑ n tʰ ɑ ɾ ʃ ɑ m,0
{arm}անթերի,ɑ n tʰ ɛ ɾ i,0
{arm}անժելա,ɑ n ʒ ɛ l ɑ,0
{arm}անիծել,ɑ n i t͡s ɛ l,0
{arm}անիծյալ,ɑ n i t͡s j ɑ l,0
{arm}անիմաստ,ɑ n i m ɑ s t,0
{arm}անիրավ,ɑ n i ɾ ɑ v,0
{arm}անխելք,ɑ n χ ɛ l kʰ,0
{arm}անխնա,ɑ n χ ə n ɑ,0
{arm}անծանոթ,ɑ n t͡s ɑ n ɔ tʰ,0
{arm}անկախ,ɑ ŋ k ɑ χ,0
{arm}անկանոն,ɑ ŋ k ɑ n ɔ n,0
{arm}անկաշկանդ,ɑ ŋ k ɑ ʃ k ɑ n d,0
{arm}անկասկած,ɑ ŋ k ɑ s k ɑ t͡s,0
{arm}անկարա,ɑ ŋ k ɑ ɾ ɑ,0
{arm}անկարելի,ɑ ŋ k ɑ ɾ ɛ l i,0
{arm}անկեղծություն,ɑ ŋ k ɛ χ t͡s u tʰ j u n,0
{arm}անկյալ,ɑ ŋ k j ɑ l,0
{arm}անկյուն,ɑ ŋ k j u n,0
{arm}անկում,ɑ ŋ k u m,0
{arm}անկուշտ,ɑ ŋ k u ʃ t,0
{arm}անհաղթ,ɑ n h ɑ χ tʰ,0
{arm}անհաղթելի,ɑ n h ɑ χ tʰ ɛ l i,0
{arm}անհամ,ɑ n h ɑ m,0
{arm}անհամբեր,ɑ n h ɑ m pʰ ɛ ɾ,0
{arm}անհամեստ,ɑ n h ɑ m ɛ s t,0
{arm}անհամեստորեն,ɑ n h ɑ m ɛ s t ɔ ɾ ɛ n,0
{arm}անհամեստություն,ɑ n h ɑ m ɛ s t u tʰ j u n,0
{arm}անհայտ,ɑ n h ɑ j t,0
{arm}անհանգիստ,ɑ n h ɑ ŋ ɡ i s t,0
{arm}անհանգստանալ,ɑ n h ɑ ŋ ɡ ə s t ɑ n ɑ l,0
{arm}անհապաղ,ɑ n h ɑ p ɑ ʁ,0
{arm}անհաջողություն,ɑ n h ɑ d͡ʒ ɔ ʁ u tʰ j u n,0
{arm}անհասանելի,ɑ n h ɑ s ɑ n ɛ l i,0
{arm}անհավանական,ɑ n h ɑ v ɑ n ɑ k ɑ n,0
{arm}անհատ,ɑ n h ɑ t,0
{arm}անհատակ,ɑ n h ɑ t ɑ k,0
{arm}անհատականություն,ɑ n h ɑ t ɑ k ɑ n u tʰ j u n,0
{arm}անհեթեթություն,ɑ n h ɛ tʰ ɛ tʰ u tʰ j u n,0
{arm}անհեռանկարային,ɑ n h ɛ r ɑ n ə k ɑ ɾ ɑ j i n,0
{arm}անհետ,ɑ n h ɛ t,0
{arm}անհետանալ,ɑ n h ɛ t ɑ n ɑ l,0
{arm}անհերքելի,ɑ n h ɛ ɾ kʰ ɛ l i,0
{arm}անհիմն,ɑ n h i m ə n,0
{arm}անհնար,ɑ n h ə n ɑ ɾ,0
{arm}անհուն,ɑ n h u n,0
{arm}անձ,ɑ n d͡z,0
{arm}անձամբ,ɑ n d͡z ɑ m pʰ,0
{arm}անձավ,ɑ n d͡z ɑ v,0
{arm}անձեռոց,ɑ n d͡z ɛ r ɔ t͡sʰ,0
{arm}անձինք,ɑ n d͡z i ŋ kʰ,0
{arm}անձիք,ɑ n d͡z i kʰ,0
{arm}անձնագիր,ɑ n d͡z n ɑ ɡ i ɾ,0
{arm}անձնական,ɑ n d͡z n ɑ k ɑ n,0
{arm}անձնանուն,ɑ n d͡z n ɑ n u n,0
{arm}անձնյա,ɑ n d͡z n j ɑ,0
{arm}անձրեւ,ɑ n d͡z ɾ ɛ v,0
{arm}անձրեւանոց,ɑ n d͡z ɾ ɛ v ɑ n ɔ t͡sʰ,0
{arm}անձրեւել,ɑ n d͡z ɾ ɛ v ɛ l,0
{arm}անճար,ɑ n t͡ʃ ɑ ɾ,0
{arm}անմահ,ɑ n m ɑ h,0
{arm}անմահություն,ɑ n m ɑ h u tʰ j u n,0
{arm}անմեղ,ɑ n m ɛ ʁ,0
{arm}անմեղություն,ɑ n m ɛ ʁ u tʰ j u n,0
{arm}անմեռ,ɑ n m ɛ r,0
{arm}անմիջաբար,ɑ n m i t͡ʃʰ ɑ b ɑ ɾ,0
{arm}անմիջական,ɑ n m i t͡ʃʰ ɑ k ɑ n,0
{arm}անմիջականորեն,ɑ n m i t͡ʃʰ ɑ k ɑ n ɔ ɾ ɛ n,0
{arm}անմիտ,ɑ n m i t,0
{arm}անմոռուկ,ɑ n m ɔ r u k,0
{arm}աննա,ɑ nː ɑ,0
{arm}աննամուս,ɑ nː ɑ m u s,0
{arm}աննկուն,ɑ nː ə k u n,0
{arm}աննման,ɑ nː ə m ɑ n,0
{arm}աննպաստ,ɑ nː ə p ɑ s t,0
{arm}աննվաճ,ɑ nː ə v ɑ t͡ʃ,0
{arm}անշարժ,ɑ n ʃ ɑ ɾ ʒ,0
{arm}անշեն,ɑ n ʃ ɛ n,0
{arm}անշշուկ,ɑ n ʃ ə ʃ u k,0
{arm}անշուշտ,ɑ n ʃ u ʃ t,0
{arm}անշուք,ɑ n ʃ u kʰ,0
{arm}անշրջելի,ɑ n ʃ ə ɾ d͡ʒ ɛ l i,0
{arm}անոթ,ɑ n ɔ tʰ,0
{arm}անոնք,ɑ n ɔ ŋ kʰ,0
{arm}անորոշ,ɑ n ɔ ɾ ɔ ʃ,0
{arm}անորոշելի,ɑ n ɔ ɾ ɔ ʃ ɛ l i,0
{arm}անորոշություն,ɑ n ɔ ɾ ɔ ʃ u tʰ j u n,0
{arm}անութ,ɑ n u tʰ,0
{arm}անուշահոտություն,ɑ n u ʃ ɑ h ɔ t u tʰ j u n,0
{arm}անուշավան,ɑ n u ʃ ɑ v ɑ n,0
{arm}անուրջ,ɑ n u ɾ d͡ʒ,0
{arm}անպայման,ɑ n p ɑ j m ɑ n,0
{arm}անպատեհ,ɑ n p ɑ t ɛ h,0
{arm}անպատրաստ,ɑ n p ɑ t ɾ ɑ s t,0
{arm}անպիտան,ɑ n p i t ɑ n,0
{arm}անջատ,ɑ n d͡ʒ ɑ t,0
{arm}անջատել,ɑ n d͡ʒ ɑ t ɛ l,0
{arm}անջրդի,ɑ n d͡ʒ ə ɾ tʰ i,0
{arm}անջրպետ,ɑ n d͡ʒ ə ɾ p ɛ t,0
{arm}անսասան,ɑ n s ɑ s ɑ n,0
{arm}անսպառ,ɑ n s p ɑ r,0
{arm}անվադող,ɑ n v ɑ d ɔ ʁ,0
{arm}անվախ,ɑ n v ɑ χ,0
{arm}անվայել,ɑ n v ɑ j ɛ l,0
{arm}անվանել,ɑ n v ɑ n ɛ l,0
{arm}անվանի,ɑ n v ɑ n i,0
{arm}անվասայլակ,ɑ n v ɑ s ɑ j l ɑ k,0
{arm}անվճռական,ɑ n v ə t͡ʃ r ɑ k ɑ n,0
{arm}անվճռականություն,ɑ n v ə t͡ʃ r ɑ k ɑ n u tʰ j u n,0
{arm}անվտանգության,ɑ n v ə t ɑ ŋ ɡ u tʰ j ɑ n,0
{arm}անվտանգություն,ɑ n v ə t ɑ ŋ ɡ u tʰ j u n,0
{arm}անտանանարիվու,ɑ n t ɑ n ɑ n ɑ ɾ i v u,0
{arm}անտառ,ɑ n t ɑ r,0
{arm}անտարբերություն,ɑ n t ɑ ɾ b ɛ ɾ u tʰ j u n,0
{arm}անտեր,ɑ n t ɛ ɾ,0
{arm}անտերունչ,ɑ n t ɛ ɾ u n t͡ʃʰ,0
{arm}անտի,ɑ n t i,0
{arm}անտիկ,ɑ n t i k,0
{arm}անտիոք,ɑ n t i ɔ kʰ,0
{arm}անտիոքացի,ɑ n t i ɔ kʰ ɑ t͡sʰ i,0
{arm}անտիոքոս,ɑ n t i ɔ kʰ ɔ s,0
{arm}անտիտավրոս,ɑ n t i t ɑ v ɾ ɔ s,0
{arm}անտիցիկլոն,ɑ n t i t͡sʰ i k l ɔ n,0
{arm}անտոնի,ɑ n t ɔ n i,0
{arm}անտոնիոս,ɑ n t ɔ n j ɔ s,0
{arm}անտուն,ɑ n t u n,0
{arm}անրադառնալ,ɑ n ɾ ɑ d ɑ r n ɑ l,0
{arm}անց,ɑ n t͡sʰ,0
{arm}անցած,ɑ n t͡sʰ ɑ t͡s,0
{arm}անցկացնել,ɑ n t͡sʰ k ɑ t͡sʰ n ɛ l,0
{arm}անցյալ,ɑ n t͡sʰ j ɑ l,0
{arm}անցնել,ɑ n t͡sʰ n ɛ l,0
{arm}անցողական,ɑ n t͡sʰ ɔ ʁ ɑ k ɑ n,0
{arm}անցում,ɑ n t͡sʰ u m,0
{arm}անցք,ɑ n t͡sʰ kʰ,0
{arm}անփույթ,ɑ n pʰ u j tʰ,0
{arm}անօգ,ɑ n ɔ kʰ,0
{arm}անօգուտ,ɑ n ɔ kʰ u t,0
{arm}անօդաչու,ɑ n ɔ tʰ ɑ t͡ʃʰ u,0
{arm}անօթեւան,ɑ n ɔ tʰ ɛ v ɑ n,0
{arm}աշակերտ,ɑ ʃ ɑ k ɛ ɾ t,0
{arm}աշակերտուհի,ɑ ʃ ɑ k ɛ ɾ t u h i,0
{arm}աշխաբադ,ɑ ʃ χ ɑ b ɑ d,0
{arm}աշխատակազմ,ɑ ʃ χ ɑ t ɑ k ɑ z m,0
{arm}աշխատակից,ɑ ʃ χ ɑ t ɑ k i t͡sʰ,0
{arm}աշխատանք,ɑ ʃ χ ɑ t ɑ ŋ kʰ,0
{arm}աշխատասեր,ɑ ʃ χ ɑ t ɑ s ɛ ɾ,0
{arm}աշխատավարձ,ɑ ʃ χ ɑ t ɑ v ɑ ɾ t͡sʰ,0
{arm}աշխատել,ɑ ʃ χ ɑ t ɛ l,0
{arm}աշխատող,ɑ ʃ χ ɑ t ɔ ʁ,0
{arm}աշխարհաբար,ɑ ʃ χ ɑ ɾ ɑ b ɑ ɾ,0
{arm}աշխարհագրական,ɑ ʃ χ ɑ ɾ ɑ ɡ ɾ ɑ k ɑ n,0
{arm}աշխարհագրություն,ɑ ʃ χ ɑ ɾ ɑ ɡ ɾ u tʰ j u n,0
{arm}աշխարհակալ,ɑ ʃ χ ɑ ɾ ɑ k ɑ l,0
{arm}աշխարհահայացք,ɑ ʃ χ ɑ ɾ ɑ h ɑ j ɑ t͡sʰ kʰ,0
{arm}աշխարհամաս,ɑ ʃ χ ɑ ɾ ɑ m ɑ s,0
{arm}աշխարհայացք,ɑ ʃ χ ɑ ɾ h ɑ j ɑ t͡sʰ kʰ,0
{arm}աշխարհային,ɑ ʃ χ ɑ ɾ ɑ j i n,0
{arm}աշխարհաքաղաքական,ɑ ʃ χ ɑ ɾ ɑ kʰ ɑ ʁ ɑ kʰ ɑ k ɑ n,0
{arm}աշխեն,ɑ ʃ χ ɛ n,0
{arm}աշխույժ,ɑ ʃ χ u j ʒ,0
{arm}աշկարա,ɑ ʃ k ɑ ɾ ɑ,0
{arm}աշոտ,ɑ ʃ ɔ t,0
{arm}աշոտյան,ɑ ʃ ɔ t j ɑ n,0
{arm}աշորա,ɑ ʃ ɔ ɾ ɑ,0
{arm}աշուղ,ɑ ʃ u ʁ,0
{arm}աշտարակ,ɑ ʃ t ɑ ɾ ɑ k,0
{arm}աուդիտոր,ɑ u d i t ɔ ɾ,0
{arm}աուլիս,ɑ u l i s,0
{arm}աչալուրջ,ɑ t͡ʃʰ ɑ l u ɾ d͡ʒ,0
{arm}աչք,ɑ t͡ʃʰ kʰ,0
{arm}ապա,ɑ p ɑ,0
{arm}ապաթարց,ɑ p ɑ tʰ ɑ ɾ t͡sʰ,0
{arm}ապակառուցողական,ɑ p ɑ k ɑ r u t͡sʰ ɔ ʁ ɑ k ɑ n,0
{arm}ապակատար,ɑ p ɑ k ɑ t ɑ ɾ,0
{arm}ապահարզան,ɑ p ɑ h ɑ ɾ z ɑ n,0
{arm}ապահով,ɑ p ɑ h ɔ v,0
{arm}ապահովանալ,ɑ p ɑ h ɔ v ɑ n ɑ l,0
{arm}ապահովել,ɑ p ɑ h ɔ v ɛ l,0
{arm}ապահովում,ɑ p ɑ h ɔ v u m,0
{arm}ապահովվել,ɑ p ɑ h ɔ vː ɛ l,0
{arm}ապաշրջափակել,ɑ p ɑ ʃ ə ɾ d͡ʒ ɑ pʰ ɑ k ɛ l,0
{arm}ապառաժ,ɑ p ɑ r ɑ ʒ,0
{arm}ապառնի,ɑ p ɑ r n i,0
{arm}ապավեն,ɑ p ɑ v ɛ n,0
{arm}ապավինել,ɑ p ɑ v i n ɛ l,0
{arm}ապատ,ɑ p ɑ t,0
{arm}ապարան,ɑ p ɑ ɾ ɑ n,0
{arm}ապարանջան,ɑ p ɑ ɾ ɑ n d͡ʒ ɑ n,0
{arm}ապարանք,ɑ p ɑ ɾ ɑ ŋ kʰ,0
{arm}ապարատ,ɑ p ɑ ɾ ɑ t,0
{arm}ապացույց,ɑ p ɑ t͡sʰ u j t͡sʰ,0
{arm}ապացուցանել,ɑ p ɑ t͡sʰ u t͡sʰ ɑ n ɛ l,0
{arm}ապացուցել,ɑ p ɑ t͡sʰ u t͡sʰ ɛ l,0
{arm}ապացուցում,ɑ p ɑ t͡sʰ u t͡sʰ u m,0
{arm}ապացուցվել,ɑ p ɑ t͡sʰ u t͡sʰ v ɛ l,0
{arm}ապենինյան,ɑ p ɛ n i n j ɑ n,0
{arm}ապեր,ɑ p ɛ ɾ,0
