merged_spelling,ipa,langid
{arm}դարեհ,d ɑ ɾ ɛ h,0
{arm}դարեր,d ɑ ɾ ɛ ɾ,0
{arm}դարձ,d ɑ ɾ t͡sʰ,0
{arm}դարձյալ,d ɑ ɾ t͡sʰ j ɑ l,0
{arm}դարձվածք,d ɑ ɾ t͡sʰ v ɑ t͡s kʰ,0
{arm}դարձվոր,d ɑ ɾ t͡sʰ v ɔ ɾ,0
{arm}դարման,d ɑ ɾ m ɑ n,0
{arm}դարչին,d ɑ ɾ t͡ʃʰ i n,0
{arm}դարպաս,d ɑ ɾ p ɑ s,0
{arm}դարվինիզմ,d ɑ ɾ v i n i z m,0
{arm}դափնեկիր,d ɑ pʰ n ɛ k i ɾ,0
{arm}դափնի,d ɑ pʰ n i,0
{arm}դդում,d ə tʰ u m,0
{arm}դե,d ɛ,0
{arm}դեբիլ,d ɛ b i l,0
{arm}դեգերում,d ɛ ɡ ɛ ɾ u m,0
{arm}դեդլայն,d ɛ d l ɑ j n,0
{arm}դեզ,d ɛ z,0
{arm}դելփին,d ɛ l pʰ i n,0
{arm}դելֆին,d ɛ l f i n,0
{arm}դեկտեմբեր,d ɛ k t ɛ m b ɛ ɾ,0
{arm}դեկտեմբերյան,d ɛ k t ɛ m b ɛ ɾ j ɑ n,0
{arm}դեղ,d ɛ ʁ,0
{arm}դեղահատ,d ɛ ʁ ɑ h ɑ t,0
{arm}դեղատոմս,d ɛ ʁ ɑ t ɔ m s,0
{arm}դեղատուն,d ɛ ʁ ɑ t u n,0
{arm}դեղին,d ɛ ʁ i n,0
{arm}դեղձ,d ɛ χ t͡sʰ,0
{arm}դեղնավուն,d ɛ ʁ n ɑ v u n,0
{arm}դեղնուց,d ɛ ʁ n u t͡sʰ,0
{arm}դեմ,d ɛ m,0
{arm}դեմիրճյան,d ɛ m i ɾ t͡ʃ j ɑ n,0
{arm}դեմոկրատ,d ɛ m ɔ k ɾ ɑ t,0
{arm}դեմոկրատիա,d ɛ m ɔ k ɾ ɑ t j ɑ,0
{arm}դեմք,d ɛ m kʰ,0
{arm}դեյրա,d ɛ j ɾ ɑ,0
{arm}դեպի,d ɛ p i,0
{arm}դեպք,d ɛ p kʰ,0
{arm}դեռ,d ɛ r,0
{arm}դեռեւս,d ɛ r ɛ v ə s,0
{arm}դեսպան,d ɛ s p ɑ n,0
{arm}դեսպանատուն,d ɛ s p ɑ n ɑ t u n,0
{arm}դեստրուկտիվ,d ɛ s t ɾ u k t i v,0
{arm}դետրոյտ,d ɛ t ɾ ɔ j t,0
{arm}դեր,d ɛ ɾ,0
{arm}դերանուն,d ɛ ɾ ɑ n u n,0
{arm}դերասան,d ɛ ɾ ɑ s ɑ n,0
{arm}դերասանուհի,d ɛ ɾ ɑ s ɑ n u h i,0
{arm}դերբայ,d ɛ ɾ b ɑ j,0
{arm}դերկոմս,d ɛ ɾ k ɔ m s,0
{arm}դերձակ,d ɛ ɾ t͡sʰ ɑ k,0
{arm}դեցիմետր,d ɛ t͡sʰ i m ɛ t ə ɾ,0
{arm}դեւ,d ɛ v,0
{arm}դեւանագարի,d ɛ v ɑ n ɑ ɡ ɑ ɾ i,0
{arm}դժար,d ə ʒ ɑ ɾ,0
{arm}դժբախտություն,d ə ʒ b ɑ χ t u tʰ j u n,0
{arm}դժգոհություն,d ə ʒ ɡ ɔ h u tʰ j u n,0
{arm}դժգույն,d ə ʒ ɡ u j n,0
{arm}դժոխք,d ə ʒ ɔ χ kʰ,0
{arm}դժվար,d ə ʒ v ɑ ɾ,0
{arm}դի,d i,0
{arm}դիաբետ,d i j ɑ b ɛ t,0
{arm}դիակ,d i j ɑ k,0
{arm}դիարան,d i j ɑ ɾ ɑ n,0
{arm}դիարբեքիր,d i j ɑ ɾ b ɛ kʰ i ɾ,0
{arm}դիետա,d i j ɛ t ɑ,0
{arm}դիեցիկ,d i j ɛ t͡sʰ i k,0
{arm}դիզայներ,d i z ɑ j n ɛ ɾ,0
{arm}դիլիջան,d i l i d͡ʒ ɑ n,0
{arm}դիմադրություն,d i m ɑ d ɾ u tʰ j u n,0
{arm}դիմախաղ,d i m ɑ χ ɑ ʁ,0
{arm}դիմակ,d i m ɑ k,0
{arm}դիմանալ,d i m ɑ n ɑ l,0
{arm}դիմանկար,d i m ɑ n ə k ɑ ɾ,0
{arm}դիմավորել,d i m ɑ v ɔ ɾ ɛ l,0
{arm}դիմացկուն,d i m ɑ t͡sʰ k u n,0
{arm}դիմորդ,d i m ɔ ɾ tʰ,0
{arm}դինաստիա,d i n ɑ s t j ɑ,0
{arm}դինար,d i n ɑ ɾ,0
{arm}դիոգենես,d i j ɔ ɡ ɛ n ɛ s,0
{arm}դիպակ,d i p ɑ k,0
{arm}դիպլոմ,d i p l ɔ m,0
{arm}դիպուկ,d i p u k,0
{arm}դիպչել,d i p t͡ʃʰ ɛ l,0
{arm}դիպված,d i p v ɑ t͡s,0
{arm}դիսերտացիա,d i s ɛ ɾ t ɑ t͡sʰ j ɑ,0
{arm}դիսկոտեկ,d i s k ɔ t ɛ k,0
{arm}դիսկուրս,d i s k u ɾ s,0
{arm}դիսպաշեր,d i s p ɑ ʃ ɛ ɾ,0
{arm}դիվանագետ,d i v ɑ n ɑ ɡ ɛ t,0
{arm}դիվանագիտություն,d i v ɑ n ɑ ɡ i t u tʰ j u n,0
{arm}դիվերսիոն,d i v ɛ ɾ s j ɔ n,0
{arm}դիվիդենտ,d i v i d ɛ n t,0
{arm}դիտակ,d i t ɑ k,0
{arm}դիտել,d i t ɛ l,0
{arm}դիտողություն,d i t ɔ ʁ u tʰ j u n,0
{arm}դիտորդական,d i t ɔ ɾ tʰ ɑ k ɑ n,0
{arm}դիտվել,d i t v ɛ l,0
{arm}դիրագ,d i ɾ ɑ ɡ,0
{arm}դիրք,d i ɾ kʰ,0
{arm}դիրքորոշում,d i ɾ kʰ ɔ ɾ ɔ ʃ u m,0
{arm}դիցուք,d i t͡sʰ u kʰ,0
{arm}դիք,d i kʰ,0
{arm}դհոլ,d ə h ɔ l,0
{arm}դղյակ,d ə ʁ j ɑ k,0
{arm}դյուժին,d j u ʒ i n,0
{arm}դյույմ,d j u j m,0
{arm}դյուր,d j u ɾ,0
{arm}դյուրաթեք,d j u ɾ ɑ tʰ ɛ kʰ,0
{arm}դյուրաշարժ,d j u ɾ ɑ ʃ ɑ ɾ ʒ,0
{arm}դյուցազուն,d j u t͡sʰ ɑ z u n,0
{arm}դնեստր,d n ɛ s t ə ɾ,0
{arm}դնթ,d ə n ə tʰ ə,0
{arm}դնչիկ,d ə n t͡ʃʰ i k,0
{arm}դոգմա,d ɔ ɡ m ɑ,0
{arm}դոդոշ,d ɔ d ɔ ʃ,0
{arm}դոլար,d ɔ l ɑ ɾ,0
{arm}դոլմա,d ɔ l m ɑ,0
{arm}դոխտուր,d ɔ χ t u ɾ,0
{arm}դոհա,d ɔ h ɑ,0
{arm}դող,d ɔ ʁ,0
{arm}դողալ,d ɔ ʁ ɑ l,0
{arm}դոմփել,d ɔ m pʰ ɛ l,0
{arm}դոնեցկ,d ɔ n ɛ t͡sʰ k,0
{arm}դոնի,d ɔ n i,0
{arm}դոշակ,d ɔ ʃ ɑ k,0
{arm}դոցենտ,d ɔ t͡sʰ ɛ n t,0
{arm}դու,d u,0
{arm}դուբայ,d u b ɑ j,0
{arm}դուբլին,d u b l i n,0
{arm}դուբնիում,d u b n i j u m,0
{arm}դուբոսար,d u b ɔ s ɑ ɾ,0
{arm}դուդուկ,d u d u k,0
{arm}դուխ,d u χ,0
{arm}դուխի,d u χ i,0
{arm}դուխով,d u χ ɔ v,0
{arm}դույզն,d u j z ə n,0
{arm}դույլ,d u j l,0
{arm}դուն,d u n,0
{arm}դունչ,d u n t͡ʃʰ,0
{arm}դուշանբե,d u ʃ ɑ n b ɛ,0
{arm}դուշման,d u ʃ m ɑ n,0
{arm}դուռ,d u r,0
{arm}դուստր,d u s t ə ɾ,0
{arm}դուր,d u ɾ,0
{arm}դուրգար,d u ɾ ɡ ɑ ɾ,0
{arm}դուրգարյան,d u ɾ ɡ ɑ ɾ j ɑ n,0
{arm}դուրս,d u ɾ s,0
{arm}դուք,d u kʰ,0
{arm}դուքան,d u kʰ ɑ n,0
{arm}դուքս,d u kʰ s,0
{arm}դպիր,d ə p i ɾ,0
{arm}դպրոց,d ə p ɾ ɔ t͡sʰ,0
{arm}դպրոցական,d ə p ɾ ɔ t͡sʰ ɑ k ɑ n,0
{arm}դռնապան,d ə r n ɑ p ɑ n,0
{arm}դռնփակ,d ə r ə n pʰ ɑ k,0
{arm}դրախտ,d ə ɾ ɑ χ t,0
{arm}դրական,d ə ɾ ɑ k ɑ n,0
{arm}դրամաշորթ,d ɾ ɑ m ɑ ʃ ɔ ɾ tʰ,0
{arm}դրամապանակ,d ɾ ɑ m ɑ p ɑ n ɑ k,0
{arm}դրամատուրգ,d ɾ ɑ m ɑ t u ɾ ɡ,0
{arm}դրամատուրգիական,d ɾ ɑ m ɑ t u ɾ ɡ j ɑ k ɑ n,0
{arm}դրամարկղ,d ə ɾ ɑ m ɑ ɾ k ə ʁ,0
{arm}դրանիկ,d ə ɾ ɑ n i k,0
{arm}դրացի,d ə ɾ ɑ t͡sʰ i,0
{arm}դրացիական,d ə ɾ ɑ t͡sʰ i j ɑ k ɑ n,0
{arm}դրափոխություն,d ə ɾ ɑ pʰ ɔ χ u tʰ j u n,0
{arm}դրժել,d ə ɾ ʒ ɛ l,0
{arm}դրոշմ,d ə ɾ ɔ ʃ m,0
{arm}դրություն,d ə ɾ u tʰ j u n,0
{arm}դրսեւորել,d ə ɾ s ɛ v ɔ ɾ ɛ l,0
{arm}եահկ,j ɛ ɑ h ə k ə,0
{arm}եատմ,j ɛ ɑ t ə m ə,0
{arm}եբրայերեն,j ɛ b ɾ ɑ j ɛ ɾ ɛ n,0
{arm}եբրայեցի,j ɛ b ɾ ɑ j ɛ t͡sʰ i,0
{arm}եգիպտացորեն,j ɛ ɡ i p t ɑ t͡sʰ ɔ ɾ ɛ n,0
{arm}եգիպտոս,j ɛ ɡ i p t ɔ s,0
{arm}եդեսացի,j ɛ d ɛ s ɑ t͡sʰ i,0
{arm}եդեսիա,j ɛ d ɛ s j ɑ,0
{arm}եզ,j ɛ z,0
{arm}եզնիկ,j ɛ z n i k,0
{arm}եզրակացություն,j ɛ z ɾ ɑ k ɑ t͡sʰ u tʰ j u n,0
{arm}եզրափակել,j ɛ z ɾ ɑ pʰ ɑ k ɛ l,0
{arm}եզրափակիչ,j ɛ z ɾ ɑ pʰ ɑ k i t͡ʃʰ,0
{arm}եթե,j ɛ tʰ ɛ,0
{arm}եթեր,j ɛ tʰ ɛ ɾ,0
{arm}եթովպիա,j ɛ tʰ ɔ f p j ɑ,0
{arm}ելակ,j ɛ l ɑ k,0
{arm}ելենա,j ɛ l ɛ n ɑ,0
{arm}ելիզավետա,j ɛ l i z ɑ v ɛ t ɑ,0
{arm}ելնել,j ɛ l n ɛ l,0
{arm}ելույթ,j ɛ l u j tʰ,0
{arm}ելունդ,j ɛ l u n d,0
{arm}ելուստ,j ɛ l u s t,0
{arm}ելցին,j ɛ l t͡sʰ i n,0
{arm}եխ,j ɛ χ ə,0
{arm}եկատերինբուրգ,j ɛ k ɑ t ɛ ɾ i n b u ɾ ɡ,0
{arm}եկբատան,j ɛ k b ɑ t ɑ n,0
{arm}եկեղեցի,j ɛ k ɛ ʁ ɛ t͡sʰ i,0
{arm}եկող,j ɛ k ɔ ʁ,0
{arm}եկվոր,j ɛ k v ɔ ɾ,0
{arm}եղած,j ɛ ʁ ɑ t͡s,0
{arm}եղանակ,j ɛ ʁ ɑ n ɑ k,0
{arm}եղբայր,j ɛ χ p ɑ j ɾ,0
{arm}եղբայրական,j ɛ χ p ɑ j ɾ ɑ k ɑ n,0
{arm}եղբորորդի,j ɛ χ p ɔ ɾ ɔ ɾ tʰ i,0
{arm}եղեգ,j ɛ ʁ ɛ ɡ,0
{arm}եղեգնաձոր,j ɛ ʁ ɛ ɡ n ɑ d͡z ɔ ɾ,0
{arm}եղեգնյա,j ɛ ʁ ɛ ɡ n j ɑ,0
{arm}եղեռն,j ɛ ʁ ɛ r n,0
{arm}եղերական,j ɛ ʁ ɛ ɾ ɑ k ɑ n,0
{arm}եղերդ,j ɛ ʁ ɛ ɾ d,0
{arm}եղեւնի,j ɛ ʁ ɛ v n i,0
{arm}եղեք,j ɛ ʁ ɛ kʰ,0
{arm}եղիա,j ɛ ʁ j ɑ,0
{arm}եղիշե,j ɛ ʁ i ʃ ɛ,0
{arm}եղիսաբեթ,j ɛ ʁ i s ɑ b ɛ tʰ,0
{arm}եղիր,j ɛ ʁ i ɾ,0
{arm}եղյամ,j ɛ ʁ j ɑ m,0
{arm}եղն,j ɛ ʁ ə n,0
{arm}եղնիկ,j ɛ ʁ n i k,0
{arm}եղունգ,j ɛ ʁ u ŋ ɡ,0
{arm}եղջյուր,j ɛ ʁ d͡ʒ j u ɾ,0
{arm}եմեն,j ɛ m ɛ n,0
{arm}եմիշ,j ɛ m i ʃ,0
{arm}են,ɛ n,0
{arm}ենթադրել,j ɛ n tʰ ɑ d ɾ ɛ l,0
{arm}ենթադրելի,j ɛ n tʰ ɑ d ɾ ɛ l i,0
{arm}ենթադրյալ,j ɛ n tʰ ɑ d ə ɾ j ɑ l,0
{arm}ենթակայական,j ɛ n tʰ ɑ k ɑ j ɑ k ɑ n,0
{arm}ենթակայան,j ɛ n tʰ ɑ k ɑ j ɑ n,0
{arm}ենթակայություն,j ɛ n tʰ ɑ k ɑ j u tʰ j u n,0
{arm}ենթակառույց,j ɛ n tʰ ɑ k ɑ r u j t͡sʰ,0
{arm}ենթարկել,j ɛ n tʰ ɑ ɾ k ɛ l,0
{arm}ենթարկվել,j ɛ n tʰ ɑ ɾ k v ɛ l,0
{arm}ենիչերի,j ɛ n i t͡ʃʰ ɛ ɾ i,0
{arm}ենիսեյ,j ɛ n i s ɛ j,0
{arm}եպիսկոպոս,j ɛ p i s k ɔ p ɔ s,0
{arm}եպհ,j ɛ p ə h ə,0
{arm}եռաբարբառ,j ɛ r ɑ b ɑ ɾ b ɑ r,0
{arm}եռալ,j ɛ r ɑ l,0
{arm}եռամսյակ,j ɛ r ɑ m s j ɑ k,0
{arm}եռանդ,j ɛ r ɑ n d,0
{arm}եռանդագին,j ɛ r ɑ n d ɑ ɡ i n,0
{arm}եռանդուն,j ɛ r ɑ n d u n,0
{arm}եռանկյուն,j ɛ r ɑ ŋ k j u n,0
{arm}եռացում,j ɛ r ɑ t͡sʰ u m,0
{arm}եսայի,j ɛ s ɑ j i,0
{arm}եսասիրական,j ɛ s ɑ s i ɾ ɑ k ɑ n,0
{arm}եվգենի,j ɛ v ɡ ɛ n i,0
{arm}եվսեբիոս,j ɛ f s ɛ b j ɔ s,0
{arm}եվրախորհրդարան,j ɛ v ɾ ɑ χ ɔ ɾ ə ɾ tʰ ɑ ɾ ɑ n,0
{arm}եվրահանձնաժողով,j ɛ v ɾ ɑ h ɑ n d͡z n ɑ ʒ ɔ ʁ ɔ v,0
{arm}եվրամիություն,j ɛ v ɾ ɑ m i u tʰ j u n,0
{arm}եվրասիական,j ɛ v ɾ ɑ s j ɑ k ɑ n,0
{arm}եվրատեսիլ,j ɛ v ɾ ɑ t ɛ s i l,0
{arm}եվրո,j ɛ v ɾ ɔ,0
{arm}եվրոպա,j ɛ v ɾ ɔ p ɑ,0
{arm}եվրոպական,j ɛ v ɾ ɔ p ɑ k ɑ n,0
{arm}եվրոպայի,j ɛ v ɾ ɔ p ɑ j i,0
{arm}եվրոպայում,j ɛ v ɾ ɔ p ɑ j u m,0
{arm}եվրոպացի,j ɛ v ɾ ɔ p ɑ t͡sʰ i,0
{arm}ետ,j ɛ t,0
{arm}ետեւ,j ɛ t ɛ v,0
{arm}ետին,j ɛ t i n,0
{arm}ետմ,j ɛ t ə m ə,0
{arm}երազ,j ɛ ɾ ɑ z,0
{arm}երազանք,j ɛ ɾ ɑ z ɑ ŋ kʰ,0
{arm}երազգավորս,j ɛ ɾ ɑ z ɡ ɑ v ɔ ɾ s,0
{arm}երազել,j ɛ ɾ ɑ z ɛ l,0
{arm}երաժիշտ,j ɛ ɾ ɑ ʒ i ʃ t,0
{arm}երախայրիք,j ɛ ɾ ɑ χ ɑ j ɾ i kʰ,0
{arm}երախտագիտություն,j ɛ ɾ ɑ χ t ɑ ɡ i t u tʰ j u n,0
{arm}երախտամոռ,j ɛ ɾ ɑ χ t ɑ m ɔ r,0
{arm}երախտիք,j ɛ ɾ ɑ χ t i kʰ,0
{arm}երակ,j ɛ ɾ ɑ k,0
{arm}երանգ,j ɛ ɾ ɑ ŋ ɡ,0
{arm}երանի,j ɛ ɾ ɑ n i,0
{arm}երաշխավորել,j ɛ ɾ ɑ ʃ χ ɑ v ɔ ɾ ɛ l,0
{arm}երաշխավորում,j ɛ ɾ ɑ ʃ χ ɑ v ɔ ɾ u m,0
{arm}երաշխիք,j ɛ ɾ ɑ ʃ χ i kʰ,0
{arm}երաշտ,j ɛ ɾ ɑ ʃ t,0
{arm}երբ,j ɛ ɾ pʰ,0
{arm}երբեմն,j ɛ ɾ pʰ ɛ m ə n,0
{arm}երբեմնի,j ɛ ɾ pʰ ɛ m n i,0
{arm}երգ,j ɛ ɾ kʰ,0
{arm}երգահան,j ɛ ɾ kʰ ɑ h ɑ n,0
{arm}երգել,j ɛ ɾ kʰ ɛ l,0
{arm}երգեցիկ,j ɛ ɾ kʰ ɛ t͡sʰ i k,0
{arm}երգեցողություն,j ɛ ɾ kʰ ɛ t͡sʰ ɔ ʁ u tʰ j u n,0
{arm}երգի,j ɛ ɾ kʰ i,0
{arm}երգիծաբան,j ɛ ɾ kʰ i t͡s ɑ b ɑ n,0
{arm}երգիծել,j ɛ ɾ kʰ i t͡s ɛ l,0
{arm}երգիչ,j ɛ ɾ kʰ i t͡ʃʰ,0
{arm}երգչուհի,j ɛ ɾ kʰ t͡ʃʰ u h i,0
{arm}երդում,j ɛ ɾ tʰ u m,0
{arm}երդվել,j ɛ ɾ tʰ v ɛ l,0
{arm}երդվյալ,j ɛ ɾ tʰ v j ɑ l,0
{arm}երեկ,j ɛ ɾ ɛ k,0
{arm}երեկո,j ɛ ɾ ɛ k ɔ,0
{arm}երեկոյան,j ɛ ɾ ɛ k ɔ j ɑ n,0
{arm}երեկույթ,j ɛ ɾ ɛ k u j tʰ,0
{arm}երեմիա,j ɛ ɾ ɛ m j ɑ,0
{arm}երեսնամյա,j ɛ ɾ ɛ s n ɑ m j ɑ,0
{arm}երերալ,j ɛ ɾ ɛ ɾ ɑ l,0
{arm}երեց,j ɛ ɾ ɛ t͡sʰ,0
{arm}երեւալ,j ɛ ɾ ɛ v ɑ l,0
{arm}երեւակայածին,j ɛ ɾ ɛ v ɑ k ɑ j ɑ t͡s i n,0
{arm}երեւակայական,j ɛ ɾ ɛ v ɑ k ɑ j ɑ k ɑ n,0
{arm}երեւակայել,j ɛ ɾ ɛ v ɑ k ɑ j ɛ l,0
{arm}երեւակայելի,j ɛ ɾ ɛ v ɑ k ɑ j ɛ l i,0
{arm}երեւակայություն,j ɛ ɾ ɛ v ɑ k ɑ j u tʰ j u n,0
{arm}երեւակայվել,j ɛ ɾ ɛ v ɑ k ɑ j v ɛ l,0
{arm}երեւան,j ɛ ɾ ɛ v ɑ n,0
{arm}երեւելի,j ɛ ɾ ɛ v ɛ l i,0
{arm}երեւույթ,j ɛ ɾ ɛ v u j tʰ,0
{arm}երեք,j ɛ ɾ ɛ kʰ,0
{arm}երեքկին,j ɛ ɾ ɛ kʰ k i n,0
{arm}երեքնուկ,j ɛ ɾ ɛ kʰ n u k,0
{arm}երթեւեկել,j ɛ ɾ tʰ ɛ v ɛ k ɛ l,0
{arm}երթեւեկություն,j ɛ ɾ tʰ ɛ v ɛ k u tʰ j u n,0
{arm}երթեւեկում,j ɛ ɾ tʰ ɛ v ɛ k u m,0
{arm}երթուղային,j ɛ ɾ tʰ u ʁ ɑ j i n,0
{arm}երթուղի,j ɛ ɾ tʰ u ʁ i,0
{arm}երիվար,j ɛ ɾ i v ɑ ɾ,0
{arm}երիտասարդ,j ɛ ɾ i t ɑ s ɑ ɾ tʰ,0
{arm}երիտասարդություն,j ɛ ɾ i t ɑ s ɑ ɾ d u tʰ j u n,0
{arm}երիքով,j ɛ ɾ i kʰ ɔ v,0
{arm}երկ,j ɛ ɾ k,0
{arm}երկաթ,j ɛ ɾ k ɑ tʰ,0
{arm}երկաթե,j ɛ ɾ k ɑ tʰ ɛ,0
{arm}երկաթեղեն,j ɛ ɾ k ɑ tʰ ɛ ʁ ɛ n,0
{arm}երկաթյա,j ɛ ɾ k ɑ tʰ j ɑ,0
{arm}երկաթուղային,j ɛ ɾ k ɑ tʰ u ʁ ɑ j i n,0
{arm}երկաթուղի,j ɛ ɾ k ɑ tʰ u ʁ i,0
{arm}երկայն,j ɛ ɾ k ɑ j n,0
{arm}երկար,j ɛ ɾ k ɑ ɾ,0
{arm}երկարաժամկետ,j ɛ ɾ k ɑ ɾ ɑ ʒ ɑ m k ɛ t,0
{arm}երկարամյա,j ɛ ɾ k ɑ ɾ ɑ m j ɑ,0
{arm}երկարավուն,j ɛ ɾ k ɑ ɾ ɑ v u n,0
{arm}երկարացնել,j ɛ ɾ k ɑ ɾ ɑ t͡sʰ n ɛ l,0
{arm}երկարություն,j ɛ ɾ k ɑ ɾ u tʰ j u n,0
{arm}երկբայելի,j ɛ ɾ k b ɑ j ɛ l i,0
{arm}երկբայորեն,j ɛ ɾ k b ɑ j ɔ ɾ ɛ n,0
{arm}երկընտրանք,j ɛ ɾ k ə n t ɾ ɑ ŋ kʰ,0
{arm}երկինք,j ɛ ɾ k i ŋ kʰ,0
{arm}երկիր,j ɛ ɾ k i ɾ,0
{arm}երկմտանք,j ɛ ɾ k m ə t ɑ ŋ kʰ,0
{arm}երկյուղ,j ɛ ɾ k j u ʁ,0
{arm}երկյուղալի,j ɛ ɾ k j u ʁ ɑ l i,0
{arm}երկյուղալիր,j ɛ ɾ k j u ʁ ɑ l i ɾ,0
{arm}երկյուղածություն,j ɛ ɾ k j u ʁ ɑ t͡s u tʰ j u n,0
{arm}երկնագույն,j ɛ ɾ k n ɑ ɡ u j n,0
{arm}երկնաքար,j ɛ ɾ k n ɑ kʰ ɑ ɾ,0
{arm}երկնաքեր,j ɛ ɾ k n ɑ kʰ ɛ ɾ,0
{arm}երկու,j ɛ ɾ k u,0
{arm}երկունք,j ɛ ɾ k u ŋ kʰ,0
{arm}երկուշաբթի,j ɛ ɾ k u ʃ ɑ pʰ tʰ i,0
{arm}երկուս,j ɛ ɾ k u s,0
{arm}երկչոտ,j ɛ ɾ k t͡ʃʰ ɔ t,0
{arm}երկսայրի,j ɛ ɾ k s ɑ j ɾ i,0
{arm}երկվորյակ,j ɛ ɾ k v ɔ ɾ j ɑ k,0
{arm}երկվորյակներ,j ɛ ɾ k v ɔ ɾ j ɑ k n ɛ ɾ,0
{arm}երկրաբան,j ɛ ɾ k ɾ ɑ b ɑ n,0
{arm}երկրագունդ,j ɛ ɾ k ɾ ɑ ɡ u n d,0
{arm}երկրաշարժ,j ɛ ɾ k ɾ ɑ ʃ ɑ ɾ ʒ,0
{arm}երկրաչափական,j ɛ ɾ k ɾ ɑ t͡ʃʰ ɑ pʰ ɑ k ɑ n,0
{arm}երկրաչափություն,j ɛ ɾ k ɾ ɑ t͡ʃʰ ɑ pʰ u tʰ j u n,0
{arm}երկրպագու,j ɛ ɾ k ə ɾ p ɑ ɡ u,0
{arm}երնեկ,j ɛ ɾ n ɛ k,0
{arm}երշիկ,j ɛ ɾ ʃ i k,0
{arm}երուսաղեմ,j ɛ ɾ u s ɑ ʁ ɛ m,0
{arm}երջանկություն,j ɛ ɾ d͡ʒ ɑ ŋ k u tʰ j u n,0
{arm}երվազ,j ɛ ɾ v ɑ z,0
{arm}երվանդ,j ɛ ɾ v ɑ n d,0
{arm}երվինյան,j ɛ ɾ v i n j ɑ n,0
{arm}եւս,j ɛ v ə s,0
{arm}եփեսոս,j ɛ pʰ ɛ s ɔ s,0
{arm}եփրատ,j ɛ pʰ ɾ ɑ t,0
{arm}եփրեմ,j ɛ pʰ ɾ ɛ m,0
{arm}եք,ɛ kʰ,0
{arm}զագրեբ,z ɑ ɡ ɾ ɛ b,0
{arm}զալցբուրգ,z ɑ l t͡sʰ b u ɾ ɡ,0
{arm}զամբիա,z ɑ m b j ɑ,0
{arm}զամբյուղ,z ɑ m b j u ʁ,0
{arm}զայրույթ,z ɑ j ɾ u j tʰ,0
{arm}զայրուց,z ɑ j ɾ u t͡sʰ,0
{arm}զանազան,z ɑ n ɑ z ɑ n,0
{arm}զանգ,z ɑ ŋ ɡ,0
{arm}զանգակ,z ɑ ŋ ɡ ɑ k,0
{arm}զանգակատուն,z ɑ ŋ ɡ ɑ k ɑ t u n,0
{arm}զանգել,z ɑ ŋ ɡ ɛ l,0
{arm}զանգի,z ɑ ŋ ɡ i,0
{arm}զանգված,z ɑ ŋ ɡ v ɑ t͡s,0
{arm}զանգվածային,z ɑ ŋ ɡ v ɑ t͡s ɑ j i n,0
{arm}զառ,z ɑ r,0
{arm}զառանցել,z ɑ r ɑ n t͡sʰ ɛ l,0
{arm}զավակ,z ɑ v ɑ k,0
{arm}զավեն,z ɑ v ɛ n,0
{arm}զավեշտ,z ɑ v ɛ ʃ t,0
{arm}զավեշտական,z ɑ v ɛ ʃ t ɑ k ɑ n,0
{arm}զավթել,z ɑ f tʰ ɛ l,0
{arm}զավտրիկ,z ɑ f t ɾ i k,0
{arm}զատ,z ɑ t,0
{arm}զատել,z ɑ t ɛ l,0
{arm}զարգանալ,z ɑ ɾ ɡ ɑ n ɑ l,0
{arm}զարգացում,z ɑ ɾ ɡ ɑ t͡sʰ u m,0
{arm}զարդ,z ɑ ɾ tʰ,0
{arm}զարդարանք,z ɑ ɾ tʰ ɑ ɾ ɑ ŋ kʰ,0
{arm}զարդարել,z ɑ ɾ tʰ ɑ ɾ ɛ l,0
{arm}զարդարուն,z ɑ ɾ tʰ ɑ ɾ u n,0
{arm}զարեհ,z ɑ ɾ ɛ h,0
{arm}զարկ,z ɑ ɾ k,0
{arm}զարկերակ,z ɑ ɾ k ɛ ɾ ɑ k,0
{arm}զարհուր,z ɑ ɾ h u ɾ,0
{arm}զարհուրանք,z ɑ ɾ h u ɾ ɑ ŋ kʰ,0
{arm}զարհուրատեսք,z ɑ ɾ h u ɾ ɑ t ɛ s kʰ,0
{arm}զարհուրելի,z ɑ ɾ h u ɾ ɛ l i,0
{arm}զարհուրում,z ɑ ɾ h u ɾ u m,0
{arm}զարմ,z ɑ ɾ m,0
{arm}զարմանալ,z ɑ ɾ m ɑ n ɑ l,0
{arm}զարմանք,z ɑ ɾ m ɑ ŋ kʰ,0
{arm}զարմացած,z ɑ ɾ m ɑ t͡sʰ ɑ t͡s,0
{arm}զարմացնել,z ɑ ɾ m ɑ t͡sʰ n ɛ l,0
{arm}զարմիկ,z ɑ ɾ m i k,0
{arm}զարմուհի,z ɑ ɾ m u h i,0
{arm}զարուհի,z ɑ ɾ u h i,0
{arm}զաքարիա,z ɑ kʰ ɑ ɾ j ɑ,0
{arm}զաքարյան,z ɑ kʰ ɑ ɾ j ɑ n,0
{arm}զբաղեցնել,ə z b ɑ ʁ ɛ t͡sʰ n ɛ l,0
{arm}զբաղվել,ə z b ɑ ʁ v ɛ l,0
{arm}զբոսանավ,ə z b ɔ s ɑ n ɑ v,0
{arm}զբոսանք,ə z b ɔ s ɑ ŋ kʰ,0
{arm}զբոսաշրջիկ,ə z b ɔ s ɑ ʃ ə ɾ d͡ʒ i k,0
{arm}զբոսաշրջություն,ə z b ɔ s ɑ ʃ ə ɾ d͡ʒ u tʰ j u n,0
{arm}զբոսնել,ə z b ɔ s n ɛ l,0
{arm}զգալ,ə z ɡ ɑ l,0
{arm}զգայարան,ə z ɡ ɑ j ɑ ɾ ɑ n,0
{arm}զգայռում,ə z ɡ ɑ j r u m,0
{arm}զգաստ,ə z ɡ ɑ s t,0
{arm}զգաստություն,ə z ɡ ɑ s t u tʰ j u n,0
{arm}զգացմունք,ə z ɡ ɑ t͡sʰ m u ŋ kʰ,0
{arm}զգեստ,ə z ɡ ɛ s t,0
{arm}զգեստապահարան,ə z ɡ ɛ s t ɑ p ɑ h ɑ ɾ ɑ n,0
{arm}զգոն,ə z ɡ ɔ n,0
{arm}զգոնություն,ə z ɡ ɔ n u tʰ j u n,0
{arm}զգույշ,ə z ɡ u j ʃ,0
{arm}զեխ,z ɛ χ,0
{arm}զեկույց,z ɛ k u j t͡sʰ,0
{arm}զեղչ,z ɛ χ t͡ʃʰ,0
{arm}զեղչել,z ɛ χ t͡ʃʰ ɛ l,0
{arm}զեյթուն,z ɛ j tʰ u n,0
{arm}զենոն,z ɛ n ɔ n,0
{arm}զենք,z ɛ ŋ kʰ,0
{arm}զեռուն,z ɛ r u n,0
{arm}զետեղել,z ɛ t ɛ ʁ ɛ l,0
{arm}զերծ,z ɛ ɾ t͡s,0
{arm}զեւս,z ɛ f s,0
{arm}զզվանք,z ə z v ɑ ŋ kʰ,0
{arm}զզվելի,z ə z v ɛ l i,0
{arm}զիբիլ,z i b i l,0
{arm}զիբիլանոց,z i b i l ɑ n ɔ t͡sʰ,0
{arm}զիբիլի,z i b i l i,0
{arm}զիգզագ,z i ɡ z ɑ ɡ,0
{arm}զինադադար,z i n ɑ d ɑ tʰ ɑ ɾ,0
{arm}զինամթերք,z i n ɑ m ə tʰ ɛ ɾ kʰ,0
{arm}զինանշան,z i n ɑ n ə ʃ ɑ n,0
{arm}զինել,z i n ɛ l,0
{arm}զինծառայող,z i n t͡s ɑ r ɑ j ɔ ʁ,0
{arm}զինված,z i n v ɑ t͡s,0
{arm}զինվել,z i n v ɛ l,0
{arm}զինվոր,z i n v ɔ ɾ,0
{arm}զինվորական,z i n v ɔ ɾ ɑ k ɑ n,0
{arm}զինվորականություն,z i n v ɔ ɾ ɑ k ɑ n u tʰ j u n,0
{arm}զիջում,z i t͡ʃʰ u m,0
{arm}զմռնիտ,z ə m ə r n i t,0
{arm}զմրուխտ,z ə m ɾ u χ t,0
{arm}զնդան,z ə n d ɑ n,0
{arm}զնջիլ,z ə n d͡ʒ i l,0
{arm}զոդ,z ɔ d,0
{arm}զոդել,z ɔ d ɛ l,0
{arm}զոհ,z ɔ h,0
{arm}զոհասեղան,z ɔ h ɑ s ɛ ʁ ɑ n,0
{arm}զոհվել,z ɔ h v ɛ l,0
{arm}զոյա,z ɔ j ɑ,0
{arm}զոոխորիա,z ɔ ɔ χ ɔ ɾ j ɑ,0
{arm}զոռ,z ɔ r,0
{arm}զոռով,z ɔ r ɔ v,0
{arm}զով,z ɔ v,0
{arm}զոր,z ɔ ɾ,0
{arm}զորախումբ,z ɔ ɾ ɑ χ u m b,0
{arm}զորահավաք,z ɔ ɾ ɑ h ɑ v ɑ kʰ,0
{arm}զորավար,z ɔ ɾ ɑ v ɑ ɾ,0
{arm}զորավարժություն,z ɔ ɾ ɑ v ɑ ɾ ʒ u tʰ j u n,0
{arm}զորավոր,z ɔ ɾ ɑ v ɔ ɾ,0
{arm}զորեղ,z ɔ ɾ ɛ ʁ,0
{arm}զորիկ,z ɔ ɾ i k,0
{arm}զորություն,z ɔ ɾ u tʰ j u n,0
{arm}զորք,z ɔ ɾ kʰ,0
{arm}զուգադիպություն,z u ɡ ɑ d i p u tʰ j u n,0
{arm}զուգարան,z u kʰ ɑ ɾ ɑ n,0
{arm}զուգել,z u kʰ ɛ l,0
{arm}զույգ,z u j kʰ,0
{arm}զուսպ,z u s p,0
{arm}զուտ,z u t,0
{arm}զուր,z u ɾ,0
{arm}զոքանչ,z ɔ kʰ ɑ n t͡ʃʰ,0
{arm}զսպաշապիկ,z ə s p ɑ ʃ ɑ p i k,0
{arm}զսպել,z ə s p ɛ l,0
{arm}զվարթ,z ə v ɑ ɾ tʰ,0
{arm}զվարճախոսել,z ə v ɑ ɾ t͡ʃ ɑ χ ɔ s ɛ l,0
{arm}զվարճանալ,z ə v ɑ ɾ t͡ʃ ɑ n ɑ l,0
{arm}զվարճանք,z ə v ɑ ɾ t͡ʃ ɑ ŋ kʰ,0
{arm}զտել,z ə t ɛ l,0
{arm}զրադաշտ,z ə ɾ ɑ d ɑ ʃ t,0
{arm}զրահ,z ə ɾ ɑ h,0
{arm}զրահակիր,z ə ɾ ɑ h ɑ k i ɾ,0
{arm}զրկել,z ə ɾ k ɛ l,0
{arm}զրո,z ə ɾ ɔ,0
{arm}զրույց,z ə ɾ u j t͡sʰ,0
{arm}զրուցարան,z ə ɾ u t͡sʰ ɑ ɾ ɑ n,0
{arm}զրուցել,z ə ɾ u t͡sʰ ɛ l,0
{arm}էակ,ɛ j ɑ k,0
{arm}էական,ɛ j ɑ k ɑ n,0
{arm}էգ,ɛ kʰ,0
{arm}էգուց,ɛ kʰ u t͡sʰ,0
{arm}էդ,ɛ d,0
{arm}էդգար,ɛ d ɡ ɑ ɾ,0
{arm}էդո,ɛ d ɔ,0
{arm}էթալ,ɛ tʰ ɑ l,0
{arm}էթիկա,ɛ tʰ i k ɑ,0
{arm}էլբակյան,ɛ l b ɑ k j ɑ n,0
{arm}էլեկտրական,ɛ l ɛ k t ɾ ɑ k ɑ n,0
{arm}էլեկտրականություն,ɛ l ɛ k t ɾ ɑ k ɑ n u tʰ j u n,0
{arm}էլեկտրոլիզ,ɛ l ɛ k t ɾ ɔ l i z,0
{arm}էլեկտրոն,ɛ l ɛ k t ɾ ɔ n,0
{arm}էլեկտրոնային,ɛ l ɛ k t ɾ ɔ n ɑ j i n,0
{arm}էլեմենտ,ɛ l ɛ m ɛ n t,0
{arm}էլեմենտար,ɛ l ɛ m ɛ n t ɑ ɾ,0
{arm}էլեն,ɛ l ɛ n,0
{arm}էլչիբեյ,ɛ l t͡ʃʰ i b ɛ j,0
{arm}էկոլոգիա,ɛ k ɔ l ɔ ɡ j ɑ,0
{arm}էկոնոմիկա,ɛ k ɔ n ɔ m i k ɑ,0
{arm}էկվադոր,ɛ k v ɑ d ɔ ɾ,0
{arm}էկրան,ɛ k ɾ ɑ n,0
{arm}էմիգրանտ,ɛ m i ɡ ɾ ɑ n t,0
{arm}էմին,ɛ m i n,0
{arm}էմիր,ɛ m i ɾ,0
{arm}էմոցիա,ɛ m ɔ t͡sʰ j ɑ,0
{arm}էմպեդոկլես,ɛ m p ɛ d ɔ k l ɛ s,0
{arm}էն,ɛ n,0
{arm}էներգիա,ɛ n ɛ ɾ ɡ j ɑ,0
{arm}էնֆիաջյան,ɛ n f i j ɑ d͡ʒ j ɑ n,0
{arm}էշ,ɛ ʃ,0
{arm}էպիկենտրոն,ɛ p i k ɛ n t ɾ ɔ n,0
{arm}էպիրոս,ɛ p i ɾ ɔ s,0
{arm}էջ,ɛ d͡ʒ,0
{arm}էջմիածին,ɛ t͡ʃʰ m j ɑ t͡s i n,0
{arm}էս,ɛ s,0
{arm}էսկալացիա,ɛ s k ɑ l ɑ t͡sʰ j ɑ,0
{arm}էսսե,ɛ sː ɛ,0
{arm}էստոնական,ɛ s t ɔ n ɑ k ɑ n,0
{arm}էստոնացի,ɛ s t ɔ n ɑ t͡sʰ i,0
{arm}էսօր,ɛ s ɔ ɾ,0
{arm}էվթանազիա,ɛ f tʰ ɑ n ɑ z j ɑ,0
{arm}էվոլյուցիա,ɛ v ɔ l j u t͡sʰ j ɑ,0
{arm}էվոլյուցիոն,ɛ v ɔ l j u t͡sʰ j ɔ n,0
{arm}էտ,ɛ t,0
{arm}էրե,ɛ ɾ ɛ,0
{arm}էրեբունի,ɛ ɾ ɛ b u n i,0
{arm}էրեխա,ɛ ɾ ɛ χ ɑ,0
{arm}էրես,ɛ ɾ ɛ s,0
{arm}էրզրում,ɛ ɾ z ə ɾ u m,0
{arm}էրիկ,ɛ ɾ i k,0
{arm}էրկու,ɛ ɾ k u,0
{arm}էրունջէկ,ɛ ɾ u n d͡ʒ ɛ k,0
{arm}էքսպերիմենտալ,ɛ kʰ s p ɛ ɾ i m ɛ n t ɑ l,0
{arm}էքսպերտ,ɛ kʰ s p ɛ ɾ t,0
{arm}էֆենդի,ɛ f ɛ n d i,0
{arm}ըղձական,ə ʁ d͡z ɑ k ɑ n,0
{arm}ըմբշամարտ,ə m b ʃ ɑ m ɑ ɾ t,0
{arm}ըմպել,ə m p ɛ l,0
{arm}ըմպելիք,ə m p ɛ l i kʰ,0
{arm}ընդամենը,ə n tʰ ɑ m ɛ n ə,0
{arm}ընդավոր,ə n d ɑ v ɔ ɾ,0
{arm}ընդարձակ,ə n tʰ ɑ ɾ t͡sʰ ɑ k,0
{arm}ընդարմանալ,ə n tʰ ɑ ɾ m ɑ n ɑ l,0
{arm}ընդդիմություն,ə n dː i m u tʰ j u n,0
{arm}ընդեղեն,ə n d ɛ ʁ ɛ n,0
{arm}ընդերք,ə n d ɛ ɾ kʰ,0
{arm}ընդլայնել,ə n d l ɑ j n ɛ l,0
{arm}ընդհանրական,ə n tʰ h ɑ n ɾ ɑ k ɑ n,0
{arm}ընդմիշտ,ə n d m i ʃ t,0
{arm}ընդունակ,ə n tʰ u n ɑ k,0
{arm}ընդունակություն,ə n tʰ u n ɑ k u tʰ j u n,0
{arm}ընդունել,ə n tʰ u n ɛ l,0
{arm}ընդունելի,ə n tʰ u n ɛ l i,0
{arm}ընդունում,ə n tʰ u n u m,0
{arm}ընդունված,ə n tʰ u n v ɑ t͡s,0
{arm}ընդվզում,ə n d v ə z u m,0
{arm}ընել,ə n ɛ l,0
{arm}ընթածիր,ə n tʰ ɑ t͡s i ɾ,0
{arm}ընթանալ,ə n tʰ ɑ n ɑ l,0
{arm}ընթաց,ə n tʰ ɑ t͡sʰ,0
{arm}ընթացակարգ,ə n tʰ ɑ t͡sʰ ɑ k ɑ ɾ kʰ,0
{arm}ընթացք,ə n tʰ ɑ t͡sʰ kʰ,0
{arm}ընթացքում,ə n tʰ ɑ t͡sʰ kʰ u m,0
{arm}ընթերցանություն,ə n tʰ ɛ ɾ t͡sʰ ɑ n u tʰ j u n,0
{arm}ընթերցող,ə n tʰ ɛ ɾ t͡sʰ ɔ ʁ,0
{arm}ընթերցում,ə n tʰ ɛ ɾ t͡sʰ u m,0
{arm}ընթրիք,ə n tʰ ɾ i kʰ,0
{arm}ընծա,ə n t͡s ɑ,0
{arm}ընկերություն,ə ŋ k ɛ ɾ u tʰ j u n,0
{arm}ընկերուհի,ə ŋ k ɛ ɾ u h i,0
{arm}ընկեցիկ,ə ŋ k ɛ t͡sʰ i k,0
{arm}ընկղմել,ə ŋ k ʁ m ɛ l,0
{arm}ընկճել,ə ŋ k ə t͡ʃ ɛ l,0
{arm}ընկճվել,ə ŋ k ə t͡ʃ v ɛ l,0
{arm}ընկնել,ə ŋ k n ɛ l,0
{arm}ընկուզենի,ə ŋ k u z ɛ n i,0
{arm}ընկույզ,ə ŋ k u j z,0
{arm}ընձառյուծ,ə n d͡z ɑ r j u t͡s,0
{arm}ընտանեական,ə n t ɑ n j ɑ k ɑ n,0
{arm}ընտանեկան,ə n t ɑ n ɛ k ɑ n,0
{arm}ընտանի,ə n t ɑ n i,0
{arm}ընտիր,ə n t i ɾ,0
{arm}ընտրական,ə n t ɾ ɑ k ɑ n,0
{arm}ընտրակաշառք,ə n t ɾ ɑ k ɑ ʃ ɑ r kʰ,0
