merged_spelling,ipa,langid
{arm}նովոռոսիյսկ,n ɔ v ɔ r ɔ s i j s k,0
{arm}նովոսիբիրսկ,n ɔ v ɔ s i b i ɾ s k,0
{arm}նոտար,n ɔ t ɑ ɾ,0
{arm}նոր,n ɔ ɾ,0
{arm}նորաբնակ,n ɔ ɾ ɑ b ə n ɑ k,0
{arm}նորածին,n ɔ ɾ ɑ t͡s i n,0
{arm}նորապսակ,n ɔ ɾ ɑ p ə s ɑ k,0
{arm}նորեկ,n ɔ ɾ ɛ k,0
{arm}նորընտիր,n ɔ ɾ ə n t i ɾ,0
{arm}նորման,n ɔ ɾ m ɑ n,0
{arm}նորմատիվ,n ɔ ɾ m ɑ t i v,0
{arm}նորոգ,n ɔ ɾ ɔ kʰ,0
{arm}նորոգել,n ɔ ɾ ɔ kʰ ɛ l,0
{arm}նորություն,n ɔ ɾ u tʰ j u n,0
{arm}նորություններ,n ɔ ɾ u tʰ j u nː ɛ ɾ,0
{arm}նորվեգական,n ɔ ɾ v ɛ ɡ ɑ k ɑ n,0
{arm}նորվեգիա,n ɔ ɾ v ɛ ɡ j ɑ,0
{arm}նու,n u,0
{arm}նուբար,n u b ɑ ɾ,0
{arm}նուկլոն,n u k l ɔ n,0
{arm}նույն,n u j n,0
{arm}նույնիսկ,n u j n i s k,0
{arm}նույնպես,n u j n p ɛ s,0
{arm}նույնքան,n u j ŋ kʰ ɑ n,0
{arm}նուշ,n u ʃ,0
{arm}նուրբ,n u ɾ pʰ,0
{arm}նպաստավոր,n ə p ɑ s t ɑ v ɔ ɾ,0
{arm}նպաստել,n ə p ɑ s t ɛ l,0
{arm}նպատակ,n ə p ɑ t ɑ k,0
{arm}նռնակ,n ə r n ɑ k,0
{arm}նռնականետ,n ə r n ɑ k ɑ n ɛ t,0
{arm}նվագ,n ə v ɑ ɡ,0
{arm}նվագել,n ə v ɑ ɡ ɛ l,0
{arm}նվազ,n ə v ɑ z,0
{arm}նվաճել,n ə v ɑ t͡ʃ ɛ l,0
{arm}նվաճում,n ə v ɑ t͡ʃ u m,0
{arm}նվարդ,n ə v ɑ ɾ tʰ,0
{arm}նվեր,n ə v ɛ ɾ,0
{arm}նվիրակ,n ə v i ɾ ɑ k,0
{arm}նվիրում,n ə v i ɾ u m,0
{arm}նրա,n ə ɾ ɑ,0
{arm}նրան,n ə ɾ ɑ n,0
{arm}նրանում,n ə ɾ ɑ n u m,0
{arm}նրանց,n ə ɾ ɑ n t͡sʰ,0
{arm}նրանք,n ə ɾ ɑ ŋ kʰ,0
{arm}նրբանցք,n ə ɾ pʰ ɑ n t͡sʰ kʰ,0
{arm}նրբերշիկ,n ə ɾ pʰ ɛ ɾ ʃ i k,0
{arm}շա,ʃ ɑ,0
{arm}շաբաշ,ʃ ɑ b ɑ ʃ,0
{arm}շագանակ,ʃ ɑ ɡ ɑ n ɑ k,0
{arm}շագանակագույն,ʃ ɑ ɡ ɑ n ɑ k ɑ ɡ u j n,0
{arm}շալ,ʃ ɑ l,0
{arm}շալակ,ʃ ɑ l ɑ k,0
{arm}շախ,ʃ ɑ χ,0
{arm}շախմատ,ʃ ɑ χ m ɑ t,0
{arm}շախմատի,ʃ ɑ χ m ɑ t i,0
{arm}շախմատիստ,ʃ ɑ χ m ɑ t i s t,0
{arm}շախմատիստուհի,ʃ ɑ χ m ɑ t i s t u h i,0
{arm}շահ,ʃ ɑ h,0
{arm}շահաբաժին,ʃ ɑ h ɑ b ɑ ʒ i n,0
{arm}շահագործել,ʃ ɑ h ɑ ɡ ɔ ɾ t͡s ɛ l,0
{arm}շահագործում,ʃ ɑ h ɑ ɡ ɔ ɾ t͡s u m,0
{arm}շահավետ,ʃ ɑ h ɑ v ɛ t,0
{arm}շահել,ʃ ɑ h ɛ l,0
{arm}շահեկան,ʃ ɑ h ɛ k ɑ n,0
{arm}շահեն,ʃ ɑ h ɛ n,0
{arm}շաղ,ʃ ɑ ʁ,0
{arm}շաղգամ,ʃ ɑ χ k ɑ m,0
{arm}շամամ,ʃ ɑ m ɑ m,0
{arm}շամբ,ʃ ɑ m b,0
{arm}շամիրամ,ʃ ɑ m i ɾ ɑ m,0
{arm}շամպայն,ʃ ɑ m p ɑ j n,0
{arm}շամպուն,ʃ ɑ m p u n,0
{arm}շայբա,ʃ ɑ j b ɑ,0
{arm}շանթ,ʃ ɑ n tʰ,0
{arm}շանհայ,ʃ ɑ n h ɑ j,0
{arm}շանսոնյե,ʃ ɑ n s ɔ n j ɛ,0
{arm}շանտաժ,ʃ ɑ n t ɑ ʒ,0
{arm}շաշ,ʃ ɑ ʃ,0
{arm}շաուրմա,ʃ ɑ u ɾ m ɑ,0
{arm}շապիկ,ʃ ɑ p i k,0
{arm}շապուհ,ʃ ɑ p u h,0
{arm}շավիղ,ʃ ɑ v i ʁ,0
{arm}շատ,ʃ ɑ t,0
{arm}շատակերիկ,ʃ ɑ t ɑ k ɛ ɾ i k,0
{arm}շատրվան,ʃ ɑ t ə ɾ v ɑ n,0
{arm}շարահյուսություն,ʃ ɑ ɾ ɑ h j u s u tʰ j u n,0
{arm}շարել,ʃ ɑ ɾ ɛ l,0
{arm}շարժական,ʃ ɑ ɾ ʒ ɑ k ɑ n,0
{arm}շարժանկար,ʃ ɑ ɾ ʒ ɑ n ə k ɑ ɾ,0
{arm}շարժապատկեր,ʃ ɑ ɾ ʒ ɑ p ɑ t k ɛ ɾ,0
{arm}շարժել,ʃ ɑ ɾ ʒ ɛ l,0
{arm}շարժիչ,ʃ ɑ ɾ ʒ i t͡ʃʰ,0
{arm}շարժում,ʃ ɑ ɾ ʒ u m,0
{arm}շարժուն,ʃ ɑ ɾ ʒ u n,0
{arm}շարք,ʃ ɑ ɾ kʰ,0
{arm}շարքային,ʃ ɑ ɾ kʰ ɑ j i n,0
{arm}շափյուղա,ʃ ɑ pʰ j u ʁ ɑ,0
{arm}շաքար,ʃ ɑ kʰ ɑ ɾ,0
{arm}շաքարախտ,ʃ ɑ kʰ ɑ ɾ ɑ χ t,0
{arm}շաքարավազ,ʃ ɑ kʰ ɑ ɾ ɑ v ɑ z,0
{arm}շաքարաքլոր,ʃ ɑ kʰ ɑ ɾ ɑ kʰ l ɔ ɾ,0
{arm}շաքարյան,ʃ ɑ kʰ ɑ ɾ j ɑ n,0
{arm}շեկ,ʃ ɛ k,0
{arm}շեղ,ʃ ɛ ʁ,0
{arm}շեղանկյուն,ʃ ɛ ʁ ɑ ŋ k j u n,0
{arm}շեղբ,ʃ ɛ ʁ b,0
{arm}շեղել,ʃ ɛ ʁ ɛ l,0
{arm}շեղջ,ʃ ɛ ʁ d͡ʒ,0
{arm}շեմ,ʃ ɛ m,0
{arm}շեյեն,ʃ ɛ j ɛ n,0
{arm}շեն,ʃ ɛ n,0
{arm}շեշտ,ʃ ɛ ʃ t,0
{arm}շեշտել,ʃ ɛ ʃ t ɛ l,0
{arm}շերեփ,ʃ ɛ ɾ ɛ pʰ,0
{arm}շերտ,ʃ ɛ ɾ t,0
{arm}շեփոր,ʃ ɛ pʰ ɔ ɾ,0
{arm}շեֆ,ʃ ɛ f,0
{arm}շթաքար,ʃ ə tʰ ɑ kʰ ɑ ɾ,0
{arm}շիզոֆրենիա,ʃ i z ɔ f ɾ ɛ n j ɑ,0
{arm}շիթ,ʃ i tʰ,0
{arm}շիճուկ,ʃ i t͡ʃ u k,0
{arm}շիմպանզե,ʃ i m p ɑ n z ɛ,0
{arm}շինական,ʃ i n ɑ k ɑ n,0
{arm}շինել,ʃ i n ɛ l,0
{arm}շինծու,ʃ i n t͡s u,0
{arm}շինվածք,ʃ i n v ɑ t͡s kʰ,0
{arm}շիշ,ʃ i ʃ,0
{arm}շիվ,ʃ i v,0
{arm}շիվա,ʃ i v ɑ,0
{arm}շիտակ,ʃ i t ɑ k,0
{arm}շիրակ,ʃ i ɾ ɑ k,0
{arm}շիրինյան,ʃ i ɾ i n j ɑ n,0
{arm}շղթա,ʃ ə χ tʰ ɑ,0
{arm}շնագայլ,ʃ ə n ɑ ɡ ɑ j l,0
{arm}շնդեղ,ʃ ə n d ɛ ʁ,0
{arm}շներ,ʃ ə n ɛ ɾ,0
{arm}շնորհ,ʃ ə n ɔ ɾ,0
{arm}շնորհակալ,ʃ ə n ɔ ɾ ɑ k ɑ l,0
{arm}շնորհակալություն,ʃ ə n ɔ ɾ ɑ k ɑ l u tʰ j u n,0
{arm}շնորհավոր,ʃ ə n ɔ ɾ ɑ v ɔ ɾ,0
{arm}շնորհավորանք,ʃ n ɔ ɾ ɑ v ɔ ɾ ɑ ŋ kʰ,0
{arm}շնորհավորել,ʃ n ɔ ɾ ɑ v ɔ ɾ ɛ l,0
{arm}շնորհավորում,ʃ n ɔ ɾ ɑ v ɔ ɾ u m,0
{arm}շնորհել,ʃ ə n ɔ ɾ ɛ l,0
{arm}շնորհիվ,ʃ ə n ɔ ɾ i v,0
{arm}շնորհք,ʃ ə n ɔ ɾ kʰ,0
{arm}շնչառություն,ʃ ə n t͡ʃʰ ɑ r u tʰ j u n,0
{arm}շնչել,ʃ ə n t͡ʃʰ ɛ l,0
{arm}շշնջալ,ʃ ə ʃ ə n d͡ʒ ɑ l,0
{arm}շոգ,ʃ ɔ kʰ,0
{arm}շոգենավ,ʃ ɔ kʰ ɛ n ɑ v,0
{arm}շոգի,ʃ ɔ kʰ i,0
{arm}շոկոլադ,ʃ ɔ k ɔ l ɑ d,0
{arm}շող,ʃ ɔ ʁ,0
{arm}շողոտ,ʃ ɔ ʁ ɔ t,0
{arm}շոշափել,ʃ ɔ ʃ ɑ pʰ ɛ l,0
{arm}շոր,ʃ ɔ ɾ,0
{arm}շորթել,ʃ ɔ ɾ tʰ ɛ l,0
{arm}շորթում,ʃ ɔ ɾ tʰ u m,0
{arm}շորժա,ʃ ɔ ɾ ʒ ɑ,0
{arm}շուկա,ʃ u k ɑ,0
{arm}շուն,ʃ u n,0
{arm}շունչ,ʃ u n t͡ʃʰ,0
{arm}շուշա,ʃ u ʃ ɑ,0
{arm}շուշան,ʃ u ʃ ɑ n,0
{arm}շուշի,ʃ u ʃ i,0
{arm}շուշմա,ʃ u ʃ m ɑ,0
{arm}շուտ,ʃ u t,0
{arm}շուտափույթ,ʃ u t ɑ pʰ u j tʰ,0
{arm}շուտով,ʃ u t ɔ v,0
{arm}շուրթ,ʃ u ɾ tʰ,0
{arm}շուրջպար,ʃ u ɾ d͡ʒ p ɑ ɾ,0
{arm}շուք,ʃ u kʰ,0
{arm}շոֆեռ,ʃ ɔ f ɛ r,0
{arm}շոֆեր,ʃ ɔ f ɛ ɾ,0
{arm}շպիլկա,ə ʃ p i l k ɑ,0
{arm}շպրտել,ʃ ə p ə ɾ t ɛ l,0
{arm}շռայլ,ʃ ə r ɑ j l,0
{arm}շռել,ʃ ə r ɛ l,0
{arm}շվեդ,ʃ ə v ɛ d,0
{arm}շվեդերեն,ʃ v ɛ d ɛ ɾ ɛ n,0
{arm}շվեդիա,ʃ v ɛ d j ɑ,0
{arm}շվի,ʃ ə v i,0
{arm}շտաբ,ə ʃ t ɑ b,0
{arm}շտապ,ə ʃ t ɑ p,0
{arm}շտապել,ə ʃ t ɑ p ɛ l,0
{arm}շտապօգնություն,ə ʃ t ɑ p ɔ kʰ n u tʰ j u n,0
{arm}շտեմարան,ə ʃ t ɛ m ɑ ɾ ɑ n,0
{arm}շտկել,ʃ ə t k ɛ l,0
{arm}շրթներկ,ʃ ə ɾ tʰ n ɛ ɾ k,0
{arm}շրջազգեստ,ʃ ə ɾ d͡ʒ ɑ z ɡ ɛ s t,0
{arm}շրջակայք,ʃ ə ɾ d͡ʒ ɑ k ɑ j kʰ,0
{arm}շրջահայաց,ʃ ə ɾ d͡ʒ ɑ h ɑ j ɑ t͡sʰ,0
{arm}շրջան,ʃ ə ɾ d͡ʒ ɑ n,0
{arm}շրջանագիծ,ʃ ə ɾ d͡ʒ ɑ n ɑ ɡ i t͡s,0
{arm}շրջանակ,ʃ ə ɾ d͡ʒ ɑ n ɑ k,0
{arm}շրջանակում,ʃ ə ɾ d͡ʒ ɑ n ɑ k u m,0
{arm}շրջանառություն,ʃ ə ɾ d͡ʒ ɑ n ɑ r u tʰ j u n,0
{arm}շրջափակել,ʃ ə ɾ d͡ʒ ɑ pʰ ɑ k ɛ l,0
{arm}շրջում,ʃ ə ɾ d͡ʒ u m,0
{arm}շրջվել,ʃ ə ɾ d͡ʒ v ɛ l,0
{arm}շփել,ʃ ə pʰ ɛ l,0
{arm}շփոթել,ʃ ə pʰ ɔ tʰ ɛ l,0
{arm}շփոթեցնել,ʃ ə pʰ ɔ tʰ ɛ t͡sʰ n ɛ l,0
{arm}շփոթմունք,ʃ ə pʰ ɔ tʰ m u ŋ kʰ,0
{arm}շփոթվել,ʃ ə pʰ ɔ tʰ v ɛ l,0
{arm}շփում,ʃ ə pʰ u m,0
{arm}շփվել,ʃ ə pʰ v ɛ l,0
{arm}շքախումբ,ʃ ə kʰ ɑ χ u m b,0
{arm}շքահանդես,ʃ ə kʰ ɑ h ɑ n d ɛ s,0
{arm}շքամուտք,ʃ ə kʰ ɑ m u t kʰ,0
{arm}շքեղ,ʃ ə kʰ ɛ ʁ,0
{arm}շքերթ,ʃ ə kʰ ɛ ɾ tʰ,0
{arm}ոգեշնչել,v ɔ kʰ ɛ ʃ ə n t͡ʃʰ ɛ l,0
{arm}ոգեշնչում,v ɔ kʰ ɛ ʃ ə n t͡ʃʰ u m,0
{arm}ոգեւորել,v ɔ kʰ ɛ v ɔ ɾ ɛ l,0
{arm}ոգեւորություն,v ɔ kʰ ɛ v ɔ ɾ u tʰ j u n,0
{arm}ոգեւորվել,v ɔ kʰ ɛ v ɔ ɾ v ɛ l,0
{arm}ոգի,v ɔ kʰ i,0
{arm}ոգորել,v ɔ ɡ ɔ ɾ ɛ l,0
{arm}ոզնախոտ,v ɔ z n ɑ χ ɔ t,0
{arm}ոզնի,v ɔ z n i,0
{arm}ոլոռ,v ɔ l ɔ r,0
{arm}ոլորապտույտ,v ɔ l ɔ ɾ ɑ p ə t u j t,0
{arm}ոլորուն,v ɔ l ɔ ɾ u n,0
{arm}ոլորտ,v ɔ l ɔ ɾ t,0
{arm}ոխ,v ɔ χ,0
{arm}ոխերիմ,v ɔ χ ɛ ɾ i m,0
{arm}ոհմակ,v ɔ h m ɑ k,0
{arm}ող,v ɔ ʁ,0
{arm}ողբ,v ɔ χ p,0
{arm}ողբերգություն,v ɔ χ p ɛ ɾ ɡ u tʰ j u n,0
{arm}ողկույզ,v ɔ χ k u j z,0
{arm}ողնաշար,v ɔ ʁ n ɑ ʃ ɑ ɾ,0
{arm}ողնաշարավոր,v ɔ ʁ n ɑ ʃ ɑ ɾ ɑ v ɔ ɾ,0
{arm}ողողել,v ɔ ʁ ɔ ʁ ɛ l,0
{arm}ողողվել,v ɔ ʁ ɔ ʁ v ɛ l,0
{arm}ողորկ,v ɔ ʁ ɔ ɾ k,0
{arm}ողորկություն,v ɔ ʁ ɔ ɾ k u tʰ j u n,0
{arm}ողորմածիկ,v ɔ ʁ ɔ ɾ m ɑ t͡s i k,0
{arm}ողորմություն,v ɔ ʁ ɔ ɾ m u tʰ j u n,0
{arm}ողջ,v ɔ χ t͡ʃʰ,0
{arm}ողջագուրել,v ɔ χ t͡ʃʰ ɑ ɡ u ɾ ɛ l,0
{arm}ողջակիզում,v ɔ χ t͡ʃʰ ɑ k i z u m,0
{arm}ողջամիտ,v ɔ χ t͡ʃʰ ɑ m i t,0
{arm}ողջույն,v ɔ χ t͡ʃʰ u j n,0
{arm}ողջունել,v ɔ χ t͡ʃʰ u n ɛ l,0
{arm}ոճ,v ɔ t͡ʃ,0
{arm}ոմն,v ɔ m ə n,0
{arm}ոնց,v ɔ n t͡sʰ,0
{arm}ոչ,v ɔ t͡ʃʰ,0
{arm}ոչինչ,v ɔ t͡ʃʰ i n t͡ʃʰ,0
{arm}ոչխար,v ɔ t͡ʃʰ χ ɑ ɾ,0
{arm}ոչնչացում,v ɔ t͡ʃʰ ə n t͡ʃʰ ɑ t͡sʰ u m,0
{arm}ոռնալ,v ɔ r n ɑ l,0
{arm}ոսկանյան,v ɔ s k ɑ n j ɑ n,0
{arm}ոսկե,v ɔ s k ɛ,0
{arm}ոսկեդրամ,v ɔ s k ɛ d ɾ ɑ m,0
{arm}ոսկեզօծ,v ɔ s k ɛ z ɔ t͡s,0
{arm}ոսկերիչ,v ɔ s k ɛ ɾ i t͡ʃʰ,0
{arm}ոսկերչություն,v ɔ s k ɛ ɾ t͡ʃʰ u tʰ j u n,0
{arm}ոսկի,v ɔ s k i,0
{arm}ոսկյա,v ɔ s k j ɑ,0
{arm}ոսկոր,v ɔ s k ɔ ɾ,0
{arm}ոսկու,v ɔ s k u,0
{arm}ոսկր,v ɔ s k ə ɾ,0
{arm}ոսոխ,v ɔ s ɔ χ,0
{arm}ոսպ,v ɔ s p,0
{arm}ոսպապուր,v ɔ s p ɑ p u ɾ,0
{arm}ոստ,v ɔ s t,0
{arm}ոստան,v ɔ s t ɑ n,0
{arm}ոստիկանապետ,v ɔ s t i k ɑ n ɑ p ɛ t,0
{arm}ոստիկանություն,v ɔ s t i k ɑ n u tʰ j u n,0
{arm}ոստրե,v ɔ s t ɾ ɛ,0
{arm}ոտ,v ɔ t,0
{arm}ոտանավոր,v ɔ t ɑ n ɑ v ɔ ɾ,0
{arm}ոտնաձայն,v ɔ t n ɑ d͡z ɑ j n,0
{arm}ոտնաչափ,v ɔ t n ɑ t͡ʃʰ ɑ pʰ,0
{arm}ոտք,v ɔ t kʰ,0
{arm}որ,v ɔ ɾ,0
{arm}որակ,v ɔ ɾ ɑ k,0
{arm}որակական,v ɔ ɾ ɑ k ɑ k ɑ n,0
{arm}որակյալ,v ɔ ɾ ɑ k j ɑ l,0
{arm}որբ,v ɔ ɾ pʰ,0
{arm}որդ,v ɔ ɾ tʰ,0
{arm}որդեգրում,v ɔ ɾ tʰ ɛ ɡ ə ɾ u m,0
{arm}որդեսեր,v ɔ ɾ tʰ ɛ s ɛ ɾ,0
{arm}որդյակ,v ɔ ɾ tʰ j ɑ k,0
{arm}որթ,v ɔ ɾ tʰ,0
{arm}որի,v ɔ ɾ i,0
{arm}որձ,v ɔ ɾ t͡sʰ,0
{arm}որմնադիր,v ɔ ɾ m n ɑ d i ɾ,0
{arm}որոգայթ,v ɔ ɾ ɔ ɡ ɑ j tʰ,0
{arm}որոմ,v ɔ ɾ ɔ m,0
{arm}որոնել,v ɔ ɾ ɔ n ɛ l,0
{arm}որոնք,v ɔ ɾ ɔ ŋ kʰ,0
{arm}որոշակի,v ɔ ɾ ɔ ʃ ɑ k i,0
{arm}որոշել,v ɔ ɾ ɔ ʃ ɛ l,0
{arm}որոշում,v ɔ ɾ ɔ ʃ u m,0
{arm}որովայն,v ɔ ɾ ɔ v ɑ j n,0
{arm}որոտ,v ɔ ɾ ɔ t,0
{arm}որոտան,v ɔ ɾ ɔ t ɑ n,0
{arm}որպեսզի,v ɔ ɾ p ɛ s z i,0
{arm}որջ,v ɔ ɾ t͡ʃʰ,0
{arm}որս,v ɔ ɾ s,0
{arm}որսալ,v ɔ ɾ s ɑ l,0
{arm}որսորդ,v ɔ ɾ s ɔ ɾ tʰ,0
{arm}որտեղ,v ɔ ɾ t ɛ ʁ,0
{arm}որտեւ,v ɔ ɾ t ɛ v,0
{arm}որքան,v ɔ ɾ kʰ ɑ n,0
{arm}ուագադուգու,u ɑ ɡ ɑ d u ɡ u,0
{arm}ուդմուրտ,u d m u ɾ t,0
{arm}ուդոն,u d ɔ n,0
{arm}ուզբեկ,u z b ɛ k,0
{arm}ուզբեկերեն,u z b ɛ k ɛ ɾ ɛ n,0
{arm}ուզբեկստան,u z b ɛ k s t ɑ n,0
{arm}ուզել,u z ɛ l,0
{arm}ութ,u tʰ,0
{arm}ուժ,u ʒ,0
{arm}ուժգին,u ʒ ɡ i n,0
{arm}ուժեղ,u ʒ ɛ ʁ,0
{arm}ուլունք,u l u ŋ kʰ,0
{arm}ուխտ,u χ t,0
{arm}ուխտագնացություն,u χ t ɑ ɡ ə n ɑ t͡sʰ u tʰ j u n,0
{arm}ուկրաինական,u k ɾ ɑ i n ɑ k ɑ n,0
{arm}ուկրաինացի,u k ɾ ɑ i n ɑ t͡sʰ i,0
{arm}ուկրաիներեն,u k ɾ ɑ i n ɛ ɾ ɛ n,0
{arm}ուղարկել,u ʁ ɑ ɾ k ɛ l,0
{arm}ուղեբեռ,u ʁ ɛ b ɛ r,0
{arm}ուղեկից,u ʁ ɛ k i t͡sʰ,0
{arm}ուղեկցել,u ʁ ɛ k t͡sʰ ɛ l,0
{arm}ուղեղ,u ʁ ɛ ʁ,0
{arm}ուղեղային,u ʁ ɛ ʁ ɑ j i n,0
{arm}ուղերձ,u ʁ ɛ ɾ t͡sʰ,0
{arm}ուղի,u ʁ i,0
{arm}ուղղագրություն,u ʁː ɑ ɡ ɾ u tʰ j u n,0
{arm}ուղղական,u ʁː ɑ k ɑ n,0
{arm}ուղղակի,u ʁː ɑ k i,0
{arm}ուղղափառ,u ʁː ɑ pʰ ɑ r,0
{arm}ուղղափառություն,u ʁː ɑ pʰ ɑ r u tʰ j u n,0
{arm}ուղղել,u ʁː ɛ l,0
{arm}ուղղություն,u ʁː u tʰ j u n,0
{arm}ուղտ,u χ t,0
{arm}ումպ,u m p,0
{arm}ունաբ,u n ɑ b,0
{arm}ունակ,u n ɑ k,0
{arm}ունակություն,u n ɑ k u tʰ j u n,0
{arm}ունայնություն,u n ɑ j n u tʰ j u n,0
{arm}ունդ,u n d,0
{arm}ունեմ,u n ɛ m,0
{arm}ունենալ,u n ɛ n ɑ l,0
{arm}ունիվերմագ,u n i v ɛ ɾ m ɑ ɡ,0
{arm}ունկնդիր,u ŋ k ə n d i ɾ,0
{arm}ունկնդրել,u ŋ k ə n d ɾ ɛ l,0
{arm}ուշ,u ʃ,0
{arm}ուշադիր,u ʃ ɑ d i ɾ,0
{arm}ուշանալ,u ʃ ɑ n ɑ l,0
{arm}ուշիմ,u ʃ i m,0
{arm}ուշունց,u ʃ u n t͡sʰ,0
{arm}ուշք,u ʃ kʰ,0
{arm}ուռել,u r ɛ l,0
{arm}ուռենի,u r ɛ n i,0
{arm}ուռի,u r i,0
{arm}ուռհա,u r h ɑ,0
{arm}ուռուցք,u r u t͡sʰ kʰ,0
{arm}ուռուցքաբան,u r u t͡sʰ kʰ ɑ b ɑ n,0
{arm}ուս,u s,0
{arm}ուսանել,u s ɑ n ɛ l,0
{arm}ուսանող,u s ɑ n ɔ ʁ,0
{arm}ուսապարկ,u s ɑ p ɑ ɾ k,0
{arm}ուսնոց,u s n ɔ t͡sʰ,0
{arm}ուսում,u s u m,0
{arm}ուսումնասիրություն,u s u m n ɑ s i ɾ u tʰ j u n,0
{arm}ուսուցանել,u s u t͡sʰ ɑ n ɛ l,0
{arm}ուսուցիչ,u s u t͡sʰ i t͡ʃʰ,0
{arm}ուսուցչուհի,u s u t͡sʰ t͡ʃʰ u h i,0
{arm}ուստի,u s t i,0
{arm}ուստիեւ,u s t i j ɛ v,0
{arm}ուստր,u s t ə ɾ,0
{arm}ուտել,u t ɛ l,0
{arm}ուտելիք,u t ɛ l i kʰ,0
{arm}ուտեստ,u t ɛ s t,0
{arm}ուտի,u t i,0
{arm}ուր,u ɾ,0
{arm}ուրալ,u ɾ ɑ l,0
{arm}ուրախ,u ɾ ɑ χ,0
{arm}ուրախակից,u ɾ ɑ χ ɑ k i t͡sʰ,0
{arm}ուրախացնել,u ɾ ɑ χ ɑ t͡sʰ n ɛ l,0
{arm}ուրախություն,u ɾ ɑ χ u tʰ j u n,0
{arm}ուրան,u ɾ ɑ n,0
{arm}ուրանալ,u ɾ ɑ n ɑ l,0
{arm}ուրարտական,u ɾ ɑ ɾ t ɑ k ɑ n,0
{arm}ուրարտերեն,u ɾ ɑ ɾ t ɛ ɾ ɛ n,0
{arm}ուրբաթ,u ɾ pʰ ɑ tʰ,0
{arm}ուրբանոս,u ɾ b ɑ n ɔ s,0
{arm}ուրեմն,u ɾ ɛ m ə n,0
{arm}ուրիշ,u ɾ i ʃ,0
{arm}ուրհա,u ɾ h ɑ,0
{arm}ուրմիա,u ɾ m i j ɑ,0
{arm}ուրու,u ɾ u,0
{arm}ուրվական,u ɾ v ɑ k ɑ n,0
{arm}ուրց,u ɾ t͡sʰ,0
{arm}ուրֆա,u ɾ f ɑ,0
{arm}ուֆա,u f ɑ,0
{arm}չա,t͡ʃʰ ɑ,0
{arm}չաղ,t͡ʃʰ ɑ ʁ,0
{arm}չաման,t͡ʃʰ ɑ m ɑ n,0
{arm}չայ,t͡ʃʰ ɑ j,0
{arm}չան,t͡ʃʰ ɑ n,0
{arm}չար,t͡ʃʰ ɑ ɾ,0
{arm}չարախոս,t͡ʃʰ ɑ ɾ ɑ χ ɔ s,0
{arm}չարամիտ,t͡ʃʰ ɑ ɾ ɑ m i t,0
{arm}չարանալ,t͡ʃʰ ɑ ɾ ɑ n ɑ l,0
{arm}չարաշահել,t͡ʃʰ ɑ ɾ ɑ ʃ ɑ h ɛ l,0
{arm}չարաչք,t͡ʃʰ ɑ ɾ ɑ t͡ʃʰ kʰ,0
{arm}չարբախ,t͡ʃʰ ɑ ɾ b ɑ χ,0
{arm}չարչարանք,t͡ʃʰ ɑ ɾ t͡ʃʰ ɑ ɾ ɑ ŋ kʰ,0
{arm}չարչարվել,t͡ʃʰ ɑ ɾ t͡ʃʰ ɑ ɾ v ɛ l,0
{arm}չափ,t͡ʃʰ ɑ pʰ,0
{arm}չափագիտություն,t͡ʃʰ ɑ pʰ ɑ ɡ i t u tʰ j u n,0
{arm}չափածո,t͡ʃʰ ɑ pʰ ɑ t͡s ɔ,0
{arm}չափահաս,t͡ʃʰ ɑ pʰ ɑ h ɑ s,0
{arm}չափանիշ,t͡ʃʰ ɑ pʰ ɑ n i ʃ,0
{arm}չափել,t͡ʃʰ ɑ pʰ ɛ l,0
{arm}չափորոշիչ,t͡ʃʰ ɑ pʰ ɔ ɾ ɔ ʃ i t͡ʃʰ,0
{arm}չբեր,t͡ʃʰ ə b ɛ ɾ,0
{arm}չգիտեմ,t͡ʃʰ ə ɡ i t ɛ m,0
{arm}չեզոք,t͡ʃʰ ɛ z ɔ kʰ,0
{arm}չեխ,t͡ʃʰ ɛ χ,0
{arm}չեխական,t͡ʃʰ ɛ χ ɑ k ɑ n,0
{arm}չեխերեն,t͡ʃʰ ɛ χ ɛ ɾ ɛ n,0
{arm}չեխիա,t͡ʃʰ ɛ χ j ɑ,0
{arm}չեխոլ,t͡ʃʰ ɛ χ ɔ l,0
{arm}չեխոսլովակիա,t͡ʃʰ ɛ χ ɔ s l ɔ v ɑ k j ɑ,0
{arm}չեղարկել,t͡ʃʰ ɛ ʁ ɑ ɾ k ɛ l,0
{arm}չեմպիոն,t͡ʃʰ ɛ m p j ɔ n,0
{arm}չեննայ,t͡ʃʰ ɛ nː ɑ j,0
{arm}չեչեն,t͡ʃʰ ɛ t͡ʃʰ ɛ n,0
{arm}չեչնիա,t͡ʃʰ ɛ t͡ʃʰ n j ɑ,0
{arm}չեռնոգորիա,t͡ʃʰ ɛ r n ɔ ɡ ɔ ɾ j ɑ,0
{arm}չէ,t͡ʃʰ ɛ,0
{arm}չիդար,t͡ʃʰ i d ɑ ɾ,0
{arm}չիթ,t͡ʃʰ i tʰ,0
{arm}չիլի,t͡ʃʰ i l i,0
{arm}չիլիացի,t͡ʃʰ i l i j ɑ t͡sʰ i,0
{arm}չիլինգարյան,t͡ʃʰ i l i ŋ ɡ ɑ ɾ j ɑ n,0
{arm}չիկագո,t͡ʃʰ i k ɑ ɡ ɔ,0
{arm}չիղջ,t͡ʃʰ i ʁ d͡ʒ,0
{arm}չինական,t͡ʃʰ i n ɑ k ɑ n,0
{arm}չինաստան,t͡ʃʰ i n ɑ s t ɑ n,0
{arm}չինարեն,t͡ʃʰ i n ɑ ɾ ɛ n,0
{arm}չինարի,t͡ʃʰ i n ɑ ɾ i,0
{arm}չինացի,t͡ʃʰ i n ɑ t͡sʰ i,0
{arm}չինգաչունգ,t͡ʃʰ i ŋ ɡ ɑ t͡ʃʰ u ŋ ɡ,0
{arm}չիներեն,t͡ʃʰ i n ɛ ɾ ɛ n,0
{arm}չիպ,t͡ʃʰ i p,0
{arm}չիր,t͡ʃʰ i ɾ,0
{arm}չիք,t͡ʃʰ i kʰ,0
{arm}չկայացած,t͡ʃʰ ə k ɑ j ɑ t͡sʰ ɑ t͡s,0
{arm}չղջիկ,t͡ʃʰ ə χ t͡ʃʰ i k,0
{arm}չնայած,t͡ʃʰ ə n ɑ j ɑ t͡s,0
{arm}չոբան,t͡ʃʰ ɔ b ɑ n,0
{arm}չոր,t͡ʃʰ ɔ ɾ,0
{arm}չորաթան,t͡ʃʰ ɔ ɾ ɑ tʰ ɑ n,0
{arm}չորավուն,t͡ʃʰ ɔ ɾ ɑ v u n,0
{arm}չորթան,t͡ʃʰ ɔ ɾ tʰ ɑ n,0
{arm}չորս,t͡ʃʰ ɔ ɾ s,0
{arm}չորքոտանի,t͡ʃʰ ɔ ɾ kʰ ɔ t ɑ n i,0
{arm}չու,t͡ʃʰ u,0
{arm}չոփ,t͡ʃʰ ɔ pʰ,0
{arm}չոփիկ,t͡ʃʰ ɔ pʰ i k,0
{arm}չոքել,t͡ʃʰ ɔ kʰ ɛ l,0
{arm}չսիրած,t͡ʃʰ ə s i ɾ ɑ t͡s,0
{arm}չվել,t͡ʃʰ ə v ɛ l,0
{arm}չվերթ,t͡ʃʰ ə v ɛ ɾ tʰ,0
{arm}չքանալ,t͡ʃʰ ə kʰ ɑ n ɑ l,0
{arm}չքավոր,t͡ʃʰ ə kʰ ɑ v ɔ ɾ,0
{arm}չքնաղ,t͡ʃʰ ə kʰ n ɑ ʁ,0
{arm}չքսեինք,t͡ʃʰ ə kʰ ə s ɛ j i ŋ kʰ,0
{arm}պագ,p ɑ kʰ,0
{arm}պագնել,p ɑ kʰ n ɛ l,0
{arm}պալատ,p ɑ l ɑ t,0
{arm}պալատական,p ɑ l ɑ t ɑ k ɑ n,0
{arm}պալար,p ɑ l ɑ ɾ,0
{arm}պակ,p ɑ k,0
{arm}պակաս,p ɑ k ɑ s,0
{arm}պակասել,p ɑ k ɑ s ɛ l,0
{arm}պակասեցնել,p ɑ k ɑ s ɛ t͡sʰ n ɛ l,0
{arm}պակասուրդ,p ɑ k ɑ s u ɾ tʰ,0
{arm}պակիստան,p ɑ k i s t ɑ n,0
{arm}պահածո,p ɑ h ɑ t͡s ɔ,0
{arm}պահանջ,p ɑ h ɑ n d͡ʒ,0
{arm}պահանջարկ,p ɑ h ɑ n d͡ʒ ɑ ɾ k,0
{arm}պահանջել,p ɑ h ɑ n d͡ʒ ɛ l,0
{arm}պահապան,p ɑ h ɑ p ɑ n,0
{arm}պահարան,p ɑ h ɑ ɾ ɑ n,0
{arm}պահել,p ɑ h ɛ l,0
{arm}պահեստ,p ɑ h ɛ s t,0
{arm}պահլավերեն,p ɑ h l ɑ v ɛ ɾ ɛ n,0
{arm}պահպանակ,p ɑ h p ɑ n ɑ k,0
{arm}պաղեստին,p ɑ ʁ ɛ s t i n,0
{arm}պաղպաղակ,p ɑ χ p ɑ ʁ ɑ k,0
{arm}պաճուճ,p ɑ t͡ʃ u t͡ʃ,0
{arm}պամիրյան,p ɑ m i ɾ j ɑ n,0
{arm}պայթյուն,p ɑ j tʰ j u n,0
{arm}պայծառ,p ɑ j t͡s ɑ r,0
{arm}պայմանագիր,p ɑ j m ɑ n ɑ ɡ i ɾ,0
{arm}պայմանական,p ɑ j m ɑ n ɑ k ɑ n,0
{arm}պայմանավոր,p ɑ j m ɑ n ɑ v ɔ ɾ,0
{arm}պայմանավորել,p ɑ j m ɑ n ɑ v ɔ ɾ ɛ l,0
{arm}պայմանավորվել,p ɑ j m ɑ n ɑ v ɔ ɾ v ɛ l,0
{arm}պայքար,p ɑ j kʰ ɑ ɾ,0
{arm}պան,p ɑ n,0
{arm}պանամա,p ɑ n ɑ m ɑ,0
{arm}պանդոկ,p ɑ n d ɔ k,0
{arm}պանիր,p ɑ n i ɾ,0
{arm}պաշար,p ɑ ʃ ɑ ɾ,0
{arm}պաշտամունք,p ɑ ʃ t ɑ m u ŋ kʰ,0
{arm}պաշտել,p ɑ ʃ t ɛ l,0
{arm}պաշտոն,p ɑ ʃ t ɔ n,0
{arm}պաշտոնական,p ɑ ʃ t ɔ n ɑ k ɑ n,0
{arm}պաշտոնակից,p ɑ ʃ t ɔ n ɑ k i t͡sʰ,0
{arm}պաշտոնավոր,p ɑ ʃ t ɔ n ɑ v ɔ ɾ,0
{arm}պաչ,p ɑ t͡ʃʰ,0
{arm}պաչել,p ɑ t͡ʃʰ ɛ l,0
{arm}պաչիկ,p ɑ t͡ʃʰ i k,0
{arm}պապ,p ɑ p,0
{arm}պապա,p ɑ p ɑ,0
{arm}պապական,p ɑ p ɑ k ɑ n,0
{arm}պապայա,p ɑ p ɑ j ɑ,0
{arm}պապանձվել,p ɑ p ɑ n d͡z v ɛ l,0
{arm}պապի,p ɑ p i,0
{arm}պապկա,p ɑ p k ɑ,0
{arm}պառավ,p ɑ r ɑ v,0
{arm}պառլամենտ,p ɑ r l ɑ m ɛ n t,0
{arm}պառկել,p ɑ r k ɛ l,0
{arm}պաս,p ɑ s,0
{arm}պաստառ,p ɑ s t ɑ r,0
{arm}պատ,p ɑ t,0
{arm}պատահար,p ɑ t ɑ h ɑ ɾ,0
{arm}պատահել,p ɑ t ɑ h ɛ l,0
{arm}պատանդ,p ɑ t ɑ n d,0
{arm}պատանեկություն,p ɑ t ɑ n ɛ k u tʰ j u n,0
{arm}պատանի,p ɑ t ɑ n i,0
{arm}պատանյակ,p ɑ t ɑ n j ɑ k,0
{arm}պատառ,p ɑ t ɑ r,0
{arm}պատառաքաղ,p ɑ t ɑ r ɑ kʰ ɑ ʁ,0
{arm}պատասխան,p ɑ t ɑ s χ ɑ n,0
{arm}պատասխանատվությամբ,p ɑ t ɑ s χ ɑ n ɑ t v u tʰ j ɑ m b,0
{arm}պատասխանատվություն,p ɑ t ɑ s χ ɑ n ɑ t v u tʰ j u n,0
{arm}պատասխանել,p ɑ t ɑ s χ ɑ n ɛ l,0
{arm}պատարագ,p ɑ t ɑ ɾ ɑ kʰ,0
{arm}պատգամավորացու,p ɑ t ɡ ɑ m ɑ v ɔ ɾ ɑ t͡sʰ u,0
{arm}պատգարակ,p ɑ t ɡ ɑ ɾ ɑ k,0
{arm}պատել,p ɑ t ɛ l,0
{arm}պատերազմ,p ɑ t ɛ ɾ ɑ z m,0
{arm}պատժամիջոց,p ɑ t ʒ ɑ m i t͡ʃʰ ɔ t͡sʰ,0
{arm}պատժել,p ɑ t ʒ ɛ l,0
{arm}պատժում,p ɑ t ʒ u m,0
{arm}պատժվել,p ɑ t ə ʒ v ɛ l,0
{arm}պատիժ,p ɑ t i ʒ,0
{arm}պատիկ,p ɑ t i k,0
{arm}պատիվ,p ɑ t i v,0
{arm}պատկանել,p ɑ t k ɑ n ɛ l,0
{arm}պատկառանք,p ɑ t k ɑ r ɑ ŋ kʰ,0
{arm}պատկառելի,p ɑ t k ɑ r ɛ l i,0
{arm}պատկերահան,p ɑ t k ɛ ɾ ɑ h ɑ n,0
{arm}պատկերասրահ,p ɑ t k ɛ ɾ ɑ s ə ɾ ɑ h,0
{arm}պատկերացնել,p ɑ t k ɛ ɾ ɑ t͡sʰ n ɛ l,0
{arm}պատկերացում,p ɑ t k ɛ ɾ ɑ t͡sʰ u m,0
{arm}պատճառ,p ɑ t t͡ʃ ɑ r,0
{arm}պատճեն,p ɑ t t͡ʃ ɛ n,0
{arm}պատճենահան,p ɑ t t͡ʃ ɛ n ɑ h ɑ n,0
{arm}պատմագիտություն,p ɑ t m ɑ ɡ i t u tʰ j u n,0
{arm}պատմական,p ɑ t m ɑ k ɑ n,0
{arm}պատմել,p ɑ t m ɛ l,0
{arm}պատմություն,p ɑ t m u tʰ j u n,0
{arm}պատմուճան,p ɑ t m u t͡ʃ ɑ n,0
{arm}պատյան,p ɑ t j ɑ n,0
{arm}պատնեշ,p ɑ t n ɛ ʃ,0
{arm}պատշաճ,p ɑ t ʃ ɑ t͡ʃ,0
{arm}պատշգամբ,p ɑ t ə ʃ ɡ ɑ m b,0
{arm}պատուհան,p ɑ t u h ɑ n,0
{arm}պատուհաս,p ɑ t u h ɑ s,0
{arm}պատռել,p ɑ t r ɛ l,0
{arm}պատվաստանյութ,p ɑ t v ɑ s t ɑ n j u tʰ,0
{arm}պատվաստել,p ɑ t v ɑ s t ɛ l,0
{arm}պատվաստում,p ɑ t v ɑ s t u m,0
{arm}պատվար,p ɑ t v ɑ ɾ,0
{arm}պատվարժան,p ɑ t v ɑ ɾ ʒ ɑ n,0
{arm}պատվեր,p ɑ t v ɛ ɾ,0
{arm}պատվիրակություն,p ɑ t v i ɾ ɑ k u tʰ j u n,0
{arm}պատվիրան,p ɑ t v i ɾ ɑ n,0
{arm}պատվիրել,p ɑ t v i ɾ ɛ l,0
{arm}պատվոգիր,p ɑ t v ɔ ɡ i ɾ,0
{arm}պատրանք,p ɑ t ɾ ɑ ŋ kʰ,0
{arm}պատրաստ,p ɑ t ɾ ɑ s t,0
{arm}պատրաստակամ,p ɑ t ɾ ɑ s t ɑ k ɑ m,0
{arm}պատրաստել,p ɑ t ɾ ɑ s t ɛ l,0
{arm}պատրաստվել,p ɑ t ɾ ɑ s t v ɛ l,0
{arm}պատրվակ,p ɑ t ə ɾ v ɑ k,0
{arm}պար,p ɑ ɾ,0
{arm}պարագա,p ɑ ɾ ɑ ɡ ɑ,0
{arm}պարագվայ,p ɑ ɾ ɑ ɡ v ɑ j,0
{arm}պարադոքս,p ɑ ɾ ɑ d ɔ kʰ s,0
{arm}պարան,p ɑ ɾ ɑ n,0
{arm}պարաշյուտ,p ɑ ɾ ɑ ʃ j u t,0
{arm}պարապ,p ɑ ɾ ɑ p,0
{arm}պարապել,p ɑ ɾ ɑ p ɛ l,0
{arm}պարարտ,p ɑ ɾ ɑ ɾ t,0
{arm}պարարտանյութ,p ɑ ɾ ɑ ɾ t ɑ n j u tʰ,0
{arm}պարգեւ,p ɑ ɾ kʰ ɛ v,0
{arm}պարգեւավճար,p ɑ ɾ kʰ ɛ v ɑ v ə t͡ʃ ɑ ɾ,0
{arm}պարգեւել,p ɑ ɾ kʰ ɛ v ɛ l,0
{arm}պարեգոտ,p ɑ ɾ ɛ ɡ ɔ t,0
{arm}պարել,p ɑ ɾ ɛ l,0
{arm}պարեն,p ɑ ɾ ɛ n,0
{arm}պարետ,p ɑ ɾ ɛ t,0
{arm}պարզ,p ɑ ɾ z,0
{arm}պարզապես,p ɑ ɾ z ɑ p ɛ s,0
{arm}պարզորոշ,p ɑ ɾ z ɔ ɾ ɔ ʃ,0
{arm}պարզունակ,p ɑ ɾ z u n ɑ k,0
{arm}պարթեւ,p ɑ ɾ tʰ ɛ v,0
{arm}պարթեւստան,p ɑ ɾ tʰ ɛ f s t ɑ n,0
{arm}պարիկ,p ɑ ɾ i k,0
{arm}պարծանք,p ɑ ɾ t͡s ɑ ŋ kʰ,0
{arm}պարծենալ,p ɑ ɾ t͡s ɛ n ɑ l,0
{arm}պարկ,p ɑ ɾ k,0
{arm}պարկավոր,p ɑ ɾ k ɑ v ɔ ɾ,0
{arm}պարմեզան,p ɑ ɾ m ɛ z ɑ n,0
{arm}պարող,p ɑ ɾ ɔ ʁ,0
{arm}պարոն,p ɑ ɾ ɔ n,0
{arm}պարուհի,p ɑ ɾ u h i,0
{arm}պարույր,p ɑ ɾ u j ɾ,0
{arm}պարս,p ɑ ɾ s,0
{arm}պարսատիկ,p ɑ ɾ s ɑ t i k,0
{arm}պարսիկ,p ɑ ɾ s i k,0
{arm}պարսկական,p ɑ ɾ s k ɑ k ɑ n,0
{arm}պարսկահայ,p ɑ ɾ s k ɑ h ɑ j,0
{arm}պարսկաստան,p ɑ ɾ s k ɑ s t ɑ n,0
{arm}պարսկերեն,p ɑ ɾ s k ɛ ɾ ɛ n,0
{arm}պարտ,p ɑ ɾ t,0
{arm}պարտականություն,p ɑ ɾ t ɑ k ɑ n u tʰ j u n,0
{arm}պարտավ,p ɑ ɾ t ɑ v,0
{arm}պարտավորություն,p ɑ ɾ t ɑ v ɔ ɾ u tʰ j u n,0
{arm}պարտատոմս,p ɑ ɾ t ɑ t ɔ m s,0
{arm}պարտեզ,p ɑ ɾ t ɛ z,0
{arm}պարտիա,p ɑ ɾ t j ɑ,0
{arm}պարտիզան,p ɑ ɾ t i z ɑ n,0
