merged_spelling,ipa,langid
{dut}boulevard,b u l ə v aː r,0
{dut}boulevardkrant,b u l ə v aː r k r ɑ n t,0
{dut}bourgeois,b u r ʒ ʋ aː,0
{dut}bouw,b ɑ u̯,0
{dut}bouwen,b ɑ u̯ ə n,0
{dut}bouwer,b ɑ u̯ ə r,0
{dut}bouwheer,b ɑ u̯ ɦ eː r,0
{dut}bouwkunde,b ɑ u̯ k ʏ n d ə,0
{dut}bouwkundig,b ɑ u̯ k ʏ n d ə x,0
{dut}bouwman,b ɑ u̯ m ɑ n,0
{dut}bouwmarkt,b ɑ u̯ m ɑ r k t,0
{dut}bouwsel,b ɑ u̯ s ə l,0
{dut}bouwt,b ɑ u̯ t,0
{dut}bouwvak,b ɑ u̯ v ɑ k,0
{dut}bouwvakker,b ɑ u̯ v ɑ k ə r,0
{dut}bouwvallig,b ɑ u̯ v ɑ l ə x,0
{dut}bouwwerk,b ɑ u̯ ʋ ɛ r k,0
{dut}bovenaan,b oː v ə n aː n,0
{dut}bovenal,b oː v ə n ɑ l,0
{dut}bovenbouw,b oː v ə n b ɑ u̯,0
{dut}bovenkant,b oː v ə n k ɑ n t,0
{dut}bovenop,b oː v ə n ɔ p,0
{dut}bovenstaand,b oː v ə n s t aː n t,0
{dut}bovenstad,b oː v ə n s t ɑ t,0
{dut}boventoon,b oː v ə n t oː n,0
{dut}bovenwereld,b oː v ə n ʋ eː r ə l t,0
{dut}bovenzijde,b oː v ə n z ɛ i̯ d ə,0
{dut}box,b ɔ k s,0
{dut}boy,b ɔ i̯,0
{dut}boycot,b ɔ i̯ k ɔ t,0
{dut}brabant,b r aː b ɑ n t,0
{dut}braderie,b r aː d ə r i,0
{dut}brak,b r ɑ k,0
{dut}braken,b r aː k ə n,0
{dut}brallen,b r ɑ l ə n,0
{dut}bram,b r ɑ m,0
{dut}brancard,b r ɑ ŋ k aː r,0
{dut}brand,b r ɑ n t,0
{dut}brander,b r ɑ n d ə r,0
{dut}branding,b r ɑ n d ɪ ŋ,0
{dut}brandstapel,b r ɑ n t s t aː p ə l,0
{dut}brandstof,b r ɑ n t s t ɔ f,0
{dut}brandweer,b r ɑ n t ʋ eː r,0
{dut}brandweerkorps,b r ɑ n t ʋ eː r k ɔ r p s,0
{dut}brandweerwagen,b r ɑ n t ʋ eː r ʋ aː ɣ ə n,0
{dut}brandwond,b r ɑ n t ʋ ɔ n t,0
{dut}brauw,b r ɑ u̯,0
{dut}braziliaan,b r aː z i l i aː n,0
{dut}brazilië,b r aː z i l i ə,0
{dut}breda,b r eː d aː,0
{dut}breed,b r eː t,0
{dut}breedband,b r eː t b ɑ n t,0
{dut}breedte,b r eː t ə,0
{dut}breekpunt,b r eː k p ʏ n t,0
{dut}breeuwen,b r eː u̯ ə n,0
{dut}brein,b r ɛ i̯ n,0
{dut}breken,b r eː k ə n,0
{dut}breking,b r eː k ɪ ŋ,0
{dut}breng,b r ɛ ŋ,0
{dut}brengen,b r ɛ ŋ ə n,0
{dut}bres,b r ɛ s,0
{dut}bretagne,b r ə t ɑ n j ə,0
{dut}breuk,b r øː k,0
{dut}breukelen,b r øː k ə l ə n,0
{dut}brief,b r i f,0
{dut}briefomslag,b r i f ɔ m s l ɑ x,0
{dut}brievenbus,b r i v ə n b ʏ s,0
{dut}brij,b r ɛ i̯,0
{dut}bril,b r ɪ l,0
{dut}brillen,b r ɪ l ə n,0
{dut}brit,b r ɪ t,0
{dut}brits,b r ɪ t s,0
{dut}brittannië,b r ɪ t ɑ n i ə,0
{dut}brochure,b r ɔ ʃ yː r ə,0
{dut}broedseizoen,b r u t s ɛ i̯ z u n,0
{dut}broeikaseffect,b r u i̯ k ɑ s ɛ f ɛ k t,0
{dut}broekzak,b r u k s ɑ k,0
{dut}broer,b r uː r,0
{dut}brok,b r ɔ k,0
{dut}brokken,b r ɔ k ə n,0
{dut}bromfiets,b r ɔ m f i t s,0
{dut}brommer,b r ɔ m ə r,0
{dut}brompot,b r ɔ m p ɔ t,0
{dut}bron,b r ɔ n,0
{dut}broncode,b r ɔ n k oː d ə,0
{dut}bronkhorst,b r ɔ ŋ k ɦ ɔ r s t,0
{dut}brood,b r oː t,0
{dut}broodje,b r oː t j ə,0
{dut}broom,b r oː m,0
{dut}broos,b r oː s,0
{dut}brosser,b r ɔ s ə r,0
{dut}brouwen,b r ɑ u̯ ə n,0
{dut}brouwer,b r ɑ u̯ ə r,0
{dut}brouwerij,b r ɑ u̯ ə r ɛ i̯,0
{dut}brouwsel,b r ɑ u̯ s ə l,0
{dut}browsen,b r ɑ u̯ z ə n,0
{dut}browser,b r ɑ u̯ z ə r,0
{dut}brug,b r ʏ x,0
{dut}brugwachter,b r ʏ x ʋ ɑ x t ə r,0
{dut}bruidegom,b r œ y̯ d ə ɣ ɔ m,0
{dut}bruikbaar,b r œ y̯ k b aː r,0
{dut}bruikbaarheid,b r œ y̯ k b aː r ɦ ɛ i̯ t,0
{dut}bruikleen,b r œ y̯ k l eː n,0
{dut}bruiloft,b r œ y̯ l ɔ f t,0
{dut}bruin,b r œ y̯ n,0
{dut}bruine,b r œ y̯ n ə,0
{dut}bruinhemd,b r œ y̯ n ɦ ɛ m t,0
{dut}bruistablet,b r œ y̯ s t aː b l ɛ t,0
{dut}brunch,b r ʏ n ʃ,0
{dut}brunette,b r y n ɛ t ə,0
{dut}brussel,b r ʏ s ə l,0
{dut}brussels,b r ʏ s ə l s,0
{dut}brutaal,b r y t aː l,0
{dut}bruto,b r y t oː,0
{dut}bruut,b r y t,0
{dut}btw,b eː t eː ʋ eː,0
{dut}budgetteren,b ʏ d ʒ ɛ t eː r ə n,0
{dut}buggy,b ʏ ɡ i,0
{dut}buienradar,b œ y̯ ə n r aː d ɑ r,0
{dut}buigen,b œ y̯ ɣ ə n,0
{dut}buiging,b œ y̯ ɣ ɪ ŋ,0
{dut}buik,b œ y̯ k,0
{dut}buikgriep,b œ y̯ k x r i p,0
{dut}buikje,b œ y̯ k j ə,0
{dut}buis,b œ y̯ s,0
{dut}buiten,b œ y̯ t ə n,0
{dut}buitenaf,b œ y̯ t ə n ɑ f,0
{dut}buitenkans,b œ y̯ t ə n k ɑ n s,0
{dut}buitenkant,b œ y̯ t ə n k ɑ n t,0
{dut}buitenkern,b œ y̯ t ə n k ɛ r n,0
{dut}buitenland,b œ y̯ t ə n l ɑ n t,0
{dut}buitenlands,b œ y̯ t ə n l ɑ n t s,0
{dut}buitenlucht,b œ y̯ t ə n l ʏ x t,0
{dut}buitenmoeder,b œ y̯ t ə n m u d ə r,0
{dut}buitenmuur,b œ y̯ t ə n m yː r,0
{dut}buitenshuis,b œ y̯ t ə n s ɦ œ y̯ s,0
{dut}buitenspel,b œ y̯ t ə n s p ɛ l,0
{dut}buitenspelval,b œ y̯ t ə n s p ɛ l v ɑ l,0
{dut}buitenstaander,b œ y̯ t ə n s t aː n d ə r,0
{dut}buitentrouw,b œ y̯ t ə n t r ɑ u̯,0
{dut}bukken,b ʏ k ə n,0
{dut}bul,b ʏ l,0
{dut}bulldog,b u l d ɔ ɡ,0
{dut}bully,b u l i,0
{dut}bult,b ʏ l t,0
{dut}bumper,b ʏ m p ə r,0
{dut}bumperkleven,b ʏ m p ə r k l eː v ə n,0
{dut}bundel,b ʏ n d ə l,0
{dut}bundelen,b ʏ n d ə l ə n,0
{dut}bunnik,b ʏ n ɪ k,0
{dut}burchtheer,b ʏ r x t ɦ eː r,0
{dut}bureau,b y r oː,0
{dut}bureaublad,b y r oː b l ɑ t,0
{dut}bureaucratie,b yː r oː k r aː t s i,0
{dut}burg,b ʏ r x,0
{dut}burgemeester,b ʏ r ɣ ə m eː s t ə r,0
{dut}burgemeesterschap,b ʏ r ɣ ə m eː s t ə r s x ɑ p,0
{dut}burger,b ʏ r ɣ ə r,0
{dut}burgerbevolking,b ʏ r ɣ ə r b ə v ɔ l k ɪ ŋ,0
{dut}burgerlijk,b ʏ r ɣ ə r l ə k,0
{dut}burgeroorlog,b ʏ r ɣ ə r oː r l ɔ x,0
{dut}burgerschap,b ʏ r ɣ ə r s x ɑ p,0
{dut}burggraaf,b ʏ r x r aː f,0
{dut}burundi,b u r u n d i,0
{dut}bushalte,b ʏ s ɦ ɑ l t ə,0
{dut}buslijn,b ʏ s l ɛ i̯ n,0
{dut}busstation,b ʏ s t aː ʃ ɔ n,0
{dut}buurland,b yː r l ɑ n t,0
{dut}buurman,b yː r m ɑ n,0
{dut}buurten,b yː r t ə n,0
{dut}buurthuis,b yː r t ɦ œ y̯ s,0
{dut}buurtschap,b yː r t s x ɑ p,0
{dut}buurvrouw,b yː r v r ɑ u̯,0
{dut}byzantijns,b i z ɑ n t ɛ i̯ n s,0
{dut}bühne,b yː n ə,0
{dut}cabaret,k aː b aː r ɛ t,0
{dut}cabaretier,k aː b aː r ɛ t j eː,0
{dut}cabine,k aː b i n ə,0
{dut}cabinepersoneel,k aː b i n ə p ɛ r s oː n eː l,0
{dut}cabriolet,k aː b r i oː l ɛ t,0
{dut}cacao,k ɑ k ɑ u̯,0
{dut}cadans,k aː d ɑ n s,0
{dut}cadeau,k a d oː,0
{dut}cadeaubon,k aː d oː b ɔ n,0
{dut}cafetaria,k aː f eː t aː r i aː,0
{dut}cafeïne,k aː f eː i n ə,0
{dut}café,k aː f eː,0
{dut}cake,k eː k,0
{dut}calamiteit,k aː l aː m i t ɛ i̯ t,0
{dut}calcium,k ɑ l s i ʏ m,0
{dut}californië,k aː l i f ɔ r n i ə,0
{dut}calvinisme,k ɑ l v i n ɪ s m ə,0
{dut}cambodja,k ɑ m b ɔ t j aː,0
{dut}camee,k aː m eː,0
{dut}camera,k aː m ə r aː,0
{dut}cameraploeg,k aː m ə r aː p l u x,0
{dut}cameratoezicht,k aː m ə r aː t u z ɪ x t,0
{dut}campagne,k ɑ m p ɑ n j ə,0
{dut}camper,k ɛ m p ə r,0
{dut}canada,k aː n aː d aː,0
{dut}candela,k ɑ n d eː l aː,0
{dut}cannabis,k ɑ n aː b ɪ s,0
{dut}canon,k aː n ɔ n,0
{dut}cantate,k ɑ n t aː t ə,0
{dut}canvas,k ɑ n v ɑ s,0
{dut}cao,s eː aː oː,0
{dut}capitool,k aː p i t oː l,0
{dut}capituleren,k aː p i t y l eː r ə n,0
{dut}capoeirista,k aː p u eː r i s t aː,0
{dut}caravan,k ɛ r ə v ɛ n,0
{dut}carbon,k ɑ r b ɔ n,0
{dut}carcinogeen,k ɑ r s i n oː ɣ eː n,0
{dut}cardioloog,k ɑ r d i oː l oː x,0
{dut}carillon,k aː r ɪ l j ɔ n,0
{dut}cariës,k aː r i ɛ s,0
{dut}carmen,k ɑ r m ə n,0
{dut}carnaval,k ɑ r n aː v ɑ l,0
{dut}carrière,k ɑ r i ɛː r ə,0
{dut}carrosserie,k ɑ r ɔ s ə r i,0
{dut}carrousel,k ɑ r u s ɛ l,0
{dut}carthago,k ɑ r t aː ɣ oː,0
{dut}cash,k ɛ ʃ,0
{dut}casino,k aː z i n oː,0
{dut}castratie,k ɑ s t r aː t s i,0
{dut}catalaans,k aː t aː l aː n s,0
{dut}catalogus,k aː t aː l oː ɣ ʏ s,0
{dut}catalonië,k aː t aː l oː n i ə,0
{dut}cataract,k aː t aː r ɑ k t,0
{dut}categorie,k ɑ t ə ɣ oː r i,0
{dut}categorisch,k ɑ t ə ɣ oː r i s,0
{dut}catheter,k aː t eː t ə r,0
{dut}cavia,k aː v i j aː,0
{dut}cd,s eː d eː,0
{dut}cda,s eː d eː aː,0
{dut}ceintuur,s ɛ n t yː r,0
{dut}cel,s ɛ l,0
{dut}celgenoot,s ɛ l ɣ ə n oː t,0
{dut}cell,s ɛ l,0
{dut}cellulose,s ɛ l y l oː z ə,0
{dut}celstraf,s ɛ l s t r ɑ f,0
{dut}cement,s ə m ɛ n t,0
{dut}censureren,s ɛ n z yː r eː r ə n,0
{dut}census,s ɛ n z ʏ s,0
{dut}centimeter,s ɛ n t i m eː t ə r,0
{dut}centraal,s ɛ n t r aː l,0
{dut}centrale,s ɛ n t r aː l ə,0
{dut}centralisatie,s ɛ n t r aː l i z aː t s i,0
{dut}centrum,s ɛ n t r ʏ m,0
{dut}centrumrechts,s ɛ n t r ʏ m r ɛ x t s,0
{dut}ceremonie,s eː r ə m oː n i,0
{dut}ceremoniemeester,s eː r ə m oː n i m eː s t ə r,0
{dut}certificaat,s ɛ r t i f i k aː t,0
{dut}certificeren,s ɛ r t i f i s eː r ə n,0
{dut}champagne,ʃ ɑ m p ɑ n j ə,0
{dut}champignon,ʃ ɑ m p i n j ɔ n,0
{dut}chanten,t ʃ ɑ n t ə n,0
{dut}chanteren,ʃ ɑ n t eː r ə n,0
{dut}chaos,x aː ɔ s,0
{dut}chaotisch,x aː oː t i s,0
{dut}chapeau,ʃ aː p oː,0
{dut}charisma,x aː r ɪ s m aː,0
{dut}charmant,ʃ ɑ r m ɑ n t,0
{dut}charmeren,ʃ ɑ r m eː r ə n,0
{dut}chat,t ʃ ɛ t,0
{dut}chatten,t ʃ ɛ t ə n,0
{dut}checken,t ʃ ɛ k ə n,0
{dut}chef,ʃ ɛ f,0
{dut}cheffin,ʃ ɛ f ɪ n,0
{dut}chemie,x eː m i,0
{dut}chemieconcern,x eː m i k ɔ n s ʏ r n,0
{dut}chemisch,x eː m i s,0
{dut}cheque,ʃ ɛ k,0
{dut}chic,ʃ i k,0
{dut}china,ʃ i n aː,0
{dut}chinchilla,t ʃ ɪ n t ʃ ɪ l aː,0
{dut}chinees,ʃ i n eː s,0
{dut}chinese,ʃ i n eː s ə,0
{dut}chinezen,ʃ i n eː z ə n,0
{dut}chip,t ʃ ɪ p,0
{dut}chirurgie,ʃ i r ʏ r ɣ i,0
{dut}chloor,x l oː r,0
{dut}chocolade,ʃ oː k oː l aː d ə,0
{dut}chocolademelk,ʃ oː k oː l aː d ə m ɛ l k,0
{dut}chocomel,ʃ oː k oː m ɛ l,0
{dut}cholera,x oː l ə r aː,0
{dut}chris,k r ɪ s,0
{dut}christa,k r ɪ s t aː,0
{dut}christendemocratie,k r ɪ s t ə n d eː m oː k r aː t s i,0
{dut}christiaan,k r ɪ s t i j aː n,0
{dut}christine,k r ɪ s t i n ə,0
{dut}chromosoom,x r oː m oː s oː m,0
{dut}chronisch,x r oː n i s,0
{dut}cijfer,s ɛ i f ə r,0
{dut}cilinder,s i l ɪ n d ə r,0
{dut}cimbaal,s ɪ m b aː l,0
{dut}circa,s ɪ r k aː,0
{dut}circuit,s ɪ r k ʋ i,0
{dut}circus,s ɪ r k ʏ s,0
{dut}circusartiest,s ɪ r k ʏ s ɑ r t i s t,0
{dut}cirkel,s ɪ r k ə l,0
{dut}citaat,s i t aː t,0
{dut}citer,s i t ə r,0
{dut}citroen,s i t r u n,0
{dut}citroensap,s i t r u n s ɑ p,0
{dut}clan,k l ɛ n,0
{dut}classis,k l ɑ s ɪ s,0
{dut}clausule,k l ɑ u̯ z y l ə,0
{dut}cliché,k l i ʃ eː,0
{dut}client,k l ɑ i̯ ə n t,0
{dut}clown,k l ɑ u̯ n,0
{dut}club,k l ʏ p,0
{dut}clubhuis,k l ʏ p ɦ œ y̯ s,0
{dut}cnv,s eː ɛ n v eː,0
{dut}co,k oː,0
{dut}coach,k oː t ʃ,0
{dut}coalitie,k oː aː l i t s i,0
{dut}cobra,k oː b r aː,0
{dut}cocaïne,k oː k aː i n ə,0
{dut}cocktail,k ɔ k t eː l,0
{dut}code,k oː d ə,0
{dut}codering,k oː d eː r ɪ ŋ,0
{dut}coen,k u n,0
{dut}coevorden,k u v ɔ r d ə n,0
{dut}coffeeshop,k ɔ f i ʃ ɔ p,0
{dut}cognitief,k ɔ x n i t i f,0
{dut}col,k ɔ l,0
{dut}cola,k oː l aː,0
{dut}collaboratie,k ɔ l aː b oː r aː t s i,0
{dut}collageen,k ɔ l aː ɣ eː n,0
{dut}collatierecht,k ɔ l aː t s i r ɛ x t,0
{dut}collectie,k ɔ l ɛ k s i,0
{dut}collectief,k ɔ l ɛ k t i f,0
{dut}collega,k ɔ l eː ɣ aː,0
{dut}college,k ɔ l eː ʒ ə,0
{dut}collegezaal,k ɔ l eː ʒ ə z aː l,0
{dut}colombia,k oː l ɔ m b i aː,0
{dut}colonne,k oː l ɔ n ə,0
{dut}combi,k ɔ m b i,0
{dut}comeback,k ɑ m b ɛ k,0
{dut}comité,k ɔ m i t eː,0
{dut}commentaar,k ɔ m ɛ n t aː r,0
{dut}commercie,k ɔ m ɛ r s i,0
{dut}commissie,k ɔ m ɪ s i,0
{dut}commotie,k ɔ m oː t s i,0
{dut}communicatie,k ɔ m y n i k aː t s i,0
{dut}communicatiemiddel,k ɔ m y n i k aː t s i m ɪ d ə l,0
{dut}communiceren,k ɔ m y n i s eː r ə n,0
{dut}communie,k ɔ m y n i,0
{dut}communistisch,k ɔ m y n ɪ s t i s,0
{dut}compact,k ɔ m p ɑ k t,0
{dut}compagnie,k ɔ m p ɑ n j i,0
{dut}compensatie,k ɔ m p ɛ n z aː t s i,0
{dut}compenseren,k ɔ m p ɛ n z eː r ə n,0
{dut}competent,k ɔ m p ə t ɛ n t,0
{dut}compleet,k ɔ m p l eː t,0
{dut}completeren,k ɔ m p l eː t eː r ə n,0
{dut}complex,k ɔ m p l ɛ k s,0
{dut}complexiteit,k ɔ m p l ɛ k s i t ɛ i̯ t,0
{dut}compliment,k ɔ m p l i m ɛ n t,0
{dut}component,k ɔ m p oː n ɛ n t,0
{dut}componeren,k ɔ m p oː n eː r ə n,0
{dut}componist,k ɔ m p oː n ɪ s t,0
{dut}compositie,k ɔ m p oː z i t s i,0
{dut}compost,k ɔ m p ɔ s t,0
{dut}compressie,k ɔ m p r ɛ s i,0
{dut}computer,k ɔ m p j u t ə r,0
{dut}computerprogramma,k ɔ m p j u t ə r p r oː ɣ r ɑ m aː,0
{dut}computerspel,k ɔ m p j u t ə r s p ɛ l,0
{dut}concentratiekamp,k ɔ n s ɛ n t r aː t s i k ɑ m p,0
{dut}concentreren,k ɔ n s ɛ n t r eː r ə n,0
{dut}concept,k ɔ n s ɛ p t,0
{dut}concern,k ɔ n s ʏ r n,0
{dut}concert,k ɔ n s ɛ r t,0
{dut}concilie,k ɔ n s i l i,0
{dut}conciërge,k ɔ n ʒ ɛ r ʒ ə,0
{dut}concluderen,k ɔ ŋ k l y d eː r ə n,0
{dut}concreet,k ɔ ŋ k r eː t,0
{dut}concurrentie,k ɔ ŋ k y r ɛ n t s i,0
{dut}conditie,k ɔ n d i t s i,0
{dut}condoleren,k ɔ n d oː l eː r ə n,0
{dut}condoom,k ɔ n d oː m,0
{dut}confederaal,k ɔ n f eː d ə r aː l,0
{dut}confederalisme,k ɔ n f eː d ə r aː l ɪ s m ə,0
{dut}conflict,k ɔ n f l ɪ k t,0
{dut}conflictstof,k ɔ n f l ɪ k t s t ɔ f,0
{dut}confrater,k ɔ n f r aː t ə r,0
{dut}confronteren,k ɔ n f r ɔ n t eː r ə n,0
{dut}congres,k ɔ ŋ ɣ r ɛ s,0
{dut}congruent,k ɔ ŋ ɣ r y ɛ n t,0
{dut}conisch,k oː n i s,0
{dut}consequent,k ɔ n s ə k ʋ ɛ n t,0
{dut}conservatief,k ɔ n z ɛ r v aː t i f,0
{dut}conservatisme,k ɔ n z ɛ r v aː t ɪ s m ə,0
{dut}conservator,k ɔ n z ɛ r v aː t ɔ r,0
{dut}conserven,k ɔ n z ɛ r v ə n,0
{dut}constant,k ɔ n s t ɑ n t,0
{dut}constante,k ɔ n s t ɑ n t ə,0
{dut}constantijn,k ɔ n s t ɑ n t ɛ i̯ n,0
{dut}constateren,k ɔ n s t aː t eː r ə n,0
{dut}constructie,k ɔ n s t r ʏ k s i,0
{dut}constructief,k ɔ n s t r ʏ k t i f,0
{dut}consument,k ɔ n z y m ɛ n t,0
{dut}consumptie,k ɔ n z ʏ m p s i,0
{dut}consumptiemaatschappij,k ɔ n z ʏ m p s i m aː t s x ɑ p ɛ i̯,0
{dut}contact,k ɔ n t ɑ k t,0
{dut}contactlens,k ɔ n t ɑ k t l ɛ n s,0
{dut}contactpersoon,k ɔ n t ɑ k t p ɛ r s oː n,0
{dut}container,k ɔ n t eː n ə r,0
{dut}contant,k ɔ n t ɑ n t,0
{dut}context,k ɔ n t ɛ k s t,0
{dut}continu,k ɔ n t i n y,0
{dut}contract,k ɔ n t r ɑ k t,0
{dut}contrast,k ɔ n t r ɑ s t,0
{dut}controleren,k ɔ n t r oː l eː r ə n,0
{dut}controller,k ɔ n t r ɔ l ə r,0
{dut}controverse,k ɔ n t r oː v ɛ r z ə,0
{dut}convenant,k ɔ n v ə n ɑ n t,0
{dut}conventie,k ɔ n v ɛ n s i,0
{dut}conversie,k ɔ n v ɛ r s i,0
{dut}cookie,k u k i,0
{dut}cool,k uː l,0
{dut}cor,k ɔ r,0
{dut}cornelia,k ɔ r n eː l i aː,0
{dut}cornelis,k ɔ r n eː l ɪ s,0
{dut}corps,k oː r,0
{dut}corpus,k ɔ r p ʏ s,0
{dut}correct,k ɔ r ɛ k t,0
{dut}correctie,k ɔ r ɛ k s i,0
{dut}corrie,k ɔ r i,0
{dut}corrumperen,k ɔ r ʏ m p eː r ə n,0
{dut}corrupt,k ɔ r ʏ p t,0
{dut}cortège,k ɔ r t ɛː ʒ ə,0
{dut}coulisselandschap,k u l i z ə l ɑ n t s x ɑ p,0
{dut}counter,k ɑ u̯ n t ə r,0
{dut}coureur,k u r øː r,0
{dut}coördinaten,k oː ɔ r d i n aː t ə n,0
{dut}coördinator,k oː ɔ r d i n aː t ɔ r,0
{dut}creatie,k r eː j aː t s i,0
{dut}credo,k r eː d oː,0
{dut}crematorium,k r eː m aː t oː r i ʏ m,0
{dut}cricket,k r ɪ k ə t,0
{dut}criminaliteit,k r i m i n aː l i t ɛ i̯ t,0
{dut}crimineel,k r i m i n eː l,0
{dut}crisis,k r i z ɪ s,0
{dut}criterium,k r i t eː r i ʏ m,0
{dut}cruise,k r uː s,0
{dut}cruiseschip,k r uː s s x ɪ p,0
{dut}cruyff,k r œ y̯ f,0
{dut}crèmekleurig,k r ɛː m k l øː r ə x,0
{dut}cuba,k y b aː,0
{dut}cuijk,k œ y̯ k,0
{dut}culemborg,k y l ə m b ɔ r x,0
{dut}cultureel,k ʏ l t y r eː l,0
{dut}cultuur,k ʏ l t y r,0
{dut}curatele,k y r aː t eː l ə,0
{dut}curator,k y r aː t ɔ r,0
{dut}curatoren,k y r aː t oː r ə n,0
{dut}curry,k ʏ r i,0
{dut}cursist,k ʏ r s ɪ s t,0
{dut}cursus,k ʏ r s ʏ s,0
{dut}cv,s eː v eː,0
{dut}cyclisch,s i k l i s,0
{dut}cycloon,s i k l oː n,0
{dut}cyclus,s i k l ʏ s,0
{dut}cynisme,s i n ɪ s m ə,0
{dut}cyprus,s i p r ʏ s,0
{dut}daad,d aː t,0
{dut}daag,d aː x,0
{dut}daags,d aː x s,0
{dut}daalder,d aː l d ə r,0
{dut}daan,d aː n,0
{dut}daar,d aː r,0
{dut}daaraan,d aː r aː n,0
{dut}daarachter,d aː r ɑ x t ə r,0
{dut}daarbij,d aː r b ɛ i̯,0
{dut}daarboven,d aː r b oː v ə n,0
{dut}daardoor,d aː r d oː r,0
{dut}daarheen,d aː r ɦ eː n,0
{dut}daarin,d aː r ɪ n,0
{dut}daarmee,d aː r m eː,0
{dut}daarna,d aː r n aː,0
{dut}daarnaar,d aː r n aː r,0
{dut}daarnaast,d aː r n aː s t,0
{dut}daarnet,d aː r n ɛ t,0
{dut}daaro,d aː r oː,0
{dut}daarom,d aː r ɔ m,0
{dut}daaromheen,d aː r ɔ m ɦ eː n,0
{dut}daaronder,d aː r ɔ n d ə r,0
{dut}daarover,d aː r oː v ə r,0
{dut}daaroverheen,d aː r oː v ə r ɦ eː n,0
{dut}daartegen,d aː r t eː ɣ ə n,0
{dut}daartegenover,d aː r t eː ɣ ə n oː v ə r,0
{dut}daarvan,d aː r v ɑ n,0
{dut}daarvandaan,d aː r v ɑ n d aː n,0
{dut}daarvoor,d aː r v oː r,0
{dut}dada,d aː d aː,0
{dut}dadelijk,d aː d ə l ə k,0
{dut}dadendrang,d aː d ə n d r ɑ ŋ,0
{dut}dader,d aː d ə r,0
{dut}dag,d ɑ x,0
{dut}dagblad,d ɑ x b l ɑ t,0
{dut}dagboek,d ɑ x b u k,0
{dut}dagdeel,d ɑ x d eː l,0
{dut}dagelijks,d aː ɣ ə l ə k s,0
{dut}dagen,d aː ɣ ə n,0
{dut}dagenlang,d aː ɣ ə n l ɑ ŋ,0
{dut}dageraad,d aː ɣ ə r aː t,0
{dut}daglicht,d ɑ x l ɪ x t,0
{dut}dagvaarden,d ɑ x f aː r d ə n,0
{dut}dagvaarding,d ɑ x f aː r d ɪ ŋ,0
{dut}dak,d ɑ k,0
{dut}dakdekker,d ɑ k d ɛ k ə r,0
{dut}dakkapel,d ɑ k aː p ɛ l,0
{dut}dakkoffer,d ɑ k ɔ f ə r,0
{dut}dal,d ɑ l,0
{dut}dalen,d aː l ə n,0
{dut}daling,d aː l ɪ ŋ,0
{dut}dam,d ɑ m,0
{dut}damascus,d aː m ɑ s k ʏ s,0
{dut}dame,d aː m ə,0
{dut}dammen,d ɑ m ə n,0
{dut}dammer,d ɑ m ə r,0
{dut}damsteen,d ɑ m s t eː n,0
{dut}dan,d ɑ n,0
{dut}danig,d aː n ə x,0
{dut}daniël,d aː n i j ɛ l,0
{dut}dankbaar,d ɑ ŋ k b aː r,0
{dut}dankbaarheid,d ɑ ŋ k b aː r ɦ ɛ i t,0
{dut}dankjewel,d ɑ ŋ k j ə ʋ ɛ l,0
{dut}danklied,d ɑ ŋ k l i t,0
{dut}dankzegging,d ɑ ŋ k s ɛ ɣ ɪ ŋ,0
{dut}dans,d ɑ n s,0
{dut}dansen,d ɑ n s ə n,0
{dut}danseres,d ɑ n s ə r ɛ s,0
{dut}dantumadeel,d ɑ n t y m aː d eː l,0
{dut}dapper,d ɑ p ə r,0
{dut}dapperheid,d ɑ p ə r ɦ ɛ i̯ t,0
{dut}darm,d ɑ r m,0
{dut}darmflora,d ɑ r m f l oː r aː,0
{dut}darmkanker,d ɑ r m k ɑ ŋ k ə r,0
{dut}dartelen,d ɑ r t ə l ə n,0
{dut}daslook,d ɑ s l oː k,0
{dut}dassen,d ɑ s ə n,0
{dut}dat,d ɑ t,0
{dut}databank,d aː t aː b ɑ ŋ k,0
{dut}date,d eː t,0
{dut}daten,d eː t ə n,0
{dut}datering,d aː t eː r ɪ ŋ,0
{dut}dato,d aː t oː,0
{dut}datum,d aː t ʏ m,0
{dut}datzelfde,d ɑ t s ɛ l f d ə,0
{dut}dauwpunt,d ɑ u̯ p ʏ n t,0
{dut}david,d aː v ɪ t,0
{dut}ddr,d eː d eː ɛ r,0
{dut}de,d ə,0
{dut}deal,d iː l,0
{dut}debiteur,d eː b i t øː r,0
{dut}debutante,d eː b y t ɑ n t ə,0
{dut}decaan,d eː k aː n,0
{dut}decennium,d eː s ɛ n i ʏ m,0
{dut}decentralisatie,d eː s ɛ n t r aː l i z aː t s i,0
{dut}decentralisering,d eː s ɛ n t r aː l i z eː r ɪ ŋ,0
{dut}deceptie,d eː s ɛ p s i,0
{dut}declareren,d eː k l aː r eː r ə n,0
{dut}decor,d eː k ɔ r,0
{dut}decoratie,d eː k oː r aː t s i,0
{dut}decoreren,d eː k oː r eː r ə n,0
{dut}deden,d eː d ə n,0
{dut}deed,d eː t,0
{dut}deeg,d eː x,0
{dut}deel,d eː l,0
{dut}deelgemeente,d eː l ɣ ə m eː n t ə,0
{dut}deelgenoot,d eː l ɣ ə n oː t,0
{dut}deelname,d eː l n aː m ə,0
{dut}deelneemster,d eː l n eː m s t ə r,0
{dut}deelnemen,d eː l n eː m ə n,0
{dut}deelnemer,d eː l n eː m ə r,0
{dut}deelneming,d eː l n eː m ɪ ŋ,0
{dut}deelstaat,d eː l s t aː t,0
{dut}deeltijds,d eː l t ɛ i̯ t s,0
{dut}deen,d eː n,0
{dut}deerlijk,d eː r l ə k,0
{dut}deerniswekkend,d eː r n ɪ s ʋ ɛ k ə n t,0
{dut}defect,d eː f ɛ k t,0
{dut}defensief,d eː f ɛ n s i f,0
{dut}defilé,d eː f i l eː,0
{dut}definitie,d eː f i n i t s i,0
{dut}definitief,d eː f i n i t i f,0
{dut}degelijk,d eː ɣ ə l ə k,0
{dut}degene,d ə ɣ eː n ə,0
{dut}dehaene,d ə ɦ aː n ə,0
{dut}deining,d ɛ i̯ n ɪ ŋ,0
{dut}dek,d ɛ k,0
{dut}dekbed,d ɛ k b ɛ t,0
{dut}deken,d eː k ə n,0
{dut}dekken,d ɛ k ə n,0
{dut}dekking,d ɛ k ɪ ŋ,0
{dut}dekmantel,d ɛ k m ɑ n t ə l,0
{dut}deksel,d ɛ k s ə l,0
{dut}del,d ɛ l,0
{dut}delen,d eː l ə n,0
{dut}delft,d ɛ l f t,0
{dut}delfts,d ɛ l f t s,0
{dut}delfzijl,d ɛ l f z ɛ i̯ l,0
{dut}delgen,d ɛ l ɣ ə n,0
{dut}delta,d ɛ l t aː,0
{dut}demagogisch,d eː m aː ɣ oː ɣ i s,0
{dut}dementie,d eː m ɛ n t s i,0
{dut}democraat,d eː m oː k r aː t,0
{dut}democratie,d eː m oː k r aː t s i,0
{dut}democratisch,d eː m oː k r aː t i s,0
{dut}democratiseren,d eː m oː k r aː t i s eː r ə n,0
{dut}demonstratie,d eː m ɔ n s t r aː t s i,0
{dut}demonstratief,d eː m ɔ n s t r aː t i f,0
{dut}demonstreren,d eː m ɔ n s t r eː r ə n,0
{dut}dempen,d ɛ m p ə n,0
{dut}demper,d ɛ m p ə r,0
{dut}dendermonde,d ɛ n d ə r m ɔ n d ə,0
{dut}denemarken,d eː n ə m ɑ r k ə n,0
{dut}denkbaar,d ɛ ŋ k b aː r,0
{dut}denktank,d ɛ ŋ k t ɛ ŋ k,0
{dut}denominatie,d eː n oː m i n aː t s i,0
{dut}deo,d eː j oː,0
{dut}deportatie,d eː p ɔ r t aː t s i,0
{dut}deporteren,d eː p ɔ r t eː r ə n,0
{dut}depot,d eː p oː,0
{dut}depressief,d eː p r ɛ s i f,0
{dut}depri,d eː p r i,0
{dut}derde,d ɛ r d ə,0
{dut}deregulering,d eː r eː ɣ y l eː r ɪ ŋ,0
{dut}dergelijk,d ɛ r ɣ ə l ə k,0
{dut}derhalve,d ɛ r ɦ ɑ l v ə,0
{dut}dermate,d ɛ r m aː t ə,0
{dut}dertien,d ɛ r t i n,0
{dut}desbetreffend,d ɛ s b ə t r ɛ f ə n t,0
{dut}desgevraagd,d ɛ s x ə v r aː x t,0
{dut}desgewenst,d ɛ s x ə ʋ ɛ n s t,0
{dut}desinfecteren,d ɛ s ɪ n f ɛ k t eː r ə n,0
{dut}desiree,d eː z i r eː,0
{dut}desktop,d ɛ s k t ɔ p,0
{dut}deskundig,d ɛ s k ʏ n d ə x,0
{dut}deskundige,d ɛ s k ʏ n d ə ɣ ə,0
{dut}desnoods,d ɛ s n oː t s,0
{dut}desondanks,d ɛ s ɔ n d ɑ ŋ k s,0
{dut}desoriëntatie,d ɛ s oː r i ɛ n t aː t s i,0
{dut}desoriënteren,d ɛ z oː r i ɛ n t eː r ə n,0
{dut}destijds,d ɛ s t ɛ i̯ t s,0
{dut}detail,d eː t ɑ i̯,0
{dut}detailhandel,d eː t ɑ i̯ ɦ ɑ n d ə l,0
{dut}detecteren,d eː t ɛ k t eː r ə n,0
{dut}deugdelijk,d øː x d ə l ə k,0
{dut}deuk,d øː k,0
{dut}deuken,d øː k ə n,0
{dut}deur,d øː r,0
{dut}deurne,d øː r n ə,0
{dut}deva,d eː v aː,0
{dut}deze,d eː z ə,0
{dut}dezelfde,d ə z ɛ l f d ə,0
{dut}dezen,d eː z ə n,0
{dut}dia,d i aː,0
{dut}diabetes,d i aː b eː t ə s,0
{dut}diaconie,d i aː k oː n i,0
{dut}dialect,d i j aː l ɛ k t,0
{dut}dialectgroep,d i aː l ɛ k t x r u p,0
{dut}diamant,d i aː m ɑ n t,0
{dut}diameter,d i aː m eː t ə r,0
{dut}diarree,d i ɑ r eː,0
{dut}diastole,d i aː s t oː l ə,0
{dut}dicht,d ɪ x t,0
{dut}dichtader,d ɪ x t aː d ə r,0
{dut}dichtbij,d ɪ x t b ɛ i̯,0
{dut}dichtdoen,d ɪ x t d u n,0
{dut}dichten,d ɪ x t ə n,0
{dut}dichter,d ɪ x t ə r,0
{dut}dichteres,d ɪ x t ə r ɛ s,0
{dut}dichtheid,d ɪ x t ɦ ɛ i̯ t,0
{dut}dictator,d ɪ k t aː t ɔ r,0
{dut}dictatuur,d ɪ k t aː t yː r,0
{dut}dictee,d i k t eː,0
{dut}dieet,d i j eː t,0
{dut}dief,d i f,0
{dut}diefstal,d i f s t ɑ l,0
{dut}diegene,d i ɣ eː n ə,0
{dut}dien,d i n,0
{dut}dienaar,d i n aː r,0
{dut}dienen,d i n ə n,0
{dut}diens,d i n s,0
{dut}dienst,d i n s t,0
{dut}dienstensector,d i n s t ə n s ɛ k t ɔ r,0
{dut}dienstplicht,d i n s t p l ɪ x t,0
{dut}dienstrooster,d i n s t r oː s t ə r,0
{dut}diep,d i p,0
{dut}diepen,d i p ə n,0
{dut}diepgaand,d i p x aː n t,0
{dut}diepgang,d i p x ɑ ŋ,0
{dut}diepte,d i p t ə,0
{dut}dieptepunt,d i p t ə p ʏ n t,0
{dut}dier,d i r,0
{dut}dierbaar,d iː r b aː r,0
{dut}dierenarts,d iː r ə n ɑ r t s,0
{dut}dierenbescherming,d iː r ə n b ə s x ɛ r m ɪ ŋ,0
{dut}dierenhuid,d iː r ə n ɦ œ y̯ t,0
{dut}dierenleed,d iː r ə n l eː t,0
{dut}dierenpark,d iː r ə n p ɑ r k,0
{dut}dierenrijk,d iː r ə n r ɛ i̯ k,0
{dut}dierenwelzijn,d iː r ə n ʋ ɛ l z ɛ i̯ n,0
{dut}diergaarde,d iː r ɣ aː r d ə,0
{dut}diersoort,d iː r s oː r t,0
{dut}diesel,d i z ə l,0
{dut}digitaal,d i ɣ i t aː l,0
{dut}dijk,d ɛ i̯ k,0
{dut}dijkstra,d ɛ i̯ k s t r aː,0
{dut}dijle,d ɛ i̯ l ə,0
{dut}dik,d ɪ k,0
{dut}dikke,d ɪ k ə,0
{dut}dilemma,d i l ɛ m aː,0
{dut}dimensie,d i m ɛ n s i,0
{dut}diner,d i n eː,0
{dut}ding,d ɪ ŋ,0
{dut}dinsdag,d ɪ n s d ɑ x,0
{dut}dinsdagmorgen,d ɪ n s d ɑ x m ɔ r ɣ ə n,0
{dut}diploma,d i p l oː m aː,0
{dut}direct,d i r ɛ k t,0
{dut}directeur,d i r ɛ k t øː r,0
{dut}directie,d i r ɛ k s i,0
{dut}directrice,d i r ɛ k t r i s ə,0
{dut}dirigeren,d i r i ɣ eː r ə n,0
{dut}dirk,d ɪ r k,0
{dut}dis,d ɪ s,0
{dut}disco,d ɪ s k oː,0
{dut}discotheek,d ɪ s k oː t eː k,0
{dut}discours,d ɪ s k uː r,0
{dut}discreet,d ɪ s k r eː t,0
{dut}discretie,d ɪ s k r eː t s i,0
{dut}discriminatie,d ɪ s k r i m i n aː t s i,0
{dut}discrimineren,d ɪ s k r i m i n eː r ə n,0
{dut}discus,d ɪ s k ʏ s,0
{dut}discussie,d ɪ s k ʏ s i,0
{dut}diskette,d ɪ s k ɛ t ə,0
{dut}display,d ɪ s p l eː,0
{dut}dispuut,d ɪ s p y t,0
{dut}dissertatie,d ɪ s ɛ r t aː t s i,0
{dut}district,d ɪ s t r ɪ k t,0
{dut}dit,d ɪ t,0
{dut}diversen,d i v ɛ r z ə n,0
{dut}diversiteit,d i v ɛ r z i t ɛ i̯ t,0
{dut}divisie,d i v i z i,0
{dut}djembé,d ʒ ɛ m b eː,0
{dut}do,d oː,0
{dut}dobber,d ɔ b ə r,0
{dut}docent,d oː s ɛ n t,0
{dut}doch,d ɔ x,0
{dut}dochter,d ɔ x t ə r,0
{dut}doctor,d ɔ k t ɔ r,0
{dut}doctoraat,d ɔ k t oː r aː t,0
{dut}document,d oː k y m ɛ n t,0
{dut}documentatie,d oː k y m ɛ n t aː t s i,0
{dut}dode,d oː d ə,0
{dut}dodelijk,d oː d ə l ə k,0
{dut}doden,d oː d ə n,0
{dut}dodental,d oː d ə n t ɑ l,0
{dut}doedelzak,d u d ə l z ɑ k,0
