merged_spelling,ipa,langid
{dut}smokkelen,s m ɔ k ə l ə n,0
{dut}smullen,s m ʏ l ə n,0
{dut}smurfen,s m ʏ r f ə n,0
{dut}snaar,s n aː r,0
{dut}snavel,s n aː v ə l,0
{dut}snede,s n eː d ə,0
{dut}snee,s n eː,0
{dut}sneeuwbui,s n eː u̯ b œ y̯,0
{dut}sneeuwdek,s n eː u̯ d ɛ k,0
{dut}sneeuwgeit,s n eː u̯ ɣ ɛ i̯ t,0
{dut}sneeuwklokje,s n eː u̯ k l ɔ k j ə,0
{dut}sneeuwschuiver,s n eː u̯ s x œ y̯ v ə r,0
{dut}sneeuwwoestijn,s n eː u̯ ʋ u s t ɛ i̯ n,0
{dut}sneijder,s n ɛ i̯ d ə r,0
{dut}snelheid,s n ɛ l ɦ ɛ i̯ t,0
{dut}sneller,s n ɛ l ə r,0
{dut}snelweg,s n ɛ l ʋ ɛ x,0
{dut}sneuvelen,s n øː v ə l ə n,0
{dut}snijwond,s n ɛ i̯ ʋ ɔ n t,0
{dut}snoeien,s n u i̯ ə n,0
{dut}snoek,s n u k,0
{dut}snoepje,s n u p j ə,0
{dut}snoepreis,s n u p r ɛ i̯ s,0
{dut}snotneus,s n ɔ t n øː s,0
{dut}snuffelhond,s n ʏ f ə l ɦ ɔ n t,0
{dut}snugger,s n ʏ ɣ ə r,0
{dut}snuiven,s n œ y̯ v ə n,0
{dut}soa,s oː aː,0
{dut}soennitisch,s u n i t i s,0
{dut}soep,s u p,0
{dut}soera,s uː r aː,0
{dut}soest,s u s t,0
{dut}soeverein,s u v ə r ɛ i̯ n,0
{dut}soevereiniteit,s u v ə r ɛ i̯ n i t ɛ i̯ t,0
{dut}sok,s ɔ k,0
{dut}sokkel,s ɔ k ə l,0
{dut}sokken,s ɔ k ə n,0
{dut}sol,s ɔ l,0
{dut}soldaat,s ɔ l d aː t,0
{dut}solist,s oː l ɪ s t,0
{dut}solo,s oː l oː,0
{dut}som,s ɔ m,0
{dut}sommige,s ɔ m ə ɣ ə,0
{dut}soms,s ɔ m s,0
{dut}somtijds,s ɔ m t ɛ i̯ t s,0
{dut}sonde,s ɔ n d ə,0
{dut}soort,s oː r t,0
{dut}sop,s ɔ p,0
{dut}sorry,s ɔ r i,0
{dut}sorteren,s ɔ r t eː r ə n,0
{dut}spaanplaat,s p aː n p l aː t,0
{dut}spaans,s p aː n s,0
{dut}spaarbank,s p aː r b ɑ ŋ k,0
{dut}spaargeld,s p aː r ɣ ɛ l t,0
{dut}spaarrekening,s p aː r eː k ə n ɪ ŋ,0
{dut}span,s p ɑ n,0
{dut}spandoek,s p ɑ n d u k,0
{dut}spanje,s p ɑ n j ə,0
{dut}spannen,s p ɑ n ə n,0
{dut}spannend,s p ɑ n ə n t,0
{dut}spanningsveld,s p ɑ n ɪ ŋ s f ɛ l t,0
{dut}spar,s p ɑ r,0
{dut}speciaal,s p eː ʃ aː l,0
{dut}specialist,s p eː ʃ aː l ɪ s t,0
{dut}specie,s p eː s i,0
{dut}speech,s p i t ʃ,0
{dut}speeksel,s p eː k s ə l,0
{dut}speelgoed,s p eː l ɣ u t,0
{dut}speelster,s p eː l s t ə r,0
{dut}speeltje,s p eː l t j ə,0
{dut}speelveld,s p eː l v ɛ l t,0
{dut}spek,s p ɛ k,0
{dut}spel,s p ɛ l,0
{dut}spelen,s p eː l ə n,0
{dut}speler,s p eː l ə r,0
{dut}spellen,s p ɛ l ə n,0
{dut}spelling,s p ɛ l ɪ ŋ,0
{dut}spelt,s p ɛ l t,0
{dut}sperma,s p ɛ r m aː,0
{dut}spervuur,s p ɛ r v yː r,0
{dut}speurhond,s p øː r ɦ ɔ n t,0
{dut}spiegel,s p i ɣ ə l,0
{dut}spieken,s p i k ə n,0
{dut}spies,s p i s,0
{dut}spijker,s p ɛ i̯ k ə r,0
{dut}spijkeren,s p ɛ i̯ k ɛ r ə n,0
{dut}spin,s p ɪ n,0
{dut}spindel,s p ɪ n d ə l,0
{dut}spinnen,s p ɪ n ə n,0
{dut}spits,s p ɪ t s,0
{dut}spitsstrook,s p ɪ t s t r oː k,0
{dut}splinternieuw,s p l ɪ n t ə r n i u̯,0
{dut}spoed,s p u t,0
{dut}spoedig,s p u d ə x,0
{dut}spoel,s p u l,0
{dut}spoelbak,s p u l b ɑ k,0
{dut}spoelen,s p u l ə n,0
{dut}spokerij,s p oː k ə r ɛ i̯,0
{dut}spook,s p oː k,0
{dut}spookhuis,s p oː k ɦ œ y̯ s,0
{dut}spookstad,s p oː k s t ɑ t,0
{dut}spoor,s p oː r,0
{dut}spoorlijn,s p oː r l ɛ i̯ n,0
{dut}spoorloos,s p oː r l oː s,0
{dut}spoorslags,s p oː r s l ɑ x s,0
{dut}spoorweg,s p oː r ʋ ɛ x,0
{dut}sporen,s p oː r ə n,0
{dut}sport,s p ɔ r t,0
{dut}sporten,s p ɔ r t ə n,0
{dut}spot,s p ɔ t,0
{dut}spraak,s p r aː k,0
{dut}spraakwaterval,s p r aː k ʋ aː t ə r v ɑ l,0
{dut}sprak,s p r ɑ k,0
{dut}spray,s p r eː,0
{dut}spreek,s p r eː k,0
{dut}spreekbeurt,s p r eː k b øː r t,0
{dut}spreekkamer,s p r eː k aː m ə r,0
{dut}spreekt,s p r eː k t,0
{dut}spreektaal,s p r eː k t aː l,0
{dut}spreekuur,s p r eː k yː r,0
{dut}spreekwoord,s p r eː k ʋ oː r t,0
{dut}spreken,s p r eː k ə n,0
{dut}spreuk,s p r øː k,0
{dut}spreuken,s p r øː k ə n,0
{dut}spring,s p r ɪ ŋ,0
{dut}springen,s p r ɪ ŋ ə n,0
{dut}springkussen,s p r ɪ ŋ k ʏ s ə n,0
{dut}springplank,s p r ɪ ŋ p l ɑ ŋ k,0
{dut}springt,s p r ɪ ŋ t,0
{dut}springvorm,s p r ɪ ŋ v ɔ r m,0
{dut}sprinten,s p r ɪ n t ə n,0
{dut}sproeien,s p r u i̯ ə n,0
{dut}sprong,s p r ɔ ŋ,0
{dut}sprookje,s p r oː k j ə,0
{dut}spruit,s p r œ y̯ t,0
{dut}spruiten,s p r œ y̯ t ə n,0
{dut}spuit,s p œ y̯ t,0
{dut}spuiten,s p œ y̯ t ə n,0
{dut}spul,s p ʏ l,0
{dut}srebrenica,s r ɛ b r eː n i t s aː,0
{dut}staafmixer,s t aː f m ɪ k s ə r,0
{dut}staal,s t aː l,0
{dut}staan,s t aː n,0
{dut}staart,s t aː r t,0
{dut}staat,s t aː t,0
{dut}staatkundig,s t aː t k ʏ n d ə x,0
{dut}staats,s t aː t s,0
{dut}staatsbedrijf,s t aː t s b ə d r ɛ i̯ f,0
{dut}staatsbezoek,s t aː t s b ə z u k,0
{dut}staatsgevaarlijk,s t aː t s x ə v aː r l ə k,0
{dut}staatsgreep,s t aː t s x r eː p,0
{dut}staatshoofd,s t aː t s ɦ oː f t,0
{dut}staatspensioen,s t aː t s p ɛ n ʃ u n,0
{dut}staatsschuld,s t aː t s x ʏ l t,0
{dut}staatssecretaris,s t aː t s eː k r ə t aː r ɪ s,0
{dut}stabiel,s t aː b i l,0
{dut}stad,s t ɑ t,0
{dut}stadhouder,s t ɑ t ɦ ɑ u̯ d ə r,0
{dut}stadhuis,s t ɑ t ɦ œ y̯ s,0
{dut}stadsbus,s t ɑ t s b ʏ s,0
{dut}stadscentrum,s t ɑ t s ɛ n t r ʏ m,0
{dut}stadsgezicht,s t ɑ t s x ə z ɪ x t,0
{dut}stadskern,s t ɑ t s k ɛ r n,0
{dut}stadsmuur,s t ɑ t s m yː r,0
{dut}stagiair,s t aː ʒ ɛː r,0
{dut}staken,s t aː k ə n,0
{dut}staking,s t aː k ɪ ŋ,0
{dut}stalen,s t aː l ə n,0
{dut}stam,s t ɑ m,0
{dut}stamboek,s t ɑ m b u k,0
{dut}stamboom,s t ɑ m b oː m,0
{dut}stamhoofd,s t ɑ m ɦ oː f t,0
{dut}stammen,s t ɑ m ə n,0
{dut}stampvol,s t ɑ m p v ɔ l,0
{dut}stamvader,s t ɑ m v aː d ə r,0
{dut}standaard,s t ɑ n d aː r t,0
{dut}standaardwerk,s t ɑ n d aː r t ʋ ɛ r k,0
{dut}standplaats,s t ɑ n d p l a t s,0
{dut}standpunt,s t ɑ n t p ʏ n t,0
{dut}standvastig,s t ɑ n t v ɑ s t i ɡ ə x,0
{dut}stapel,s t aː p ə l,0
{dut}stapelgek,s t aː p ə l ɣ ɛ k,0
{dut}start,s t ɑ r t,0
{dut}starter,s t ɑ r t ə r,0
{dut}startsein,s t ɑ r t s ɛ i̯ n,0
{dut}statief,s t aː t i f,0
{dut}station,s t aː ʃ ɔ n,0
{dut}statuut,s t aː t y t,0
{dut}stavoren,s t aː v oː r ə n,0
{dut}steden,s t eː d ə n,0
{dut}steeg,s t eː x,0
{dut}steek,s t eː k,0
{dut}steel,s t eː l,0
{dut}steen,s t eː n,0
{dut}steenkool,s t eː n k oː l,0
{dut}steenwijk,s t eː n ʋ ɛ i̯ k,0
{dut}stek,s t ɛ k,0
{dut}stekel,s t eː k ə l,0
{dut}stekelhuidige,s t eː k ə l ɦ œ y̯ d ə ɣ ə,0
{dut}steken,s t eː k ə n,0
{dut}stekker,s t ɛ k ə r,0
{dut}stelen,s t eː l ə n,0
{dut}stellen,s t ɛ l ə n,0
{dut}stelling,s t ɛ l ɪ ŋ,0
{dut}stem,s t ɛ m,0
{dut}stembus,s t ɛ m b ʏ s,0
{dut}stemhok,s t ɛ m ɦ ɔ k,0
{dut}stemmen,s t ɛ m ə n,0
{dut}stemming,s t ɛ m ɪ ŋ,0
{dut}stemt,s t ɛ m t,0
{dut}stemwijzer,s t ɛ m ʋ ɛ i̯ z ə r,0
{dut}stengel,s t ɛ ŋ ə l,0
{dut}step,s t ɛ p,0
{dut}ster,s t ɛ r,0
{dut}sterfbed,s t ɛ r f b ɛ t,0
{dut}sterfdag,s t ɛ r f d ɑ x,0
{dut}sterfte,s t ɛ r f t ə,0
{dut}sterk,s t ɛ r k,0
{dut}sterren,s t ɛ r ə n,0
{dut}sterrenkunde,s t ɛ r ə n k ʏ n d ə,0
{dut}sterven,s t ɛ r v ə n,0
{dut}steunen,s t øː n ə n,0
{dut}steven,s t eː v ə n,0
{dut}stevens,s t eː v ə n s,0
{dut}stiekem,s t i k ə m,0
{dut}stier,s t iː r,0
{dut}stijgen,s t ɛ i̯ ɣ ə n,0
{dut}stijn,s t ɛ i̯ n,0
{dut}stijve,s t ɛ i v ə,0
{dut}stilleven,s t ɪ l l eː v ə n,0
{dut}stilstand,s t ɪ l s t ɑ n t,0
{dut}stilte,k ɪ l t ə,0
{dut}stilzwijgen,s t ɪ l z ʋ ɛ i̯ ɣ ə n,0
{dut}stimulans,s t i m y l ɑ n s,0
{dut}stins,s t ɪ n s,0
{dut}stockholm,s t ɔ k ɦ ɔ l m,0
{dut}stoel,s t u l,0
{dut}stoelen,s t u l ə n,0
{dut}stoep,s t u p,0
{dut}stoepa,s t u p aː,0
{dut}stoeterij,s t u t ə r ɛ i̯,0
{dut}stof,s t ɔ f,0
{dut}stoffen,s t ɔ f ə n,0
{dut}stofvrij,s t ɔ f r ɛ i̯,0
{dut}stofwisseling,s t ɔ f ʋ ɪ s ə l ɪ ŋ,0
{dut}stofwolk,s t ɔ f ʋ ɔ l k,0
{dut}stofzuiger,s t ɔ f s œ y̯ ɣ ə r,0
{dut}stok,s t ɔ k,0
{dut}stokbrood,s t ɔ k b r oː t,0
{dut}stoken,s t oː k ə n,0
{dut}stol,s t ɔ l,0
{dut}stollen,s t ɔ l ə n,0
{dut}stom,s t ɔ m,0
{dut}stomen,s t oː m ə n,0
{dut}stomerij,s t oː m ə r ɛ i̯,0
{dut}stomp,s t ɔ m p,0
{dut}stond,s t ɔ n t,0
{dut}stookolie,s t oː k oː l i,0
{dut}stoom,s t oː m,0
{dut}stoombad,s t oː m b ɑ t,0
{dut}stoomboot,s t oː m b oː t,0
{dut}stoomgemaal,s t oː m ɣ ə m aː l,0
{dut}stoomturbine,s t oː m t ʏ r b i n ə,0
{dut}stop,s t ɔ p,0
{dut}stopcontact,s t ɔ p k ɔ n t ɑ k t,0
{dut}stoplicht,s t ɔ p l ɪ x t,0
{dut}storen,s t oː r ə n,0
{dut}storing,s t oː r ɪ ŋ,0
{dut}stork,s t ɔ r k,0
{dut}storm,s t ɔ r m,0
{dut}stormachtig,s t ɔ r m ɑ x t ə x,0
{dut}stormbandpinguïn,s t ɔ r m b ɑ n t p ɪ ŋ ɡ ʋ ɪ n,0
{dut}stort,s t ɔ r t,0
{dut}storten,s t ɔ r t ə n,0
{dut}storting,s t ɔ r t ɪ ŋ,0
{dut}stoten,s t oː t ə n,0
{dut}stout,s t ɑ u̯ t,0
{dut}straaljager,s t r aː l j aː ɣ ə r,0
{dut}straalvinnige,s t r aː l v ɪ n ə ɣ ə,0
{dut}straat,s t r aː t,0
{dut}straatnaam,s t r aː t n aː m,0
{dut}straatsburg,s t r aː t s b ʏ r x,0
{dut}strafbaar,s t r ɑ f b aː r,0
{dut}straffen,s t r ɑ f ə n,0
{dut}strafkamp,s t r ɑ f k ɑ m p,0
{dut}strafrecht,s t r ɑ f r ɛ x t,0
{dut}strafschop,s t r ɑ f s x ɔ p,0
{dut}strafstudie,s t r ɑ f s t y d i,0
{dut}strak,s t r ɑ k,0
{dut}stralen,s t r aː l ə n,0
{dut}strandpaviljoen,s t r ɑ n t p aː v ɪ l j u n,0
{dut}stream,s t r iː m,0
{dut}streek,s t r eː k,0
{dut}streep,s t r eː p,0
{dut}strekken,s t r ɛ k ə n,0
{dut}streng,s t r ɛ ŋ,0
{dut}strepen,s t r eː p ə n,0
{dut}streven,s t r eː v ə n,0
{dut}striep,s t r i p,0
{dut}strijden,s t r ɛ i̯ d ə n,0
{dut}strijdtoneel,s t r ɛ i̯ t oː n eː l,0
{dut}strijken,s t r ɛ i̯ k ə n,0
{dut}stripboek,s t r ɪ p b u k,0
{dut}stripfiguur,s t r ɪ p f i ɣ yː r,0
{dut}strippenkaart,s t r ɪ p ə n k aː r t,0
{dut}stromen,s t r oː m ə n,0
{dut}stront,s t r ɔ n t,0
{dut}strontium,s t r ɔ n t s i ʏ m,0
{dut}strooien,s t r oː i̯ ə n,0
{dut}strook,s t r oː k,0
{dut}stroom,s t r oː m,0
{dut}stroop,s t r oː p,0
{dut}strop,s t r ɔ p,0
{dut}stropen,s t r oː p ə n,0
{dut}stropop,s t r oː p ɔ p,0
{dut}strot,s t r ɔ t,0
{dut}structuur,s t r ʏ k t y r,0
{dut}struikelen,s t r œ y̯ k ə l ə n,0
{dut}studeerkamer,s t y d eː r k aː m ə r,0
{dut}studeren,s t y d eː r ə n,0
{dut}studie,s t y d i,0
{dut}studio,s t y d i oː,0
{dut}stug,s t ʏ x,0
{dut}stuifsneeuw,s t œ y̯ f s n eː u̯,0
{dut}stuk,s t ʏ k,0
{dut}sturen,s t y r ə n,0
{dut}stuur,s t y r,0
{dut}stuurbekrachtiging,s t yː r b ə k r ɑ x t ə ɣ ɪ ŋ,0
{dut}stuurhut,s t yː r ɦ ʏ t,0
{dut}stuurwiel,s t yː r ʋ i l,0
{dut}stylus,s t i l ʏ s,0
{dut}substantie,s ʏ b s t ɑ n s i,0
{dut}sudderen,s ʏ d ə r ə n,0
{dut}sufferd,s ʏ f ə r t,0
{dut}suiker,s œ y̯ k ə r,0
{dut}suikerpatiënt,s œ y̯ k ə r p aː ʃ ɛ n t,0
{dut}suikerziekte,s œ y̯ k ə r z i k t ə,0
{dut}sultan,s ʏ l t ɑ n,0
{dut}sumatra,s y m aː t r aː,0
{dut}superheld,s y p ə r ɦ ɛ l t,0
{dut}superieur,s y p eː r i øː r,0
{dut}supermarkt,s y p ə r m ɑ r k t,0
{dut}supplement,s ʏ p l ə m ɛ n t,0
{dut}suppletie,s ʏ p l eː t s i,0
{dut}supporter,s ʏ p ɔ r t ə r,0
{dut}supporters,s ʏ p ɔ r t ə r s,0
{dut}surinaams,s y r i n aː m s,0
{dut}suriname,s y r i n aː m ə,0
{dut}surinamer,s y r i n aː m ə r,0
{dut}surprise,s ʏ r p r iː z ə,0
{dut}sushi,s u ʃ i,0
{dut}suspensie,s ʏ s p ɛ n s i,0
{dut}sven,s ʋ ɛ n,0
{dut}swingen,s ʋ ɪ ŋ ə n,0
{dut}symboliek,s ɪ m b oː l i k,0
{dut}symbool,s ɪ m b oː l,0
{dut}synagoge,s i n aː ɣ oː ɣ ə,0
{dut}syndroom,s ɪ n d r oː m,0
{dut}synthese,s ɪ n t eː z ə,0
{dut}synthetisch,s ɪ n t eː t i s,0
{dut}syrinx,s iː r ɪ ŋ k s,0
{dut}taak,t aː k,0
{dut}taakstraf,t aː k s t r ɑ f,0
{dut}taal,t aː l,0
{dut}taalfilosofie,t aː l f i l oː s oː f i,0
{dut}taalgebied,t aː l ɣ ə b i t,0
{dut}taalgrens,t aː l ɣ r ɛ n s,0
{dut}taalwetenschap,t aː l ʋ eː t ə n s x ɑ p,0
{dut}tabak,t aː b ɑ k,0
{dut}tabblad,t ɑ b l ɑ t,0
{dut}tabel,t aː b ɛ l,0
{dut}taboe,t aː b u,0
{dut}tachtig,t ɑ x t ə x,0
{dut}tafel,t aː f ə l,0
{dut}tafeltennis,t aː f ə l t ɛ n ɪ s,0
{dut}tafelzilver,t aː f ə l z ɪ l v ə r,0
{dut}taille,t ɑ j ə,0
{dut}tak,t ɑ k,0
{dut}taken,t aː k ə n,0
{dut}taks,t ɑ k s,0
{dut}talen,t aː l ə n,0
{dut}talent,t aː l ɛ n t,0
{dut}tam,t ɑ m,0
{dut}tamboer,t ɑ m b uː r,0
{dut}tamelijk,t aː m ə l ə k,0
{dut}tamil,t aː m i l,0
{dut}tand,t ɑ n t,0
{dut}tandarts,t ɑ n d ɑ r t s,0
{dut}tandem,t ɑ n d ɛ m,0
{dut}tanden,t ɑ n d ə n,0
{dut}tandheelkunde,t ɑ n t ɦ eː l k ʏ n d ə,0
{dut}tandpasta,t ɑ n t p ɑ s t aː,0
{dut}tandplak,t ɑ n t p l ɑ k,0
{dut}tandsteen,t ɑ n t s t eː n,0
{dut}tandvlees,t ɑ n t f l eː s,0
{dut}tang,t ɑ ŋ,0
{dut}tango,t ɑ ŋ ɡ oː,0
{dut}tanker,t ɛ ŋ k ə r,0
{dut}tante,t ɑ n t ə,0
{dut}tap,t ɑ p,0
{dut}tapijt,t aː p ɛ i̯ t,0
{dut}tapir,t aː p i r,0
{dut}tarief,t aː r i f,0
{dut}tas,t ɑ s,0
{dut}tatoeëren,t ɑ t u eː r ə n,0
{dut}taugé,t ɑ u̯ ɡ eː,0
{dut}taxi,t ɑ k s i,0
{dut}te,t ə,0
{dut}team,t iː m,0
{dut}teamwerk,t iː m ʋ ɛ r k,0
{dut}technicus,t ɛ x n i k ʏ s,0
{dut}teef,t eː f,0
{dut}teelt,t eː l t,0
{dut}teen,t eː n,0
{dut}tegelen,t eː ɣ ə l ə n,0
{dut}tegen,t eː ɣ ə n,0
{dut}tegenaan,t eː ɣ ə n aː n,0
{dut}tegenaanval,t eː ɣ ə n aː n v ɑ l,0
{dut}tegengif,t eː ɣ ə n ɣ ɪ f,0
{dut}tegenover,t eː ɣ ə n oː v ə r,0
{dut}tegenovergestelde,t eː ɣ ə n oː v ə r ɣ ə s t ɛ l d ə,0
{dut}tegenpartij,t eː ɣ ə n p ɑ r t ɛ i̯,0
{dut}tegenspeler,t eː ɣ ə n s p eː l ə r,0
{dut}tegenspoed,t eː ɣ ə n s p u t,0
{dut}tegenwerpen,t eː ɣ ə n ʋ ɛ r p ə n,0
{dut}tegenwicht,t eː ɣ ə n ʋ ɪ x t,0
{dut}tehuis,t ə ɦ œ y̯ s,0
{dut}tekenaar,t eː k ə n aː r,0
{dut}tekenen,t eː k ə n ə n,0
{dut}tekenfilm,t eː k ə n f ɪ l m,0
{dut}tekort,t ə k ɔ r t,0
{dut}tekst,t ɛ k s t,0
{dut}telefonisch,t eː l ə f oː n i s,0
{dut}telefoon,t eː l ə f oː n,0
{dut}telefoongesprek,t eː l ə f oː n ɣ ə s p r ɛ k,0
{dut}telefoongids,t eː l ə f oː n ɣ ɪ t s,0
{dut}telefoonnummer,t eː l ə f oː n ʏ m ə r,0
{dut}telegraaf,t eː l ə ɣ r aː f,0
{dut}telegram,t eː l ə ɡ r ɑ m,0
{dut}telen,t eː l ə n,0
{dut}teletekst,t eː l ə t ɛ k s t,0
{dut}teleurstellen,t ə l øː r s t ɛ l ə n,0
{dut}televisie,t eː l ə v i z i,0
{dut}telg,t ɛ l x,0
{dut}tempel,t ɛ m p ə l,0
{dut}tempelman,t ɛ m p ə l m ɑ n,0
{dut}temperatuur,t ɛ m p ə r aː t yː r,0
{dut}ten,t ɛ n,0
{dut}tenach,t ə n ɑ x,0
{dut}teneinde,t ɛ n ɛ i̯ n d ə,0
{dut}tenen,t eː n ə n,0
{dut}tennis,t ɛ n ə s,0
{dut}tennisbaan,t ɛ n ə s b aː n,0
{dut}tennissen,t ɛ n ɪ s ə n,0
{dut}tennisser,t ɛ n ɪ s ə r,0
{dut}tent,t ɛ n t,0
{dut}tepel,t eː p ə l,0
{dut}terdege,t ɛ r d eː ɣ ə,0
{dut}terechtstelling,t ə r ɛ x t s t ɛ l ɪ ŋ,0
{dut}terloops,t ɛ r l oː p s,0
{dut}termen,t ɛ r m ə n,0
{dut}territorium,t ɛ r ɪ t oː r i ʏ m,0
{dut}terrorisme,t ɛ r ɔ r ɪ s m ə,0
{dut}terschelling,t ɛ r s x ɛ l ɪ ŋ,0
{dut}teruggaan,t ə r ʏ x aː n,0
{dut}test,t ɛ s t,0
{dut}testament,t ɛ s t a m ɛ n t,0
{dut}teug,t øː x,0
{dut}teun,t øː n,0
{dut}teveel,t ə v eː l,0
{dut}teweegbrengen,t ə ʋ eː x b r ɛ ŋ ə n,0
{dut}texas,t ɛ k s ɑ s,0
{dut}texel,t ɛ s ə l,0
{dut}thai,t ɑ i̯,0
{dut}thailand,t ɑ i l ɑ n t,0
{dut}thans,t ɑ n s,0
{dut}theater,t eː j aː t ə r,0
{dut}thee,t eː,0
{dut}theetuin,t eː t œ y̯ n,0
{dut}theo,t eː j oː,0
{dut}theorie,t eː oː r i,0
{dut}thermodynamisch,t ɛ r m oː d i n aː m i s,0
{dut}thomas,t oː m ɑ s,0
{dut}thorn,t ɔ r n,0
{dut}thuis,t œ y̯ s,0
{dut}thuisfront,t œ y̯ s f r ɔ n t,0
{dut}thuisgevoel,t œ y̯ s x ə v u l,0
{dut}thuiskomst,t œ y̯ s k ɔ m s t,0
{dut}ticket,t ɪ k ə t,0
{dut}tiel,t i l,0
{dut}tien,t i n,0
{dut}tiende,t i n d ə,0
{dut}tienjarig,t i n j aː r ə x,0
{dut}tij,t ɛ i̯,0
{dut}tijd,t ɛ i̯ t,0
{dut}tijdens,t ɛ i̯ d ə n s,0
{dut}tijdgenoot,t ɛ i̯ t x ə n oː t,0
{dut}tijdperk,t ɛ i̯ t p ɛ r k,0
{dut}tijdschema,t ɛ i̯ t s x eː m aː,0
{dut}tijdschrift,t ɛ i̯ t s x r ɪ f t,0
{dut}tijdsduur,t ɛ i̯ t s d yː r,0
{dut}tijdstip,t ɛ i̯ t s t ɪ p,0
{dut}tikken,t ɪ k ə n,0
{dut}tilburg,t ɪ l b ʏ r x,0
{dut}tim,t ɪ m,0
{dut}timing,t ɑ i̯ m ɪ ŋ,0
{dut}timmer,t ɪ m ə r,0
{dut}timmeren,t ɪ m ə r ə n,0
{dut}timmerman,t ɪ m ə r m ɑ n,0
{dut}tin,t ɪ n,0
{dut}tintelfris,t ɪ n t ə l f r ɪ s,0
{dut}tobben,t ɔ b ə n,0
{dut}toch,t ɔ x,0
{dut}tocht,t ɔ x t,0
{dut}tochtgenoot,t ɔ x t x ə n oː t,0
{dut}toe,t u,0
{dut}toekan,t u k ɑ n,0
{dut}toekomst,t u k ɔ m s t,0
{dut}toekomstige,t u k ɔ m s t ə ɣ ə,0
{dut}toendra,t u n d r aː,0
{dut}toenemen,t u n eː m ə n,0
{dut}toeren,t uː r ə n,0
{dut}toerisme,t u r ɪ s m ə,0
{dut}toerist,t u r ɪ s t,0
{dut}toeslaan,t u s l aː n,0
{dut}toeslag,t u s l ɑ x,0
{dut}toespraak,t u s p r aː k,0
{dut}toetreding,t u t r eː d ɪ ŋ,0
{dut}toets,t u t s,0
{dut}toetsenbord,t u t s ə n b ɔ r t,0
{dut}toeval,t uː v ɑ l,0
{dut}toeven,t u v ə n,0
{dut}toevlucht,t u v l ʏ x t,0
{dut}toevluchtsoord,t u v l ʏ x t s oː r t,0
{dut}toevoegen,t u v u ɣ ə n,0
{dut}toewijding,t u ʋ ɛ i̯ d ɪ ŋ,0
{dut}toezicht,t u z ɪ x t,0
{dut}toilet,t ʋ aː l ɛ t,0
{dut}tokio,t oː k i j oː,0
{dut}toko,t oː k oː,0
{dut}tol,t ɔ l,0
{dut}tolheffing,t ɔ l ɦ ɛ f ɪ ŋ,0
{dut}tolhuis,t ɔ l ɦ œ y̯ s,0
{dut}tolken,t ɔ l k ə n,0
{dut}tolweg,t ɔ l ʋ ɛ x,0
{dut}tomaat,t oː m aː t,0
{dut}tomatensaus,t oː m aː t ə n s ɑ u̯ s,0
{dut}ton,t ɔ n,0
{dut}toneel,t oː n eː l,0
{dut}toneelspeler,t oː n eː l s p eː l ə r,0
{dut}tonen,t oː n ə n,0
{dut}tong,t ɔ ŋ,0
{dut}tongen,t ɔ ŋ ə n,0
{dut}toog,t oː x,0
{dut}tool,t uː l,0
{dut}toon,t oː n,0
{dut}toonbank,t oː n b ɑ ŋ k,0
{dut}toonbeeld,t oː n b eː l t,0
{dut}toonsoort,t oː n s oː r t,0
{dut}topless,t ɔ p l ə s,0
{dut}topman,t ɔ p m ɑ n,0
{dut}topoi,t o p ɔ ɪ,0
{dut}topper,t ɔ p ə r,0
{dut}topprioriteit,t ɔ p p r i oː r i t ɛ i̯ t,0
{dut}topscoorder,t ɔ p s k oː r d ə r,0
{dut}tora,t oː r aː,0
{dut}torsen,t ɔ r s ə n,0
{dut}tosti,t ɔ s t i,0
{dut}tot,t ɔ t,0
{dut}totdat,t ɔ t d ɑ t,0
{dut}touw,t ɑ u̯,0
{dut}toveren,t oː v ə r ə n,0
{dut}toverspreuk,t oː v ə r s p r øː k,0
{dut}traag,t r aː x,0
{dut}trachten,t r ɑ x t ə n,0
{dut}traditie,t r aː d i t s i,0
{dut}traditiegetrouw,t r aː d i t s i ɣ ə t r ɑ u̯,0
{dut}tragisch,t r aː ɣ i s,0
{dut}tragische,t r aː ɣ i s ə,0
{dut}training,t r eː n ɪ ŋ,0
{dut}transformatie,t r ɑ n s f ɔ r m aː t s i,0
{dut}trap,t r ɑ p,0
{dut}trappen,t r ɑ p ə n,0
{dut}trechter,t r ɛ x t ə r,0
{dut}trede,t r eː d ə,0
{dut}treden,t r eː d ə n,0
{dut}tree,t r eː,0
{dut}treffen,t r ɛ f ə n,0
{dut}treffer,t r ɛ f ə r,0
{dut}trein,t r ɛ i̯ n,0
{dut}trek,t r ɛ k,0
{dut}trekhaak,t r ɛ k ɦ aː k,0
{dut}trend,t r ɛ n t,0
{dut}treur,t r øː r,0
{dut}trijntje,t r ɛ i̯ n j t j ə,0
{dut}trillen,t r ɪ l ə n,0
{dut}trilling,t r ɪ l ɪ ŋ,0
{dut}triton,t r i t ɔ n,0
{dut}troef,t r u f,0
{dut}troep,t r u p,0
{dut}troeteldier,t r u t ə l d iː r,0
{dut}trok,t r ɔ k,0
{dut}trollen,t r ɔ l ə n,0
{dut}trombone,t r ɔ m b ɔː n ə,0
{dut}trombose,t r ɔ m b oː z ə,0
{dut}tromp,t r ɔ m p,0
{dut}trompet,t r ɔ m p ɛ t,0
{dut}trompetter,t r ɔ m p ɛ t ə r,0
{dut}troon,t r oː n,0
{dut}troonsafstand,t r oː n s ɑ f s t ɑ n t,0
{dut}troost,t r oː s t,0
{dut}trossen,t r ɔ s ə n,0
{dut}trouw,t r ɑ u̯,0
{dut}trouwen,t r ɑ u̯ ə n,0
{dut}truc,t r y k,0
{dut}trui,t r œ y̯,0
{dut}tsaar,t s aː r,0
{dut}tsarina,t s aː r i n aː,0
{dut}tsjechië,t ʃ ɛ x i j ə,0
{dut}tsunami,t s u n aː m i,0
{dut}tuig,t œ y̯ x,0
{dut}tuigleer,t œ y̯ x l eː r,0
{dut}tuinbouw,t œ y̯ n b ɑ u̯,0
{dut}tuinen,t œ y̯ n ə n,0
{dut}tuinkers,t œ y̯ ŋ k ɛ r s,0
{dut}tuinman,t œ y̯ n m ɑ n,0
{dut}tulp,t ʏ l p,0
{dut}tumor,t y m ɔ r,0
{dut}tuniek,t y n i k,0
{dut}tunnel,t ʏ n ə l,0
{dut}turbulentie,t ʏ r b y l ɛ n s i,0
{dut}tureluur,t yː r ə l yː r,0
{dut}turijn,t y r ɛ i̯ n,0
{dut}tussen,t ʏ s ə n,0
{dut}tussenruimtetjes,t ʏ s ə n r œ y̯ m t ə t j ə s,0
{dut}tussenstop,t ʏ s ə n s t ɔ p,0
{dut}twaalf,t ʋ aː l ə f,0
{dut}twaalfde,t ʋ aː l f d ə,0
{dut}twee,t ʋ eː,0
{dut}tweede,t ʋ eː d ə,0
{dut}tweedejaars,t ʋ eː d ə j aː r s,0
{dut}tweehonderd,t ʋ eː ɦ ɔ n d ə r t,0
{dut}tweepersoonsbed,t ʋ eː p ɛ r s oː n s b ɛ t,0
{dut}twente,t ʋ ɛ n t ə,0
{dut}twijfel,t ʋ ɛ i̯ f ə l,0
{dut}twijfelen,t ʋ ɛ i̯ f ə l ə n,0
{dut}twintig,t ʋ ɪ n t ə x,0
{dut}twintigste,t ʋ ɪ n t ə x s t ə,0
{dut}twisten,t ʋ ɪ s t ə n,0
{dut}typen,t i p ə n,0
{dut}typesoort,t i p ə s oː r t,0
{dut}typisch,t i p i s,0
{dut}ui,œ y̯,0
{dut}uil,œ y̯ l,0
{dut}uit,œ y̯ t,0
{dut}uitbarsting,œ y̯ t b ɑ r s t ɪ ŋ,0
{dut}uitblijven,œ y̯ d b l ɛ i̯ v ə n,0
{dut}uitbraak,œ y̯ t b r aː k,0
{dut}uitbreiding,œ y̯ t b r ɛ i̯ d ɪ ŋ,0
{dut}uitbreidingspakket,œ y̯ t b r ɛ i̯ d ɪ ŋ s p ɑ k ɛ t,0
{dut}uitbuiten,œ y̯ t b œ y̯ t ə n,0
{dut}uitbuiting,œ y̯ t b œ y̯ t ɪ ŋ,0
{dut}uitdaging,œ y̯ t d aː ɣ ɪ ŋ,0
{dut}uitdragen,œ y̯ d r aː ɣ ə n,0
{dut}uitdrukken,œ y̯ d r ʏ k ə n,0
{dut}uitdrukking,œ y̯ t d r ʏ k ɪ ŋ,0
{dut}uitdunnen,œ y̯ d ʏ n ə n,0
{dut}uiterst,œ y̯ t ə r s t,0
{dut}uiterwaard,œ y̯ t ə r ʋ aː r t,0
{dut}uitgebaat,œ y̯ t x ə b aː t,0
{dut}uitgedrukt,œ y̯ t x ə d r ʏ k t,0
{dut}uitgekookt,œ y̯ t x ə k oː k t,0
{dut}uitgeleverd,œ y̯ t x ə l eː v ə r t,0
{dut}uitgescheiden,œ y̯ t x ə s x ɛ i̯ d ə n,0
{dut}uitgesproken,œ y̯ t x ə s p r oː k ə n,0
{dut}uitgestoken,œ y̯ t x ə s t oː k ə n,0
{dut}uitgeven,œ y̯ t ɣ eː v ə n,0
{dut}uitgever,œ y̯ t x eː v ə r,0
{dut}uitgeverij,œ y̯ t x eː v ə r ɛ i̯,0
{dut}uitgezet,œ y̯ t x ə z ɛ t,0
{dut}uitgroeien,œ y̯ t ɣ r u i̯ ə n,0
{dut}uithangbord,œ y̯ t ɦ ɑ ŋ b ɔ r t,0
{dut}uithoek,œ y̯ t ɦ u k,0
{dut}uiting,œ y̯ t ɪ ŋ,0
{dut}uitkering,œ y̯ t k eː r ɪ ŋ,0
{dut}uitkijk,œ y̯ t k ɛ i̯ k,0
{dut}uitkomen,œ y̯ t k oː m ə n,0
{dut}uitkomst,œ y̯ t k ɔ m s t,0
{dut}uitleg,œ y̯ t l ɛ x,0
{dut}uitleggen,œ y̯ t l ɛ ɣ ə n,0
{dut}uitloper,œ y̯ t l oː p ə r,0
{dut}uitmaken,œ y̯ t m aː k ə n,0
{dut}uitnodiging,œ y̯ t n oː d ə ɣ ɪ ŋ,0
{dut}uitpakken,œ y̯ t p ɑ k ə n,0
{dut}uitrekenen,œ y̯ t r eː k ə n ə n,0
{dut}uitscheiden,œ y̯ t s x ɛ i̯ d ə n,0
{dut}uitslag,œ y̯ t s l ɑ x,0
{dut}uitspraak,œ y̯ t s p r aː k,0
{dut}uitstapje,œ y̯ t s t ɑ p j ə,0
{dut}uitstekende,œ y̯ t s t eː k ə n d ə,0
{dut}uitstel,œ y̯ t s t ɛ l,0
{dut}uitte,œ y̯ t ə,0
{dut}uitvechten,œ y̯ t f ɛ x t ə n,0
{dut}uitvergroot,œ y̯ t f ə r ɣ r oː t,0
{dut}uitverkocht,œ y̯ t f ə r k ɔ x t,0
{dut}uitverkoop,œ y̯ t f ə r k oː p,0
{dut}uitzichtloos,œ y̯ t z ɪ x t l oː s,0
{dut}uitzien,œ y̯ t s i n,0
{dut}uitzitten,œ y̯ t s ɪ t ə n,0
{dut}uitzondering,œ y̯ t s ɔ n d ə r ɪ ŋ,0
{dut}ultimatum,ʏ l t i m aː t ʏ m,0
{dut}unaniem,y n aː n i m,0
{dut}unie,y n i,0
{dut}uniform,y n i f ɔ r m,0
{dut}universeel,y n i v ɛ r z eː l,0
{dut}universitair,y n i v ɛ r z i t ɛː r,0
{dut}universiteit,y n i v ɛ r z i t ɛ i̯ t,0
{dut}universiteitsbibliotheek,y n i v ɛ r z i t ɛ i̯ t s b i b l i oː t eː k,0
{dut}universiteitsstad,y n i v ɛ r z i t ɛ i̯ t s t ɑ t,0
{dut}universum,y n i v ɛ r z ʏ m,0
{dut}update,ʏ p d eː t,0
{dut}updaten,ʏ p d eː t ə n,0
{dut}upgrade,ʏ p ɡ r ɛ i̯ t,0
{dut}upgraden,ʏ p ɡ r eː d ə n,0
{dut}upload,ʏ p l oː t,0
{dut}uploaden,ʏ p l oː d ə n,0
{dut}uranium,y r aː n i ʏ m,0
{dut}uren,y r ə n,0
{dut}urenlang,yː r ə n l ɑ ŋ,0
{dut}urine,y r i n ə,0
{dut}uur,y r,0
{dut}uva,y v aː,0
{dut}uw,y u̯,0
{dut}uwe,y u̯ ə,0
{dut}vaag,v aː x,0
{dut}vaak,v aː k,0
{dut}vaal,v aː l,0
{dut}vaardig,v aː r d ə x,0
{dut}vaart,v aː r t,0
{dut}vaarwel,v aː r ʋ ɛ l,0
{dut}vaas,v aː s,0
{dut}vaatwasser,v aː t ʋ ɑ s ə r,0
{dut}vacht,v ɑ x t,0
{dut}vader,v aː d ə r,0
{dut}vaderland,v aː d ə r l ɑ n t,0
{dut}vadermoord,v aː d ə r m oː r t,0
{dut}vagina,v aː ɣ i n aː,0
{dut}vak,v ɑ k,0
{dut}vakantie,v aː k ɑ n t s i,0
{dut}vakantieganger,v aː k ɑ n t s i ɣ ɑ ŋ ə r,0
{dut}vakantiehuis,v aː k ɑ n t s i ɦ œ y̯ s,0
{dut}vakbond,v ɑ k b ɔ n t,0
{dut}vakgebied,v ɑ k x ə b i t,0
{dut}vakkenvuller,v ɑ k ə n v ʏ l ə r,0
{dut}vakman,v ɑ k m ɑ n,0
{dut}vakmanschap,v ɑ k m ɑ n s x ɑ p,0
{dut}val,v ɑ l,0
{dut}valk,v ɑ l k,0
{dut}vallen,v ɑ l ə n,0
{dut}valt,v ɑ l t,0
{dut}valuta,v aː l y t aː,0
{dut}van,v ɑ n,0
{dut}vanavond,v ɑ n aː v ɔ n t,0
{dut}vandaag,v ɑ n d aː x,0
{dut}vandalisme,v ɑ n d aː l ɪ s m ə,0
{dut}vangen,v ɑ ŋ ə n,0
{dut}vangrail,v ɑ ŋ r eː l,0
{dut}vangst,v ɑ ŋ s t,0
{dut}vangt,v ɑ ŋ t,0
{dut}vannacht,v ɑ n ɑ x t,0
{dut}vanwaar,v ɑ n ʋ aː r,0
{dut}vanwege,v ɑ n ʋ eː ɣ ə,0
{dut}vanzelfsprekend,v ɑ n z ɛ l f s p r eː k ə n t,0
{dut}vara,v aː r aː,0
{dut}varen,v aː r ə n,0
{dut}variant,v aː r i ɑ n t,0
{dut}variatie,v aː r i aː t s i,0
{dut}varken,v ɑ r k ə n,0
{dut}varkensgriep,v ɑ r k ə n s x r i p,0
{dut}vast,v ɑ s t,0
{dut}vastleggen,v ɑ s t l ɛ ɣ ə n,0
{dut}vaststellen,v ɑ s s t ɛ l ə n,0
{dut}vat,v ɑ t,0
{dut}vatbaar,v ɑ t b aː r,0
{dut}vaticaan,v aː t i k aː n,0
{dut}vaticaans,v aː t i k aː n s,0
{dut}vatten,v ɑ t ə n,0
{dut}vazen,v aː z ə n,0
{dut}vecht,v ɛ x t,0
{dut}vechten,v ɛ x t ə n,0
{dut}vechtpartij,v ɛ x t p ɑ r t ɛ i̯,0
{dut}veder,v eː d ə r,0
{dut}vederlicht,v eː d ə r l ɪ x t,0
{dut}vee,v eː,0
{dut}veeg,v eː x,0
{dut}veegt,v eː x t,0
{dut}veel,v eː l,0
