merged_spelling,ipa,langid
{fre}reconquête,ʁ ə k ɔ̃ k ɛ t,0
{fre}reconstituer,ʁ ə k ɔ̃ s t i t ɥ e,0
{fre}reconstruire,ʁ ə k ɔ̃ s t ʁ ɥ i ʁ,0
{fre}record,ʁ ə k ɔ ʁ,0
{fre}recordman,ʁ ə k ɔ ʁ d m a n,0
{fre}recourir,ʁ ə k u ʁ i ʁ,0
{fre}recours,ʁ ə k u ʁ,0
{fre}recrudescence,ʁ ə k ʁ y d ɛ s ɑ̃ s,0
{fre}recrue,ʁ ə k ʁ y,0
{fre}recruter,ʁ ə k ʁ y t e,0
{fre}rectal,ʁ ɛ k t a l,0
{fre}recul,ʁ ə k y l,0
{fre}reculait,ʁ ə k y l ɛ,0
{fre}recule,ʁ ə k y l,0
{fre}reculer,ʁ ə k y l e,0
{fre}reculerions,ʁ ə k y l ə ʁ j ɔ̃,0
{fre}recyclable,ʁ e s i k l a b l,0
{fre}recyclage,ʁ ə s i k l a ʒ,0
{fre}recycler,ʁ ə s i k l e,0
{fre}reddition,ʁ ɛ d i s j ɔ̃,0
{fre}redescendre,ʁ ə d e s ɑ̃ d ʁ,0
{fre}redevenir,ʁ ə d ə v ə n i ʁ,0
{fre}redire,ʁ ə d i ʁ,0
{fre}redirigerais,ʁ ə d i ʁ i ʒ ʁ ɛ,0
{fre}redirigerez,ʁ ə d i ʁ i ʒ ʁ e,0
{fre}rediscutaient,ʁ ə d i s k y t ɛ,0
{fre}redonner,ʁ ə d ɔ n e,0
{fre}redoubler,ʁ ə d u b l e,0
{fre}redoutable,ʁ ə d u t a b l,0
{fre}redoutables,ʁ ə d u t a b l,0
{fre}redouter,ʁ ə d u t e,0
{fre}refaire,ʁ ə f ɛ ʁ,0
{fre}refait,ʁ ə f ɛ,0
{fre}refinancer,ʁ ə f i n ɑ̃ s e,0
{fre}reflet,ʁ ə f l ɛ,0
{fre}refléter,ʁ ə f l e t e,0
{fre}reformassions,ʁ ə f ɔ ʁ m a s j ɔ̃,0
{fre}reformé,ʁ ə f ɔ ʁ m e,0
{fre}refrain,ʁ ə f ʁ ɛ̃,0
{fre}refuge,ʁ ə f y ʒ,0
{fre}refus,ʁ ə f y,0
{fre}refuser,ʁ ə f y z e,0
{fre}regagner,ʁ ə ɡ a ɲ e,0
{fre}regard,ʁ ə ɡ a ʁ,0
{fre}regarde,ʁ ə ɡ a ʁ d,0
{fre}regarder,ʁ ə ɡ a ʁ d e,0
{fre}regardé,ʁ ə ɡ a ʁ d e,0
{fre}registre,ʁ ə ʒ i s t ʁ,0
{fre}regret,ʁ ə ɡ ʁ ɛ,0
{fre}regrettable,ʁ ə ɡ ʁ ɛ t a b l,0
{fre}rehausser,ʁ ə o s e,0
{fre}rehaussé,ʁ ə o s e,0
{fre}reims,ʁ ɛ̃ s,0
{fre}rein,ʁ ɛ̃,0
{fre}reine,ʁ ɛ n,0
{fre}rejeter,ʁ ə ʒ ə t e,0
{fre}rejoindre,ʁ ə ʒ w ɛ̃ d ʁ,0
{fre}rejouerait,ʁ ə ʒ u ʁ ɛ,0
{fre}relais,ʁ ə l ɛ,0
{fre}relance,ʁ ə l ɑ̃ s,0
{fre}relancerait,ʁ ə l ɑ̃ s ʁ ɛ,0
{fre}relancé,ʁ ə l ɑ̃ s e,0
{fre}relatif,ʁ ə l a t i f,0
{fre}relation,ʁ ə l a s j ɔ̃,0
{fre}relationnel,ʁ ə l a s j ɔ n ɛ l,0
{fre}relative,ʁ ə l a t i v,0
{fre}relatives,ʁ ə l a t i v,0
{fre}relativiser,ʁ ə l a t i v i z e,0
{fre}relevant,ʁ ə l ə v ɑ̃,0
{fre}relever,ʁ ə l ə v e,0
{fre}relevez,ʁ ə l ə v e,0
{fre}relevé,ʁ ə l ə v e,0
{fre}reliant,ʁ ə l j ɑ̃,0
{fre}relie,ʁ ə l i,0
{fre}relief,ʁ ə l j ɛ f,0
{fre}relier,ʁ ə l j e,0
{fre}religieuse,ʁ ə l i ʒ j ø z,0
{fre}religieux,ʁ ə l i ʒ j ø,0
{fre}religion,ʁ ə l i ʒ j ɔ̃,0
{fre}relire,ʁ ə l i ʁ,0
{fre}relié,ʁ ə l j e,0
{fre}relogeaient,ʁ ə l ɔ ʒ ɛ,0
{fre}reluque,ʁ ə l y k,0
{fre}relâche,ʁ ə l ɑ ʃ,0
{fre}relâcher,ʁ ə l ɑ ʃ e,0
{fre}relève,ʁ ə l ɛ v,0
{fre}relèvent,ʁ ə l ɛ v,0
{fre}relèves,ʁ ə l ɛ v,0
{fre}relégable,ʁ ə l e ɡ a b l,0
{fre}relégation,ʁ ə l e ɡ a s j ɔ̃,0
{fre}remaniement,ʁ ə m a n i m ɑ̃,0
{fre}remanier,ʁ ə m a n j e,0
{fre}remarquable,ʁ ə m a ʁ k a b l,0
{fre}remarque,ʁ ə m a ʁ k,0
{fre}remarquer,ʁ ə m a ʁ k e,0
{fre}remblai,ʁ ɑ̃ b l ɛ,0
{fre}remboursement,ʁ ɑ̃ b u ʁ s ə m ɑ̃,0
{fre}rembourser,ʁ ɑ̃ b u ʁ s e,0
{fre}remerciement,ʁ ə m ɛ ʁ s i m ɑ̃,0
{fre}remercier,ʁ ə m ɛ ʁ s j e,0
{fre}remise,ʁ ə m i z,0
{fre}remiser,ʁ ə m i z e,0
{fre}remobiliser,ʁ ə m ɔ b i l i z e,0
{fre}remorque,ʁ ə m ɔ ʁ k,0
{fre}remous,ʁ ə m u,0
{fre}remplacement,ʁ ɑ̃ p l a s m ɑ̃,0
{fre}remplacer,ʁ ɑ̃ p l a s e,0
{fre}remplir,ʁ ɑ̃ p l i ʁ,0
{fre}remporter,ʁ ɑ̃ p ɔ ʁ t e,0
{fre}remugle,ʁ ə m y ɡ l,0
{fre}remédier,ʁ ə m e d j e,0
{fre}renaissance,ʁ ə n ɛ s ɑ̃ s,0
{fre}renard,ʁ ə n a ʁ,0
{fre}renaud,ʁ ə n o,0
{fre}renault,ʁ ə n o,0
{fre}renchérit,ʁ ɑ̃ ʃ e ʁ i,0
{fre}rencontre,ʁ ɑ̃ k ɔ̃ t ʁ,0
{fre}rencontrer,ʁ ɑ̃ k ɔ̃ t ʁ e,0
{fre}rend,ʁ ɑ̃,0
{fre}rendant,ʁ ɑ̃ d ɑ̃,0
{fre}rendez,ʁ ɑ̃ d e,0
{fre}rendit,ʁ ɑ̃ d i,0
{fre}rendre,ʁ ɑ̃ d ʁ,0
{fre}renforcement,ʁ ɑ̃ f ɔ ʁ s ə m ɑ̃,0
{fre}renforcer,ʁ ɑ̃ f ɔ ʁ s e,0
{fre}renfort,ʁ ɑ̃ f ɔ ʁ,0
{fre}renforçant,ʁ ɑ̃ f ɔ ʁ s ɑ̃,0
{fre}renifler,ʁ ə n i f l e,0
{fre}rennais,ʁ ɛ n ɛ,0
{fre}rennes,ʁ ɛ n,0
{fre}renommée,ʁ ə n ɔ m e,0
{fre}renouveau,ʁ ə n u v o,0
{fre}renouvellement,ʁ ə n u v ɛ l m ɑ̃,0
{fre}rente,ʁ ɑ̃ t,0
{fre}rentre,ʁ ɑ̃ t ʁ,0
{fre}rentrer,ʁ ɑ̃ t ʁ e,0
{fre}rentrée,ʁ ɑ̃ t ʁ e,0
{fre}renverser,ʁ ɑ̃ v ɛ ʁ s e,0
{fre}renvoi,ʁ ɑ̃ v w a,0
{fre}renvois,ʁ ɑ̃ v w a,0
{fre}renvoyer,ʁ ɑ̃ v w a j e,0
{fre}renâclait,ʁ ə n a k l ɛ,0
{fre}renâcleras,ʁ ə n a k l ə ʁ a,0
{fre}rené,ʁ ə n e,0
{fre}repaire,ʁ ə p ɛ ʁ,0
{fre}repartir,ʁ ə p a ʁ t i ʁ,0
{fre}repasser,ʁ ə p ɑ s e,0
{fre}report,ʁ ə p ɔ ʁ,0
{fre}reporting,ʁ ə p ɔ ʁ t i ŋ,0
{fre}repos,ʁ ə p o,0
{fre}repose,ʁ ə p o z,0
{fre}reposer,ʁ ə p o z e,0
{fre}repoussant,ʁ ə p u s ɑ̃,0
{fre}repousser,ʁ ə p u s e,0
{fre}repoussé,ʁ ə p u s e,0
{fre}reprise,ʁ ə p ʁ i z,0
{fre}reproduction,ʁ ə p ʁ ɔ d y k s j ɔ̃,0
{fre}reproduire,ʁ ə p ʁ ɔ d ɥ i ʁ,0
{fre}représentait,ʁ ə p ʁ e z ɑ̃ t ɛ,0
{fre}représentant,ʁ ə p ʁ e z ɑ̃ t ɑ̃,0
{fre}représentante,ʁ ə p ʁ e z ɑ̃ t ɑ̃ t,0
{fre}représenter,ʁ ə p ʁ e z ɑ̃ t e,0
{fre}repère,ʁ ə p ɛ ʁ,0
{fre}repérer,ʁ ə p e ʁ e,0
{fre}repêchage,ʁ ə p ɛ ʃ a ʒ,0
{fre}requin,ʁ ə k ɛ̃,0
{fre}requête,ʁ ə k ɛ t,0
{fre}rescousse,ʁ ɛ s k u s,0
{fre}respect,ʁ ɛ s p ɛ,0
{fre}respecter,ʁ ɛ s p ɛ k t e,0
{fre}respectif,ʁ ɛ s p ɛ k t i f,0
{fre}respectivement,ʁ ɛ s p ɛ k t i v m ɑ̃,0
{fre}respectueux,ʁ ɛ s p ɛ k t ɥ ø,0
{fre}respirer,ʁ ɛ s p i ʁ e,0
{fre}responsabilité,ʁ ɛ s p ɔ̃ s a b i l i t e,0
{fre}responsable,ʁ ɛ s p ɔ̃ s a b l,0
{fre}ressassant,ʁ ə s a s ɑ̃,0
{fre}ressassés,ʁ ə s a s e,0
{fre}resserrant,ʁ ə s e ʁ ɑ̃,0
{fre}resserre,ʁ ə s ɛ ʁ,0
{fre}resserré,ʁ ə s e ʁ e,0
{fre}ressort,ʁ ə s ɔ ʁ,0
{fre}ressorti,ʁ ə s ɔ ʁ t i,0
{fre}ressortir,ʁ ə s ɔ ʁ t i ʁ,0
{fre}ressortissaient,ʁ ə s ɔ ʁ t i s ɛ,0
{fre}ressortissant,ʁ ə s ɔ ʁ t i s ɑ̃,0
{fre}ressource,ʁ ə s u ʁ s,0
{fre}restaient,ʁ ɛ s t ɛ,0
{fre}restait,ʁ ɛ s t ɛ,0
{fre}restant,ʁ ɛ s t ɑ̃,0
{fre}restaurant,ʁ ɛ s t ɔ ʁ ɑ̃,0
{fre}restauration,ʁ ɛ s t o ʁ a s j ɔ̃,0
{fre}reste,ʁ ɛ s t,0
{fre}restent,ʁ ɛ s t,0
{fre}rester,ʁ ɛ s t e,0
{fre}restes,ʁ ɛ s t,0
{fre}restez,ʁ ɛ s t e,0
{fre}restiez,ʁ ɛ s t j e,0
{fre}resto,ʁ ɛ s t o,0
{fre}restos,ʁ ɛ s t o,0
{fre}restriction,ʁ ɛ s t ʁ i k s j ɔ̃,0
{fre}resté,ʁ ɛ s t e,0
{fre}retarder,ʁ ə t a ʁ d e,0
{fre}retenir,ʁ ə t ə n i ʁ,0
{fre}retirer,ʁ ə t i ʁ e,0
{fre}retomber,ʁ ə t ɔ̃ b e,0
{fre}retordre,ʁ ə t ɔ ʁ d ʁ,0
{fre}retour,ʁ ə t u ʁ,0
{fre}retourner,ʁ ə t u ʁ n e,0
{fre}retourné,ʁ ə t u ʁ n e,0
{fre}retrait,ʁ ə t ʁ ɛ,0
{fre}retrancher,ʁ ə t ʁ ɑ̃ ʃ e,0
{fre}retranscrire,ʁ ə t ʁ ɑ̃ s k ʁ i ʁ,0
{fre}retransmettre,ʁ ə t ʁ ɑ̃ s m ɛ t ʁ,0
{fre}retroussé,ʁ ə t ʁ u s e,0
{fre}retrouver,ʁ ə t ʁ u v e,0
{fre}revanche,ʁ ə v ɑ̃ ʃ,0
{fre}revenant,ʁ ə v ə n ɑ̃,0
{fre}revendication,ʁ ə v ɑ̃ d i k a s j ɔ̃,0
{fre}revenir,ʁ ə v ə n i ʁ,0
{fre}revenu,ʁ ə v ə n y,0
{fre}revenues,ʁ ə v ə n y,0
{fre}revers,ʁ ə v ɛ ʁ,0
{fre}reversant,ʁ ə v ɛ ʁ s ɑ̃,0
{fre}reverser,ʁ ə v ɛ ʁ s e,0
{fre}reverses,ʁ ə v ɛ ʁ s,0
{fre}reversèrent,ʁ ə v ɛ ʁ s ɛ ʁ,0
{fre}revisiter,ʁ ə v i z i t e,0
{fre}revivre,ʁ ə v i v ʁ,0
{fre}revoici,ʁ ə v w a s i,0
{fre}revoilà,ʁ ə v w a l a,0
{fre}revoir,ʁ ə v w a ʁ,0
{fre}revêt,ʁ ə v ɛ,0
{fre}revêtent,ʁ ə v ɛ t,0
{fre}revêtions,ʁ ə v ɛ t j ɔ̃,0
{fre}reçu,ʁ ə s y,0
{fre}reçues,ʁ ə s y,0
{fre}rhodanien,ʁ ɔ d a n j ɛ̃,0
{fre}rhodes,ʁ ɔ d,0
{fre}rhume,ʁ y m,0
{fre}rhétorique,ʁ e t ɔ ʁ i k,0
{fre}rhône,ʁ o n,0
{fre}riant,ʁ i j ɑ̃,0
{fre}ribambelle,ʁ i b ɑ̃ b ɛ l,0
{fre}ricard,ʁ i k a ʁ,0
{fre}riche,ʁ i ʃ,0
{fre}riches,ʁ i ʃ,0
{fre}rien,ʁ j ɛ̃,0
{fre}riga,ʁ i ɡ a,0
{fre}rigide,ʁ i ʒ i d,0
{fre}rigoureux,ʁ i ɡ u ʁ ø,0
{fre}rime,ʁ i m,0
{fre}rimerions,ʁ i m ə ʁ j ɔ̃,0
{fre}rimini,ʁ i m i n i,0
{fre}ring,ʁ i ŋ ɡ,0
{fre}rire,ʁ i ʁ,0
{fre}ris,ʁ i,0
{fre}risque,ʁ i s k,0
{fre}risquer,ʁ i s k e,0
{fre}rissoler,ʁ i s ɔ l e,0
{fre}risée,ʁ i z e,0
{fre}rivage,ʁ i v a ʒ,0
{fre}rivages,ʁ i v a ʒ,0
{fre}rival,ʁ i v a l,0
{fre}rivaliser,ʁ i v a l i z e,0
{fre}rive,ʁ i v,0
{fre}riyad,ʁ i j a d,0
{fre}robert,ʁ ɔ b ɛ ʁ,0
{fre}robin,ʁ ɔ b ɛ̃,0
{fre}robuste,ʁ ɔ b y s t,0
{fre}roc,ʁ ɔ k,0
{fre}roche,ʁ ɔ ʃ,0
{fre}rocher,ʁ ɔ ʃ e,0
{fre}roches,ʁ ɔ ʃ,0
{fre}rock,ʁ ɔ k,0
{fre}rodage,ʁ ɔ d a ʒ,0
{fre}rodin,ʁ ɔ d ɛ̃,0
{fre}rogne,ʁ ɔ ɲ,0
{fre}roi,ʁ w a,0
{fre}roland,ʁ ɔ l ɑ̃,0
{fre}romaine,ʁ ɔ m ɛ n,0
{fre}roman,ʁ ɔ m ɑ̃,0
{fre}romancier,ʁ ɔ m ɑ̃ s j e,0
{fre}romans,ʁ ɔ m ɑ̃,0
{fre}rome,ʁ ɔ m,0
{fre}rompre,ʁ ɔ̃ p ʁ,0
{fre}rond,ʁ ɔ̃,0
{fre}ronde,ʁ ɔ̃ d,0
{fre}rondelle,ʁ ɔ̃ d ɛ l,0
{fre}rondement,ʁ ɔ̃ d m ɑ̃,0
{fre}ronds,ʁ ɔ̃,0
{fre}ronronnement,ʁ ɔ̃ ʁ ɔ n m ɑ̃,0
{fre}roquette,ʁ ɔ k ɛ t,0
{fre}roseau,ʁ o z o,0
{fre}roselyne,ʁ o z l i n,0
{fre}rosette,ʁ o z ɛ t,0
{fre}rosser,ʁ ɔ s e,0
{fre}roubaix,ʁ u b ɛ,0
{fre}roue,ʁ u,0
{fre}rouge,ʁ u ʒ,0
{fre}rouleau,ʁ u l o,0
{fre}rouler,ʁ u l e,0
{fre}roumain,ʁ u m ɛ̃,0
{fre}roumaine,ʁ u m ɛ n,0
{fre}roumanie,ʁ u m a n i,0
{fre}round,ʁ u n d,0
{fre}routait,ʁ u t ɛ,0
{fre}route,ʁ u t,0
{fre}routine,ʁ u t i n,0
{fre}roux,ʁ u,0
{fre}royal,ʁ w a j a l,0
{fre}ruben,ʁ y b ɛ n,0
{fre}rubrique,ʁ y b ʁ i k,0
{fre}rudes,ʁ y d,0
{fre}rudesse,ʁ y d ɛ s,0
{fre}rudimentaire,ʁ y d i m ɑ̃ t ɛ ʁ,0
{fre}rue,ʁ y,0
{fre}ruer,ʁ ɥ e,0
{fre}ruine,ʁ ɥ i n,0
{fre}ruiner,ʁ ɥ i n e,0
{fre}ruines,ʁ ɥ i n,0
{fre}ruissellement,ʁ ɥ i s ɛ l m ɑ̃,0
{fre}rupture,ʁ y p t y ʁ,0
{fre}rural,ʁ y ʁ a l,0
{fre}ruse,ʁ y z,0
{fre}russes,ʁ y s,0
{fre}russie,ʁ y s i,0
{fre}ruth,ʁ y t,0
{fre}ruthène,ʁ y t ɛ n,0
{fre}rythme,ʁ i t m,0
{fre}rythmé,ʁ i t m e,0
{fre}règle,ʁ ɛ ɡ l,0
{fre}règlement,ʁ ɛ ɡ l ə m ɑ̃,0
{fre}règles,ʁ ɛ ɡ l,0
{fre}règne,ʁ ɛ ɲ,0
{fre}réactivé,ʁ e a k t i v e,0
{fre}réalisateur,ʁ e a l i z a t œ ʁ,0
{fre}réalisatrice,ʁ e a l i z a t ʁ i s,0
{fre}réaliser,ʁ e a l i z e,0
{fre}réaliste,ʁ e a l i s t,0
{fre}réalité,ʁ e a l i t e,0
{fre}réalités,ʁ e a l i t e,0
{fre}réaménagent,ʁ e a m e n a ʒ,0
{fre}réarmâmes,ʁ e a ʁ m ɑ m,0
{fre}récemment,ʁ e s a m ɑ̃,0
{fre}récent,ʁ e s ɑ̃,0
{fre}réception,ʁ e s ɛ p s j ɔ̃,0
{fre}récif,ʁ e s i f,0
{fre}réciproque,ʁ e s i p ʁ ɔ k,0
{fre}récit,ʁ e s i,0
{fre}récital,ʁ e s i t a l,0
{fre}réclame,ʁ e k l a m,0
{fre}réclamer,ʁ e k l a m e,0
{fre}récolte,ʁ e k ɔ l t,0
{fre}récolter,ʁ e k ɔ l t e,0
{fre}récupération,ʁ e k y p e ʁ a s j ɔ̃,0
{fre}récurant,ʁ e k y ʁ ɑ̃,0
{fre}récurrent,ʁ e k y ʁ ɑ̃,0
{fre}rédaction,ʁ e d a k s j ɔ̃,0
{fre}rédactrice,ʁ e d a k t ʁ i s,0
{fre}rédiger,ʁ e d i ʒ e,0
{fre}réduction,ʁ e d y k s j ɔ̃,0
{fre}réduire,ʁ e d ɥ i ʁ,0
{fre}réduit,ʁ e d ɥ i,0
{fre}réel,ʁ e ɛ l,0
{fre}réellement,ʁ e ɛ l m ɑ̃,0
{fre}réenchérissiez,ʁ e ɑ̃ ʃ e ʁ i s j e,0
{fre}réexaminé,ʁ e ɛ ɡ z a m i n e,0
{fre}réfection,ʁ e f ɛ k s j ɔ̃,0
{fre}réfectoire,ʁ e f ɛ k t w a ʁ,0
{fre}réflexion,ʁ e f l ɛ k s j ɔ̃,0
{fre}réfléchi,ʁ e f l e ʃ i,0
{fre}réfléchir,ʁ e f l e ʃ i ʁ,0
{fre}réfréner,ʁ e f ʁ e n e,0
{fre}réfugier,ʁ e f y ʒ j e,0
{fre}réfugié,ʁ e f y ʒ j e,0
{fre}régie,ʁ e ʒ i,0
{fre}régime,ʁ e ʒ i m,0
{fre}région,ʁ e ʒ j ɔ̃,0
{fre}régional,ʁ e ʒ j ɔ n a l,0
{fre}régionales,ʁ e ʒ j ɔ n a l,0
{fre}régionaux,ʁ e ʒ j ɔ n o,0
{fre}régis,ʁ e ʒ i s,0
{fre}réglementaire,ʁ ɛ ɡ l ə m ɑ̃ t ɛ ʁ,0
{fre}réglementer,ʁ ɛ ɡ l ə m ɑ̃ t e,0
{fre}régler,ʁ e ɡ l e,0
{fre}régner,ʁ e ɲ e,0
{fre}régresse,ʁ e ɡ ʁ ɛ s,0
{fre}réguler,ʁ e ɡ y l e,0
{fre}régulier,ʁ e ɡ y l j e,0
{fre}régulièrement,ʁ e ɡ y l j ɛ ʁ m ɑ̃,0
{fre}réinitialiser,ʁ e i n i s j a l i z e,0
{fre}réislamisas,ʁ e i s l a m i z ɑ,0
{fre}rémunération,ʁ e m y n e ʁ a s j ɔ̃,0
{fre}rémunérer,ʁ e m y n e ʁ e,0
{fre}rémy,ʁ e m i,0
{fre}réouverture,ʁ e u v ɛ ʁ t y ʁ,0
{fre}répandre,ʁ e p ɑ̃ d ʁ,0
{fre}répandu,ʁ e p ɑ̃ d y,0
{fre}répartie,ʁ e p a ʁ t i,0
{fre}répartir,ʁ e p a ʁ t i ʁ,0
{fre}répartition,ʁ e p a ʁ t i s j ɔ̃,0
{fre}répercussion,ʁ e p ɛ ʁ k y s j ɔ̃,0
{fre}répercuter,ʁ e p ɛ ʁ k y t e,0
{fre}répit,ʁ e p i,0
{fre}réplique,ʁ e p l i k,0
{fre}répliquer,ʁ e p l i k e,0
{fre}répondeur,ʁ e p ɔ̃ d œ ʁ,0
{fre}répondre,ʁ e p ɔ̃ d ʁ,0
{fre}réponse,ʁ e p ɔ̃ s,0
{fre}répression,ʁ e p ʁ ɛ s j ɔ̃,0
{fre}réprimandes,ʁ e p ʁ i m ɑ̃ d,0
{fre}réprimer,ʁ e p ʁ i m e,0
{fre}républicain,ʁ e p y b l i k ɛ̃,0
{fre}républicaine,ʁ e p y b l i k ɛ n,0
{fre}républicaines,ʁ e p y b l i k ɛ n,0
{fre}république,ʁ e p y b l i k,0
{fre}réputation,ʁ e p y t a s j ɔ̃,0
{fre}répéter,ʁ e p e t e,0
{fre}réquisitionnez,ʁ e k i z i s j ɔ n e,0
{fre}réseau,ʁ e z o,0
{fre}réserve,ʁ e z ɛ ʁ v,0
{fre}réserver,ʁ e z ɛ ʁ v e,0
{fre}réservoir,ʁ e z ɛ ʁ v w a ʁ,0
{fre}résidence,ʁ e z i d ɑ̃ s,0
{fre}résidente,ʁ e z i d ɑ̃ t,0
{fre}résigné,ʁ e z i ɲ e,0
{fre}résille,ʁ e z i j,0
{fre}résulter,ʁ e z y l t e,0
{fre}résumé,ʁ e z y m e,0
{fre}rétablissement,ʁ e t a b l i s m ɑ̃,0
{fre}rétention,ʁ e t ɑ̃ s j ɔ̃,0
{fre}réticence,ʁ e t i s ɑ̃ s,0
{fre}rétracter,ʁ e t ʁ a k t e,0
{fre}réunion,ʁ e y n j ɔ̃,0
{fre}réunir,ʁ e y n i ʁ,0
{fre}réussi,ʁ e y s i,0
{fre}réussir,ʁ e y s i ʁ,0
{fre}réussites,ʁ e y s i t,0
{fre}réutilisions,ʁ e y t i l i z j ɔ̃,0
{fre}réveil,ʁ e v ɛ j,0
{fre}réveille,ʁ e v ɛ j,0
{fre}réveiller,ʁ e v ɛ j e,0
{fre}réveillé,ʁ e v ɛ j e,0
{fre}réviser,ʁ e v i z e,0
{fre}révolte,ʁ e v ɔ l t,0
{fre}révolution,ʁ e v ɔ l y s j ɔ̃,0
{fre}révolutionnaire,ʁ e v ɔ l y s j ɔ n ɛ ʁ,0
{fre}révélation,ʁ e v e l a s j ɔ̃,0
{fre}révéler,ʁ e v e l e,0
{fre}réédition,ʁ e e d i s j ɔ̃,0
{fre}rêveur,ʁ ɛ v œ ʁ,0
{fre}sa,s a,0
{fre}sabbatisas,s a b a t i z ɑ,0
{fre}sabotage,s a b ɔ t a ʒ,0
{fre}sabrina,s a b ʁ i n a,0
{fre}sac,s a k,0
{fre}sacerdoce,s a s ɛ ʁ d ɔ s,0
{fre}sachant,s a ʃ ɑ̃,0
{fre}sache,s a ʃ,0
{fre}sachet,s a ʃ ɛ,0
{fre}sacrifice,s a k ʁ i f i s,0
{fre}sacrifier,s a k ʁ i f j e,0
{fre}sadienne,s a d j ɛ n,0
{fre}safari,s a f a ʁ i,0
{fre}saga,s a ɡ a,0
{fre}sage,s a ʒ,0
{fre}sagesse,s a ʒ ɛ s,0
{fre}sahara,s a a ʁ a,0
{fre}sahraoui,s a ʁ a w i,0
{fre}sahraouie,s a ʁ a w i,0
{fre}sain,s ɛ̃,0
{fre}saint,s ɛ̃,0
{fre}saintes,s ɛ̃ t,0
{fre}sais,s ɛ,0
{fre}saisie,s ɛ z i,0
{fre}saisine,s ɛ z i n,0
{fre}sait,s ɛ,0
{fre}sala,s a l a,0
{fre}salade,s a l a d,0
{fre}salaires,s a l ɛː ʁ,0
{fre}sale,s a l,0
{fre}salle,s a l,0
{fre}salon,s a l ɔ̃,0
{fre}salonique,s a l ɔ n i k,0
{fre}saluer,s a l ɥ e,0
{fre}salut,s a l y,0
{fre}salvador,s a l v a d ɔ ʁ,0
{fre}salve,s a l v,0
{fre}salé,s a l e,0
{fre}samba,s ɑ̃ b a,0
{fre}samedi,s a m d i,0
{fre}samuel,s a m ɥ ɛ l,0
{fre}san,s a n,0
{fre}sanction,s ɑ̃ k s j ɔ̃,0
{fre}sanctuaire,s ɑ̃ k t ɥ ɛ ʁ,0
{fre}sandrine,s ɑ̃ d ʁ i n,0
{fre}sanglant,s ɑ̃ ɡ l ɑ̃,0
{fre}santé,s ɑ̃ t e,0
{fre}saoudien,s a u d j ɛ̃,0
{fre}sapin,s a p ɛ̃,0
{fre}saragosse,s a ʁ a ɡ ɔ s,0
{fre}sarah,s a ʁ a,0
{fre}sardinières,s a ʁ d i n j ɛ ʁ,0
{fre}sarkozy,s a ʁ k ɔ z i,0
{fre}sarthe,s a ʁ t,0
{fre}saskatchewan,s a s k a t ʃ ə w a n,0
{fre}satisfaction,s a t i s f a k s j ɔ̃,0
{fre}satisfaire,s a t i s f ɛ ʁ,0
{fre}satisfaisant,s a t i s f ə z ɑ̃,0
{fre}satisfait,s a t i s f ɛ,0
{fre}saturasse,s a t y ʁ a s,0
{fre}saturation,s a t y ʁ a s j ɔ̃,0
{fre}saturé,s a t y ʁ e,0
{fre}saucisson,s o s i s ɔ̃,0
{fre}sauf,s o f,0
{fre}saumon,s o m ɔ̃,0
{fre}saut,s o,0
{fre}saute,s o t,0
{fre}sauter,s o t e,0
{fre}sauve,s o v,0
{fre}sauver,s o v e,0
{fre}sauvetage,s o v t a ʒ,0
{fre}sauveur,s o v œ ʁ,0
{fre}savait,s a v ɛ,0
{fre}savamment,s a v a m ɑ̃,0
{fre}save,s a v,0
{fre}savent,s a v,0
{fre}saveur,s a v œ ʁ,0
{fre}savez,s a v e,0
{fre}savoir,s a v w a ʁ,0
{fre}savoirs,s a v w a ʁ,0
{fre}savons,s a v ɔ̃,0
{fre}savoureux,s a v u ʁ ø,0
{fre}scandale,s k ɑ̃ d a l,0
{fre}scandaleux,s k ɑ̃ d a l ø,0
{fre}scandalisé,s k ɑ̃ d a l i z e,0
{fre}scandinave,s k ɑ̃ d i n a v,0
{fre}scandinavie,s k ɑ̃ d i n a v i,0
{fre}sceaux,s o,0
{fre}sceptique,s ɛ p t i k,0
{fre}schiste,ʃ i s t,0
{fre}schéma,ʃ e m a,0
{fre}scie,s i,0
{fre}sciemment,s j a m ɑ̃,0
{fre}scier,s j e,0
{fre}scinder,s ɛ̃ d e,0
{fre}score,s k ɔ ʁ,0
{fre}scrupule,s k ʁ y p y l,0
{fre}scrutin,s k ʁ y t ɛ̃,0
{fre}sculptrice,s k y l t ʁ i s,0
{fre}sculpture,s k y l t y ʁ,0
{fre}sculptures,s k y l t y ʁ,0
{fre}scène,s ɛ n,0
{fre}scénariste,s e n a ʁ i s t,0
{fre}sdf,ɛ s d e ɛ f,0
{fre}se,s ə,0
{fre}seau,s o,0
{fre}second,s ə ɡ ɔ̃,0
{fre}secondaire,s ə ɡ ɔ̃ d ɛ ʁ,0
{fre}secouer,s ə k w e,0
{fre}secourir,s ə k u ʁ i ʁ,0
{fre}secours,s ə k u ʁ,0
{fre}secousse,s ə k u s,0
{fre}secrets,s ə k ʁ ɛ,0
{fre}secteur,s ɛ k t œ ʁ,0
{fre}seguin,s ə ɡ ɛ̃,0
{fre}sein,s ɛ̃,0
{fre}seinassiez,s ɛ n a s j e,0
{fre}seine,s ɛ n,0
{fre}seins,s ɛ̃,0
{fre}seize,s ɛ z,0
{fre}seizième,s ɛ z j ɛ m,0
{fre}sel,s ɛ l,0
{fre}selle,s ɛ l,0
{fre}selon,s ə l ɔ̃,0
{fre}sels,s ɛ l,0
{fre}semblable,s ɑ̃ b l a b l,0
{fre}semence,s ə m ɑ̃ s,0
{fre}semer,s ə m e,0
{fre}semestre,s ə m ɛ s t ʁ,0
{fre}semis,s ə m i,0
{fre}senior,s e n j ɔ ʁ,0
{fre}sens,s ɑ̃ s,0
{fre}sensation,s ɑ̃ s a s j ɔ̃,0
{fre}sensible,s ɑ̃ s i b l,0
{fre}sentant,s ɑ̃ t ɑ̃,0
{fre}sentence,s ɑ̃ t ɑ̃ s,0
{fre}senti,s ɑ̃ t i,0
{fre}sentiers,s ɑ̃ t j e,0
{fre}sentiment,s ɑ̃ t i m ɑ̃,0
{fre}sentimentale,s ɑ̃ t i m ɑ̃ t a l,0
{fre}sentir,s ɑ̃ t i ʁ,0
{fre}septentrionale,s ɛ p t ɑ̃ t ʁ i j ɔ n a l,0
{fre}septique,s ɛ p t i k,0
{fre}serbie,s ɛ ʁ b i,0
{fre}serein,s ə ʁ ɛ̃,0
{fre}serge,s ɛ ʁ ʒ,0
{fre}sergent,s ɛ ʁ ʒ ɑ̃,0
{fre}serin,s ə ʁ ɛ̃,0
{fre}serment,s ɛ ʁ m ɑ̃,0
{fre}serpe,s ɛ ʁ p,0
{fre}serra,s ɛ ʁ a,0
{fre}serre,s ɛ ʁ,0
{fre}serrée,s e ʁ e,0
{fre}serrés,s e ʁ e,0
{fre}sert,s ɛ ʁ,0
{fre}serve,s ɛ ʁ v,0
{fre}servent,s ɛ ʁ v,0
{fre}serveur,s ɛ ʁ v œ ʁ,0
{fre}serveuse,s ɛ ʁ v ø z,0
{fre}service,s ɛ ʁ v i s,0
{fre}servir,s ɛ ʁ v i ʁ,0
{fre}session,s ɛ s j ɔ̃,0
{fre}seuil,s œ j,0
{fre}seul,s œ l,0
{fre}seule,s œ l,0
{fre}seulement,s œ l m ɑ̃,0
{fre}sevré,s ə v ʁ e,0
{fre}sexe,s ɛ k s,0
{fre}sexologie,s ɛ k s ɔ l ɔ ʒ i,0
{fre}sexuel,s ɛ k s ɥ ɛ l,0
{fre}sexuellement,s e k s ɥ ɛ l m ɑ̃,0
{fre}seyant,s ɛ j ɑ̃,0
{fre}sherbrooke,ʃ ɛ ʁ b ʁ u k,0
{fre}short,ʃ ɔ ʁ t,0
{fre}si,s i,0
{fre}sied,s j e,0
{fre}siemens,s i m ɛ n s,0
{fre}sien,s j ɛ̃,0
{fre}siens,s j ɛ̃,0
{fre}sieste,s j ɛ s t,0
{fre}sieur,s j œ ʁ,0
{fre}sifflet,s i f l ɛ,0
{fre}signal,s i ɲ a l,0
{fre}signalement,s i ɲ a l m ɑ̃,0
{fre}signaler,s i ɲ a l e,0
{fre}signalisation,s i ɲ a l i z a s j ɔ̃,0
{fre}signalé,s i ɲ a l e,0
{fre}signature,s i ɲ a t y ʁ,0
{fre}signe,s i ɲ,0
{fre}signent,s i ɲ,0
{fre}signer,s i ɲ e,0
{fre}signes,s i ɲ,0
{fre}signification,s i ɲ i f i k a s j ɔ̃,0
{fre}significations,s i ɲ i f i k a s j ɔ̃,0
{fre}silence,s i l ɑ̃ s,0
{fre}silences,s i l ɑ̃ s,0
{fre}silencieux,s i l ɑ̃ s j ø,0
{fre}silhouette,s i l w ɛ t,0
{fre}silice,s i l i s,0
{fre}sillage,s i j a ʒ,0
{fre}simon,s i m ɔ̃,0
{fre}simple,s ɛ̃ p l,0
{fre}simplement,s ɛ̃ p l ə m ɑ̃,0
{fre}simplicité,s ɛ̃ p l i s i t e,0
{fre}simultané,s i m y l t a n e,0
{fre}simultanément,s i m y l t a n e m ɑ̃,0
{fre}sincère,s ɛ̃ s ɛ ʁ,0
{fre}sincèrement,s ɛ̃ s ɛ ʁ m ɑ̃,0
{fre}sincérité,s ɛ̃ s e ʁ i t e,0
{fre}singapour,s ɛ̃ ɡ a p u ʁ,0
{fre}singer,s ɛ̃ ʒ e,0
{fre}sinistre,s i n i s t ʁ,0
{fre}sinistres,s i n i s t ʁ,0
{fre}sinon,s i n ɔ̃,0
{fre}sinécure,s i n e k y ʁ,0
{fre}sismique,s i s m i k,0
{fre}situer,s i t ɥ e,0
{fre}sitôt,s i t o,0
{fre}sixième,s i z j ɛ m,0
{fre}siècle,s j ɛ k l,0
{fre}siècles,s j ɛ k l,0
{fre}siège,s j ɛ ʒ,0
{fre}ski,s k i,0
{fre}skieur,s k i œ ʁ,0
{fre}slalom,s l a l ɔ m,0
{fre}slave,s l a v,0
{fre}slip,s l i p,0
{fre}slovaque,s l ɔ v a k,0
{fre}slovaquie,s l ɔ v a k i,0
{fre}slovène,s l ɔ v ɛ n,0
{fre}slovénie,s l ɔ v e n i,0
{fre}smartphone,s m a ʁ t f ɔ n,0
{fre}smashasse,s m a ʃ a s,0
{fre}smic,s m i k,0
{fre}smith,s m i t,0
{fre}sms,ɛ s ɛ m ɛ s,0
{fre}soccer,s ɔ k œ ʁ,0
{fre}social,s ɔ s j a l,0
{fre}sociale,s ɔ s j a l,0
{fre}sociales,s ɔ s j a l,0
{fre}socialisassent,s ɔ s j a l i z a s,0
{fre}socialise,s ɔ s j a l i z,0
{fre}socialisme,s ɔ s j a l i z m,0
{fre}sociaux,s ɔ s j o,0
{fre}sociologie,s ɔ s j ɔ l ɔ ʒ i,0
{fre}sociétaire,s ɔ s j e t ɛ ʁ,0
{fre}société,s ɔ s j e t e,0
{fre}sociétés,s ɔ s j e t e,0
{fre}socle,s ɔ k l,0
{fre}soda,s o d a,0
{fre}soeur,s œ ʁ,0
{fre}sofia,s ɔ f j a,0
{fre}soft,s ɔ f t,0
{fre}soie,s w a,0
{fre}soigner,s w a ɲ e,0
{fre}soigneux,s w a ɲ ø,0
{fre}soigné,s w a ɲ e,0
{fre}soin,s w ɛ̃,0
{fre}soixante,s w a s ɑ̃ t,0
{fre}sol,s ɔ l,0
{fre}solange,s ɔ l ɑ̃ ʒ,0
{fre}solde,s ɔ l d,0
{fre}soleil,s ɔ l ɛ j,0
{fre}solidaire,s ɔ l i d ɛ ʁ,0
{fre}solidarité,s ɔ l i d a ʁ i t e,0
{fre}solide,s ɔ l i d,0
{fre}solitude,s ɔ l i t y d,0
{fre}solliciter,s ɔ l i s i t e,0
{fre}solo,s ɔ l o,0
{fre}solutionner,s ɔ l y s j ɔ n e,0
{fre}solvabilité,s ɔ l v a b i l i t e,0
{fre}somalie,s ɔ m a l i,0
{fre}sombre,s ɔ̃ b ʁ,0
{fre}sombrer,s ɔ̃ b ʁ e,0
{fre}sommaire,s ɔ m ɛ ʁ,0
{fre}somme,s ɔ m,0
{fre}sommeil,s ɔ m ɛ j,0
{fre}sommes,s ɔ m,0
{fre}sommet,s ɔ m ɛ,0
{fre}somnolent,s ɔ m n ɔ l ɑ̃,0
{fre}son,s ɔ̃,0
{fre}sonde,s ɔ̃ d,0
{fre}songe,s ɔ̃ ʒ,0
{fre}sonia,s ɔ n j a,0
{fre}sonnette,s ɔ n ɛ t,0
{fre}sonore,s ɔ n ɔ ʁ,0
{fre}sons,s ɔ̃,0
{fre}sont,s ɔ̃,0
{fre}sophie,s ɔ f i,0
{fre}sorcière,s ɔ ʁ s j ɛ ʁ,0
{fre}sort,s ɔ ʁ,0
{fre}sorte,s ɔ ʁ t,0
{fre}sortilèges,s ɔ ʁ t i l ɛ ʒ,0
{fre}sortir,s ɔ ʁ t i ʁ,0
{fre}sou,s u,0
{fre}souche,s u ʃ,0
{fre}souci,s u s i,0
{fre}soucier,s u s j e,0
{fre}soudain,s u d ɛ̃,0
{fre}soudan,s u d ɑ̃,0
{fre}soudard,s u d a ʁ,0
{fre}soude,s u d,0
{fre}souder,s u d e,0
{fre}souffle,s u f l,0
{fre}souffler,s u f l e,0
{fre}soufflé,s u f l e,0
{fre}souffrir,s u f ʁ i ʁ,0
{fre}soufre,s u f ʁ,0
{fre}soulagement,s u l a ʒ m ɑ̃,0
{fre}soulever,s u l v e,0
{fre}soulier,s u l j e,0
{fre}souligner,s u l i ɲ e,0
{fre}soumission,s u m i s j ɔ̃,0
{fre}soupapes,s u p a p,0
{fre}soupe,s u p,0
{fre}souper,s u p e,0
{fre}soupir,s u p i ʁ,0
{fre}souplesse,s u p l ɛ s,0
{fre}soupçons,s u p s ɔ̃,0
{fre}source,s u ʁ s,0
{fre}sourd,s u ʁ,0
{fre}sourde,s u ʁ d,0
{fre}sous,s u,0
{fre}souscription,s u s k ʁ i p s j ɔ̃,0
{fre}soustraire,s u s t ʁ ɛ ʁ,0
{fre}soutenir,s u t n i ʁ,0
{fre}soutien,s u t j ɛ̃,0
{fre}souvent,s u v ɑ̃,0
{fre}souverain,s u v ʁ ɛ̃,0
{fre}souverainiste,s u v ʁ ɛ n i s t,0
{fre}spam,s p a m,0
{fre}spartiate,s p a ʁ s j a t,0
{fre}spectacle,s p ɛ k t a k l,0
{fre}spectaculaire,s p ɛ k t a k y l ɛ ʁ,0
{fre}spencer,s p ɛ n s ɛ ʁ,0
{fre}sperme,s p ɛ ʁ m,0
{fre}sphinx,s f ɛ̃ k s,0
{fre}spirale,s p i ʁ a l,0
{fre}spirituel,s p i ʁ i t ɥ ɛ l,0
{fre}spirituelles,s p i ʁ i t ɥ ɛ l,0
{fre}splendeur,s p l ɑ̃ d œ ʁ,0
{fre}splendides,s p l ɑ̃ d i d,0
{fre}sponsor,s p ɔ̃ s ɔ ʁ,0
{fre}sponsorisasse,s p ɔ̃ s ɔ ʁ i z a s,0
{fre}sport,s p ɔ ʁ,0
{fre}spot,s p ɔ t,0
{fre}spécial,s p e s j a l,0
{fre}spécialement,s p e s j a l m ɑ̃,0
{fre}spécialiste,s p e s j a l i s t,0
{fre}spécifique,s p e s i f i k,0
{fre}spécifiquement,s p e s i f i k m ɑ̃,0
{fre}spéculateurs,s p e k y l a t œ ʁ,0
{fre}square,s k w a ʁ,0
{fre}squattent,s k w a t,0
{fre}squelette,s k ə l ɛ t,0
{fre}stabiliser,s t a b i l i z e,0
{fre}stable,s t a b l,0
{fre}stade,s t a d,0
{fre}staff,s t a f,0
{fre}stage,s t a ʒ,0
{fre}stages,s t a ʒ,0
{fre}stagne,s t a ɡ n,0
{fre}stagner,s t a ɡ n e,0
{fre}stand,s t ɑ̃ d,0
{fre}standard,s t ɑ̃ d a ʁ,0
{fre}standing,s t ɑ̃ d i ŋ,0
{fre}stanislas,s t a n i s l a s,0
{fre}star,s t a ʁ,0
{fre}station,s t a s j ɔ̃,0
{fre}statistique,s t a t i s t i k,0
{fre}statistiques,s t a t i s t i k,0
{fre}statut,s t a t y,0
{fre}stigmatise,s t i ɡ m a t i z,0
{fre}stigmatiser,s t i ɡ m a t i z e,0
{fre}stigmatiserais,s t i ɡ m a t i z ʁ ɛ,0
{fre}stigmatisé,s t i ɡ m a t i z e,0
{fre}stimulation,s t i m y l a s j ɔ̃,0
{fre}stock,s t ɔ k,0
{fre}stockholm,s t ɔ k ɔ l m,0
{fre}stone,s t o n,0
{fre}stoppeur,s t ɔ p œ ʁ,0
{fre}store,s t ɔ ʁ,0
{fre}stress,s t ʁ ɛ s,0
{fre}structure,s t ʁ y k t y ʁ,0
{fre}structurer,s t ʁ y k t y ʁ e,0
{fre}structures,s t ʁ y k t y ʁ,0
{fre}structuré,s t ʁ y k t y ʁ e,0
{fre}stupide,s t y p i d,0
{fre}style,s t i l,0
{fre}stylet,s t i l ɛ,0
{fre}stéphane,s t e f a n,0
{fre}stéphanie,s t e f a n i,0
{fre}stœchiométrique,s t e k j o m e t ʁ i k,0
{fre}su,s y,0
{fre}subir,s y b i ʁ,0
{fre}subit,s y b i,0
{fre}subitement,s y b i t m ɑ̃,0
{fre}subjectif,s y b ʒ ɛ k t i f,0
{fre}subjectives,s y b ʒ ɛ k t i v,0
{fre}substance,s y p s t ɑ̃ s,0
{fre}substitut,s y p s t i t y,0
{fre}substrat,s y p s t ʁ a,0
{fre}subvention,s y b v ɑ̃ s j ɔ̃,0
{fre}successeur,s y k s ɛ s œ ʁ,0
