merged_spelling,ipa,langid
{fre}contentieux,k ɔ̃ t ɑ̃ s j ø,0
{fre}contes,k ɔ̃ t,0
{fre}contestait,k ɔ̃ t ɛ s t ɛ,0
{fre}contestant,k ɔ̃ t ɛ s t ɑ̃,0
{fre}conteste,k ɔ̃ t ɛ s t,0
{fre}contestent,k ɔ̃ t ɛ s t,0
{fre}contester,k ɔ̃ t ɛ s t e,0
{fre}contesté,k ɔ̃ t ɛ s t e,0
{fre}conteur,k ɔ̃ t œ ʁ,0
{fre}contexte,k ɔ̃ t ɛ k s t,0
{fre}continent,k ɔ̃ t i n ɑ̃,0
{fre}contingent,k ɔ̃ t ɛ̃ ʒ ɑ̃,0
{fre}continuellement,k ɔ̃ t i n ɥ ɛ l m ɑ̃,0
{fre}contourner,k ɔ̃ t u ʁ n e,0
{fre}contraction,k ɔ̃ t ʁ a k s j ɔ̃,0
{fre}contradiction,k ɔ̃ t ʁ a d i k s j ɔ̃,0
{fre}contradictoire,k ɔ̃ t ʁ a d i k t w a ʁ,0
{fre}contraindre,k ɔ̃ t ʁ ɛ̃ d ʁ,0
{fre}contrarier,k ɔ̃ t ʁ a ʁ j e,0
{fre}contrarié,k ɔ̃ t ʁ a ʁ j e,0
{fre}contrat,k ɔ̃ t ʁ a,0
{fre}contre,k ɔ̃ t ʁ,0
{fre}contreproductif,k ɔ̃ t ʁ ə p ʁ ɔ d y k t i f,0
{fre}contrer,k ɔ̃ t ʁ e,0
{fre}contretemps,k ɔ̃ t ʁ ə t ɑ̃,0
{fre}contribuable,k ɔ̃ t ʁ i b ɥ a b l,0
{fre}contribuer,k ɔ̃ t ʁ i b ɥ e,0
{fre}contributeur,k ɔ̃ t ʁ i b y t œ ʁ,0
{fre}controverses,k ɔ̃ t ʁ ɔ v ɛ ʁ s,0
{fre}contrée,k ɔ̃ t ʁ e,0
{fre}contrôle,k ɔ̃ t ʁ o l,0
{fre}contrôler,k ɔ̃ t ʁ o l e,0
{fre}contrôleur,k ɔ̃ t ʁ o l œ ʁ,0
{fre}contusion,k ɔ̃ t y z j ɔ̃,0
{fre}convaincant,k ɔ̃ v ɛ̃ k ɑ̃,0
{fre}convalescent,k ɔ̃ v a l ɛ s ɑ̃,0
{fre}convalescente,k ɔ̃ v a l ɛ s ɑ̃ t,0
{fre}convalescentes,k ɔ̃ v a l ɛ s ɑ̃ t,0
{fre}convenable,k ɔ̃ v n a b l,0
{fre}convention,k ɔ̃ v ɑ̃ s j ɔ̃,0
{fre}convergé,k ɔ̃ v ɛ ʁ ʒ e,0
{fre}conversations,k ɔ̃ v ɛ ʁ s a s j ɔ̃,0
{fre}convertir,k ɔ̃ v ɛ ʁ t i ʁ,0
{fre}convictions,k ɔ̃ v i k s j ɔ̃,0
{fre}conviviale,k ɔ̃ v i v j a l,0
{fre}convivialité,k ɔ̃ v i v j a l i t e,0
{fre}conviviaux,k ɔ̃ v i v j o,0
{fre}convocation,k ɔ̃ v ɔ k a s j ɔ̃,0
{fre}convoi,k ɔ̃ v w a,0
{fre}convoitises,k ɔ̃ v w a t i z,0
{fre}convoquent,k ɔ̃ v ɔ k,0
{fre}convoquer,k ɔ̃ v ɔ k e,0
{fre}convoquions,k ɔ̃ v ɔ k j ɔ̃,0
{fre}convoqué,k ɔ̃ v ɔ k e,0
{fre}coopérant,k ɔ ɔ p e ʁ ɑ̃,0
{fre}coopératif,k ɔ ɔ p e ʁ a t i f,0
{fre}coopération,k ɔ ɔ p e ʁ a s j ɔ̃,0
{fre}coopérer,k ɔ ɔ p e ʁ e,0
{fre}coordinateur,k ɔ ɔ ʁ d i n a t œ ʁ,0
{fre}coordination,k ɔ ɔ ʁ d i n a s j ɔ̃,0
{fre}coordonnatrice,k ɔ ɔ ʁ d ɔ n a t ʁ i s,0
{fre}coordonné,k ɔ ɔ ʁ d ɔ n e,0
{fre}copain,k ɔ p ɛ̃,0
{fre}copine,k ɔ p i n,0
{fre}copines,k ɔ p i n,0
{fre}copte,k ɔ p t,0
{fre}copulas,k ɔ p y l ɑ,0
{fre}copulasse,k ɔ p y l a s,0
{fre}coque,k ɔ k,0
{fre}coqueluche,k ɔ k l y ʃ,0
{fre}coquette,k ɔ k ɛ t,0
{fre}corail,k ɔ ʁ a j,0
{fre}coraux,k ɔ ʁ o,0
{fre}corde,k ɔ ʁ d,0
{fre}cordon,k ɔ ʁ d ɔ̃,0
{fre}coriace,k ɔ ʁ j a s,0
{fre}corinne,k ɔ ʁ i n,0
{fre}cormier,k ɔ ʁ m j e,0
{fre}corne,k ɔ ʁ n,0
{fre}corneille,k ɔ ʁ n ɛ j,0
{fre}cornet,k ɔ ʁ n ɛ,0
{fre}cornouaille,k ɔ ʁ n w a j,0
{fre}corp,k ɔ ʁ p,0
{fre}corps,k ɔ ʁ,0
{fre}correction,k ɔ ʁ ɛ k s j ɔ̃,0
{fre}corrections,k ɔ ʁ ɛ k s j ɔ̃,0
{fre}correspondant,k ɔ ʁ ɛ s p ɔ̃ d ɑ̃,0
{fre}correspondent,k ɔ ʁ ɛ s p ɔ̃ d,0
{fre}corriger,k ɔ ʁ i ʒ e,0
{fre}corrompre,k ɔ ʁ ɔ̃ p ʁ,0
{fre}corruption,k ɔ ʁ y p s j ɔ̃,0
{fre}corrélation,k ɔ ʁ e l a s j ɔ̃,0
{fre}corse,k ɔ ʁ s,0
{fre}corset,k ɔ ʁ s ɛ,0
{fre}cortège,k ɔ ʁ t ɛ ʒ,0
{fre}corvette,k ɔ ʁ v ɛ t,0
{fre}corvée,k ɔ ʁ v e,0
{fre}cosmétique,k ɔ s m e t i k,0
{fre}costaud,k ɔ s t o,0
{fre}costume,k ɔ s t y m,0
{fre}cote,k ɔ t,0
{fre}cotisation,k ɔ t i z a s j ɔ̃,0
{fre}coté,k ɔ t e,0
{fre}couac,k w a k,0
{fre}coucher,k u ʃ e,0
{fre}cougar,k u ɡ a ʁ,0
{fre}couler,k u l e,0
{fre}couloir,k u l w a ʁ,0
{fre}coulée,k u l e,0
{fre}country,k œ̃ t ʁ i,0
{fre}coup,k u,0
{fre}coupable,k u p a b l,0
{fre}coupables,k u p a b l,0
{fre}couper,k u p e,0
{fre}couperet,k u p ʁ ɛ,0
{fre}coupole,k u p ɔ l,0
{fre}coupé,k u p e,0
{fre}cour,k u ʁ,0
{fre}courageux,k u ʁ a ʒ ø,0
{fre}courant,k u ʁ ɑ̃,0
{fre}courante,k u ʁ ɑ̃ t,0
{fre}courbe,k u ʁ b,0
{fre}courent,k u ʁ,0
{fre}courir,k u ʁ i ʁ,0
{fre}couronne,k u ʁ ɔ n,0
{fre}couronnement,k u ʁ ɔ n m ɑ̃,0
{fre}couronner,k u ʁ ɔ n e,0
{fre}courriel,k u ʁ j ɛ l,0
{fre}courrier,k u ʁ j e,0
{fre}courroie,k u ʁ w a,0
{fre}cours,k u ʁ,0
{fre}course,k u ʁ s,0
{fre}court,k u ʁ,0
{fre}courtier,k u ʁ t j e,0
{fre}courtois,k u ʁ t w a,0
{fre}courts,k u ʁ,0
{fre}couscous,k u s k u s,0
{fre}cousin,k u z ɛ̃,0
{fre}cousine,k u z i n,0
{fre}coussin,k u s ɛ̃,0
{fre}cout,k u,0
{fre}couteau,k u t o,0
{fre}coutume,k u t y m,0
{fre}couturier,k u t y ʁ j e,0
{fre}couvert,k u v ɛ ʁ,0
{fre}couverture,k u v ɛ ʁ t y ʁ,0
{fre}couvrir,k u v ʁ i ʁ,0
{fre}coyote,k ɔ j ɔ t,0
{fre}coïncider,k ɔ ɛ̃ s i d e,0
{fre}coûteux,k u t ø,0
{fre}cpa,s e p e a,0
{fre}crabe,k ʁ a b,0
{fre}cracher,k ʁ a ʃ e,0
{fre}cracovie,k ʁ a k ɔ v i,0
{fre}crainte,k ʁ ɛ̃ t,0
{fre}cran,k ʁ ɑ̃,0
{fre}crapahutasse,k ʁ a p a y t a s,0
{fre}crapahuter,k ʁ a p a y t e,0
{fre}crapule,k ʁ a p y l,0
{fre}crash,k ʁ a ʃ,0
{fre}cratère,k ʁ a t ɛ ʁ,0
{fre}cravacher,k ʁ a v a ʃ e,0
{fre}cravate,k ʁ a v a t,0
{fre}creuser,k ʁ ø z e,0
{fre}creux,k ʁ ø,0
{fre}crever,k ʁ ə v e,0
{fre}crevé,k ʁ ə v e,0
{fre}cri,k ʁ i,0
{fre}criant,k ʁ i j ɑ̃,0
{fre}crible,k ʁ i b l,0
{fre}crie,k ʁ i,0
{fre}crier,k ʁ i j e,0
{fre}crime,k ʁ i m,0
{fre}cris,k ʁ i,0
{fre}crise,k ʁ i z,0
{fre}crispation,k ʁ i s p a s j ɔ̃,0
{fre}cristal,k ʁ i s t a l,0
{fre}critique,k ʁ i t i k,0
{fre}critiquer,k ʁ i t i k e,0
{fre}critiques,k ʁ i t i k,0
{fre}croatie,k ʁ o a s i,0
{fre}crocheter,k ʁ ɔ ʃ t e,0
{fre}crocodile,k ʁ ɔ k ɔ d i l,0
{fre}croisement,k ʁ w a z m ɑ̃,0
{fre}croiseur,k ʁ w a z œ ʁ,0
{fre}croissance,k ʁ w a s ɑ̃ s,0
{fre}croissant,k ʁ w a s ɑ̃,0
{fre}croisée,k ʁ w a z e,0
{fre}croupit,k ʁ u p i,0
{fre}croyance,k ʁ w ɑ j ɑ̃ s,0
{fre}croît,k ʁ w a,0
{fre}croître,k ʁ w a t ʁ,0
{fre}cruchon,k ʁ y ʃ ɔ̃,0
{fre}crucial,k ʁ y s j a l,0
{fre}cruel,k ʁ y ɛ l,0
{fre}cruelle,k ʁ y ɛ l,0
{fre}crâne,k ʁ ɑ n,0
{fre}crèche,k ʁ ɛ ʃ,0
{fre}crème,k ʁ ɛ m,0
{fre}crèmerie,k ʁ ɛ m ʁ i,0
{fre}créa,k ʁ e a,0
{fre}créateur,k ʁ e a t œ ʁ,0
{fre}créatifs,k ʁ e a t i f,0
{fre}création,k ʁ e a s j ɔ̃,0
{fre}créative,k ʁ e a t i v,0
{fre}créativité,k ʁ e a t i v i t e,0
{fre}crédible,k ʁ e d i b l,0
{fre}crédit,k ʁ e d i,0
{fre}crédo,k ʁ e d o,0
{fre}crée,k ʁ e,0
{fre}créent,k ʁ e,0
{fre}créer,k ʁ e e,0
{fre}créole,k ʁ e ɔ l,0
{fre}crépiter,k ʁ e p i t e,0
{fre}crépuscule,k ʁ e p y s k y l,0
{fre}crû,k ʁ y,0
{fre}cuba,k y b a,0
{fre}cubassiez,k y b a s j e,0
{fre}cube,k y b,0
{fre}cubes,k y b,0
{fre}cueillir,k œ j i ʁ,0
{fre}cuisine,k ɥ i z i n,0
{fre}cuisiner,k ɥ i z i n e,0
{fre}cuisinier,k ɥ i z i n j e,0
{fre}cuisse,k ɥ i s,0
{fre}cuisses,k ɥ i s,0
{fre}cuisson,k ɥ i s ɔ̃,0
{fre}cuit,k ɥ i,0
{fre}cuite,k ɥ i t,0
{fre}cuivra,k ɥ i v ʁ a,0
{fre}cuivre,k ɥ i v ʁ,0
{fre}culot,k y l o,0
{fre}culte,k y l t,0
{fre}cultiver,k y l t i v e,0
{fre}cultivé,k y l t i v e,0
{fre}culture,k y l t y ʁ,0
{fre}cumulait,k y m y l ɛ,0
{fre}cumulative,k y m y l a t i v,0
{fre}cumulatives,k y m y l a t i v,0
{fre}cumule,k y m y l,0
{fre}cumulé,k y m y l e,0
{fre}cupidité,k y p i d i t e,0
{fre}cure,k y ʁ,0
{fre}curie,k y ʁ i,0
{fre}curieux,k y ʁ j ø,0
{fre}curiosité,k y ʁ j o z i t e,0
{fre}curseur,k y ʁ s œ ʁ,0
{fre}cursus,k y ʁ s y s,0
{fre}cuve,k y v,0
{fre}cv,s e v e,0
{fre}cycle,s i k l,0
{fre}cycliques,s i k l i k,0
{fre}cycliste,s i k l i s t,0
{fre}cyclone,s i k l o n,0
{fre}cygnes,s i ɲ,0
{fre}cynique,s i n i k,0
{fre}cyril,s i ʁ i l,0
{fre}cyrille,s i ʁ i l,0
{fre}câble,k ɑ b l,0
{fre}cécile,s e s i l,0
{fre}cécilia,s e s i l j a,0
{fre}cécité,s e s i t e,0
{fre}cédric,s e d ʁ i k,0
{fre}cégétiste,s e ʒ e t i s t,0
{fre}céleri,s ɛ l ʁ i,0
{fre}céleste,s e l ɛ s t,0
{fre}célibataire,s e l i b a t ɛ ʁ,0
{fre}céline,s e l i n,0
{fre}céramique,s e ʁ a m i k,0
{fre}cérébral,s e ʁ e b ʁ a l,0
{fre}cérémonie,s e ʁ e m ɔ n i,0
{fre}cérémonies,s e ʁ e m ɔ n i,0
{fre}césar,s e z a ʁ,0
{fre}côte,k o t,0
{fre}côtière,k o t j ɛ ʁ,0
{fre}côté,k o t e,0
{fre}daller,d a l e,0
{fre}damasse,d a m a s,0
{fre}damien,d a m j ɛ̃,0
{fre}dan,d a n,0
{fre}dance,d ɛ n s,0
{fre}dandiner,d ɑ̃ d i n e,0
{fre}danemark,d a n m a ʁ k,0
{fre}danger,d ɑ̃ ʒ e,0
{fre}dangereuse,d ɑ̃ ʒ ʁ ø z,0
{fre}dangereux,d ɑ̃ ʒ ʁ ø,0
{fre}dangerosité,d ɑ̃ ʒ ʁ o z i t e,0
{fre}danielle,d a n j ɛ l,0
{fre}danièle,d a n j ɛ l,0
{fre}danoise,d a n w a z,0
{fre}danseuse,d ɑ̃ s ø z,0
{fre}das,d a s,0
{fre}dater,d a t e,0
{fre}dauphin,d o f ɛ̃,0
{fre}dauphine,d o f i n,0
{fre}davis,d e v i s,0
{fre}de,d ə,0
{fre}dead,d ɛ d,0
{fre}dealeras,d i l ʁ ɑ,0
{fre}debout,d ə b u,0
{fre}degré,d ə ɡ ʁ e,0
{fre}degrés,d ə ɡ ʁ e,0
{fre}delphine,d ɛ l f i n,0
{fre}delta,d ɛ l t a,0
{fre}delà,d ə l a,0
{fre}demain,d ə m ɛ̃,0
{fre}demande,d ə m ɑ̃ d,0
{fre}demander,d ə m ɑ̃ d e,0
{fre}demandeur,d ə m ɑ̃ d œ ʁ,0
{fre}demeurant,d ə m œ ʁ ɑ̃,0
{fre}demeure,d ə m œ ʁ,0
{fre}demeurer,d ə m œ ʁ e,0
{fre}demeuré,d ə m œ ʁ e,0
{fre}demi,d ə m i,0
{fre}dengue,d ɛ̃ ɡ,0
{fre}denis,d ə n i,0
{fre}denise,d ə n i z,0
{fre}dent,d ɑ̃,0
{fre}dentelle,d ɑ̃ t ɛ l,0
{fre}dentelles,d ɑ̃ t ɛ l,0
{fre}dentier,d ɑ̃ t j e,0
{fre}der,d ɛ ʁ,0
{fre}derby,d ɛ ʁ b i,0
{fre}dernier,d ɛ ʁ n j e,0
{fre}dernièrement,d ɛ ʁ n j ɛ ʁ m ɑ̃,0
{fre}des,d e,0
{fre}descendant,d e s ɑ̃ d ɑ̃,0
{fre}descendants,d ɛ s ɑ̃ d ɑ̃,0
{fre}descendre,d e s ɑ̃ d ʁ,0
{fre}descente,d e s ɑ̃ t,0
{fre}description,d ɛ s k ʁ i p s j ɔ̃,0
{fre}design,d i z a j n,0
{fre}despote,d ɛ s p ɔ t,0
{fre}desquelles,d e k ɛ l,0
{fre}dessein,d e s ɛ̃,0
{fre}desserrassions,d e s e ʁ a s j ɔ̃,0
{fre}dessous,d ə s u,0
{fre}destination,d ɛ s t i n a s j ɔ̃,0
{fre}destinée,d ɛ s t i n e,0
{fre}destruction,d ɛ s t ʁ y k s j ɔ̃,0
{fre}destructrice,d ɛ s t ʁ y k t ʁ i s,0
{fre}deuil,d œ j,0
{fre}deux,d ø,0
{fre}deuxième,d ø z j ɛ m,0
{fre}devait,d ə v ɛ,0
{fre}devance,d ə v ɑ̃ s,0
{fre}devancent,d ə v ɑ̃ s,0
{fre}devancer,d ə v ɑ̃ s e,0
{fre}devancé,d ə v ɑ̃ s e,0
{fre}devant,d ə v ɑ̃,0
{fre}devançant,d ə v ɑ̃ s ɑ̃,0
{fre}devenir,d ə v ə n i ʁ,0
{fre}deviner,d ə v i n e,0
{fre}devoir,d ə v w a ʁ,0
{fre}devoirs,d ə v w a ʁ,0
{fre}devrait,d ə v ʁ ɛ,0
{fre}deçà,d ə s a,0
{fre}dia,d j a,0
{fre}diabolique,d j a b ɔ l i k,0
{fre}dialecte,d j a l ɛ k t,0
{fre}dialogue,d j a l ɔ ɡ,0
{fre}diamant,d j a m ɑ̃,0
{fre}diamante,d j a m ɑ̃ t,0
{fre}diatribe,d j a t ʁ i b,0
{fre}dictateur,d i k t a t œ ʁ,0
{fre}dictature,d i k t a t y ʁ,0
{fre}dicter,d i k t e,0
{fre}dictée,d i k t e,0
{fre}didacticiel,d i d a k t i s j ɛ l,0
{fre}didier,d i d j e,0
{fre}diffamation,d i f a m a s j ɔ̃,0
{fre}difficile,d i f i s i l,0
{fre}difficilement,d i f i s i l m ɑ̃,0
{fre}difficulté,d i f i k y l t e,0
{fre}diffuse,d i f y z,0
{fre}diffuser,d i f y z e,0
{fre}différemment,d i f e ʁ a m ɑ̃,0
{fre}différence,d i f e ʁ ɑ̃ s,0
{fre}différencier,d i f e ʁ ɑ̃ s j e,0
{fre}différend,d i f e ʁ ɑ̃,0
{fre}différent,d i f e ʁ ɑ̃,0
{fre}digital,d i ʒ i t a l,0
{fre}digitale,d i ʒ i t a l,0
{fre}digitales,d i ʒ i t a l,0
{fre}digne,d i ɲ,0
{fre}dignité,d i ɲ i t e,0
{fre}digue,d i ɡ,0
{fre}dijon,d i ʒ ɔ̃,0
{fre}dilettante,d i l ɛ t ɑ̃ t,0
{fre}diluviens,d i l y v j ɛ̃,0
{fre}dimanche,d i m ɑ̃ ʃ,0
{fre}dimension,d i m ɑ̃ s j ɔ̃,0
{fre}diminuer,d i m i n ɥ e,0
{fre}dimitri,d i m i t ʁ i,0
{fre}diocèse,d j ɔ s ɛ z,0
{fre}diplomatie,d i p l ɔ m a s i,0
{fre}diplôme,d i p l o m,0
{fre}diplômes,d i p l o m,0
{fre}dira,d i ʁ a,0
{fre}dirai,d i ʁ e,0
{fre}dirais,d i ʁ ɛ,0
{fre}dirait,d i ʁ ɛ,0
{fre}dire,d i ʁ,0
{fre}directe,d i ʁ ɛ k t,0
{fre}directement,d i ʁ ɛ k t ə m ɑ̃,0
{fre}directes,d i ʁ ɛ k t,0
{fre}directeur,d i ʁ ɛ k t œ ʁ,0
{fre}direction,d i ʁ ɛ k s j ɔ̃,0
{fre}directive,d i ʁ ɛ k t i v,0
{fre}directrice,d i ʁ ɛ k t ʁ i s,0
{fre}dirige,d i ʁ i ʒ,0
{fre}dirigeant,d i ʁ i ʒ ɑ̃,0
{fre}dirigent,d i ʁ i ʒ ɑ̃,0
{fre}diriger,d i ʁ i ʒ e,0
{fre}dirons,d i ʁ ɔ̃,0
{fre}diront,d i ʁ ɔ̃,0
{fre}dis,d i,0
{fre}disaient,d i z ɛ,0
{fre}disais,d i z ɛ,0
{fre}disait,d i z ɛ,0
{fre}disciplinaire,d i s i p l i n ɛ ʁ,0
{fre}discipline,d i s i p l i n,0
{fre}discorde,d i s k ɔ ʁ d,0
{fre}discothèque,d i s k ɔ t ɛ k,0
{fre}discours,d i s k u ʁ,0
{fre}discrimination,d i s k ʁ i m i n a s j ɔ̃,0
{fre}discriminatoire,d i s k ʁ i m i n a t w a ʁ,0
{fre}discrètement,d i s k ʁ ɛ t m ɑ̃,0
{fre}discussion,d i s k y s j ɔ̃,0
{fre}discussions,d i s k y s j ɔ̃,0
{fre}discutable,d i s k y t a b l,0
{fre}discuter,d i s k y t e,0
{fre}dise,d i z,0
{fre}disent,d i z,0
{fre}disette,d i z ɛ t,0
{fre}diseur,d i z œ ʁ,0
{fre}disions,d i z j ɔ̃,0
{fre}disons,d i z ɔ̃,0
{fre}disparaître,d i s p a ʁ ɛ t ʁ,0
{fre}disparition,d i s p a ʁ i s j ɔ̃,0
{fre}disperse,d i s p ɛ ʁ s,0
{fre}disponibilité,d i s p ɔ n i b i l i t e,0
{fre}disponible,d i s p ɔ n i b l,0
{fre}dispositif,d i s p o z i t i f,0
{fre}dispute,d i s p y t,0
{fre}disputer,d i s p y t e,0
{fre}disque,d i s k,0
{fre}dissident,d i s i d ɑ̃,0
{fre}distinction,d i s t ɛ̃ k s j ɔ̃,0
{fre}distincts,d i s t ɛ̃,0
{fre}distinguer,d i s t ɛ̃ ɡ e,0
{fre}distorsion,d i s t ɔ ʁ s j ɔ̃,0
{fre}distraire,d i s t ʁ ɛ ʁ,0
{fre}distrayant,d i s t ʁ ɛ j ɑ̃,0
{fre}distribuer,d i s t ʁ i b ɥ e,0
{fre}distributeur,d i s t ʁ i b y t œ ʁ,0
{fre}distribution,d i s t ʁ i b y s j ɔ̃,0
{fre}dit,d i,0
{fre}dite,d i t,0
{fre}dites,d i t,0
{fre}divan,d i v ɑ̃,0
{fre}divergeas,d i v ɛ ʁ ʒ ɑ,0
{fre}divers,d i v ɛ ʁ,0
{fre}diversifiée,d i v ɛ ʁ s i f j e,0
{fre}diversité,d i v ɛ ʁ s i t e,0
{fre}divertissement,d i v ɛ ʁ t i s m ɑ̃,0
{fre}dividende,d i v i d ɑ̃ d,0
{fre}diviser,d i v i z e,0
{fre}divorce,d i v ɔ ʁ s,0
{fre}divorcée,d i v ɔ ʁ s e,0
{fre}dixième,d i z j ɛ m,0
{fre}djibouti,d ʒ i b u t i,0
{fre}do,d o,0
{fre}docte,d ɔ k t,0
{fre}document,d ɔ k y m ɑ̃,0
{fre}documentaire,d ɔ k y m ɑ̃ t ɛ ʁ,0
{fre}documentation,d ɔ k y m ɑ̃ t a s j ɔ̃,0
{fre}documenter,d ɔ k y m ɑ̃ t e,0
{fre}dogme,d ɔ ɡ m,0
{fre}doigt,d w a,0
{fre}dois,d w a,0
{fre}doit,d w a,0
{fre}dollar,d ɔ l a ʁ,0
{fre}domaine,d ɔ m ɛ n,0
{fre}domestique,d ɔ m ɛ s t i k,0
{fre}domestiques,d ɔ m ɛ s t i k,0
{fre}domicile,d ɔ m i s i l,0
{fre}dominant,d ɔ m i n ɑ̃,0
{fre}dominateurs,d ɔ m i n a t œ ʁ,0
{fre}dominer,d ɔ m i n e,0
{fre}dominion,d ɔ m i n j ɔ̃,0
{fre}dominique,d ɔ m i n i k,0
{fre}dommage,d ɔ m a ʒ,0
{fre}don,d ɔ̃,0
{fre}donc,d ɔ̃ k,0
{fre}donne,d ɔ n,0
{fre}donner,d ɔ n e,0
{fre}donnée,d ɔ n e,0
{fre}dons,d ɔ̃,0
{fre}dont,d ɔ̃,0
{fre}dopamine,d ɔ p a m i n,0
{fre}dordogne,d ɔ ʁ d ɔ ɲ,0
{fre}dorment,d ɔ ʁ m,0
{fre}dormi,d ɔ ʁ m i,0
{fre}dormir,d ɔ ʁ m i ʁ,0
{fre}dorothée,d ɔ ʁ ɔ t e,0
{fre}dors,d ɔ ʁ,0
{fre}dort,d ɔ ʁ,0
{fre}doré,d ɔ ʁ e,0
{fre}dos,d o,0
{fre}dosage,d o z a ʒ,0
{fre}dose,d o z,0
{fre}dote,d ɔ t,0
{fre}doter,d ɔ t e,0
{fre}dotée,d ɔ t e,0
{fre}dotées,d ɔ t e,0
{fre}dotés,d ɔ t e,0
{fre}douane,d w a n,0
{fre}doublage,d u b l a ʒ,0
{fre}double,d u b l,0
{fre}doubler,d u b l e,0
{fre}doubles,d u b l,0
{fre}doublure,d u b l y ʁ,0
{fre}doubs,d u,0
{fre}doucement,d u s m ɑ̃,0
{fre}douceur,d u s œ ʁ,0
{fre}douche,d u ʃ,0
{fre}douillet,d u j ɛ,0
{fre}douloureux,d u l u ʁ ø,0
{fre}doute,d u t,0
{fre}douter,d u t e,0
{fre}doux,d u,0
{fre}douze,d u z,0
{fre}douzième,d u z j ɛ m,0
{fre}douée,d w e,0
{fre}dragon,d ʁ a ɡ ɔ̃,0
{fre}drakkar,d ʁ a k a ʁ,0
{fre}drame,d ʁ a m,0
{fre}drapeau,d ʁ a p o,0
{fre}draveur,d ʁ a v œ ʁ,0
{fre}drogue,d ʁ ɔ ɡ,0
{fre}drogueront,d ʁ ɔ ɡ ʁ ɔ̃,0
{fre}droit,d ʁ w ɑ,0
{fre}droite,d ʁ w a t,0
{fre}droiture,d ʁ w a t y ʁ,0
{fre}drop,d ʁ ɔ p,0
{fre}drôle,d ʁ o l,0
{fre}drôles,d ʁ o l,0
{fre}drôme,d ʁ o m,0
{fre}dubaï,d u b a j,0
{fre}dublin,d y b l ɛ̃,0
{fre}due,d y,0
{fre}dues,d y,0
{fre}duettos,d ɥ ɛ t o,0
{fre}dune,d y n,0
{fre}dunkerque,d œ̃ k ɛ ʁ k,0
{fre}duo,d ɥ o,0
{fre}duquel,d y k ɛ l,0
{fre}dur,d y ʁ,0
{fre}dura,d y ʁ a,0
{fre}durant,d y ʁ ɑ̃,0
{fre}durci,d y ʁ s i,0
{fre}durcir,d y ʁ s i ʁ,0
{fre}durcisse,d y ʁ s i s,0
{fre}durcit,d y ʁ s i,0
{fre}dure,d y ʁ,0
{fre}durer,d y ʁ e,0
{fre}durera,d y ʁ ə ʁ a,0
{fre}dures,d y ʁ,0
{fre}dureté,d y ʁ t e,0
{fre}durs,d y ʁ,0
{fre}durée,d y ʁ e,0
{fre}dus,d y,0
{fre}dut,d y,0
{fre}dylan,d i l a n,0
{fre}dynamique,d i n a m i k,0
{fre}dynamisassent,d i n a m i z a s,0
{fre}dysfonctionnement,d i s f ɔ̃ k s j ɔ n m ɑ̃,0
{fre}dès,d ɛ,0
{fre}débarrasser,d e b a ʁ a s e,0
{fre}débat,d e b a,0
{fre}débattre,d e b a t ʁ,0
{fre}débilitons,d e b i l i t ɔ̃,0
{fre}débit,d e b i,0
{fre}débiteur,d e b i t œ ʁ,0
{fre}déblayer,d e b l ɛ j e,0
{fre}déblocage,d e b l ɔ k a ʒ,0
{fre}déboires,d e b w a ʁ,0
{fre}débordement,d e b ɔ ʁ d ə m ɑ̃,0
{fre}déborder,d e b ɔ ʁ d e,0
{fre}déboucher,d e b u ʃ e,0
{fre}débouché,d e b u ʃ e,0
{fre}débridement,d e b ʁ i d m ɑ̃,0
{fre}débris,d e b ʁ i,0
{fre}débrouiller,d e b ʁ u j e,0
{fre}décadence,d e k a d ɑ̃ s,0
{fre}décaler,d e k a l e,0
{fre}décalque,d e k a l k,0
{fre}décalé,d e k a l e,0
{fre}décanter,d e k ɑ̃ t e,0
{fre}décaper,d e k a p e,0
{fre}décennie,d e s e n i,0
{fre}décevoir,d e s ə v w a ʁ,0
{fre}décharger,d e ʃ a ʁ ʒ e,0
{fre}déchet,d e ʃ ɛ,0
{fre}déchets,d e ʃ ɛ,0
{fre}déchirant,d e ʃ i ʁ ɑ̃,0
{fre}déchirure,d e ʃ i ʁ y ʁ,0
{fre}décider,d e s i d e,0
{fre}décidément,d e s i d e m ɑ̃,0
{fre}décision,d e s i z j ɔ̃,0
{fre}déclaration,d e k l a ʁ a s j ɔ̃,0
{fre}déclarer,d e k l a ʁ e,0
{fre}déclencher,d e k l ɑ̃ ʃ e,0
{fre}déclinaison,d e k l i n ɛ z ɔ̃,0
{fre}déclinante,d e k l i n ɑ̃ t,0
{fre}décliner,d e k l i n e,0
{fre}décoder,d e k ɔ d e,0
{fre}décodé,d e k ɔ d e,0
{fre}décoiffer,d e k w a f e,0
{fre}décollage,d e k ɔ l a ʒ,0
{fre}décoller,d e k ɔ l e,0
{fre}décor,d e k ɔ ʁ,0
{fre}décoration,d e k ɔ ʁ a s j ɔ̃,0
{fre}décorations,d e k ɔ ʁ a s j ɔ̃,0
{fre}décordons,d e k ɔ ʁ d ɔ̃,0
{fre}découdre,d e k u d ʁ,0
{fre}découpage,d e k u p a ʒ,0
{fre}décourager,d e k u ʁ a ʒ e,0
{fre}découverte,d e k u v ɛ ʁ t,0
{fre}découvrir,d e k u v ʁ i ʁ,0
{fre}décret,d e k ʁ ɛ,0
{fre}décrire,d e k ʁ i ʁ,0
{fre}décrocher,d e k ʁ ɔ ʃ e,0
{fre}décrypte,d e k ʁ i p t,0
{fre}déculpabiliser,d e k y l p a b i l i z e,0
{fre}décès,d e s ɛ,0
{fre}dédale,d e d a l,0
{fre}dédier,d e d j e,0
{fre}dédommagement,d e d ɔ m a ʒ m ɑ̃,0
{fre}dédramatiser,d e d ʁ a m a t i z e,0
{fre}déduction,d e d y k s j ɔ̃,0
{fre}déduire,d e d ɥ i ʁ,0
{fre}défaire,d e f ɛ ʁ,0
{fre}défaite,d e f ɛ t,0
{fre}défaut,d e f o,0
{fre}défendre,d e f ɑ̃ d ʁ,0
{fre}défendu,d e f ɑ̃ d y,0
{fre}défense,d e f ɑ̃ s,0
{fre}défi,d e f i,0
{fre}déficit,d e f i s i t,0
{fre}défier,d e f j e,0
{fre}défini,d e f i n i,0
{fre}définir,d e f i n i ʁ,0
{fre}définitif,d e f i n i t i f,0
{fre}définition,d e f i n i s j ɔ̃,0
{fre}définitive,d e f i n i t i v,0
{fre}définitivement,d e f i n i t i v m ɑ̃,0
{fre}déflation,d e f l a s j ɔ̃,0
{fre}déforestation,d e f ɔ ʁ ɛ s t a s j ɔ̃,0
{fre}dégager,d e ɡ a ʒ e,0
{fre}dégainer,d e ɡ ɛ n e,0
{fre}dégel,d e ʒ ɛ l,0
{fre}déglinguerais,d e ɡ l ɛ̃ ɡ ʁ ɛ,0
{fre}déglinguions,d e ɡ l ɛ̃ ɡ j ɔ̃,0
{fre}dégourdir,d e ɡ u ʁ d i ʁ,0
{fre}dégoût,d e ɡ u,0
{fre}dégringolade,d e ɡ ʁ ɛ̃ ɡ ɔ l a d,0
{fre}dégueulasse,d e ɡ œ l a s,0
{fre}déguster,d e ɡ y s t e,0
{fre}dégénéré,d e ʒ e n e ʁ e,0
{fre}déhancher,d e ɑ̃ ʃ e,0
{fre}déjeuné,d e ʒ œ n e,0
{fre}déjouer,d e ʒ w e,0
{fre}déjà,d e ʒ a,0
{fre}délabre,d e l a b ʁ,0
{fre}délai,d e l ɛ,0
{fre}délation,d e l a s j ɔ̃,0
{fre}délibérations,d e l i b e ʁ a s j ɔ̃,0
{fre}délicieux,d e l i s j ø,0
{fre}délictueux,d e l i k t ɥ ø,0
{fre}délire,d e l i ʁ,0
{fre}délivrance,d e l i v ʁ ɑ̃ s,0
{fre}délivrer,d e l i v ʁ e,0
{fre}délogera,d e l ɔ ʒ ʁ a,0
{fre}déluge,d e l y ʒ,0
{fre}délégation,d e l e ɡ a s j ɔ̃,0
{fre}démarche,d e m a ʁ ʃ,0
{fre}démarcher,d e m a ʁ ʃ e,0
{fre}démarquer,d e m a ʁ k e,0
{fre}démembrer,d e m ɑ̃ b ʁ e,0
{fre}démembrions,d e m ɑ̃ b ʁ i j ɔ̃,0
{fre}dément,d e m ɑ̃,0
{fre}démenti,d e m ɑ̃ t i,0
{fre}démentir,d e m ɑ̃ t i ʁ,0
{fre}démentis,d e m ɑ̃ t i,0
{fre}démis,d e m i,0
{fre}démission,d e m i s j ɔ̃,0
{fre}démissionnaire,d e m i s j ɔ n ɛ ʁ,0
{fre}démocrate,d e m ɔ k ʁ a t,0
{fre}démocrates,d e m ɔ k ʁ a t,0
{fre}démocratie,d e m ɔ k ʁ a s i,0
{fre}démocraties,d e m ɔ k ʁ a s i,0
{fre}démocratique,d e m ɔ k ʁ a t i k,0
{fre}démocratiques,d e m ɔ k ʁ a t i k,0
{fre}démographique,d e m ɔ ɡ ʁ a f i k,0
{fre}démolir,d e m ɔ l i ʁ,0
{fre}démoniaque,d e m ɔ n j a k,0
{fre}démonstration,d e m ɔ̃ s t ʁ a s j ɔ̃,0
{fre}démontrer,d e m ɔ̃ t ʁ e,0
{fre}démosthène,d e m ɔ s t ɛ n,0
{fre}déménagement,d e m e n a ʒ m ɑ̃,0
{fre}dénaturé,d e n a t y ʁ e,0
{fre}déni,d e n i,0
{fre}dénicher,d e n i ʃ e,0
{fre}dénombrer,d e n ɔ̃ b ʁ e,0
{fre}dénomination,d e n ɔ m i n a s j ɔ̃,0
{fre}dénonce,d e n ɔ̃ s,0
{fre}dénoncent,d e n ɔ̃ s,0
{fre}dénoncer,d e n ɔ̃ s e,0
{fre}dénonciation,d e n ɔ̃ s j a s j ɔ̃,0
{fre}dénoncé,d e n ɔ̃ s e,0
{fre}dénonçait,d e n ɔ̃ s ɛ,0
{fre}dénonçant,d e n ɔ̃ s ɑ̃,0
{fre}déodorant,d e ɔ d ɔ ʁ ɑ̃,0
{fre}déontologie,d e ɔ̃ t ɔ l ɔ ʒ i,0
{fre}département,d e p a ʁ t ə m ɑ̃,0
{fre}départemental,d e p a ʁ t ə m ɑ̃ t a l,0
{fre}départementale,d e p a ʁ t ə m ɑ̃ t a l,0
{fre}dépendance,d e p ɑ̃ d ɑ̃ s,0
{fre}dépendant,d e p ɑ̃ d ɑ̃,0
{fre}dépens,d e p ɑ̃,0
{fre}dépense,d e p ɑ̃ s,0
{fre}dépenser,d e p ɑ̃ s e,0
{fre}dépenses,d e p ɑ̃ s,0
{fre}dépistasse,d e p i s t a s,0
{fre}dépit,d e p i,0
{fre}dépité,d e p i t e,0
{fre}déplacement,d e p l a s m ɑ̃,0
{fre}déplacer,d e p l a s e,0
{fre}déplacé,d e p l a s e,0
{fre}dépliants,d e p l i j ɑ̃,0
{fre}déplorable,d e p l ɔ ʁ a b l,0
{fre}déployer,d e p l w a j e,0
{fre}déposer,d e p o z e,0
{fre}déposséder,d e p ɔ s e d e,0
{fre}dépouille,d e p u j,0
{fre}dépouillement,d e p u j m ɑ̃,0
{fre}dépourvu,d e p u ʁ v y,0
{fre}dépresseur,d e p ʁ ɛ s œ ʁ,0
{fre}dépressif,d e p ʁ ɛ s i f,0
{fre}dépression,d e p ʁ ɛ s j ɔ̃,0
{fre}dépurâmes,d e p y ʁ ɑ m,0
{fre}députée,d e p y t e,0
{fre}dépêche,d e p ɛ ʃ,0
{fre}dépôt,d e p o,0
{fre}déracinement,d e ʁ a s i n m ɑ̃,0
{fre}dérailler,d e ʁ ɑ j e,0
{fre}dérapage,d e ʁ a p a ʒ,0
{fre}dériver,d e ʁ i v e,0
{fre}dérivé,d e ʁ i v e,0
{fre}dérober,d e ʁ ɔ b e,0
{fre}dérobé,d e ʁ ɔ b e,0
{fre}dérogation,d e ʁ ɔ ɡ a s j ɔ̃,0
{fre}dérouler,d e ʁ u l e,0
{fre}déroute,d e ʁ u t,0
{fre}déréférencent,d e ʁ e f e ʁ ɑ̃ s,0
{fre}désaccord,d e z a k ɔ ʁ,0
{fre}désagréable,d e z a ɡ ʁ e a b l,0
{fre}désamour,d e z a m u ʁ,0
{fre}désarroi,d e z a ʁ w a,0
{fre}désarçonner,d e z a ʁ s ɔ n e,0
{fre}désastre,d e z a s t ʁ,0
{fre}désastres,d e z a s t ʁ,0
{fre}désaveu,d e z a v ø,0
{fre}désert,d e z ɛ ʁ,0
{fre}déserte,d e z ɛ ʁ t,0
{fre}désespoir,d e z ɛ s p w a ʁ,0
{fre}désespérant,d e z ɛ s p e ʁ ɑ̃,0
{fre}déshonneur,d e z ɔ n œ ʁ,0
{fre}désigner,d e z i ɲ e,0
{fre}désinvestir,d e z ɛ̃ v ɛ s t i ʁ,0
{fre}désireux,d e z i ʁ ø,0
{fre}désirs,d e z i ʁ,0
{fre}désobligeant,d e z ɔ b l i ʒ ɑ̃,0
{fre}désobéissance,d e z ɔ b e i s ɑ̃ s,0
{fre}désolé,d e z ɔ l e,0
{fre}désordre,d e z ɔ ʁ d ʁ,0
{fre}désormais,d e z ɔ ʁ m ɛ,0
{fre}désossé,d e z ɔ s e,0
{fre}déséquilibrer,d e z e k i l i b ʁ e,0
{fre}détail,d e t a j,0
{fre}détailler,d e t a j e,0
{fre}détenait,d e t n ɛ,0
{fre}détenteur,d e t ɑ̃ t œ ʁ,0
{fre}déterminer,d e t ɛ ʁ m i n e,0
{fre}déterminé,d e t ɛ ʁ m i n e,0
{fre}détester,d e t ɛ s t e,0
{fre}détiendra,d e t j ɛ̃ d ʁ a,0
{fre}détiennent,d e t j ɛ n ɛ,0
{fre}détour,d e t u ʁ,0
{fre}détournement,d e t u ʁ n ə m ɑ̃,0
{fre}détournée,d e t u ʁ n e,0
{fre}détresse,d e t ʁ ɛ s,0
{fre}détruire,d e t ʁ ɥ i ʁ,0
{fre}détrôner,d e t ʁ o n e,0
{fre}détériorer,d e t e ʁ j ɔ ʁ e,0
{fre}dévaliser,d e v a l i z e,0
{fre}dévalué,d e v a l ɥ e,0
{fre}développer,d e v l ɔ p e,0
{fre}développé,d e v l ɔ p e,0
{fre}déviation,d e v j a s j ɔ̃,0
{fre}dévier,d e v j e,0
{fre}dévoiler,d e v w a l e,0
{fre}dévouement,d e v u m ɑ̃,0
{fre}dévoué,d e v w e,0
{fre}déçu,d e s y,0
{fre}dôme,d o m,0
{fre}dû,d y,0
{fre}dûment,d y m ɑ̃,0
{fre}ed,ɛ d,0
{fre}edouard,e d w a ʁ,0
{fre}effacer,e f a s e,0
{fre}effectifs,e f ɛ k t i f,0
{fre}effective,e f ɛ k t i v,0
{fre}effectivement,e f ɛ k t i v m ɑ̃,0
{fre}effet,e f ɛ,0
{fre}efficace,e f i k a s,0
{fre}efficacement,e f i k a s m ɑ̃,0
{fre}efficacité,ɛ f i k a s i t e,0
{fre}efficiente,e f i s j ɑ̃ t,0
{fre}effondrement,ɛ f ɔ̃ d ʁ ə m ɑ̃,0
{fre}effondrer,e f ɔ̃ d ʁ e,0
{fre}effort,e f ɔ ʁ,0
{fre}effraction,e f ʁ a k s j ɔ̃,0
{fre}effraie,e f ʁ ɛ,0
{fre}effrité,e f ʁ i t e,0
{fre}egypte,e ʒ i p t,0
{fre}elles,ɛ l,0
{fre}elliptique,e l i p t i k,0
{fre}embarcation,ɑ̃ b a ʁ k a s j ɔ̃,0
{fre}embardée,ɑ̃ b a ʁ d e,0
{fre}embargo,ɑ̃ b a ʁ ɡ o,0
{fre}embarquer,ɑ̃ b a ʁ k e,0
