merged_spelling,ipa,langid
{fre}guidé,ɡ i d e,0
{fre}guillaume,ɡ i j o m,0
{fre}guingamp,ɡ ɛ̃ ɡ ɑ̃,0
{fre}guinée,ɡ i n e,0
{fre}guinéen,ɡ i n e ɛ̃,0
{fre}guitare,ɡ i t a ʁ,0
{fre}gus,ɡ y s,0
{fre}guy,ɡ i,0
{fre}guère,ɡ ɛ ʁ,0
{fre}guérir,ɡ e ʁ i ʁ,0
{fre}guérison,ɡ e ʁ i z ɔ̃,0
{fre}guérisseur,ɡ e ʁ i s œ ʁ,0
{fre}guêtres,ɡ ɛ t ʁ,0
{fre}gâcher,ɡ ɑ ʃ e,0
{fre}gâchette,ɡ a ʃ ɛ t,0
{fre}gâteau,ɡ ɑ t o,0
{fre}gâteaux,ɡ ɑ t o,0
{fre}gène,ʒ ɛ n,0
{fre}géant,ʒ e ɑ̃,0
{fre}génial,ʒ e n j a l,0
{fre}génie,ʒ e n i,0
{fre}génital,ʒ e n i t a l,0
{fre}génitales,ʒ e n i t a l,0
{fre}génocide,ʒ e n ɔ s i d,0
{fre}génomique,ʒ e n ɔ m i k,0
{fre}général,ʒ e n e ʁ a l,0
{fre}générale,ʒ e n e ʁ a l,0
{fre}générales,ʒ e n e ʁ a l,0
{fre}génération,ʒ e n e ʁ a s j ɔ̃,0
{fre}généreux,ʒ e n e ʁ ø,0
{fre}générosité,ʒ e n e ʁ o z i t e,0
{fre}génétique,ʒ e n e t i k,0
{fre}génétiquement,ʒ e n e t i k m ɑ̃,0
{fre}génétiques,ʒ e n e t i k,0
{fre}géographie,ʒ e ɔ ɡ ʁ a f i,0
{fre}géographique,ʒ e ɔ ɡ ʁ a f i k,0
{fre}géologie,ʒ e ɔ l ɔ ʒ i,0
{fre}géologique,ʒ e ɔ l ɔ ʒ i k,0
{fre}géophysicien,ʒ e o f i z i s j ɛ̃,0
{fre}géophysique,ʒ e o f i z i k,0
{fre}géorgie,ʒ e ɔ ʁ ʒ i,0
{fre}géraldine,ʒ e ʁ a l d i n,0
{fre}gérant,ʒ e ʁ ɑ̃,0
{fre}gérard,ʒ e ʁ a ʁ,0
{fre}gérer,ʒ e ʁ e,0
{fre}habile,a b i l,0
{fre}habilement,a b i l m ɑ̃,0
{fre}habiletés,a b i l t e,0
{fre}habilité,a b i l i t e,0
{fre}habillage,a b i j a ʒ,0
{fre}habit,a b i,0
{fre}habitat,a b i t a,0
{fre}habits,a b i,0
{fre}habituelles,a b i t ɥ ɛ l,0
{fre}habitué,a b i t ɥ e,0
{fre}hache,a ʃ,0
{fre}haine,ɛ n,0
{fre}haleine,a l ɛ n,0
{fre}hall,o l,0
{fre}hallucinant,a l y s i n ɑ̃,0
{fre}hallucination,a l y s i n a s j ɔ̃,0
{fre}halte,a l t,0
{fre}haltère,a l t ɛ ʁ,0
{fre}hambourg,ɑ̃ b u ʁ,0
{fre}hanche,ɑ̃ ʃ,0
{fre}handball,ɑ̃ d b a l,0
{fre}handicap,ɑ̃ d i k a p,0
{fre}harassant,a ʁ a s ɑ̃,0
{fre}harcèlement,a ʁ s ɛ l m ɑ̃,0
{fre}harcèlements,a ʁ s ɛ l m ɑ̃,0
{fre}hargneux,a ʁ ɲ ø,0
{fre}harmonieuse,a ʁ m ɔ n j ø z,0
{fre}haro,a ʁ o,0
{fre}harper,a ʁ p e,0
{fre}hasard,a z a ʁ,0
{fre}hausse,o s,0
{fre}hausser,o s e,0
{fre}haussier,o s j e,0
{fre}haussé,o s e,0
{fre}haute,o t,0
{fre}havre,ɑ v ʁ,0
{fre}hawaï,a w a j,0
{fre}haïti,a i t i,0
{fre}hebdomadaire,ɛ b d ɔ m a d ɛ ʁ,0
{fre}henri,ɑ̃ ʁ i,0
{fre}henry,ɑ̃ ʁ i,0
{fre}herbe,ɛ ʁ b,0
{fre}hernie,ɛ ʁ n i,0
{fre}hervé,ɛ ʁ v e,0
{fre}heure,œ ʁ,0
{fre}heures,œ ʁ,0
{fre}hexagone,ɛ ɡ z a ɡ ɔ n,0
{fre}hic,i k,0
{fre}hidjab,i d ʒ a b,0
{fre}hilarant,i l a ʁ ɑ̃,0
{fre}hindou,ɛ̃ d u,0
{fre}hisser,i s e,0
{fre}historien,i s t ɔ ʁ j ɛ̃,0
{fre}historique,i s t ɔ ʁ i k,0
{fre}hiver,i v ɛ ʁ,0
{fre}hivernal,i v ɛ ʁ n a l,0
{fre}hiérarchique,j e ʁ a ʁ ʃ i k,0
{fre}hockey,ɔ k ɛ,0
{fre}hollandais,ɔ l ɑ̃ d ɛ,0
{fre}hollandaise,ɔ l ɑ̃ d ɛ z,0
{fre}hollande,ɔ l ɑ̃ d,0
{fre}homme,ɔ m,0
{fre}hommes,ɔ m,0
{fre}homonyme,ɔ m ɔ n i m,0
{fre}homosexualité,ɔ m ɔ s ɛ k s ɥ a l i t e,0
{fre}homosexuel,ɔ m ɔ s ɛ k s ɥ ɛ l,0
{fre}honduras,ɔ̃ d y ʁ a s,0
{fre}hongrie,ɔ̃ ɡ ʁ i,0
{fre}hongrois,ɔ̃ ɡ ʁ w a,0
{fre}honneur,ɔ n œ ʁ,0
{fre}honnête,ɔ n ɛ t,0
{fre}honnêtement,ɔ n ɛ t m ɑ̃,0
{fre}honte,ɔ̃ t,0
{fre}honteux,ɔ̃ t ø,0
{fre}hop,ɔ p,0
{fre}horaire,ɔ ʁ ɛ ʁ,0
{fre}horizon,ɔ ʁ i z ɔ̃,0
{fre}horizons,ɔ ʁ i z ɔ̃,0
{fre}horizontale,ɔ ʁ i z ɔ̃ t a l,0
{fre}horizontaliserons,ɔ ʁ i z ɔ̃ t a l i z ʁ ɔ̃,0
{fre}horizontalisons,ɔ ʁ i z ɔ̃ t a l i z ɔ̃,0
{fre}horloger,ɔ ʁ l ɔ ʒ e,0
{fre}hormis,ɔ ʁ m i,0
{fre}hormone,ɔ ʁ m ɔ n,0
{fre}horreur,ɔ ʁ œ ʁ,0
{fre}hors,ɔ ʁ,0
{fre}hortense,ɔ ʁ t ɑ̃ s,0
{fre}hospitalier,ɔ s p i t a l j e,0
{fre}hospitalité,ɔ s p i t a l i t e,0
{fre}houlette,u l ɛ t,0
{fre}houleux,u l ø,0
{fre}house,a w s,0
{fre}houspillerai,u s p i j ʁ e,0
{fre}hugo,y ɡ o,0
{fre}huguette,y ɡ ɛ t,0
{fre}hui,ɥ i,0
{fre}huile,ɥ i l,0
{fre}huis,ɥ i,0
{fre}huissier,ɥ i s j e,0
{fre}huitièmes,ɥ i t j ɛ m,0
{fre}hulotte,y l ɔ t,0
{fre}humain,y m ɛ̃,0
{fre}humaines,y m ɛ n,0
{fre}humains,y m ɛ̃,0
{fre}humanité,y m a n i t e,0
{fre}humanités,y m a n i t e,0
{fre}humbert,œ̃ b ɛ ʁ,0
{fre}humble,œ̃ b l,0
{fre}humer,y m e,0
{fre}humide,y m i d,0
{fre}humides,y m i d,0
{fre}humiliant,y m i l j ɑ̃,0
{fre}humiliante,y m i l j ɑ̃ t,0
{fre}humilier,y m i l j e,0
{fre}humilité,y m i l i t e,0
{fre}huppé,y p e,0
{fre}hurlant,y ʁ l ɑ̃,0
{fre}hurler,y ʁ l e,0
{fre}hybride,i b ʁ i d,0
{fre}hygiène,i ʒ j ɛ n,0
{fre}hypermarché,i p ɛ ʁ m a ʁ ʃ e,0
{fre}hypocondriaque,i p ɔ k ɔ̃ d ʁ i j a k,0
{fre}hypocrisie,i p ɔ k ʁ i z i,0
{fre}hypothèse,i p ɔ t ɛ z,0
{fre}hâte,ɑ t,0
{fre}hâter,ɑ t e,0
{fre}hâtive,ɑ t i v,0
{fre}hâtivement,ɑ t i v m ɑ̃,0
{fre}hébergement,e b ɛ ʁ ʒ ə m ɑ̃,0
{fre}héberger,e b ɛ ʁ ʒ e,0
{fre}hébert,e b ɛ ʁ,0
{fre}hébreu,e b ʁ ø,0
{fre}hélicoptère,e l i k ɔ p t ɛ ʁ,0
{fre}hémorragie,e m ɔ ʁ a ʒ i,0
{fre}hémorroïdes,e m ɔ ʁ ɔ i d,0
{fre}hérault,e ʁ o,0
{fre}héritiers,e ʁ i t j e,0
{fre}héroïne,e ʁ ɔ i n,0
{fre}hésite,e z i t,0
{fre}hésitent,e z i t,0
{fre}hésiter,e z i t e,0
{fre}hésitez,e z i t e,0
{fre}hôte,o t,0
{fre}hôtellerie,o t ɛ l ʁ i,0
{fre}hôtesse,o t ɛ s,0
{fre}ici,i s i,0
{fre}idem,i d ɛ m,0
{fre}identification,i d ɑ̃ t i f i k a s j ɔ̃,0
{fre}identifier,i d ɑ̃ t i f j e,0
{fre}identité,i d ɑ̃ t i t e,0
{fre}idiot,i d j o,0
{fre}idyllique,i d i l i k,0
{fre}idéal,i d e a l,0
{fre}idéaliste,i d e a l i s t,0
{fre}idée,i d e,0
{fre}idéologie,i d e ɔ l ɔ ʒ i,0
{fre}ignifuger,i ɡ n i f y ʒ e,0
{fre}ignorance,i ɲ ɔ ʁ ɑ̃ s,0
{fre}ignorer,i ɲ ɔ ʁ e,0
{fre}illicite,i l i s i t,0
{fre}illimité,i l i m i t e,0
{fre}illinois,i l i n w a,0
{fre}illusion,i l y z j ɔ̃,0
{fre}illustratif,i l y s t ʁ a t i f,0
{fre}illustration,i l y s t ʁ a s j ɔ̃,0
{fre}imaginant,i m a ʒ i n ɑ̃,0
{fre}imaginatifs,i m a ʒ i n a t i f,0
{fre}imagination,i m a ʒ i n a s j ɔ̃,0
{fre}imaginer,i m a ʒ i n e,0
{fre}imaginez,i m a ʒ i n e,0
{fre}imam,i m a m,0
{fre}imbécile,ɛ̃ b e s i l,0
{fre}imitation,i m i t a s j ɔ̃,0
{fre}immense,i m ɑ̃ s,0
{fre}immeuble,i m œ b l,0
{fre}immigré,i m i ɡ ʁ e,0
{fre}immisce,i m i s,0
{fre}immobile,i m ɔ b i l,0
{fre}immuable,i m ɥ a b l,0
{fre}immunité,i m y n i t e,0
{fre}immédiat,i m e d j a,0
{fre}immédiatement,i m e d j a t m ɑ̃,0
{fre}impact,ɛ̃ p a k t,0
{fre}imparable,ɛ̃ p a ʁ a b l,0
{fre}impardonnable,ɛ̃ p a ʁ d ɔ n a b l,0
{fre}impartial,ɛ̃ p a ʁ s j a l,0
{fre}impasse,ɛ̃ p ɑ s,0
{fre}impatiemment,ɛ̃ p a s j a m ɑ̃,0
{fre}impatient,ɛ̃ p a s j ɑ̃,0
{fre}impeccable,ɛ̃ p ɛ k a b l,0
{fre}impensable,ɛ̃ p ɑ̃ s a b l,0
{fre}impertinent,ɛ̃ p ɛ ʁ t i n ɑ̃,0
{fre}impitoyable,ɛ̃ p i t w a j a b l,0
{fre}implicitement,ɛ̃ p l i s i t m ɑ̃,0
{fre}impliquer,ɛ̃ p l i k e,0
{fre}implosai,ɛ̃ p l o z e,0
{fre}imploser,ɛ̃ p l o z e,0
{fre}impolitesse,ɛ̃ p ɔ l i t ɛ s,0
{fre}important,ɛ̃ p ɔ ʁ t ɑ̃,0
{fre}importateurs,ɛ̃ p ɔ ʁ t a t œ ʁ,0
{fre}importe,ɛ̃ p ɔ ʁ t,0
{fre}importer,ɛ̃ p ɔ ʁ t e,0
{fre}imposant,ɛ̃ p o z ɑ̃,0
{fre}imposer,ɛ̃ p o z e,0
{fre}impossible,ɛ̃ p ɔ s i b l,0
{fre}imprime,ɛ̃ p ʁ i m,0
{fre}imprimerie,ɛ̃ p ʁ i m ʁ i,0
{fre}improbable,ɛ̃ p ʁ ɔ b a b l,0
{fre}imprudent,ɛ̃ p ʁ y d ɑ̃,0
{fre}imprécis,ɛ̃ p ʁ e s i,0
{fre}imprévisible,ɛ̃ p ʁ e v i z i b l,0
{fre}imprévus,ɛ̃ p ʁ e v y,0
{fre}impuissance,ɛ̃ p ɥ i s ɑ̃ s,0
{fre}impédance,ɛ̃ p e d ɑ̃ s,0
{fre}impériale,ɛ̃ p ɛ ʁ j a l,0
{fre}impérieuse,ɛ̃ p e ʁ j ø z,0
{fre}impôt,ɛ̃ p o,0
{fre}inacceptable,i n a k s ɛ p t a b l,0
{fre}inaction,i n a k s j ɔ̃,0
{fre}inadmissible,i n a d m i s i b l,0
{fre}inaliénable,i n a l j e n a b l,0
{fre}inauguration,i n o ɡ y ʁ a s j ɔ̃,0
{fre}incapable,ɛ̃ k a p a b l,0
{fre}incarnation,ɛ̃ k a ʁ n a s j ɔ̃,0
{fre}incarner,ɛ̃ k a ʁ n e,0
{fre}incendiaire,ɛ̃ s ɑ̃ d j ɛ ʁ,0
{fre}incendiait,ɛ̃ s ɑ̃ d j ɛ,0
{fre}incendie,ɛ̃ s ɑ̃ d i,0
{fre}incendies,ɛ̃ s ɑ̃ d i,0
{fre}incendié,ɛ̃ s ɑ̃ d j e,0
{fre}incertain,ɛ̃ s ɛ ʁ t ɛ̃,0
{fre}incertitude,ɛ̃ s ɛ ʁ t i t y d,0
{fre}incessamment,ɛ̃ s ɛ s a m ɑ̃,0
{fre}incidence,ɛ̃ s i d ɑ̃ s,0
{fre}incident,ɛ̃ s i d ɑ̃,0
{fre}incitation,ɛ̃ s i t a s j ɔ̃,0
{fre}inciter,ɛ̃ s i t e,0
{fre}incliner,ɛ̃ k l i n e,0
{fre}inclure,ɛ̃ k l y ʁ,0
{fre}inclus,ɛ̃ k l y,0
{fre}incomplet,ɛ̃ k ɔ̃ p l ɛ,0
{fre}incompréhensible,ɛ̃ k ɔ̃ p ʁ e ɑ̃ s i b l,0
{fre}inconcevable,ɛ̃ k ɔ̃ s v a b l,0
{fre}inconditionnel,ɛ̃ k ɔ̃ d i s j ɔ n ɛ l,0
{fre}inconnu,ɛ̃ k ɔ n y,0
{fre}inconnue,ɛ̃ k ɔ n y,0
{fre}inconsciemment,ɛ̃ k ɔ̃ s j a m ɑ̃,0
{fre}incontestable,ɛ̃ k ɔ̃ t ɛ s t a b l,0
{fre}incontestablement,ɛ̃ k ɔ̃ t ɛ s t a b l ə m ɑ̃,0
{fre}incontournable,ɛ̃ k ɔ̃ t u ʁ n a b l,0
{fre}inculquer,ɛ̃ k y l k e,0
{fre}inde,ɛ̃ d,0
{fre}indemne,ɛ̃ d ɛ m n,0
{fre}index,ɛ̃ d ɛ k s,0
{fre}indicatif,ɛ̃ d i k a t i f,0
{fre}indication,ɛ̃ d i k a s j ɔ̃,0
{fre}indice,ɛ̃ d i s,0
{fre}indices,ɛ̃ d i s,0
{fre}indien,ɛ̃ d j ɛ̃,0
{fre}indifférent,ɛ̃ d i f e ʁ ɑ̃,0
{fre}indignation,ɛ̃ d i ɲ a s j ɔ̃,0
{fre}indigne,ɛ̃ d i ɲ,0
{fre}indignes,ɛ̃ d i ɲ,0
{fre}indique,ɛ̃ d i k,0
{fre}indiquer,ɛ̃ d i k e,0
{fre}indiscutable,ɛ̃ d i s k y t a b l,0
{fre}indispensable,ɛ̃ d i s p ɑ̃ s a b l,0
{fre}individuel,ɛ̃ d i v i d ɥ ɛ l,0
{fre}indonésie,ɛ̃ d o n e z i,0
{fre}indonésien,ɛ̃ d ɔ n e z j ɛ̃,0
{fre}indonésienne,ɛ̃ d ɔ n e z j ɛ n,0
{fre}induit,ɛ̃ d ɥ i,0
{fre}industrie,ɛ̃ d y s t ʁ i,0
{fre}industriel,ɛ̃ d y s t ʁ i j ɛ l,0
{fre}indéfinie,ɛ̃ d e f i n i,0
{fre}indéfiniment,ɛ̃ d e f i n i m ɑ̃,0
{fre}indépendance,ɛ̃ d e p ɑ̃ d ɑ̃ s,0
{fre}indépendantiste,ɛ̃ d e p ɑ̃ d ɑ̃ t i s t,0
{fre}inepties,i n ɛ p s i,0
{fre}inertie,i n ɛ ʁ s i,0
{fre}inexact,i n ɛ ɡ z a k t,0
{fre}infatigable,ɛ̃ f a t i ɡ a b l,0
{fre}infidélité,ɛ̃ f i d e l i t e,0
{fre}infiniment,ɛ̃ f i n i m ɑ̃,0
{fre}infirmer,ɛ̃ f i ʁ m e,0
{fre}infirmier,ɛ̃ f i ʁ m j e,0
{fre}infirmière,ɛ̃ f i ʁ m j ɛ ʁ,0
{fre}inflation,ɛ̃ f l a s j ɔ̃,0
{fre}infligea,ɛ̃ f l i ʒ a,0
{fre}infligent,ɛ̃ f l i ʒ,0
{fre}infligerions,ɛ̃ f l i ʒ ə ʁ j ɔ̃,0
{fre}infliges,ɛ̃ f l i ʒ,0
{fre}infligé,ɛ̃ f l i ʒ e,0
{fre}influence,ɛ̃ f l y ɑ̃ s,0
{fre}influencer,ɛ̃ f l y ɑ̃ s e,0
{fre}influentes,ɛ̃ f l y ɑ̃ t,0
{fre}influents,ɛ̃ f l y ɑ̃,0
{fre}influer,ɛ̃ f l y e,0
{fre}info,ɛ̃ f o,0
{fre}informelle,ɛ̃ f ɔ ʁ m ɛ l,0
{fre}informels,ɛ̃ f ɔ ʁ m ɛ l,0
{fre}informer,ɛ̃ f ɔ ʁ m e,0
{fre}informé,ɛ̃ f ɔ ʁ m e,0
{fre}infortune,ɛ̃ f ɔ ʁ t y n,0
{fre}infrarouge,ɛ̃ f ʁ a ʁ u ʒ,0
{fre}inféoder,ɛ̃ f e ɔ d e,0
{fre}inférieur,ɛ̃ f e ʁ j œ ʁ,0
{fre}ingrat,ɛ̃ ɡ ʁ a,0
{fre}ingrid,i ŋ ɡ ʁ i d,0
{fre}ingrédients,ɛ̃ ɡ ʁ e d j ɑ̃,0
{fre}inguérissable,ɛ̃ ɡ e ʁ i s a b l,0
{fre}ingénieur,ɛ̃ ʒ e n j œ ʁ,0
{fre}inhabituel,i n a b i t ɥ ɛ l,0
{fre}inhalation,i n a l a s j ɔ̃,0
{fre}initiatique,i n i s j a t i k,0
{fre}initier,i n i s j e,0
{fre}injection,ɛ̃ ʒ ɛ k s j ɔ̃,0
{fre}injure,ɛ̃ ʒ y ʁ,0
{fre}injustice,ɛ̃ ʒ y s t i s,0
{fre}innocence,i n ɔ s ɑ̃ s,0
{fre}innover,i n ɔ v e,0
{fre}inquiet,ɛ̃ k j ɛ,0
{fre}inquiets,ɛ̃ k j ɛ,0
{fre}inquiète,ɛ̃ k j ɛ t,0
{fre}inquiéter,ɛ̃ k j e t e,0
{fre}inquiétude,ɛ̃ k j e t y d,0
{fre}inscription,ɛ̃ s k ʁ i p s j ɔ̃,0
{fre}inscrire,ɛ̃ s k ʁ i ʁ,0
{fre}insecte,ɛ̃ s ɛ k t,0
{fre}insipide,ɛ̃ s i p i d,0
{fre}insolite,ɛ̃ s ɔ l i t,0
{fre}insouciance,ɛ̃ s u s j ɑ̃ s,0
{fre}inspecteur,ɛ̃ s p ɛ k t œ ʁ,0
{fre}inspiration,ɛ̃ s p i ʁ a s j ɔ̃,0
{fre}inspirer,ɛ̃ s p i ʁ e,0
{fre}installation,ɛ̃ s t a l a s j ɔ̃,0
{fre}installer,ɛ̃ s t a l e,0
{fre}instance,ɛ̃ s t ɑ̃ s,0
{fre}instantané,ɛ̃ s t ɑ̃ t a n e,0
{fre}instar,ɛ̃ s t a ʁ,0
{fre}instaurer,ɛ̃ s t ɔ ʁ e,0
{fre}instit,ɛ̃ s t i,0
{fre}instruction,ɛ̃ s t ʁ y k s j ɔ̃,0
{fre}instrument,ɛ̃ s t ʁ y m ɑ̃,0
{fre}instruments,ɛ̃ s t ʁ y m ɑ̃,0
{fre}insuffisance,ɛ̃ s y f i z ɑ̃ s,0
{fre}insuffler,ɛ̃ s y f l e,0
{fre}insultant,ɛ̃ s y l t ɑ̃,0
{fre}insulte,ɛ̃ s y l t,0
{fre}insulter,ɛ̃ s y l t e,0
{fre}insultes,ɛ̃ s y l t,0
{fre}insultât,ɛ̃ s y l t ɑ,0
{fre}insulté,ɛ̃ s y l t e,0
{fre}insupportable,ɛ̃ s y p ɔ ʁ t a b l,0
{fre}insurgé,ɛ̃ s y ʁ ʒ e,0
{fre}intelligemment,ɛ̃ t e l i ʒ a m ɑ̃,0
{fre}intempestive,ɛ̃ t ɑ̃ p ɛ s t i v,0
{fre}intense,ɛ̃ t ɑ̃ s,0
{fre}intensifier,ɛ̃ t ɑ̃ s i f j e,0
{fre}intensité,ɛ̃ t ɑ̃ s i t e,0
{fre}intention,ɛ̃ t ɑ̃ s j ɔ̃,0
{fre}inter,ɛ̃ t e,0
{fre}interactif,ɛ̃ t ɛ ʁ a k t i f,0
{fre}interaction,ɛ̃ t ɛ ʁ a k s j ɔ̃,0
{fre}interdire,ɛ̃ t ɛ ʁ d i ʁ,0
{fre}interdit,ɛ̃ t ɛ ʁ d i,0
{fre}interface,ɛ̃ t ɛ ʁ f a s,0
{fre}interjeter,ɛ̃ t ɛ ʁ ʒ ə t e,0
{fre}interlocuteur,ɛ̃ t ɛ ʁ l ɔ k y t œ ʁ,0
{fre}interminable,ɛ̃ t ɛ ʁ m i n a b l,0
{fre}intermunicipale,ɛ̃ t ɛ ʁ m y n i s i p a l,0
{fre}intermédiaire,ɛ̃ t ɛ ʁ m e d j ɛ ʁ,0
{fre}international,ɛ̃ t ɛ ʁ n a s j ɔ n a l,0
{fre}internationale,ɛ̃ t ɛ ʁ n a s j ɔ n a l,0
{fre}interne,ɛ̃ t ɛ ʁ n,0
{fre}internet,ɛ̃ t ɛ ʁ n ɛ t,0
{fre}interpellation,ɛ̃ t ɛ ʁ p e l a s j ɔ̃,0
{fre}interprète,ɛ̃ t ɛ ʁ p ʁ ɛ t,0
{fre}interprétation,ɛ̃ t ɛ ʁ p ʁ e t a s j ɔ̃,0
{fre}interrogatoire,ɛ̃ t ɛ ʁ ɔ ɡ a t w a ʁ,0
{fre}interrompre,ɛ̃ t ɛ ʁ ɔ̃ p ʁ,0
{fre}interrompu,ɛ̃ t ɛ ʁ ɔ̃ p y,0
{fre}interruption,ɛ̃ t ɛ ʁ y p s j ɔ̃,0
{fre}intervalle,ɛ̃ t ɛ ʁ v a l,0
{fre}intime,ɛ̃ t i m,0
{fre}intimes,ɛ̃ t i m,0
{fre}intimider,ɛ̃ t i m i d e,0
{fre}intimité,ɛ̃ t i m i t e,0
{fre}intimé,ɛ̃ t i m e,0
{fre}intouchable,ɛ̃ t u ʃ a b l,0
{fre}intox,ɛ̃ t ɔ k s,0
{fre}intraveineuse,ɛ̃ t ʁ a v e n ø z,0
{fre}intraveineux,ɛ̃ t ʁ a v e n ø,0
{fre}intrigue,ɛ̃ t ʁ i ɡ,0
{fre}introduction,ɛ̃ t ʁ ɔ d y k s j ɔ̃,0
{fre}intuition,ɛ̃ t ɥ i s j ɔ̃,0
{fre}intègre,ɛ̃ t ɛ ɡ ʁ,0
{fre}intégral,ɛ̃ t e ɡ ʁ a l,0
{fre}intégration,ɛ̃ t e ɡ ʁ a s j ɔ̃,0
{fre}intéressant,ɛ̃ t e ʁ ɛ s ɑ̃,0
{fre}intéresser,ɛ̃ t e ʁ ɛ s e,0
{fre}intérieur,ɛ̃ t e ʁ j œ ʁ,0
{fre}intérim,ɛ̃ t e ʁ i m,0
{fre}intérêt,ɛ̃ t e ʁ ɛ,0
{fre}intérêts,ɛ̃ t e ʁ ɛ,0
{fre}inusités,i n y z i t e,0
{fre}inutile,i n y t i l,0
{fre}inutiles,i n y t i l,0
{fre}inutilité,i n y t i l i t e,0
{fre}invasion,ɛ̃ v a z j ɔ̃,0
{fre}inventer,ɛ̃ v ɑ̃ t e,0
{fre}invention,ɛ̃ v ɑ̃ s j ɔ̃,0
{fre}inverse,ɛ̃ v ɛ ʁ s,0
{fre}investigation,ɛ̃ v ɛ s t i ɡ a s j ɔ̃,0
{fre}investir,ɛ̃ v ɛ s t i ʁ,0
{fre}investissement,ɛ̃ v ɛ s t i s m ɑ̃,0
{fre}investiture,ɛ̃ v ɛ s t i t y ʁ,0
{fre}invitation,ɛ̃ v i t a s j ɔ̃,0
{fre}inviter,ɛ̃ v i t e,0
{fre}invoquer,ɛ̃ v ɔ k e,0
{fre}inédit,i n e d i,0
{fre}inégale,i n e ɡ a l,0
{fre}inégalitaire,i n e ɡ a l i t ɛ ʁ,0
{fre}inégalité,i n e ɡ a l i t e,0
{fre}inénarrable,i n e n a ʁ a b l,0
{fre}inévitable,i n e v i t a b l,0
{fre}ioniques,j ɔ n i k,0
{fre}ionisation,j ɔ n i z a s j ɔ̃,0
{fre}ipod,a j p ɔ d,0
{fre}iqaluit,i k a l ɥ i t,0
{fre}ira,i ʁ a,0
{fre}irakien,i ʁ a k j ɛ̃,0
{fre}iran,i ʁ ɑ̃,0
{fre}ire,i ʁ,0
{fre}irez,i ʁ e,0
{fre}irlandais,i ʁ l ɑ̃ d ɛ,0
{fre}irlandaise,i ʁ l ɑ̃ d ɛ z,0
{fre}irlande,i ʁ l ɑ̃ d,0
{fre}irons,i ʁ ɔ̃,0
{fre}iront,i ʁ ɔ̃,0
{fre}irresponsable,i ʁ ɛ s p ɔ̃ s a b l,0
{fre}irruption,i ʁ y p s j ɔ̃,0
{fre}irréconciliable,i ʁ e k ɔ̃ s i l j a b l,0
{fre}irrémédiable,i ʁ e m e d j a b l,0
{fre}irrésistible,i ʁ e z i s t i b l,0
{fre}irréversible,i ʁ e v ɛ ʁ s i b l,0
{fre}isaac,i z a a k,0
{fre}islam,i s l a m,0
{fre}islamique,i s l a m i k,0
{fre}islamiste,i s l a m i s t,0
{fre}islandais,i s l ɑ̃ d ɛ,0
{fre}islande,i s l ɑ̃ d,0
{fre}isolation,i z ɔ l a s j ɔ̃,0
{fre}isolement,i z ɔ l m ɑ̃,0
{fre}isoler,i z ɔ l e,0
{fre}isolé,i z ɔ l e,0
{fre}israélien,i s ʁ a e l j ɛ̃,0
{fre}issu,i s y,0
{fre}istanbul,i s t ɑ̃ b u l,0
{fre}isère,i z ɛ ʁ,0
{fre}italie,i t a l i,0
{fre}italienne,i t a l j ɛ n,0
{fre}itinéraire,i t i n e ʁ ɛ ʁ,0
{fre}itou,i t u,0
{fre}ivrogne,i v ʁ ɔ ɲ,0
{fre}jacker,ʒ a k e,0
{fre}jacob,ʒ a k ɔ b,0
{fre}jalousie,ʒ a l u z i,0
{fre}jaloux,ʒ a l u,0
{fre}jamaïcain,ʒ a m a i k ɛ̃,0
{fre}jambage,ʒ ɑ̃ b a ʒ,0
{fre}jambon,ʒ ɑ̃ b ɔ̃,0
{fre}janine,ʒ a n i n,0
{fre}jante,ʒ ɑ̃ t,0
{fre}janvier,ʒ ɑ̃ v j e,0
{fre}japonais,ʒ a p ɔ n ɛ,0
{fre}japonaise,ʒ a p ɔ n ɛ z,0
{fre}jardin,ʒ a ʁ d ɛ̃,0
{fre}jardinage,ʒ a ʁ d i n a ʒ,0
{fre}jardiner,ʒ a ʁ d i n e,0
{fre}jardinier,ʒ a ʁ d i n j e,0
{fre}jaune,ʒ o n,0
{fre}jaunes,ʒ o n,0
{fre}java,ʒ a v a,0
{fre}jazz,d ʒ ɑ z,0
{fre}jeanne,ʒ a n,0
{fre}jennifer,ʒ ɛ n i f ɛ ʁ,0
{fre}jessica,ʒ ɛ s i k a,0
{fre}jetable,ʒ ə t a b l,0
{fre}jetables,ʒ ə t a b l,0
{fre}jette,ʒ ɛ t,0
{fre}jeté,ʒ ə t e,0
{fre}jetées,ʒ ə t e,0
{fre}jeu,ʒ ø,0
{fre}jeudi,ʒ ø d i,0
{fre}jeune,ʒ œ n,0
{fre}jeunes,ʒ œ n,0
{fre}jeunesse,ʒ œ n ɛ s,0
{fre}jeux,ʒ ø,0
{fre}jeûne,ʒ ø n,0
{fre}ji,ʒ i,0
{fre}jihad,d ʒ i a d,0
{fre}jocelyn,ʒ o s l ɛ̃,0
{fre}jockey,ʒ ɔ k ɛ,0
{fre}johnson,ʒ ɔ n s ɔ̃,0
{fre}joindre,ʒ w ɛ̃ d ʁ,0
{fre}joins,ʒ w ɛ̃,0
{fre}joint,ʒ w ɛ̃,0
{fre}joints,ʒ w ɛ̃,0
{fre}joli,ʒ ɔ l i,0
{fre}jonas,ʒ ɔ n ɑ,0
{fre}jonathan,ʒ ɔ n a t ɑ̃,0
{fre}jones,ʒ ɔ n,0
{fre}jongler,ʒ ɔ̃ ɡ l e,0
{fre}jordanie,ʒ ɔ ʁ d a n i,0
{fre}joseph,ʒ o z ɛ f,0
{fre}josselin,ʒ o s e l ɛ̃,0
{fre}josé,ʒ o z e,0
{fre}joséphine,ʒ o z e f i n,0
{fre}joue,ʒ u,0
{fre}jouet,ʒ w ɛ,0
{fre}joueur,ʒ w œ ʁ,0
{fre}jouit,ʒ w i,0
{fre}jour,ʒ u ʁ,0
{fre}journal,ʒ u ʁ n a l,0
{fre}journalisme,ʒ u ʁ n a l i z m,0
{fre}journaliste,ʒ u ʁ n a l i s t,0
{fre}journée,ʒ u ʁ n e,0
{fre}jours,ʒ u ʁ,0
{fre}joute,ʒ u t,0
{fre}joutes,ʒ u t,0
{fre}joué,ʒ w e,0
{fre}joyeux,ʒ w a j ø,0
{fre}joël,ʒ ɔ ɛ l,0
{fre}joëlle,ʒ ɔ ɛ l,0
{fre}jt,ʒ i t e,0
{fre}juge,ʒ y ʒ,0
{fre}jugeant,ʒ y ʒ ɑ̃,0
{fre}juger,ʒ y ʒ e,0
{fre}juges,ʒ y ʒ,0
{fre}jugé,ʒ y ʒ e,0
{fre}jujubier,ʒ y ʒ y b j e,0
{fre}julia,ʒ y l j a,0
{fre}julie,ʒ y l i,0
{fre}julien,ʒ y l j ɛ̃,0
{fre}jumeau,ʒ y m o,0
{fre}jumeler,ʒ y m l e,0
{fre}jument,ʒ y m ɑ̃,0
{fre}junte,ʒ œ̃ t,0
{fre}jupiter,ʒ y p i t ɛ ʁ,0
{fre}jura,ʒ y ʁ a,0
{fre}jurançon,ʒ y ʁ ɑ̃ s ɔ̃,0
{fre}jure,ʒ y ʁ,0
{fre}jurent,ʒ y ʁ,0
{fre}jurer,ʒ y ʁ e,0
{fre}juridique,ʒ y ʁ i d i k,0
{fre}jurisprudence,ʒ y ʁ i s p ʁ y d ɑ̃ s,0
{fre}jury,ʒ y ʁ i,0
{fre}juré,ʒ y ʁ e,0
{fre}jus,ʒ y,0
{fre}jusque,ʒ y s k,0
{fre}just,ʒ y s t,0
{fre}juste,ʒ y s t,0
{fre}justement,ʒ y s t ə m ɑ̃,0
{fre}justes,ʒ y s t,0
{fre}justice,ʒ y s t i s,0
{fre}justification,ʒ y s t i f i k a s j ɔ̃,0
{fre}justin,ʒ y s t ɛ̃,0
{fre}justine,ʒ y s t i n,0
{fre}jérémie,ʒ e ʁ e m i,0
{fre}jérémy,ʒ e ʁ e m i,0
{fre}jérôme,ʒ e ʁ o m,0
{fre}ka,k ɑ,0
{fre}kaboul,k a b u l,0
{fre}kangourou,k ɑ̃ ɡ u ʁ u,0
{fre}kaolinisas,k a ɔ l i n i z ɑ,0
{fre}kazakh,k a z a k,0
{fre}ken,k ɛ n,0
{fre}kenya,k e n j a,0
{fre}kenyane,k e n j a n,0
{fre}kenzo,k ɛ n z o,0
{fre}kevin,k e v i n,0
{fre}kiev,k j ɛ v,0
{fre}kif,k i f,0
{fre}kilo,k i l o,0
{fre}kiosque,k j ɔ s k,0
{fre}kirghizistan,k i ʁ ɡ i z i s t ɑ̃,0
{fre}kirghizstan,k i ʁ ɡ i s t ɑ̃,0
{fre}koala,k ɔ a l a,0
{fre}kurde,k y ʁ d,0
{fre}la,l a,0
{fre}label,l a b ɛ l,0
{fre}labeur,l a b œ ʁ,0
{fre}laboratoire,l a b ɔ ʁ a t w a ʁ,0
{fre}lac,l a k,0
{fre}lacrosse,l a k ʁ ɔ s,0
{fre}lacrymogène,l a k ʁ i m ɔ ʒ ɛ n,0
{fre}ladite,l a d i t,0
{fre}lafrenière,l a f ʁ ə n j ɛ ʁ,0
{fre}lahore,l a ɔ ʁ,0
{fre}lai,l ɛ,0
{fre}laideur,l ɛ d œ ʁ,0
{fre}laine,l ɛ n,0
{fre}laisse,l ɛ s,0
{fre}laissé,l ɛ s e,0
{fre}lait,l ɛ,0
{fre}lama,l a m a,0
{fre}lambert,l ɑ̃ b ɛ ʁ,0
{fre}lambris,l ɑ̃ b ʁ i,0
{fre}lamperais,l ɑ̃ p ʁ ɛ,0
{fre}lance,l ɑ̃ s,0
{fre}lancement,l ɑ̃ s m ɑ̃,0
{fre}lancent,l ɑ̃ s,0
{fre}lancer,l ɑ̃ s e,0
{fre}lancera,l ɑ̃ s ʁ a,0
{fre}lanceur,l ɑ̃ s œ ʁ,0
{fre}lancé,l ɑ̃ s e,0
{fre}landau,l ɑ̃ d o,0
{fre}landes,l ɑ̃ d,0
{fre}langage,l ɑ̃ ɡ a ʒ,0
{fre}lange,l ɑ̃ ʒ,0
{fre}langue,l ɑ̃ ɡ,0
{fre}lanterne,l ɑ̃ t ɛ ʁ n,0
{fre}lançait,l ɑ̃ s ɛ,0
{fre}lançons,l ɑ̃ s ɔ̃,0
{fre}laocoon,l a o k o ɔ̃,0
{fre}lapin,l a p ɛ̃,0
{fre}laps,l a p s y s,0
{fre}lapsus,l a p s y,0
{fre}laquelle,l a k ɛ l,0
{fre}large,l a ʁ ʒ,0
{fre}larges,l a ʁ ʒ,0
{fre}largeur,l a ʁ ʒ œ ʁ,0
{fre}larme,l a ʁ m,0
{fre}larmes,l a ʁ m,0
{fre}laser,l a z ɛ ʁ,0
{fre}latif,l a t i f,0
{fre}latin,l a t ɛ̃,0
{fre}latine,l a t i n,0
{fre}latitude,l a t i t y d,0
{fre}laurait,l o ʁ ɛ,0
{fre}laurence,l o ʁ ɑ̃ s,0
{fre}laurentienne,l ɔ ʁ ɑ̃ s j ɛ n,0
{fre}lauréat,l o ʁ e a,0
{fre}lausanne,l o z a n,0
{fre}laval,l a v a l,0
{fre}lave,l a v,0
{fre}laver,l a v e,0
{fre}lavoir,l a v w a ʁ,0
{fre}laxisme,l a k s i s m,0
{fre}laïc,l a i k,0
{fre}leader,l i d œ ʁ,0
{fre}lebel,l ə b ɛ l,0
{fre}leclerc,l ə k l ɛ ʁ,0
{fre}lecteur,l ɛ k t œ ʁ,0
{fre}lecture,l ɛ k t y ʁ,0
{fre}ledit,l ə d i,0
{fre}legrand,l ə ɡ ʁ ɑ̃,0
{fre}leitmotiv,l a j t m ɔ t i f,0
{fre}lens,l ɑ̃ s,0
{fre}lensois,l ɑ̃ s w a,0
{fre}lent,l ɑ̃,0
{fre}lentement,l ɑ̃ t m ɑ̃,0
{fre}les,l e,0
{fre}lesbienne,l ɛ s b j ɛ n,0
{fre}leslie,l ɛ s l i,0
{fre}lesquelles,l e k ɛ l,0
{fre}lesquels,l e k ɛ l,0
{fre}lest,l ɛ s t,0
{fre}lettre,l ɛ t ʁ,0
{fre}lettres,l ɛ t ʁ,0
{fre}leur,l œ ʁ,0
{fre}leurs,l œ ʁ,0
{fre}levant,l ə v ɑ̃,0
{fre}lever,l ə v e,0
{fre}levier,l ə v j e,0
{fre}levé,l ə v e,0
{fre}levée,l ə v e,0
{fre}leçon,l ə s ɔ̃,0
{fre}li,l i,0
{fre}liaison,l j ɛ z ɔ̃,0
{fre}liban,l i b ɑ̃,0
{fre}libanais,l i b a n ɛ,0
{fre}liberté,l i b ɛ ʁ t e,0
{fre}libidinale,l i b i d i n a l,0
{fre}libre,l i b ʁ,0
{fre}libye,l i b i,0
{fre}libyen,l i b j ɛ̃,0
{fre}libéral,l i b e ʁ a l,0
{fre}libération,l i b e ʁ a s j ɔ̃,0
{fre}libérer,l i b e ʁ e,0
{fre}libéria,l i b e ʁ j a,0
{fre}libéro,l i b e ʁ o,0
{fre}lice,l i s,0
{fre}licence,l i s ɑ̃ s,0
{fre}licences,l i s ɑ̃ s,0
{fre}licenciement,l i s ɑ̃ s i m ɑ̃,0
{fre}lien,l j ɛ̃,0
{fre}liens,l j ɛ̃,0
{fre}liesse,l j ɛ s,0
{fre}lieu,l j ø,0
{fre}lieutenant,l j ø t n ɑ̃,0
{fre}lieux,l j ø,0
{fre}ligne,l i ɲ,0
{fre}ligue,l i ɡ,0
{fre}lilian,l i l j ɑ̃,0
{fre}liliane,l i l j a n,0
{fre}lillois,l i l w a,0
{fre}lilloise,l i l w a z,0
{fre}limbourgeois,l ɛ̃ b u ʁ ʒ w a,0
{fre}lime,l i m,0
{fre}limitation,l i m i t a s j ɔ̃,0
{fre}limite,l i m i t,0
{fre}limiter,l i m i t e,0
{fre}limites,l i m i t,0
{fre}limoges,l i m ɔ ʒ,0
{fre}limogé,l i m ɔ ʒ e,0
{fre}limpide,l ɛ̃ p i d,0
{fre}lin,l ɛ̃,0
{fre}linguistiques,l ɛ̃ ɡ ɥ i s t i k,0
{fre}lion,l j ɔ̃,0
{fre}lionel,l j ɔ n ɛ l,0
{fre}liquidation,l i k i d a s j ɔ̃,0
{fre}lire,l i ʁ,0
{fre}lisbonne,l i z b ɔ n,0
{fre}lisibilité,l i z i b i l i t e,0
{fre}lisible,l i z i b l,0
{fre}lit,l i,0
{fre}lithium,l i t j ɔ m,0
{fre}litiges,l i t i ʒ,0
{fre}litote,l i t ɔ t,0
{fre}litre,l i t ʁ,0
{fre}littéraire,l i t e ʁ ɛ ʁ,0
{fre}littérature,l i t e ʁ a t y ʁ,0
{fre}lituanie,l i t ɥ a n i,0
{fre}livraison,l i v ʁ ɛ z ɔ̃,0
{fre}livre,l i v ʁ,0
{fre}livrer,l i v ʁ e,0
{fre}livres,l i v ʁ,0
{fre}livrée,l i v ʁ e,0
{fre}lièvre,l j ɛ v ʁ,0
{fre}liégeois,l j e ʒ w a,0
{fre}lloris,j ɔ ʁ i s,0
{fre}lnh,ɛ l ɛ n a ʃ,0
{fre}lob,l ɔ b,0
{fre}lobber,l ɔ b e,0
{fre}lobby,l ɔ b i,0
{fre}lobbying,l ɔ b i i ŋ,0
{fre}local,l ɔ k a l,0
{fre}locale,l ɔ k a l,0
{fre}localement,l ɔ k a l m ɑ̃,0
{fre}localisation,l ɔ k a l i z a s j ɔ̃,0
{fre}localité,l ɔ k a l i t e,0
{fre}location,l ɔ k a s j ɔ̃,0
{fre}logement,l ɔ ʒ m ɑ̃,0
{fre}logiciel,l ɔ ʒ i s j ɛ l,0
{fre}logique,l ɔ ʒ i k,0
{fre}logistique,l ɔ ʒ i s t i k,0
{fre}logistiquement,l ɔ ʒ i s t i k m ɑ̃,0
{fre}logo,l ɔ ɡ o,0
{fre}logue,l ɔ ɡ,0
{fre}loguâmes,l ɔ ɡ ɑ m,0
{fre}loi,l w a,0
{fre}loin,l w ɛ̃,0
{fre}loir,l w a ʁ,0
{fre}loisir,l w a z i ʁ,0
{fre}loisirs,l w a z i ʁ,0
{fre}lolement,l ɔ l m ɑ̃,0
{fre}londonien,l ɔ̃ d ɔ n j ɛ̃,0
{fre}londonienne,l ɔ̃ d ɔ n j ɛ n,0
{fre}londres,l ɔ̃ d ʁ,0
{fre}long,l ɔ̃,0
{fre}longuement,l ɔ̃ ɡ m ɑ̃,0
{fre}longueuil,l ɔ̃ ɡ œ j,0
{fre}longévité,l ɔ̃ ʒ e v i t e,0
{fre}look,l u k,0
{fre}lorient,l ɔ ʁ j ɑ̃,0
{fre}lorraine,l ɔ ʁ ɛ n,0
{fre}lors,l ɔ ʁ,0
{fre}lorsque,l ɔ ʁ s k,0
{fre}los,l o,0
{fre}losange,l o z ɑ̃ ʒ,0
{fre}lots,l o,0
{fre}lou,l u,0
{fre}loue,l u,0
{fre}louer,l w e,0
{fre}loueur,l w œ ʁ,0
{fre}louise,l w i z,0
{fre}louisiane,l w i z j a n,0
{fre}loup,l u,0
{fre}loupe,l u p,0
{fre}lourd,l u ʁ,0
{fre}lourdement,l u ʁ d ə m ɑ̃,0
{fre}lourds,l u ʁ,0
{fre}loyal,l w a j a l,0
{fre}loyauté,l w a j o t e,0
{fre}loyer,l w a j e,0
{fre}lozère,l ɔ z ɛ ʁ,0
{fre}loïc,l ɔ i k,0
{fre}lu,l y,0
{fre}lucarne,l y k a ʁ n,0
{fre}lucas,l y k ɑ,0
{fre}lucide,l y s i d,0
{fre}lucie,l y s i,0
{fre}lucien,l y s j ɛ̃,0
{fre}lucrèce,l y k ʁ ɛ s,0
{fre}ludovic,l y d ɔ v i k,0
{fre}lueur,l ɥ œ ʁ,0
{fre}luge,l y ʒ,0
{fre}luis,l ɥ i,0
{fre}lumineux,l y m i n ø,0
{fre}lumière,l y m j ɛ ʁ,0
{fre}lumières,l y m j ɛ ʁ,0
{fre}lump,l œ̃ p,0
{fre}lundi,l œ̃ d i,0
{fre}lune,l y n,0
{fre}lunettes,l y n ɛ t,0
{fre}lus,l y,0
{fre}lutte,l y t,0
